,Header,Summary,Detail
7,Appellants told to file rejoinder in plea against Karachi's Malir Expressway,The tribunal has adjourned the proceedings till Aug 17.,"KARACHI: The Sindh Environmental Tribunal has asked the counsel for the residents and environmentalists to make rebuttal to the reply filed by a private firm constructing the controversial Malir Expressway project.
The tribunal, headed by retired Justice Nisar Ahmed Shaikh, asked advocates Kazim Hussain Mahesar and Muhammad Imran Kalmati to file the rebuttal on the next date and adjourned the hearing on appeals challenging the Environment Impact Assessment (EIA) approval of the project.
The tribunal has adjourned the proceedings till Aug 17.
The location of the project, as per the EIA approval, is starting from right before the Jam Sadiq bridge on Korangi Road and run along the right bank of the Malir river through the Korangi and Malir districts, terminating on M-9 near DHA City outside Karachi.
On a previous hearing, Advocate Ravi Pinjani, who represented M/s Malir Expressway Limited, had filed a copy of the ‘fresh’ EIA report dated June 10 and signed by Sepa director general Muhammad Naeem Mughal, removing the appellants’ objection that the earlier EIA report was signed by a deputy director who got no legal authority to issue such an approval under the law.
Regarding the merits of the appeals, the counsel had argued that the appellants never raised any environmental concerns with regard to the environment of the metropolis.
He had objected that since the tribunal’s domain was environmental concerns therefore the appeals should be dismissed for lacking merit since the appellants did not highlight any environmental adversity in the proposed project.
The lawyer also challenged the appellants` locus standi, arguing that they were not directly aggrieved by the proposed project, while they did not highlight any adversity by the proposed cutting of trees or air pollution, etc, in their appeals.
He maintained that with the construction of the Malir Expressway “we will have primary advantage that western portion of the metropolis is connected through bypasses, but there is no such bypasses connectivity in the eastern corridor. Therefore, this project will connect the city with far-flung parts, including Korangi Industrial Area, the Defence Housing Authority and other areas on the outskirts”.
Advocate Pinjani argued that at present the average daily commuting time in the eastern corridor was 90 minutes, adding that with the construction of Malir Expressway this commuting time would be reduced to 30 minutes on an average day. “The overall impact is positive for the metropolis, since this is not any commercial or residential project, but a highway,” he claimed.
The company’s lawyer had also maintained that around 1,800 trees coming in the way of the expressway were to be cut down, but Sepa had advised to grow 19,000 trees with three rows of trees cover on either side of the expressway to maintain environmental balance in the area.
Lastly, the counsel had submitted that the project currently costing Rs27 billion, out of which 72 per cent is publically funded since its a consortium of banks and the Sindh government.
Opposing the appellants’ requests for granting an interim stay order against any construction activity at the site, Advocate Pinjani had cautioned that if due to any technical reasons the project was stayed the costs would spiral up given the growing rate of inflation. 
He pleaded to dismiss the appeals for being devoid of merits.
Published in Dawn, August 9th, 2022
"
8,Govt official robbed of cash in Bahadurabad,KARACHI: A mugger snatched cash and other valuables from Assistant Commissioner Asma Batool in Bahadurabad on Sunday...,"KARACHI: A mugger snatched cash and other valuables from Assistant Commissioner Asma Batool in Bahadurabad on Sunday morning, officials said.
They said Ms Batool, the AC-Ferozabad, along with her husband and children went to an eatery on Alamgir Road. She said she was on way to the restaurant after parking her car when an armed motorcyclist, wearing a shirt and pants, intercepted her and held her at gunpoint.
She said he snatched her gold jewellery, a cell phone, Rs5,000-6000, three ATM cards, one service card and her original computerised national identity card and rode away. 
The incident prompted Sindh Chief Secretary Dr Muhammad Sohail Rajput to order the city police chief to immediately arrest the mugger.
“We have taken CCTV footage and made headway,” said SSP-East Abdul Rahim Sherazi.
Two boys drown 
Two teenage boys drowned in the Malir river in the Sharafi Goth area on Monday, police and rescue services said.
An Edhi Foundation spokesperson said that the boys drowned while swimming in the rainwater-filled Malir river. 
Edhi divers fished out their bodies, which were taken to the Jinnah Postgraduate Medical Centre for completing medico-legal formalities.  
The deceased were identified as Abdul Ghani, 15, and Aga Ali, 17.
Published in Dawn, August 9th, 2022
"
9,AKU gets international endorsement for healthcare simulation,KARACHI: The Aga Khan University’s School of Nursing and Midwifery (AKU-SONAM) has been awarded the Core Four...,"KARACHI: The Aga Khan University’s School of Nursing and Midwifery (AKU-SONAM) has been awarded the Core Four Healthcare Simulation Standards endorsement by the International Nursing Association of Clinical Simulation and Learning (INACSL), as part of its inaugural endorsement programme for nursing schools and simulation centres worldwide.
The school is the first in Pakistan and amongst nine nursing institutions globally to have received the endorsement, which was received by AKU Dean Dr Rozina Karmaliani, who represented the institute at the INACSL conference held in the USA in June, 2022.
“The INACSL endorsement gives us greater confidence in our strategic direction focusing on innovation and transformation of clinical education. At AKU-SONAM, we are committed to delivering a world-class educational experience through advanced simulation preparing our students to become leaders in healthcare,” said Dr Karmaliani.
Zohra Kurji, assistant professor and simulation programme lead at AKU-SONAM, was presented with the Frontline Simulation Champion Award of Excellence 2022. 
She is the first nurse from the South Asian region to receive this recognition for driving the simulation programme at SONAM.
Published in Dawn, August 9th, 2022
"
10,Hazaras of Hyderabad keep their decades-old Muharram traditions intact,"HYDERABAD: Hyderabad’s small but tightly-knit and somewhat reclusive Hazara ethnic community, which has a...","HYDERABAD: Hyderabad’s small but tightly-knit and somewhat reclusive Hazara ethnic community, which has a reputation of being fearless, shuns its low profile existence during Ashura days as its young and elderly men lead central procession of 10th of Muharram in the city every year. They have kept the distinction intact for decades.
The community is concentrated in Hazara Colony in Hussainabad, which witnesses multiple activities during Muharram ranging from serving of ‘langar’ (free food) to staging of old mourning processions. 
Mallah and Solangi communities were the oldest ones living in the area followed by those whose elders migrated from India and Hazaras. Several houses of their community are located in Hazara Colony mainly close to the protective bund.
Hazaras, usually, pass a low profile life even though they are serving in government departments. However, when it comes to Ashura, the Hazara men including young and elderly lead the central Ashura’s procession on 10th of Muharram here. They would keep the tradition intact even tis day, they resolved.
Hazara Imambargah is located a few paces from the protective bund. Members of the community profess Asna Ashari sect among Fiqah-i-Jafria and have been living in the area for close to seven decades. Because of distinct facial features this ethnic community is easily distinguishable.
Ashura (today’s) central procession emanates from Qadamgah Maula Ali off Station Road. Hazaras’ dasta (circle) remains in the forefront of a procession staged under the aegis of Anjuman-i-Hyderi (AH), registered in 1948. 
“Our dasta is the first among all Anjumans without any fear while other Anjumans get their numbers after balloting,” says a bearded Hamid Hussain, administrator of Hussainabad’s Hazara Imambargah. 
“We never felt frightened or threatened even when Hazara community members were being massacred in various parts of the country, particularly in Balochistan. We had led Ashura’s procession even in those days without having any fear,” said a confident looking Hamid Hazara.
Hyder Ali, his young fellow who works in a private school, is incumbent general secretary of the community’s Anjuman after the death of his father. 
The 7th Muharram mehndi of Shahzada Qasim was one of the important events of the community in Hussainabad. It is held inside an Imambargah. “Like any other event of Shahzada Qasim’s mehndi, women from other ethnic backgrounds turn up in our Imambargah to have their ‘mannat’ for different reasons including social, domestic, personal and family oriented,” informs Hamid.
District police provide security to mourners who are part of central procession. Besides other mourners, Hazaras were taken to Qadamgah under security for leading the central mourning procession. They beat their chests and flagellate en route to Karbala Dadan Shah from where they were brought to their Imambargah under security.
“Many of our elders had settled here in Hyderabad and Nawabshah soon after partition. Gen Musa also owned land in Bulri Shah Karim, Tando Mohammad Khan district,” Hamid Hazara recalled. Some community fellows also live in Latifabad Unit-3 and in 60-Mile area in Shaheed Banazirabad district.
“Our members are associated with government jobs and also own shops in Qadamgah area and deal in used clothes business in loonda bazaar,” he says. They are active in different political parties, chiefly Pakistan Peoples Party. “Sindh Assembly member Jabbar Khan considers our colony as his strong vote bank,” Hamid says.
Their Muharram observance of rituals was largely confined to their locality and mainly at the Imambargah. Ritual of our 7th Muharram mehndi is also performed within the Imambargah,” interjects an elderly Nadir Ali Hazara in Persian while speaking to Hamid. 
He also agreed with Hamid that his community fellows here never scared away from terror incidents targeting their community members. Many including children had lost their lives in the terror waves of religious extremism, sweeping the country.
Hazara community stages Imam Hussain chehlum’s procession in Hussainabad instead of participating in the central procession of the city which was brought out by Anjuman-i-Imamia Sindh (AIS). After taking a round of the street the mourners again converge on the Imambargah, and Hamid explains why.
“Our community’s ‘dasta’ used to be at the forefront at number one in chehlum procession as well like Ashura’s. But then Anjuman-i-Imamia Sindh (AIS) changed our number to which our community members objected and parted company with them,” says Hamid. AIS stages chehlum’s or “Arba’een” central procession in the city. It emanates from Qadam Gah and culminates at Dadan Shah.
AH general secretary Syed Raza Rizvi points out that Hazaras participate as one community or tribe under the command of their elder. “We always want that procession is led by those who are organised more than anyone else. And that’s why we keep our own Anjuman at the tail of the procession to make sure that the procession reaches its destination on time,” he says.
Hazaras, he says, don’t participate in any balloting for getting number of ‘dasta’ as they are somewhat exempted from this process. But other Anjumans have to participate in the process. So, he says, that’s why Hazaras lead AH’s central procession every year.
Published in Dawn, August 9th, 2022
"
11,Emergency assistance ordered after death of 17 ailing children in Sindh's Dadu district,DHOs asked to set up medical camps in wake of deaths caused by gastroenteritis.,"DADU: Sindh chief secretary has directed district health officers of Dadu and Jamshoro to establish medical camps in flood-hit areas of Kachho and Manchhar Lake to provide help to ailing children on an emergency basis in the wake of reports of 17 children’s death from gastroenteritis. 
The chief secretary Dr Sohail Ahmed Rajput took serious notice of the children’s deaths, which started coming out of the rain-hit areas from July 7 to date during and after heavy rains, and asked Dadu DHO Dr Ahmed Ali Samejo and Jamshoro DHO Dr Vinod Kumar to bring aid to the ailing children at their doorsteps.
He directed the health officers to diagnose real cause of the children’s deaths. He would not brook any negligence by health officials in this regard and take stern action against them if the camps were not set up immediately, he warned.
He said that directives had also been issued to secretary of health, DG health Sindh, Hyderabad commissioner and Dadu deputy commissioner to monitor the operation of the medical camps and government healthcare facilities in Kachho and Manchhar Lake areas.

DHOs asked to set up medical camps

Dadu DC Syed Murtaza Ali Shah said that he had written letters to DHO Dr Ahmed Ali Samejo on Aug 2 and 5 and asked him to organise the camps and report about deaths of children and others from gastroenteritis and other diseases.
Palijo’s appeal
Ayaz Latif Palijo, president of Qaumi Awami Party, has demanded Sindh and federal governments immediately provide medical facilities, ration and other essential needs of life to rain-hit people of Kachho.
He said the situation was getting from bad to worse in Kachho region in Dadu and Jamshoro as well as Qambar-Shahdadkot districts after gastroenteritis breakout following heavy rain but health teams were still not visible in the affected areas.
Palijo said the government had not yet taken serious efforts to provide food and medical facilities to people of Kachho and ensure measures to protect human lives.
He said that leaders of both Sindh and central governments were only busy issuing statements but they had not taken any relief measures on ground.
Published in Dawn, August 9th, 2022
"
12,Stampede in mourning procession in Sukkur leaves six dead,"The stampede occurred when many of the hundreds of participants tried to touch, kiss and shoulder the taboot at a time.","SUKKUR: Six people were killed and several others fainted in a stampede during the 8th Muharram taboot (coffin) procession in Rohri late on Sunday night.
The procession was taken out from Imam­bargha Shah-i-Iraq in the evening. The stampede occurred when many of the hundreds of participants tried to touch, kiss and shoulder the taboot at a time. Scores of them fell down and were run over by many others.
They fell unconscious and six of them died before they could be provided any medical assistance.
Five of the deceased were identifed as Dil Sher, son of Moorzado, a resident of Kashmore; Hassan Pathan, a resident of Local Board locality of Sukkur; Zulfiqar Solangi and his brother Mansoor Solangi, residents of Khairpur district; and Kamran Ali, a resident of Ghotki district. The name of the remaining one could not be ascertained till late in the evening.
The other affected people were taken to nearby medical camps set up by the Edhi and other welfare organisations in Rohri.
The procession continued to take its course after the incident to reach its culmination point, Mandho Khabar.
Published in Dawn, August 9th, 2022
"
13,Two killed as oil spilling tanker hits truck,SUKKUR: A head-on collision between an oil tanker and a truck left two persons dead on National Highway near Daharki...,"SUKKUR: A head-on collision between an oil tanker and a truck left two persons dead on National Highway near Daharki town of Ghotki district on Monday.
According to the area police, the tanker was spilling oil and its driver was desperately trying to drive it away from the busy path in order to avoid accidents on the road that was getting slippery. However, he could not avoid a collision with an upcoming speeding truck.
The two occupants of the truck, Khizar Hayat and Imtiaz Ahmed, both hailing from Muzafferabad, lost their lives in the accident.
Published in Dawn, August 9th, 2022
"
14,Durrani distances himself from ethnic strife,SUKKUR: Sindh Assembly Speaker Agha Siraj Durrani has distanced himself from ongoing attempts to fan ethnic strife...,"SUKKUR: Sindh Assembly Speaker Agha Siraj Durrani has distanced himself from ongoing attempts to fan ethnic strife between Sindhis and Pathans and said that his ancestors had been living in Sindh for almost two centuries and they had now become completely Sindhis. 
They would always be in the forefront to spill their blood for Sindh if things ever came to such a pass, he said. 
It were the Afghan nationals who wreaked havoc on Sindh’s soil and Syed Jalal Shah, Dr Qadir Magsi, Ayaz Latif Palijo, Sanan Khan Qureshi, Riaz Ahmed Chandio and other leaders and old nationalist families fully appreciated this fact, they would never incite people to hatred for all Pathans in Sindh, remarked Durrani.
Talking to media persons after offering condolences to Amanullah Pathan over his mother’s death in Jacobabad, Durrani said that current monsoon rain had ruined standing crops and inundated cities and villages in Balochistan and Sindh.
He said in answer to a question on bills that it was Sindh government’s duty to enforce laws made by Sindh Assembly but implementation of federal government’s laws could be problematic in the province when the centre did not support or cooperate in their enforcement.
Commenting on foreign funding case against Pakistan Tehreek-i-Insaf, he said that it was an old case and the Election Commission of Pakistan should have impartially and thoroughly checked the evidence of the case.
Published in Dawn, August 9th, 2022
"
15,More fire stations be established in Larkana: LCCI,LARKANA: The Larkana Chamber of Commerce and Industry (LCCI) has expressed its concern over the local...,"LARKANA: The Larkana Chamber of Commerce and Industry (LCCI) has expressed its concern over the local municipality’s ill-preparedness to cope with any major fire incident in the city, pointing out that it had only four fire engines and they all were in bad shape.  
With these few vehicles, the Larkana Municipal Corporation (LMC) could perform its duty of firefighting in an efficient manner, it said, pointing out that the city had expanded in all directions and its population had also increased to 800,000 souls. 
The LCCI has urged the authorities concerned to establish more fire stations at different locations.
LCCI president Bashir M. Paryal Shaikh has written a letter to the department concerned in this regard.
Speaking to Dawn on Monday, he said it looked unjustified that the city with a population of 800,000 people had only one fire station. He said that the station was located in the thickly populated area, Jiles Bazaar, which appeared to be hub of business and trade. Vehicular traffic in the area could hardly move in peak hours, often at a snail’s pace. In an emergency situation, the fire brigade vehicles struggle hard to move amid a mess of traffic. This causes delay in rushing to a place where fire has to be extinguished. Ultimately the fire inflicts more damage. He said the four firefighting vehicles available to the station were procured in 1990s and since then the LMC seemed to have paid no attention to their maintenance. 
The station was in a shabby condition and very recently the plaster of its ceiling had partially fallen down, he said, adding that the life its personnel were also at risk while sitting in the office and the parking area. 
“It is very sad to see that the district is left at the mercy of nature; an emergency can hit this city anytime and the fire brigade would not be able to cope up it, he apprehended. 
He suggested that at least four fire stations be established on the outskirts of the city and also new vehicles be made available to them to save people from suffering heavy losses in the event of emergencies. 
Published in Dawn, August 9th, 2022
"
16,Khuhro condemns social media campaign over chopper crash,‘Imran Khan cannot escape disqualification after ECP’s foreign funding case decision’,"LARKANA: Pakistan Peoples Party (PPP) Sindh president Senator Nisar Ahmed Khuhro on Monday visited Sujawal Tunio village near Bakrani town to offer his condolences to the family of Maj Saeed Ahmed Tunio, the pilot of the army helicopter that had crashed in Winder, Balochistan, on August 1. Six army officers had embraced martyrdom in the incident.  
Other PPP leaders including Abdul Fatah Bhutto, Shakeel Memon and Amin Shaikh were accompanying Mr Khuhro. 
Later, speaking to the media the Senator condemned the regretful campaign on social media in the wake of the chopper crash. He fully supported the calls for immediate legal action against all those involved in the propaganda against the state and its institutions. He regretted that the propaganda was resorted to while the entire nation was in deep distress over the tragedy. He acknowledged that the institution of army had always been on the forefront and played its due role in difficult times. 
Mr Khuhro also commented on former prime minister Imran Khan’s politics and criticised him for “instigating youth to adopt a wrong path”. This would give birth to disturbance, he apprehended, and advised Mr Khan to “stop poisoning youths’ minds and exploiting them for his personal gains”.  

‘Imran Khan cannot escape disqualification after ECP’s foreign funding case decision’

The PPP leader claimed that fissures had emerged within PTI over its leadership. “There are many candidates in PTI for the slot of prime minister and one of them is [former foreign minister] Shah Mehmood Qureshi,” he further claimed.  
A day earlier, the PPP leader held a press conference here to explain his party’s views with regard to the Election Commission of Pakistan’s decision against PTI in foreign funding case. Mr Khuhro said Imran Khan was facing disqualification after the ECP decision and now seeking “NRO from political leadership of the ruling coalition [at the centre]. 
“Imran Khan is sending messages to the political leadership and seeking to spare himself from action,” alleged Mr Khuhro. 
“How could he be granted NRO now when foreign funding against him has been proved?” he argued, and expressed his confidence that Mr Khan would not escape disqualification. 
When leaders like Khwaja Nazimuddin, Ayoub Khuhro, Qazi Fazlullah, Pir Illahi Bakhsh, Hussain Shaheed Suharwardi and others could be disqualified than why not Imran Khan, he further argued. 
The PPP Senator noted that some PTI lawmakers were tendering their resignations while some others were sending their leave applications.  
Mr Khuhro alleged that millions of rupees had been deposited in the accounts of President Dr Arif Alvi, former Sindh governor Imran Ismail and other PTI leaders. President Alvi should step down and face the investigation, he said. 
He also pointed out that President Alvi and Imran Khan gave contradictory statements about alleged “directions” leading to the successful no-trust move against PTI government. “It proves that Mr Khan’s claim of US conspiracy was a lie,” he added.
Published in Dawn, August 9th, 2022
"
