,Header,Summary,Detail,Link,Category
9,"Three held at Lahore airport with $60,000",LAHORE: Authorities at the Allama Iqbal International Airport on Tuesday arrested three passengers for trying to...,"LAHORE: Authorities at the Allama Iqbal International Airport on Tuesday arrested three passengers for trying to smuggle $60,000 to Saudi Arabia.
According to officials, three passengers were to board a Saudi Arabia-bound flight when during checking an amount of $60,000 was recovered from their luggage. 
A case has been registered against them.
Meanwhile, the Federal Investigation Agency (FIA) arrested a man for his alleged involvement in illegal currency business in Dera Ghazi Khan.
According to a spokesperson, suspect Abdul Sattar was running a business of hawala and hundi.  
The FIA recovered Rs5.7m and 2,900 Saudi riyals from his possession.
A case has been registered against him under the Foreign Exchange Regulation Act 1947.
The FIA recently launched a campaign against those involved in illegal currency business and its smuggling.
The Lahore division FIA launched a crackdown on the persons involved in illegal currency business and arrested 50 suspects during this month. It nabbed the suspects from different parts of Lahore, Gujranwala and Gujrat and recovered a huge amount of foreign and local currency from them.
“The action against those involved in illegal currency business – hawala and hundi – has served as deterrence to the practice. It will also encourage the people to send remittances through a legal channel – banking,” FIA Lahore Director Sarfraz Virk had told Dawn.
Meanwhile, the FIA arrested three people for uploading objectionable pictures of women on social media in Gujranwala.
According to a spokesperson for the FIA cyber crime, suspects Nabil Hussain, Adeel Hussain and Amjad Afzal shared objectionable pictures of three women on social media.
A case has been registered against them under PECA Act.
Published in Dawn, December 28th, 2022
",read full story,lahore
10,Reforms suggested to outlaw domestic child labour,LAHORE: The government and civil society agreed to jointly push for legislative reform to outlaw child domestic...,"LAHORE: The government and civil society agreed to jointly push for legislative reform to outlaw child domestic labour in Punjab by amending the child protection law.  
This was finalised in the first meeting of the Provincial Coordination Forum, jointly established by Search for Justice and National Commission for Human Rights, Punjab. The forum was established to review the current legal and administrative framework for dealing with the issues of child domestic labour in Punjab and to recommend legislative and administrative measures to the provincial government to effectively prohibit the practice.  
The speakers were of the view that since the enactment of The Punjab Domestic Workers Act in 2019, not even a single case has been registered against anyone over the contravention of Section 3 of the law. From 2019-22, the government has been unable to establish clear mechanisms to receive complaints if someone employed a child under 15 years of age in accordance with the domestic workers law. This was evident to establish that there was a dire need to review the legal instruments with primary consideration to secure best interest of the child.  
Syed Miqdad Mehdi, a legal expert on child rights, shared that the legislatures and executives must see the issue through the lense of child protection and not labour. In the current legal environment, the police registered a first information report under Section 328-A of the Pakistan Penal Code where a child domestic labourer faced physical violence by their employers.  
In that case, despite all the efforts by the police, Child Protection and Welfare Bureau and civil society organisations, a culprit immediately got relief as the offence “cruelty to child” was bailable and compoundable. Such an offence must be non-bailable and non-compoundable for setting deterrence through the law.  
Nadeem Ashraf, a member/commissioner of the National Commission for Human Rights (Punjab), highlighted the need to strengthen interdepartmental coordination among relevant government departments and civil society organisations for a robust and efficient response to rescue and recover child domestic labourers, victims of violence and abuse.  
Child Protection and Welfare Bureau Chairperson Sarah Ahmad endorsed the suggestion to bring the issue of child domestic labour under the purview of ‘The Punjab Destitute and Neglected Children Act’. She mentioned that the bureau would initiate drafting of an amendment that would be introduced in the assembly after consultations with relevant stakeholders, including government, domestic workers union, civil society organisation and parliamentarians.
Published in Dawn, December 28th, 2022
",read full story,lahore
11,Fog-related accidents claim four lives,BAHAWALPUR: Four people were killed and five others injured seriously in separate fog-related accidents in different...,"BAHAWALPUR: Four people were killed and five others injured seriously in separate fog-related accidents in different parts of the province on Tuesday.  
According to Rescue 1122 Bahawalpur, Nazi Bibi, 35, was run over and killed on the spot by a speeding trailer while she was walking on a roadside near Ashraf Sugar Mills on Bahawalpur-Ahmedpur East road.  
According to the traffic police, the trailer driver could not spot the deceased woman due to poor visibility caused by a thick layer of fog on the highway. However, Sammasatta police arrested the driver and the body was handed over to her family. 
Separately, Ahad, 12, drowned in an open manhole in Basti 42 Adda Yazman road, while his relative Wajahat, also 12, was rescued and shifted to Bahawal Victoria Hospital. 
A motorcyclist, Abdul Malik, was killed while his pillion riders, Ehsan and Muhammad Ismail, suffered injuries when their vehicle was hit from the rear side by a tractor-trolley near Karampur on Uch Sharif Road.  
Police claimed to have arrested the trolley driver.  
TOBA TEK SINGH: A motorcyclist died after he was hit by a crane near Kashmir Underpass on Faisalabad’s Canal Road.  
He was identified as Abdul Rehman, 19, of Madanpura locality.  
In another fog-related accident in Jhang, two people were injured critically on Chiniot Road near Adda Khewa.  
Rescue 1122 said a mini-van of a milk company collided head-on with a sugarcane-laden tractor trolley, injuring the van driver and his helper, identified as Abdul Hameed and Zulfiqar Ali, respectively.  
They remained trapped in the van and were pulled out after cutting the vehicle’s body. They were shifted to the Jhang DHQ hospital.
Published in Dawn, December 28th, 2022
",read full story,lahore
12,UAF signs accord with tech firm for collaboration,TOBA TEK SINGH: The University of Agriculture Faisalabad (UAF) and EPTeck Technologies Pvt Ltd on Tuesday inked a...,"TOBA TEK SINGH: The University of Agriculture Faisalabad (UAF) and EPTeck Technologies Pvt Ltd on Tuesday inked a memorandum of understanding (MoU) to collaborate in the areas of academia and research. 
The MoU was signed by UAF Vice Chancellor Prof Dr Iqrar Ahmad Khan and EPTeck Technologies Chief Executive Officer Engr Khalil Ahmed Rashid. Both parties agreed to work jointly on capacity-building, faculty and staff development programs, exchange of students and staff and exchange of academic information and materials. 
Speaking on the occasion, Prof Khan said the UAF mission would lead the change through learning, discovery and community services with a special focus on agriculture and rural development. 
He said the country was facing different challenges in the agriculture sector and the latest agriculture practices would have to be developed to counter them. 
Engr Khalil Ahmed Rashid called for making the joint efforts for knowledge-based economy.  
UAF Director External Linkages Prof Dr Waseem Akram, Prof Dr Khalid Mushtaq, EPTeck Technologies Director Amir Zahoor and Saleem Akhtar also attended the meeting.  
RECOVERED: Jhang police recovered two missing girls belonging to Garh Maharaja from Soan Sakesar and Multan.
Jhang SP investigation Asghar Ali said the Garh Maharaja police had registered a case on complaint of Muhammad Ayub of Mohalla Jattanwala. He complained that his daughter Rukhsana (19) had been missing from home and he suspected that she might have gone with her class fellow, Saadia, to unknown place. 
Later, the families of both the girls received on WhatsApp pictures of the girls tied with ropes. A kidnapper demanded Rs10m ransom from their parents. 
Police traced the girls and arrested a man, Shahzeb Ahmad of Khanewal, and recovered the girls from Soan Sakesar and Multan on his identification. Police found out that both the girls had disappeared on their own under a plan made with Shahzeb.
Published in Dawn, December 28th, 2022
",read full story,lahore
13,Uplift projects approved,BAHAWALPUR: The District Development Committee at its meeting held here on Tuesday approved 53 uplift projects...,"BAHAWALPUR: The District Development Committee at its meeting held here on Tuesday approved 53 uplift projects costing over Rs600 million.
According to a handout, the meeting chaired by Deputy Commissioner Zahid Pervaiz Warraich pertained to the departments of highways, buildings, Public Health Engineering (PHED) and Mepco. The DC directed to ensure the quality and standard of the works to be completed within the specified period. 
MEPCO: The Mepco claims to have detected the alleged pilferage of about 72,000 units in one day in south Punjab on Tuesday.
According to Mepco PRO Jamshed Niazi, the power thieves were fined a sum of Rs140,000 while three FIRs were registered against power thieves.
Published in Dawn, December 28th, 2022
",read full story,lahore
