,Header,Summary,Detail
9,Classic events in doubt as F1 plans for city-centred future,LE CASTELLET: The future of the French Grand Prix and several other classic European races was declared uncertain on...,"LE CASTELLET: The future of the French Grand Prix and several other classic European races was declared uncertain on Monday as the dust settled following Max Verstappen’s crushing victory in front of a sell-out crowd at the Paul Ricard Circuit.
Widespread misgivings about F1’s plans to scrap established traditional races, or rotate them, and instead to hold more ‘international’ big city street circuit events, including a proposed Las Vegas race, dominated paddock debate during a sun-baked weekend.
World champion Verstappen had joined other drivers before the race in objecting to the likely loss of the sport’s iconic traditional circuits, including the Spa-Francorchamps track in the Belgian Ardennes, from a proposed 25-race calendar for next year.
Other historic events, including the Monaco and Italian Grands Prix, have been cited as targets for the axe as Liberty Media, owners of the commercial rights, forge a new future, breaking from the past and targeting new younger audiences.
“I don’t want to see myself in 2028, or whatever, driving only on street circuits close to a city just for the fan engagement, or whatever,” said championship leader Verstappen.
“I understand everyone wants to make money, but there is also a limit to that because it’s important to keep these really cool circuits on the calendar instead of just driving on street circuits, which I think F1 cars are not designed for anyway.”
Verstappen has been reluctant to accept the sport’s Americanisation, led by owners Liberty Media’s push for a Netflix-driven expansion into new markets including the United States, the Middle East and South Africa and objected to participating in the ‘Drive to Survive’ series.
The sport’s traditionalists were given hope on Monday when race promoter Christian Estrosi said he was  “not resigned” to the loss of the French Grand Prix next year after record crowds at this season’s event.
“It’s the end of a contract in which France had to show its know-how in organisation,” he said.  “200,000 people filled the circuit between Friday and Sunday, which is an absolute record.
“We are in the middle of a discussion -- so no, I am not resigned. I saw our country regain its Grand Prix de France -- this magnificent, popular sporting event. I am convinced that in the coming weeks, we will have extremely positive things to announce for the future of our Grand Prix.”
French driver Esteban Ocon of Alpine suggested Le Mans, the venue of the world’s most famous 24-Hour race, could be used in a new format that also helped to preserve the Belgian Grand Prix.
“I think we have multiple options,” he said.  “I don’t think around Paris is realistic with the way the people there are running the area, but there are others that could work -- Magny-Cours, of course, but it is hard to get to. Le Mans as a French Grand Prix could be awesome.”
He added that alternating races in France and Belgium could be a solution.
“I don’t care about the business aspect of it as a driver, but it leaves F1 in a better place and for us it’s important, but as a driving experience I like Jeddah and many of these new tracks.”
France, Belgium and Italy, along with Britain and Monaco, hosted races in the inaugural 1950 world championship season.
All five have been touted as under threat in recent years as the hosting fees have risen with the arrival of new events including Miami, Singapore, Las Vegas, Abu Dhabi, Doha, Jeddah and more planned.
France has paid a reported fee of around $20 million to host a race at Le Castellet since returning to the calendar in 2018, after a 10-year absence, while Saudi Arabia pays a reported $50 million.
“The reality is that F1 is extremely attractive and there are a lot of cities and countries that want to host F1,” said French GP director Eric Boullier.
Verstappen offered a more purist view that helped explain why thousands of fans would spend three days in cold, wet woodlands, staying in tents, to watch the Belgian race rather than a luxury hotel in a warm climate with a street track.
“It’s just a great track to drive... I understand that to get there compared to other tracks, it’s probably a little bit more difficult, but it is just fantastic,” he said.
Published in Dawn, July 26th, 2022
"
10,Williamson returns for white ball tour of West Indies,WELLINGTON: New Zealand captain Kane Williamson has been named in his first white ball squad since the T20 World Cup...,"WELLINGTON: New Zealand captain Kane Williamson has been named in his first white ball squad since the T20 World Cup as the Black Caps ramp up their preparations for the global tournament with their first tour of the Caribbean in eight years.
Williamson, who played his last T20 match in the defeat by Australia in the World Cup final last November, will captain identical T20 and ODI squads to play the West Indies in six white ball matches starting in Jamaica on Aug 10.
Williamson will be joined by pace veterans Trent Boult and Tim Southee, and batsman Devon Conway, all of whom were rested following the team’s 3-0 whitewash by England in the Test series in June.
“It’s always exciting to be heading somewhere you’ve not been in a while and I know this group cant wait for the challenge of taking on the West Indies in the Caribbean,” coach Gary Stead said in a statement on Monday.
“For Kane, Trent, Tim and Devon, this will be the first time they have played white ball cricket for New Zealand since last years T20 World Cup and tour to India — so this trip will be important for them.”
New Zealand wrapped up a 3-0 T20 series defeat of Ireland with a six-wicket win in Belfast last week.
A number of players who featured in that series have been omitted for the West Indies tour, including Dane Cleaver, Jacob Duffy and Blair Tickner.
Batsmen Finn Allen and Michael Bracewell have broken into New Zealand’s best 15 in the lead-up to the T20 World Cup being hosted by champions Australia in October-November.
Allen made his ODI debut against Ireland this month, while Bracewell made his T20I debut against the Irish last week.
Squad:  Kane Williamson (captain), Finn Allen, Trent Boult, Michael Bracewell, Devon Conway, Lockie Ferguson, Martin Guptill, Matt Henry, Tom Latham, Daryl Mitchell, Jimmy Neesham, Glenn Phillips, Mitchell Santner, Ish Sodhi, Tim Southee.
"
11,Multi-format cricketers could be on way out: De Kock,"""Three formats is a lot and it looks like more games are happening over the calendar,"" he says.","LEEDS: Quinton de Kock believes it will become increasingly difficult for leading cricketers to play all three main formats, although he remains confident about the future for One-day Internationals.
The South Africa wicket-keeper/batsman, who made a fine unbeaten 92 before the third ODI against England at Headingley on Sunday was washed out, ended his Test career late last year, shortly before becoming a father for the first time.
Questions regarding a congested global schedule were raised again after the ODI retirement of England all-rounder Ben Stokes following the first match of this series at the 2019 World Cup final star’s Chester-le-Street home ground.
De Kock, speaking after Sunday’s rain in Leeds meant a three-game contest ended in a 1-1 draw, told reporters:  “It’s going to start being tough for players — three formats is a lot and it looks like more games are happening over the calendar.
“Players need to make decisions individually and if they feel they can do it [play Tests, ODIs and T20 Internationals], I am happy for them,” the 29-year-old added.
“But guys need to take decisions into their own hands. For me, I am happy where I am.”
De Kock though stressed curtailing a 54-match Test career had yet to have the desired effect.
Although he had two months off after returning from paternity leave to play in South Africa’s white-ball matches against India in January ahead of the series against Bangladesh, he has been on the go playing cricket ever since.
De Kock featured for the Lucknow Super Giants in the Indian Premier League before the tour of England, which also includes several further T20 Internationals.
He will then remain in England to play in the Hundred before heading to the Caribbean Premier League prior to another white-ball series in India which precedes the T20 World Cup in Australia.
“It [retiring from Tests] hasn’t freed up my calendar -- at least not this year,” said De Kock.
“I’ve been roped in to play a couple of leagues but that’s my own consequence.
“I am happy to do it. It’s still a sacrifice but I’m slowly getting to an age where I need to think about where I want to be in my career.”
South Africa have never won a 50-over World Cup — something they will try to put right in India next year — with De Kock insisting:  “The (ODI) game is doing well for itself with the way players are going about it and from a batting and bowling competitiveness.
“There’s a future for it and a lot of us still want to win 50-over World Cups.”
Meanwhile, England captain Jos Buttler was left frustrated by a gruelling schedule, as much as the bad weather.
The 50-over world champions are currently nine games into a hectic period of 12 white-ball fixtures in 24 days, with just a solitary training day in that time.
Buttler, who recently succeeded Eoin Morgan as England’s limited-overs captain following the 2019 World Cup-winning skipper’s international retirement, said:  “It’s tough.
“To get the highest standard of cricket possible, you need to prepare properly. Hopefully that’s something we can look at going forward.
“That’s been a frustration to be truthfully honest — it would be nice to have that time to do the work,” Buttler added.
Published in Dawn, July 26th, 2022
"
12,Record-breaking Duplantis soars as US complete historic medal haul,EUGENE: Armand Duplantis brought down the curtain on the World Athletics Championships in stunning fashion on ...,"EUGENE: Armand Duplantis brought down the curtain on the World Athletics Championships in stunning fashion on Sunday, breaking his own pole vault world record in the final act of the 10-day global track and field extravaganza. 
After the United States claimed emphatic victories in both the men’s and women’s 4x400 metre relays, Duplantis took centre stage and duly delivered a perfect finale for the first championships on American soil — apart from the fact maybe that the US-born and raised 22-year-old was wearing the yellow and blue of Sweden and not representing the Stars and Stripes. 
The Swede sailed over 6.21 metres to surpass his previous mark by one centimetre — set in March en route to winning gold at the World Indoor Championships — and complete his collection of medals by claiming a first world title. 
The packed, raucous crowd at Hayward Field went wild as Duplantis sprinted to see his father and coach Greg and plant a kiss on girlfriend Desire Inglander. 
“It’s great; I cannot complain,” Duplantis said. “Actually, I did not think about the record that much today .... I really wanted to win the gold so badly. It was the medal I was missing. So when I was on this height, it was like everything came together and it happened from there. 
“I love jumping in Eugene and it was amazing here. I cannot figure the next heights right now. I am going to have a bit time off with my family and my friends.” 
American Chris Nilsen took silver with 5.94 metres on countback from Ernest John Obiena, whose bronze was the first-ever world medal for the Philippines. 
Unheralded Nigerian Tobi Amusan had earlier stolen the show with two electric runs on her way to gold in the 100m hurdles. 
In the very first event of a loaded evening of track, people had barely had chance to sit down with their sodas and popcorn before Amusan rocketed to a new world record of 12.12 seconds in the semi-finals. 
When she retook to the track later in the session, the Nigerian stormed to victory in 12.06sec, although a tailwind speed of 2.5 metres per second meant it wouldn’t go down in the freshly-inked record books. 
“The goal was to come out and to win this gold. .... The world record is a bonus. I just did it,” said Amusan, who finished 0.17 seconds ahead of Jamaican Britany Anderson while Puerto Rico’s Olympic champion Jasmine Camacho-Quinn went home with bronze. “I believe in my abilities but I was not expecting a world record at these championships.” 
American Athing Mu lived up to her hype by adding the world 800m title to her Olympic crown. 
Mu, still only 20 years of age, was forced to dig deep to hold off British rival Keeley Hodgkinson in a thrilling battle down the final straight before taking gold in a world-leading 1min 56.30sec. 
“I’m just glad I made it to the line to finish the race, and thankfully I won gold. I just physically wasn’t where I would like to be,” Mu said. 
Another gold medallist from last year’s Tokyo Olympics, Malaika Mihambo, won Germany a long-awaited medal as she retained her world long jump title. 
But Uganda’s Joshua Cheptegei floundered in a 5000m race won convincingly by Norway’s Jakob Ingebrigtsen, who bounced back from the disappointment of silver in the 1500m. 
“I didn’t want a sprint finish,” Ingebrigtsen said.  “I wanted to prove that I’m a better runner than the rest of the guys. It was a great race. I ran it, I needed it. I felt really good today, but 5km is really tough.” 
French world record holder Kevin Mayer regained the decathlon title after impressive performances in the pole vault and javelin, seizing opportunity after a competition-ending injury to Olympic champion Damian Warner. 
Mayer accrued 8,816 points after 10 disciplines over two days to follow up on previous world gold in 2017 in London. 
In the morning session, Italy’s Massimo Stano claimed a one-second victory over Masatora Kawano of Japan in the men’s 35km race walk, adding a world gold to his Olympic crown. 
The United States wrapped up the championships by consolidating their place at the top of the medals table with a championship record 33 medals. 
The men’s quartet came home in two minutes, 56.17 seconds and strengthened the Americans’ stranglehold on the event. The United States has now won eight of the past nine world titles and eight of the past 10 Olympic golds. 
Sydney McLaughlin, the newly crowned 400 metres hurdles gold medallist, anchored the women’s team and ran a remarkable 47.91 final leg to give the hosts their 13th gold medal of the event. 
The women’s victory meant the now-retired Allyson Felix bagged a 20th world medal as she was a squad member who ran in Saturday’s heats.
Published in Dawn, July 26th, 2022
"
