,Header,Summary,Detail
0,Opposition will not allow mini-budget: Shehbaz,"“The government’s policy of relying on foreign banks for US dollars is like playing with fire,” he says.","LAHORE: National Assembly opposition leader Shehbaz Sharif says the PTI government is falling back on global commercial banks to avoid depletion of foreign exchange reserves which confirms the concerns and alarm expressed by the opposition.  
“The government’s policy of relying on foreign banks for US dollars is like playing with fire. The opposition will not let the government approve a mini-budget,” he said in a statement on Friday.  
The PML-N president hoped the conscientious members of the government and its allies would take a bold stand to stand by truth. “If the government’s allies join the oppression of the people they will also be seen by the nation as accomplices in destruction of the national economy along with the PTI,” he said.
Shehbaz said that since 2018, the government had reached a debt level of $40 billion which was alarming to say the least.  
“During the first five months of the current financial year, the government borrowed $4.96bn out of which $3.45bn were for non-developmental purposes. Out of the $14bn budget estimate, only $4.699bn have been raised so far,” he said and added debt money could not sustain the economy and nor was it a wise policy in favour of the country.  
“With the entire economy, national defence and government system on debt, the philosophy of geoeconomics will become a joke,” he lambasted.  
“The US dollar is at an all-time high of Rs180.7 and the government is creating more instability by saying the country is running out of dollars,” Shehbaz said.
Published in Dawn, December 25th, 2021
"
1,Man shot dead for warning biker against driving rashly,LAHORE: A young man was allegedly shot dead for asking his neighbour not to drive motorbike rashly in the street in...,"LAHORE: A young man was allegedly shot dead for asking his neighbour not to drive motorbike rashly in the street in Kahna area here on Friday.
Initial police inquiries suggested that the suspect, Latif Safdar, used to drive motorcycle rashly at Bado Ki village.
As per police, on Friday, Safdar was doing stunts on his bike when children were playing in the village street. Adil Yousuf stopped him and requested him to avoid rash driving.  
This led to exchange of words between the two, the police said, adding that later Safdar returned with a pistol and shot at and injured Adil critically.
He was shifted to hospital where he succumbed to his injuries.  
The police lodged a murder case against the suspect who had fled the scene.
In another incident taking place in Shahdara area, Rehana Bibi, 40, was shot dead in her house by an unidentified armed man.
The victim’s son, Huzaifa, told police that as the family members heard gunshots, they rushed to the first floor of the house and found his mother lying in a pool of blood.
He said she was shifted to hospital where she died before getting any treatment.  
He claimed they had no enmity with anyone.
The police shifted the woman’s body to the city morgue for an autopsy and lodged a murder case against the unidentified killer(s).
Published in Dawn, December 25th, 2021
"
2,Consumers face gas crisis,Arrival of LNG cargo in January may ease pressure,"LAHORE: Domestic consumers across the province are either experiencing extremely low pressure or no gas at all in peak hours these days. 
The situation may improve if an LNG cargo ordered by the Pakistan LNG Limited is received by Jan 10, Dawn has learned. 
“The Sui Northern Gas Pipelines Limited (SNGPL) wants to provide gas uninterruptedly to domestic consumers,” says an official. “To meet the demand, three LNG cargos are required, but orders for two of the three cargoes were delayed. So, keeping in view the situation, it seems that only one cargo may arrive on Jan 10. And if it is also delayed, the situation may get out of control.”  
According to another official source, the domestic sector’s demand in Punjab alone is 950MMCFD that includes over 500MMCFD of Regasified Liquefied Natural Gas (RLNG) and 450MMCFD of system gas (Indigenous gas). Under the constitution, Punjab is supposed to use the indigenous gas that is surplus of the gas-producing provinces. 

Arrival of LNG cargo in January may ease pressure

“The problem was created by those who failed to import LNG on time to meet consumers’ demand in winter,” he said, adding that the company (SNGPL) recently suspended RLNG supplies to captive power-run export industry and diverted the same to domestic consumers. “And if the domestic consumers’ demand increases, the company may suspend supplies to non-export industries.” 
On the other hand, domestic consumers have been facing extremely low gas pressure or no gas in peak hours across the province. “Most of the time, we have no gas these days,” said a resident of Township. “So, when we have no gas, why we are being served heavy bills.”
The consumers residing in other localities also complained about the severe shortage of gas, low gas pressure, or no gas. 
“The situation has been worst for the last couple of years, as, we have no gas in peak hours (especially after 9pm) in winter,” complained another consumer. 
However, the official dispelled the impression, stating that the problems existed in the tail-end area alone. 
He admitted the fact that most areas were experiencing gas shortages after 9pm. 
“Actually, it’s due to the gas pressure-building activities that are supposed to be carried out by the SNGPL’s teams for normal gas supplies to the consumers,” he clarified.
Published in Dawn, December 25th, 2021
"
3,Pindi Ring Road scam resonates in Punjab Assembly,PML-N’s Samiullah Khan alleges the government deliberately delayed answering the question for eight months.,"LAHORE: The Rawalpindi Ring Road project scandal resonated in the Punjab Assembly on Friday as the treasury and opposition members leveled allegations of corruption against each other.
Not satisfied with the answer given to a written query during the Question Hour, PML-N’s Samiullah Khan alleged that the government deliberately delayed answering the question for eight months.
He challenged the authenticity of the details related to the scandal given in the house and said that action was taken only against the bureaucrats involved in the multi-billion rupees scam, while the political figures like federal ministers Ghulam Sarwar Khan and Zulfi Bukhari were given a clean chit.
He also alleged that both the prime minister and Punjab chief minister were aware of the wrongdoings committed in the ring road project and sought details of the meetings presided over by them pertaining to the project.
Parliamentary Secretary Taimur Masood said the prime minister had himself exposed the scandal and naming Imran Khan in the case would be unfair.
He said a transparent inquiry had been conducted into the case registered with the Anti-Corruption Establishment. He vowed to take the case to its logical end. 
Published in Dawn, December 25th, 2021
"
4,Govt asked to allow LNG imports by private sector,"LAHORE: Blaming the mismanagement on the part of relevant ministers and departments for the ongoing gas crisis, the...","LAHORE: Blaming the mismanagement on the part of relevant ministers and departments for the ongoing gas crisis, the All Pakistan CNG Association has asked the government to immediately allow the private sector to import Liquefied Natural Gas (LNG) to meet the growing demand of various sectors.
“Despite the government’s desire of liberalising the gas sector, some elements are not allowing the private sector to start cheap gas imports. This is the only reason behind the gas crisis emerging every year in winter,” the association’s group leader Ghayas Piracha told Dawn on Friday.
“We firmly believe that some departments are ruining the economy in a bid to continue their monopoly over the troubled gas sector. And the desire of these departments is resulting in production and export losses, while hundreds of thousands of people are losing their jobs in this era of double-digit inflation,” he alleged.
Mr Piracha said the association had earlier planned to start LNG imports from August after the government (the then secretary and the minister) gave us a go-ahead in this regard in March. But unfortunately, they were removed from the posts and the matter lingered on again.
After posting of the new minister and the secretary, the association approached them to accord certain approvals in this regard. They worked, enabling the association to start imports and receive its first LNG cargo on Jan 21, 2022.
“But recently, the petroleum secretary was transferred and it, again, delayed the works underway to accord approvals. And if the new secretary, even, quickly removes bottlenecks, we may not be able to receive the first cargo before Feb 10, 2022, since the whole process (approvals, import orders, receipt of cargo, etc) requires at least 45 days,” he explained.
Because of these factors, a gas crisis occurs every winter and now even it has also become a routine during the summer, costing the battered economy dearly, deplored Mr Paracha.
He also accused the SNGPL of delaying getting the agreement (for LNG imports by CNG and other sectors) approved by its board of directors.  
“We request the government to intervene in the matter immediately and enable the private sector including CNG to import LNG to meet the growing demand.”
Earlier in a statement, he said the bureaucracy has also failed to make timely LNG imports at reasonable prices as a result expensive gas is being imported to sell it cheaply to influential sectors. 
Published in Dawn, December 25th, 2021
"
5,Ulema board decides to cleanse curriculum of extremism: SAPM,"So far, 307 books had been cleared from possible extremist content, he says.","LAHORE: The Muttahida Ulema Board has unanimously decided to cleanse the curriculum of extremist content, says Special Assistant to Prime Minister on Religious Harmony Hafiz Tahir Ashrafi. 
Speaking at a press conference here on Friday following a meeting of the board, he said the single national curriculum did not have any element of extremism and radicalism. So far, 307 books had been cleared from possible extremist content, he added. 
Mr Ashrafi expressed grief over the Sialkot tragedy, stating that the nation as a whole was embarrassed over the incident. He said that teachings of Islam did not allow any such heinous act and the united voice raised by the Ulema in condemning the incident had been heard all over the world. 
In response to a question, Hafiz Ashrafi said that if Maulana Fazlur Rehman was expecting to be congratulated on winning the local body elections in Khyber Pakhtunkhwa, he should first congratulate Imran Khan on becoming the prime minister. 
Commenting on the Afghanistan situation, he said that it’s the responsibility of all human beings to help the Afghans on humanitarian grounds in the prevailing circumstances. He hoped that aid to Afghanistan would soon begin to flow to alleviate the sufferings of its people. 
Mr Ashrafi felicitated the Christian community on the eve of Christmas with the commitment to help avail all facilities to celebrate their festivities.
Published in Dawn, December 25th, 2021
"
6,Vehicles sans fitness certificates barred from entering Lahore,Relief commissioner says Lahore’s AQI fluctuating from “satisfactory” to “poor” levels.,"LAHORE: In view of persistent deterioration in Air Quality Index (AQI) of Lahore city, Punjab Relief Commissioner Babar Hayat Tarar has banned the entry of public service vehicles in the city without valid fitness certificates issued by the Vehicle Inspection and Certificate System (VICS).
The relief commissioner states that the Lahore’s AQI was fluctuating from “satisfactory” to “poor” levels, which is likely to cause breathing discomfort, respiratory tract and heart diseases amongst people in all age brackets.  
The Punjab cabinet has already declared smog as a calamity.
He says that manual vehicle inspections shall be suspended for three months till March 22 next across Punjab. All public service vehicles will now be required to obtain fitness certificate from the respective VICS stations.
The traffic police has been asked to impound the documents of public service vehicles found playing without valid fitness certificates and forward the same to the Regional Transport Authority (RTA) secretary concerned for release after verification of their fitness certificates. 
Published in Dawn, December 25th, 2021
"
7,"Inquiry against Shehbaz, Hamza: Arguments sought on court jurisdiction",LAHORE: A special court (offences in bank) on Friday sought arguments from the prosecution and the defence on the...,"LAHORE: A special court (offences in bank) on Friday sought arguments from the prosecution and the defence on the point of its jurisdiction to hold trial proceedings in the money laundering and sugar scam inquiry against Leader of Opposition in the National Assembly Shehbaz Sharif and his son, Hamza.
As Presiding Judge Tahir Sabir resumed the hearing, a lawyer told the court that lead defence counsel Amjad Pervez was not available due to his appearance before the high court. The lawyer sought a short adjournment.
The judge allowed the request and adjourned the hearing till Jan 4 with a direction to both sides to come up with arguments on the point of court’s jurisdiction.
The Federal Investigation Agency (FIA) had challenged the court’s jurisdiction to hold trial in the inquiry wherein a challan had also been filed by the agency.
The FIA had booked Shehbaz and his sons Hamza and Suleman in November 2020 under sections 419, 420, 468, 471, 34 and 109 (financial fraud, impersonation and forgery) of the Pakistan Penal Code (PPC) and 5(2) and 5(3) (criminal misconduct) of Prevention of Corruption Act and r/w 3/4 of THE Anti Money Laundering Act.  
Suleman Shehbaz is absconding and residing in the UK.
Arabic teachers: The Lahore High Court on Friday sought a report from the Punjab government about the progress on the recruitment of teachers for Arabic language in order to implement teaching of the Holy Quran in schools.  
A division bench headed by Justice Shahid Waheed was hearing an appeal seeking teaching of the Quran in schools.  
An official of the education department told the bench that 7,000 teachers were being given training in the first phase. He said a total of 60,000 Arabic language teachers were required in the province. He said there were financial constraints but the process of appointment of the teachers would start soon.  
The bench adjourned further hearing till Jan 3 and directed the education department to submit a progress report.  
In this case, the bench had earlier directed the sessions judges of all the districts in Punjab to check in their relevant territories whether the Holy Quran was being taught as a separate subject as claimed by the education department.  
The school education department in a report had confirmed that the chief executive officers of the district education authorities visited all the schools (public, private, madressahs) in their respective areas and confirmed that the Holy Quran was being taught in every school as a separate subject.
The judge had ordered that the D&SJs or their nominees would not only check whether Quran was being taught as a separate subject but also counter-verify that the facts narrated by the education department were correct in all respects.
Published in Dawn, December 25th, 2021
"
8,FIA case against Shehbaz: Marriyum asks Shehzad to produce evidence,LAHORE: PML-N information secretary Marriyum Aurangzeb has challenged Prime Minister Imran Khan and his adviser...,"LAHORE: PML-N information secretary Marriyum Aurangzeb has challenged Prime Minister Imran Khan and his adviser Shehzad Akbar to present evidence, if any, against the National Assembly opposition leader Shehbaz Sharif in the court, or stop “false propaganda and smear campaign” against him.
“On Jan 4 (next court hearing in the FIA’s money laundering case against Shehbaz), Khan and Akbar must come to the court with a box of evidence to support the false allegations being peddled for the past three and a half years. The people of Pakistan will find out who is actually on the run,” she said in a statement on Friday.
She said there was no point in responding to anything Mr Akbar said because the adviser, like his “master” Imran Khan, was a “pathological liar” who had been embarrassed by the courts, yet he continued to lie because that’s what he was hired for.
“The PML-N president faced false cases and allegations on a daily basis, now it is Imran Khan and his tout’s turn. Imran had been disgraced for three years with the so-called files of cases against Shehbaz. Imran should also appear in the defamation suit filed by Shehbaz and bring evidence instead of running away,” she said.
She said it had been over a year since the “false” FIR of money laundering was filed against Shehbaz, but so far no evidence had been furnished. Evidence supporting Imran’s allegations against Shehbaz had been missing from day one, she said and added there was no evidence of corruption and corrupt practices in the FIA’s challan.
“Daily Mail and its tout Shahzad ran away from the London court when it came to [presenting] evidence. After the failure of NAB, FIA is being used only to fulfill Imran’s desire for political revenge,” she said.
Published in Dawn, December 25th, 2021
"
9,Larvae detection: FIR against businessman quashed,LAHORE: The Lahore High Court has quashed an FIR registered by police against the owner of a business place after...,"LAHORE: The Lahore High Court has quashed an FIR registered by police against the owner of a business place after dengue larvae was found from the premises.  
Announcing a reserved verdict, Justice Ali Baqar Najafi allowed a petition challenging a criminal case lodged by the Lorry Adda police against the petitioner under section 188 of PPC read with section 15 of the Punjab Prevention & Control of Dengue Regulations 2021.  
The petitioner’s counsel, Sheraz Zaka, submitted that according to rule 4 and 5 of the dengue regulations, a notice and recommendatory measures had to be issued by the health inspector, whereas in the instant case no notice or recommendations had been issued. He said the health inspector appointed by the government sealed the premises in violation of the rules and police registered the FIR unlawfully.  
In the verdict, Justice Najafi observes that the registration of FIR is nothing but abuse of the process of law. “Such FIR, therefore, cannot be sustained in the eyes of law. The submission of challan in the court of law of a case which has inherent deficiency cannot be carried out,” the judge rules.  
The judge also directed the government not to seal the business premises without complying with the mandatory provisions.
Published in Dawn, December 25th, 2021
"
10,"Lahore ‘TechnoPolis’ being set up for education, hi-tech firms: minister",LAHORE: Punjab Minister for Higher Education and Information Technology Raja Yassir Humayun Sarfraz says ‘Lahore...,"LAHORE: Punjab Minister for Higher Education and Information Technology Raja Yassir Humayun Sarfraz says ‘Lahore TechnoPolis’ is being established on 800 acres to create an ecosystem for knowledge economy, education, research and hi-tech manufacturing.  
“The Lahore TechnoPolis is a project of the Higher Education Department (HED) and the Lahore Knowledge Park Company (LKPC) will manage and operate it.” 
He stated this while addressing a press conference at Alhamra on Friday. Special Assistant to Chief Minister (SACM) Hasaan Khawar and LKPC Chairman Jamal Ansari accompanied him. 
Mr Sarfraz said the Lahore TechnoPolis, inaugurated by Prime Minister Imran Khan, would house top-ranked international universities, research centres and hi-tech companies. He said business centres would be established for conducting research on the technology products and establish linkages with the local as well international industries with a focus on exports of technology and boosting the knowledge economy. 
The higher education minister added that a fully operative working environment containing electricity, the internet and furnished offices would be provided to fresh graduates for the brainstorming and materialising the innovative ideas in line with the industrial requirement. 
He said that in the first phase, a tower consisting on 5-10 acres would be constructed as Iconic Tower to house the LKPC regulatory offices, research centres, business incubators along the facility of one-window operation for facilitating Zone Enterprises to set up their organisations. 
Mr Sarfraz said the Lahore TechnoPolis was aiming at developing a ‘Boot Camp’ for providing knowledge and technical training and skills to the young IT students. 
The minister claimed the TechnoPolis would increase the reputation as well as ranking of Pakistan amongst other countries of the world in terms of the creation of entrepreneurs (currently Pakistan is at 107 position), job creation and improve the quality of life of people. 
SACM Khawar said Pakistan would claim its share from world’s 11tr revenue tech industries and launch of work on the Lahore Technopolis was a part of the practical strategy in achieving this aim. He said the previous government had acquired 813 acres in 2013 for setting up universities on 200 acres and use the remaining land for commercial purposes.  
He said more than Rs1.5bn were spent on the project till 2018 and a wall, a gate and a heap of garbage were present on the spot while the PML-N was trying to claim the credit. 
LKPC Chairman Mr Ansari also spoke.
Published in Dawn, December 25th, 2021
"
11,Public depts hold ceremonies on eve of Christmas,"LAHORE: Several public departments on Friday held cake- cutting ceremonies on the eve of Christmas.  

The heads of...","LAHORE: Several public departments on Friday held cake- cutting ceremonies on the eve of Christmas.  
The heads of these departments were present in the ceremonies and wished the Christian community a happy Christmas.  
Punjab Inspector General of Police (IGP) Rao Sardar Ali Khan chaired a special ceremony in the honour of Christian employees at the Central Police Office. He along with Christian employees cut a cake and disbursed money and directed the RPOs and DPOs to hold events in the honour of Christian employees in their districts and regions.  
He said Christian brothers were serving remarkably in every section of society and their distinction in maintaining peace and development of the country did not need any introduction.  
The Parks and Horticulture Authority union also organised a ceremony for Christian employees and cut the cake. PHA chairman Yasir Gillani and DG Jawad Ahmed Qureshi and others were also present at the ceremony held at Jillani Park.  
The Lahore Development Authority (LDA) also organised the ceremony at Sports Complex in Johar Town where Director General Ahmad Aziz Tarar was chief guest. All the employees wished the Christian colleagues on their special occasion and also praised their efforts for working for the development of the country.  
Pakistan Railways chairman Nisar Ahmed also organised the cake-cutting ceremony at the Railways Headquarters on the eve of Christmas and served the cake to the Christian employees himself. The railways has paid salaries of the Christian employees before Christmas. 
Published in Dawn, December 25th, 2021
"
12,"Digitisation, engineers’ training discussed",LAHORE: The Ministry of Information Technology and Telecommunications at a meeting held here on Friday discussed...,"LAHORE: The Ministry of Information Technology and Telecommunications at a meeting held here on Friday discussed digitisation, skill development and training for local engineers in line with the vision of “digital Pakistan”.
Matters related to digitisation and mobile phone manufacturing were also discussed during the meeting.
Federal IT and telecom minister Syed Aminul Haque said measures were underway for connectivity in all urban and rural areas of the country, adding that provision of low-price and good quality mobile phones was the need of the hour and there was a great potential in the youth of Pakistani that was a mega market for technology.
He said the government was committed to achieve the digital objectives as per the vision of a “digital Pakistan”.
He said presently there were five National Incubation Centres (NICs) in Pakistan, adding that two more such centres would be operative, one each in Hyderabad and Faisalabad in the next six months.
A private company, Ericsson Pakistan, showed a keen interest in deploying advanced networks to create job opportunities for local engineers.
Ericsson Pakistan, Middle East and Africa Chairperson Ekow Nelson said the company was committed to expansion and diversification to bring investment and the best technology to Pakistan.
He termed the meeting with the IT and telecom minister successful, saying they were looking forward to the future of technological advancement in the country. IT and Telecom Secretary Dr Sohail Rajput also discussed the regulatory and financial business models and policies for ease of conducting business.
Published in Dawn, December 25th, 2021
"
