,Header,Summary,Detail
13,Man held for selling PCTB books to scrap dealer,"BAHAWALNAGAR: A man was caught selling 1,600 “not for sale” government textbooks of grade 1 to 3 of the Punjab...","BAHAWALNAGAR: A man was caught selling 1,600 “not for sale” government textbooks of grade 1 to 3 of the Punjab Curriculum Text Book Board (PCTB) to a scrap shop at Minchinabad.  
Police on Friday registered a case against him on the complaint of the School Education Department.  
According to the FIR lodged at the Minchinabad police station on the complaint of Deputy District Education Officer Rana Muhammad Sajid, loader rickshaw driver Javed Iqbal of Pakpattan reached a scrap shop at Green Market Chowk to sell a huge quantity of new edition textbooks for 2021-2022 of the Punjab Curriculum Text Book Board.  
On receiving information, the deputy district education officer along with staff came there and confiscated 160 bundles (comprising 1,600 textbooks) and informed police. 
Police registered a case against the suspect under sections 379 and 411 of PPC while seizing the books and arrested the driver. 
The deputy district education officer told Dawn that during the course of investigation, the man confessed to taking “not for sale” government books from Pakpattan for selling. 
He said the confiscated textbooks which were used in community schools were being sold at Rs20 per kg as scrap.
Published in Dawn, December 25th, 2021
"
14,DHQ hospital postings: Rejected candidates raise allegations of favouritism,SAHIWAL: The young medical graduates of the Sahiwal Medical College (SMC) have raised allegations of favouritism and...,"SAHIWAL: The young medical graduates of the Sahiwal Medical College (SMC) have raised allegations of favouritism and nepotism in recruitment of 42 medical officers (MO) and women medical officers (WMO) for the DHQ Teaching Hospital Sahiwal on an ad hoc basis. 
The SMC had announced ad hoc MO/WMO (BPS-17) posts. The health department formed a selection board under SMC Principal Prof Dr Rashad Qamar Rao for conducting interviews while DHQ Teaching Hospital MS Dr Abdul Wahid was also a part of it along with about a dozen other members.  
Sources said around 800 graduates had applied for the posts, including 250 graduates of the SMC. Interviews were conducted from Nov 15 to 20 and only four candidates having degree from the SMC were selected. The rejected candidates included Dr Noor Muhammad and Dr Rabia Ahmed who had got five and two gold medals, respectively from the University of Health Sciences (UHS). 
The graduates alleged that some candidates were selected for ‘their family and political connections’ with either the selection committee members or the Young Doctor Association (YDA) local chapter chairman. They claimed that the merit list was not publicly displayed. 
The graduates alleged that the scrutiny committee, headed by Dr Shahid, and the selection board, headed by Dr Qamar Rao, violated merit while Dr Usama Akram, the chairman of the YDA, exerted influence on the selection process.  
Dawn learnt from the sources that about nine graduates of the SMC wrote to secretary health, Specialised Healthcare and Medical Education Department, to look into the matter. 
Dr Qamar Rao and Dr Shahid both denied allegations of nepotism and favouritism while talking to Dawn separately. Dr Qamar said the guidelines approved by the Pakistan Medical and Dental Association were followed during the selection to maintain transparency.  
Dr Usama, the chairman of the YDA, said there were no rules to give preference to the local college graduates in the interviews. He added that for the selection 60pc marks were based on qualification while the rest of 40pc came from the selection board. He denied exerting ‘influence’ on the selection board. 
Published in Dawn, December 25th, 2021
"
15,Abuse of power by ex-VC: CMIT summons registrar with record,RAHIM YAR KHAN: The Chief Minister’s Inspection Team (CMIT) on Friday called the Khwaja Fareed University of...,"RAHIM YAR KHAN: The Chief Minister’s Inspection Team (CMIT) on Friday called the Khwaja Fareed University of Engineering and Information Technology (KFUEIT) registrar for an inquiry into alleged abuse of power by former vice chancellor.  
The chief minister asked the team to submit a comprehensive report regarding abuse of power by KFUEIT ex-VC Dr Athar Mehboob on Dec 24 last. 
The CMIT has directed the registrar to appear in the office of Member General-1 Sarfraz Ahmed Bajwa along with all relevant record and para wise comments in an annotated form.  
Eight allegations were raised against Dr Mehboob in the letter. “As per the audit report of KFUEIT for 2017-18 there are about Rs4.70 billion audit paras against him and in the history of universities of Pakistan, this is an unprecedented financial misconduct,” it says.  
He is also alleged to have made more than 100 illegal appointments and purchased Toyota Fortuner (RNJ-35) beyond his entitlement by spending more than Rs6 million, says the letter which demands that responsibility should be fixed and cost of this vehicle recovered from him.  
The letter further says that according to a court decision a cheque bearing No 00004253 of Rs8,413,214 was signed by him in back date (when he was not VC KFUEIT) and more importantly, this cheque was issued before the completion of work. Payment worth Rs72,925,217 was made by him to Ayaz Builders for which no bill is available in the record. Millions were paid to the same contractor in violation of rules and regulations, goes another allegation.  
Furthermore, Prof Dr Muhammad Munir Ahmed and ICT Director Rizwan Majeed were illegally appointed by Dr Mehboob and seven advance increments were awarded to the ICT director.  
KFUEIT focal person Rana Anwar Farooq confirmed that the registrar received a letter to respond to inquiry against ex-VC.  
ARRESTED: A court bailiff on Friday arrested Multan Electric Power Company’s (Mepco) Mianwali Qureshian SDO for not appearing in court for the last two months.  
Bailiff Muhammad Jawad Alam Qureshi raided Mepco’s Mianwali Qureshian office and arrested SDO Hafiz Ali Hassan Javed. During the raid the SDO resisted arrest a video of which went viral.  
Jam Fazal Ahmed Ganga, a resident of Gulshan-i-Iqbal, complained against Mepco RYK Senior Engineer Farhan Shabbir Malik, Khanpur EXEN Zakir Hussain, Mianwali Qureshian SDO Hafiz Ali Hassan Javed and two other employees. He alleged that his meter and line transformer were replaced and despite court order, these were not re-installed.
Published in Dawn, December 25th, 2021
"
16,‘Bone-breaking’ road’s reconstruction begins,"NAROWAL: Construction work on the 29km long Zafarwal-Narowal Road has started, for which Chief Minister Usman Buzdar...","NAROWAL: Construction work on the 29km long Zafarwal-Narowal Road has started, for which Chief Minister Usman Buzdar has released Rs1.36 billion.  
The road has been in a state of disrepair for decades.  
The potholes-infested road was known as the bone-breaking road. Sewage from villages along the road and residential areas adjacent to the bus stop also inundate the road. 
Private and public vehicles often develop faults on the road.
Feasibility reports were compiled several times for the road construction in the previous tenures of the PML-N but no funds were released.
When Mr Buzdar came to Zafarwal to condole the death of the brother of Provincial Minister for Endowments Pir Syed Saeedul Hassan, the minister and citizens demanded construction of the road.  
On Friday, minister  Hassan inaugurated the project in the presence of hundreds of locals. A sewerage system will also be laid along the road. The construction project will be completed by Dec 31, 2022.  
Citizens have thanked the chief minister for providing funds for the road.
Published in Dawn, December 25th, 2021
"
17,Road blocked for recovery of kidnapped trader,DERA GHAZI KHAN:  A large number of Hindus staged a sit-in on Indus Highway near Allahabad Chowk on Friday demanding...,"DERA GHAZI KHAN:  A large number of Hindus staged a sit-in on Indus Highway near Allahabad Chowk on Friday demanding recovery of trader Chandar Lal, who was kidnapped a month ago by armed bandits of the riverine area of Rujhan.
The Rajanpur police could not recover him even after the passage of one month.  
The relatives of the kidnapped trader and members of the Hindu community demanded his recovery. They blocked the inter-provincial road near Allahabad Chowk and put traffic out of gear for more than three hours.  
After three-hour negotiations with protesters, the police succeeded in clearing the highway.  
Sources said the gangsters of the Sikhani gang kidnapped Chandar Lal in reaction to the arrest of their family members by the Rajanpur police.
Regional Police Officer Waqas Nazir told Dawn the police would soon rescue Chandar Lal. He said the police had arrested facilitators of bandits. He said the bandits had not demanded ransom for the release of the trader so far while the police were in contact with the brother of the kidnapped trader.
Various teams of police were working to trace the captors. Also, the IGP has taken notice of the kidnapping of Chandar Lal and directed the RPO to use all measures for the safe recovery of the trader.
Published in Dawn, December 25th, 2021
"
18,"DCs of Gujrat, Rahim Yar Khan transferred",GUJRAT: The Punjab government on Friday transferred Deputy Commissioner Mehtab Waseem Azhar and replaced him with Dr...,"GUJRAT: The Punjab government on Friday transferred Deputy Commissioner Mehtab Waseem Azhar and replaced him with Dr Khurram Shahzad. 
Mr Waseem, a BPS-18 officer of Pakistan Administrative Service (PAS), has been posted as Rahim Yar Khan DC in place of Nouman Yousaf (BPS-19) who has been transferred and directed to report to the Services and General Administration Department with immediate effect.  
Both Dr Khurram and Mehtab Waseem had earlier served as Gujrat and Mandi Bahauddin DCs, respectively and they were removed from these posts reportedly on the orders of Prime Minister Imran Khan who had reportedly received complaints against them by the PTI lawmakers from these districts in September last year.  
After removal from Gujrat, Dr Khurram Shahzad (a BPS-19 officer of provincial secretariat service, ex-PSS/PMS) was posted as the director general Environmental Protection Department Punjab from where he was further posted as Rahim Yar Khan DC in 2021. These days he was working as the chief World Trade Organisation under Industries, Commerce, Investment And Skills Development Department. 
As per the power-sharing formula agreed upon by the PTI and the PML-Q in Punjab, the recommendations of the latter would prevail in the administrative affairs of Gujrat, Mandi Bahauddin, Chakwal, Bahawalpur districts and Daska tehsil of Sialkot district.
Published in Dawn, December 25th, 2021
"
