,Header,Summary,Detail
9,Abbottabad board declares SSC exam results,"ABBOTTABAD: The Board of Intermediate and Secondary Education (BISE), Abbottabad, announced results of the Secondary...","ABBOTTABAD: The Board of Intermediate and Secondary Education (BISE), Abbottabad, announced results of the Secondary School Certificate (SSC) examinations here on Sunday. 
Khyber Pakhtunkhwa Assembly Speaker and acting governor, Mushtaq Ahmed Ghani, who was chief guest on the occasion, distributed prizes among the position-holder students. 
According to the results, the first position was secured by Mustabshirah Jadoon of Tameer-i-Wattan Public School and College, Abbottabad, by obtaining 1,078 marks of total 1,100 marks. 
Zafar Ahmed of Koh-i-Daman Public School and College, Kohistan, grabbed second position with 1,072 marks and Mohammad Soban of Tameer-i-Wattan Public School and College, Abbottabad, stood third by obtaining 1,069 marks. 
In humanities group, Areeba Bibi of Government Girls High School (GGHS), Bher Kund Mansehra, got first position by securing 928 marks and Mahnoor Tariq of GGHSS Sherwan, Abbottabad, second position with 923 marks. 
Iqra Fiaz of GGHS, Khala Butt Township Sector No 3, Haripur, obtained 917 marks and settled for the third place. 
Controller of examinations Prof Babar Ayaz said that 61,076 students appeared in the examinations of which 44,632 were declared successful withthe total pass percentage of 73 per cent. 
Speaking on the occasion, Mushtaq Ghani hoped that foolproof marking system would be ensured by the board and there would be no compromise onmerit at any stage. 
Board chairman Shafiq Awan congratulated the position-holder students and wished them a bright future. The function was attended by parents of the position-holder students and principalsof the educational institutions.
Published in Dawn, August 15th, 2022
"
10,Literati laud nomination of senior artist for presidential award,PESHAWAR: The artists and literati have appreciated announcement of ‘Pride of Performance’ award for senior TV...,"

Bushra Farrukh

 
PESHAWAR: The artists and literati have appreciated announcement of ‘Pride of Performance’ award for senior TV and radio artist and writer Bushra Farrukh on the occasion of 75th Independence Day of Pakistan.
The award will be conferred on the artist next year on March 23 for her illustrious contributions to performing art. Ms Farrukh is also a recipient of about 20 national and international awards and commendation certificates.
She has played lead roles in around 1,500 plays of Urdu, Hindko and Pashto. She enjoys the honour of being the first announcer of PTV Peshawar centre.
Born and bred in Peshawar, Bushra Farrukh has been contributing to performing art for the last 50 years as radio and TV artist. She has also been actively engaged in literary activities for the last more than two decades as she enjoyed mastery over Urdu, Hindko and Pashto.
She is author of a dozen books including poetry, fiction and travelogue. Most of her publications remained on the award winning list.
The associations of artists including Awaz, Women Artists Sky (WAK) and Hunari Tolana Welfare Society (HWS) and rights organisations have lauded the announcement of award for her.
The women literary organisations have also appreciated honouring the senior artist and writer whose literary services to three languages Urdu, Hindko and Pashto are commendable.
Talking to this scribe, Ms Farrukh said that the announcement in recognition of her contributions would encourage young artists to bring out their hidden talent. She added that KP women artists had great potential, which required support to display it out.
She presently heads Karwan-i-Hawa Literary Forum, a registered women organisation where budding poets and writers are groomed up and encouraged to play their due role in the society.
Prof Nasir Ali Syed said that Bushra Farrukh deserved the award because she had been contributing to art and literature for more than five decades.
He said that many young women were encouraged to perform on TV and radio looking at the work of Ms Farrukh.
Published in Dawn, August 15th, 2022
"
