,Header,Summary,Detail
9,Rift in Peoples Party over supporting PDM candidates in by-polls,Workers Ittehad wants party’s Peshawar city district unit restored,"PESHAWAR: A group of Pakistan Peoples Party (PPP) activists in Peshawar division on Thursday refused to support the Pakistan Democratic Movement (PDM) candidates in the by-election in NA-31 Peshawar and NA-24 Charsadda. 
Talking to mediapersons in Peshawar Press Club, PPP Workers Ittehad office-bearers led by its president Bilal Ahmad, Habibullah, Dr Fawad and Riffatullah said they had some serious differences with the party leadership over reorganisation and they were not bound to abide by the decisions taken by the party’s Peshawar division leadership. 
They said the provincial leadership had abolished the city district organisation by merging the unit in Peshawar district (organisation), which had led to division among the workers. 
They demanded immediate restoration of the city district organisation. 

Workers Ittehad wants party’s Peshawar city district unit restored

“Majority of the PPP workers will avoid supporting the PDM candidates in the upcoming by-elections if our demands are not accepted,” they said. 
They demanded of the leadership to take decisions on organisational matters in consultation with the relevant local workers to avoid rifts in the party ranks. 
They said the reorganisation was a longstanding demand of the workers, but it did not mean to take unilateral decisions without taking the senior people on board. 
In a related development, PPP Peshawar division has formed a committee to keep close liaison with the PDM candidates Haji Ghulam Ahmad Bilour (NA-31 Peshawar) and Aimal Wali Khan (NA-24 Charsadda) for stepping up their campaign. 
PPP Peshawar division spokesman Tariq Raheem told Dawn that his party would take active part in the election campaign. 
“Peshawar division president Liaquat Shabab has asked the party workers to ensure participation in the campaign,’’ the spokesman said. 
He said a committee of senior leaders, including provincial general secretary Amjad Afridi, Liaquat Shabab and Malik Tehmash, would supervise the election campaign to ensure PPP workers’ participation in it. 
The PDM has nominated ANP central leader Ghulam Ahmad Bilour and its provincial president Aimal Wali as its candidates for NA-31 and NA-24, respectively.
Published in Dawn, August 26th, 2022
"
10,Bajaur sit-in for peace enters seventh day,Protesters pledge not to end the sit-in without assurance by authorities that their demands will be met.,"BAJAUR: A protest sit-in for improvement of law and order in the region continued on seventh consecutive day here on Thursday despite rain.
The leaders of the protesters pledged that they would not end the sit-in without getting strong assurance from the authorities to accept their demands.
People from all walks of life, mostly political and social activists, attended the sit-in in a large number despite rain. Besides locals, a delegation of Khyber tribal district, led by former MNA Haji Shahji Gul Afridi, also attended the sit-in.
The district chapter of Jamiat Ulema-i-Islam has organised the sit-in.
Speaking on the occasion, Mr Afridi said that such peaceful demonstrations were necessary to draw attention of the authorities towards the law and order situation in all the tribal districts. He said that law and order was badly disturbed during the last few months in tribal districts.
He lauded the leaders of political and religious parties and social activists for showing unity to raise the issue of law and order by arranging the sit-in.
The former MNA termed the demands of the protesters valid and asked both the federal and provincial governments to initiate concrete steps to resolve the issues raised by the participants of the sit-in. He also announced Rs100,000 for the sit-in as financial support.
On Thursday, a number of political and religious leaders including former governor Eng Shaukatullah Khan, former PPP MNA Syed AkhunzadaChattan, JUI-F district chief Maulana Abdur Rasheed, Bajaur Chamber of Commerce and Industry chief Haji Lali Shah and ANP leader Maulana Khan Zeb addressed the sit-in.
The speakers flayed the federal and provincial government for not taking the sit-in seriously. They said that the demonstration would continue until their demands were addressed.
Later talking to reporters, Maulana Rasheed said that leadership of political and religious parties and elders decided to continue the demonstration until the authorities promised resolution of their issues. 
Published in Dawn, August 26th, 2022
"
11,Local body heads accuse MPA of interfering in their work,MANSEHRA: The chairmen of two of the three tehsil councils in Torghar district have alleged that local ANP MPA Laiq...,"MANSEHRA: The chairmen of two of the three tehsil councils in Torghar district have alleged that local ANP MPA Laiq Mohammad Khan is interfering in their work.
They also accused the lawmaker of embezzling development funds for their tehsils.
“MPA Laiq Mohammad Khan has threatened district and tehsil administrations that he won’t let them get funds, offices, vehicles and other facilities,” Judbah tehsil council chairman Haji Mohammad Khan told reporters here on Wednesday.
Accompanied by Dor Mera tehsil council chairman Shahzameen and Jamiat Ulema-i-Islam-Fazl leader Maulana Safiullah, Mr Khan said the tehsil governments were denied powers promised by the law.
He said work on district headquarters hospital and seven basic health units had been suspended for two years despite the release of funds.
Mr Shahzameen said except for the deputy commissioner, officers of works and communication and other departments didn’t do their duties regularly.
Mr Safiullah said a jirga would be held to discuss delay in the execution of development projects and corruption in departments.
He warned the Karakoram Highway would be blocked if tehsil governments didn’t get powers.
Meanwhile, Balakot assistant commissioner Basharat Bibi has promised early resolution of the problems of the residents.
“We [administration] have been holding open kutcheris across Balakot to learn about the people’s problems for early yet effective response,” Ms Bibi told a public forum in Garhi Habibullah area on Wednesday.
The residents complained about inflated power bills, lack of cleanliness and corruption and demanded corrective measures.
They also called for the opening of the Rescue 1122 centre in Garhi Habibullah to respond to emergencies to save lives.
Ms Bibi said complaints about corruption in development schemes would be probed.
Meanwhile, the police on Thursday organised a ‘psycho-social’ session for traffic wardens to help them address stress and anxiety at work.
Traffic wardens from Mansehra, Oghi, Baffa-Pakhal, Balakot and Darband tehsils attended the event held by the Victim Support Services doctors, who educated them on causes, prevention and control of stress and anxiety. They suggested physical and breathing exercises.
Deputy inspector of police (traffic) Farooq Shah said good mental health was imperative for traffic wardens to perform duty efficiently and effectively.
Published in Dawn, August 26th, 2022
"
12,Education termed key to progress,LOWER DIR: Malakand Commissioner Shaukat Ali Yousafzai has said that education is the key to social development and...,"LOWER DIR: Malakand Commissioner Shaukat Ali Yousafzai has said that education is the key to social development and economic prosperity.
Addressing a function after inaugurating the intermediate section of a private school in Timergara here the other day, he said that no nation could make progress without education.
The commissioner said that private sector played a vital role in providing quality education to students and increasing literacy rate. He said private educational institutions decreased burden on the government. He said huge money was being spent on education and health sectors.
The commissioner said that a total of 2.6 million children were still out of schools in the province for which a special enrollment drive was launched the government. He asked the parents and teachers to play their role in making the enrollment drive a success so that more children could be brought to schools. 
Published in Dawn, August 26th, 2022
"
