,Header,Summary,Detail
11,PCB dedicates second day of Lahore Test to Pakistan’s fight against polio,"“Together, we can bowl out polio by focusing more on awareness-raising and promoting a culture of vaccine acceptance.” says PCB.","ISLAMABAD: While the country has not reported any polio case for around 15 months, the Pakistan Cricket Board ramped up support for polio eradication by dedicating the second day of the Lahore Test against Australia to raising awareness against the virus.
Under its Corporate Social Responsibility partnership with the Polio Programme, the PCB facilitated various awareness-raising activities, including a shout-out by the players, promoting awareness messages, honouring polio workers and polio survivors and ensuring their free access to the match.
“Cricketers, as national heroes are role models for the children and youth of Pakistan,” Dr Shahzad Baig, Coordinator of the National Emergency Operations Centre for Polio Eradication, said in a statement.

 





 
“I am so pleased and proud they are supporting the national mission of polio eradication and hope that their messages will reach some of the country’s hard to reach areas. I believe our work together with the PCB will help to reach parents and caregivers with an important message on vaccination. No child should ever be paralysed by Polio because it is a disease that can easily be prevented by a very safe vaccine.” he added.
PCB chairman Ramiz Raja assured full support of the country’s cricket governing body including the Pakistan players and officials to the Polio Programme.
“The PCB is committed to play its role,” Ramiz said. “Together, we can bowl out polio by focusing more on awareness-raising and promoting a culture of vaccine acceptance.”
While acknowledging the contributions of polio workers he added: “The entire Nation is proud of all polio workers for their commitment and hard work despite challenges in reaching every child across Pakistan.”
Pakistan recently marked a significant milestone with no wild polio case reported in the last 14 months, though the virus is still present in some parts of the country, and therefore it is a threat to all children in Pakistan.
Pakistan and Afghanistan are the only two countries left with the polio virus; and there is still an imminent risk of the polio virus to any unvaccinated child on either side of the border.
Published in Dawn, March 23rd, 2022
"
12,India boost Women's World Cup semi-final hopes as Australia crush South Africa,"With Australia already through to the semi-finals, SA had more to play for as a win would have sealed a spot in the top four.","HAMILTON: India boosted their Women’s Cricket World Cup semi-final prospects with a crushing 110-run win over Bangladesh on Tuesday, as a century from Australia captain Meg Lanning powered the tournament favourites to a five-wicket victory over South Africa.
India set Bangladesh a target of 230 in Hamilton and then skittled them for 119 in 40.3 overs to keep alive their playoff hopes.
In Tuesday’s other match, in Wellington, Lanning smashed an unbeaten 135 as Australia cruised past South Africa’s 271-5.
It leaves previously unbeaten South Africa in a scrap for the three other semi-final berths with India, the West Indies and England. Australia were already into the last four.
India chose to bat and appeared to be cruising at 74 without loss in the 15th over when Smriti Mandhana was dismissed for 30.
It sparked a mini-collapse which saw India lose two wickets in successive balls without adding to the score as Shafali Verma was stumped on 42 and Mithali Raj caught for a first-ball duck.
India entered the last 10 overs at 165-5 and their scoring momentum appeared to have stalled when Yastika Bhatia was dismissed for 50.
But Pooja Vastrakar and Sneh Rana came together for a useful 48-run stand that helped give India’s bowlers a respectable total to defend.
Bangladesh’s run chase never ignited in the face of tight bowling from India highlighted by four wickets for 30 from Rana.
There was some middle-order resistance from Salma Khatun, who made 32, and Lata Mondal, 24, but they never looked like reeling in India’s target.
The match between Australia and South Africa brought together the only two undefeated teams at this year’s tournament.
With Australia already through to the semi-finals, South Africa had more to play for as a win would have sealed a spot in the top four.
They set a solid target of 272 off the back of 90 from Laura Woolvardt but Australia’s formidable batting line-up easily overhauled the target with 28 balls to spare.
“We had a great first innings and 270 was par, on another day the bowling attack would have defended it,” said South Africa captain Sune Luus.
“We just lost it a bit on the field and probably lost a bit of focus... it won’t happen again.” Australia put South Africa in to bat after winning the toss but struggled to make early inroads as Woolvardt and Lizelle Lee put on an 88-run opening partnership.
Woolvardt notched her fourth consecutive half-century at the tournament, supported by Luus’s run-a-ball 52 and Marizanne Kapp’s 30 off 21 balls.
Australia’s openers departed cheaply but skipper Lanning stepped up to guide the six-time champions to 146-3 after 25 overs.
“It sort of became clear to me that I had to bat through after we lost a couple of early wickets,” she said.
It was Lanning’s 15th ODI century and came of 92 balls, including 13 fours and one six.
Tahlia McGrath was Australia’s next best batter on 32, with Lanning’s teammates content to play cameo roles.
Summarised scores:
SOUTH AFRICA 271-5 in 50 overs (L. Woolvardt 90, S. Luus 52, M. Kapp 30 not out; A. Sutherland 1-26); AUSTRALIA 272-5 in 45.2 overs (M. Lanning 135 not out, T. McGrath 32; S.Ismail 2-33, C. Tryon 2-44). 
INDIA 229-7 in 50 overs (Y. Bhatia 50, S. Verma 42, S. Mandhana 30; R. Moni 3-37, N. Akter 2-42); BANGLADESH 119 all out in 40.3 overs (S. Khatun 32, L. Mondal 24; S. Rana 4-30).
Published in Dawn, March 23rd, 2022
"
13,Matches at Junior National Tennis held,LAHORE: More matches were decided on the second day of the Servis Tyres Junior National Tennis Championship in...,"LAHORE: More matches were decided on the second day of the Servis Tyres Junior National Tennis Championship in different categories here at the Punjab Tennis Academy, Bagh-e-Jinnah on Tuesday.
Results:
Boys  U-18: Bilal Asim bt Ahtesham Humayun 6-2, 6-1; Abdul Hanan Khan bt Hanzla Anwar 6-0, 6-0; Muneeb Majeed beat Zaeem Ghafoor 4-6, 6-3, 6-2; Shehyar Anees beat Azan Sajid 6-0, 6-1
Boys U-16: Bilal Asim bt Husnain Ali 6-0, 7-5; Ahtesham Humayun bt Shehryar Anees 6-0, 6-0; M. Humza Aasim bt Haider Ali Rizwan 3-6, 6-4, 6-1
Boys U-14: Amir Mazari bt Abdur Rehman 5-3, 4-1; Hamza Ali Rizwan bt Aalay Hussain 4-0, 4-0; M. Haziq bt Inam Bari 4-0, 4-0; Abdullah Pirzada bt M. Humza Ahmad 4-2, 4-0
Boys U-12: Omer Jawad bt Eesa Bilal 4-1, 4-0; Abdur Rehman  bt Ismail Aftab 4-11, 5-4(4); Hamza Ali Rizwan bt Shayyan Afridi 4-1, 4-1; Ahmad Khuda Bakhsh bt Hassan Ali 4-0, 4-1.
Published in Dawn, March 23rd, 2022
"
14,Portugal replace goalkeeper ahead of World Cup qualifier,LISBON: Portugal have called up Wolverhampton Wanderers goalkeeper Jose Sa to replace Anthony Lopes for the World ...,"LISBON: Portugal have called up Wolverhampton Wanderers goalkeeper Jose Sa to replace Anthony Lopes for the World Cup qualifier against Turkey on Thursday. 
The Portuguese Football Federation said Lopes has been ruled out because of an undisclosed injury. 
Portugal coach Fernando Santos also had to replace Pepe with Lille centre-back Tiago Djalo, 21, on Monday after the veteran defender tested positive for Covid-19. 
The 39-year-old FC Porto player’s absence means the former European champions will be without their two first-choice centre backs for the clash at Porto, with Manchester City defender Ruben Dias ruled out due to a hamstring injury. 
Midfielder Ruben Neves is also unavailable because of an injury. 
If they win against Turkey, Portugal will play either Italy or North Macedonia five days later in a game that will determine one of the last three spots left for European teams at Qatar 2022, which kicks off in November. 
It wasn’t yet clear if the 39-year-old Pepe would be able to play the second qualifier next week if Portugal advanced. 
Cristiano Ronaldo and his team-mates joined the national side’s training camp at Oeiras, near Lisbon on Monday. 
Portugal last failed to qualify for the World Cup in 1998, playing in each of the last five editions.
Published in Dawn, March 23rd, 2022
"
