,Header,Summary,Detail
12,Kohistan jirga demand free power supply,Decides to take up matter with commissioner...,"MANSEHRA: A jirga constituted by the people of three Kohistan districts have decided to take up the matter of free of cost electricity supply and other issues related Dubair Khwar hydropower project with the Hazara division commissioner and federal energy minister. 
“The jirga, also attended by local lawmakers, has decided to hold meetings with the commissioner and federal energy minister to ensure the implementation of an agreement reached between them and the government in 2013,” Maulana Kareemdad, spokesperson for the jirga, told mediapersons in Pattan, the district headquarters of Lower Kohistan, on Saturday. 
He said the jirga elders, including MNA Malik Afreen, MPA Mufti Obaidur Rehman, MPA Maulana Abdul Ghaffar and MPA Didar Khan were going to hold a meeting with the Hazara commissioner on Monday (Nov 22). 

Decides to take up matter with commissioner

“We will also meet the federal energy minister next week in this regard,” he said. 
Maulana Kareemdad said according to the agreement the Wapda was supposed to supply electricity to around 20,000 households at the cheapest tariffs, enhance the capacity of Pattan grid station to 132KV from existing 25 KV and induct locals on lower grade positions, but to no avail. 
He said that work on Dubair Khwar hydropower project, built on a local stream, was completed in 2011, but they were still without the promised benefits. 
CRACKDOWN: The Kolai-Palas police have launched a crackdown on outlaws wanted in various criminal cases. 
“We are going to contact Nadra to get blocked the computerised national identity cards of the outlaws wanted by police in heinous crimes,” Kolai-Palas district police officer Sulman Khan told the monthly crime meeting attended by DSPs and SHOs from across the district. 
CHILDREN’S DAY: The Saibaan Development Organisation in collaboration with the Kindernothilfe (LNH) organised an event to mark the World Children’s Day in Dadar area of Siren valley here on Saturday. 
“We should give due rights to children to make them beneficial members of our society,” Sahibzada Jawad Alfaizi, chief executive officer of Saibaan, said while speaking at the function attended among others by children and community members. 
The children through speech competition and games highlighted the issues being faced by them in the society. 
“It is unfortunate that millions of children are out of schools. The social welfare organisations should ensure their enrolment in schools,” he said.
Published in Dawn, November 21st, 2021
"
13,Class-IV employees demand pay raise,LOWER DIR: The All Class-IV Employees Association’s Lower Dir president Ubaidur Rehman on Saturday demanded...,"LOWER DIR: The All Class-IV Employees Association’s Lower Dir president Ubaidur Rehman on Saturday demanded increase in salaries of workers according to the prevailing inflation.
Talking to reporters in Talash, he said the Class-IV workers were barely able to meet their household expenses as prices of food items had gone beyond their purchasing power.
Mr Rehman said it was difficult for the low-salaried class to afford food and utility bills, medical treatment, house rent and children’s education. 
VACCINATION: District health officer Dr Irshad Ahmad Rughani on Saturday said 279,000 children had been vaccinated against measles and rubella in five days in Lower Dir.
He told journalists that 619,000 more children would be vaccinated during the ongoing drive. He added 149,000 children were vaccinated in schools and seminaries and 131,000 in hujras and houses. He said 500 teams were taking part in the exercise.
Meanwhile, a cricket tournament concluded in Shalkundi Godar area on Saturday. Jamaat-i-Islami Youth Wing’s tehsil president Ikramuddin, former youth councillor Inamuddin and others addressed the prize distribution ceremony.
They announced Rs5,000 for the tournament’s organising committee, Rs2,000 for the winning and Rs1,000 for the runner-up teams.
Published in Dawn, November 21st, 2021
"
14,Resumption of gas supply demanded,KOHAT: Former MPA Pir Sanaullah Banoori and hundreds of residents of Garhijaats (city towns) here on Saturday set a...,"KOHAT: Former MPA Pir Sanaullah Banoori and hundreds of residents of Garhijaats (city towns) here on Saturday set a three-day deadline for resumption of gas supply, saying it had been stopped for the past two months. 
The protest was held in the vicinity of Garhi Banoorian which was led by the former MPA and participated by former councillors, nazims, elders and residents from Garhi Dhodhewal, Garhi Behram Khan and Garhi Kalarsadar. 
The former lawmaker said on the occasion he had also held such a protest earlier and threatened self-immolation against non-provision of gas, after which the supply was restored. 
He said that they could not cook food and their children went to schools and colleges without taking breakfast. Similarly, they had to bring food from hotels, while washing clothes was another problem in winter. 
Mr Banoori lamented that the federal energy minister had announced three-time gas for cooking, but they were deprived of it completely. 
He threatened that if their demand for restoration of gas supply was not accepted they would gather after the deadline at the Martyrs’ Chowk with their women and children and put themselves on fire and all the responsibility for this would rest with the chief minister, governor, SNGPL and the local administration.
Published in Dawn, November 21st, 2021
"
15,Food festival brings regional dishes under one roof,RAWALPINDI: A three-day Regional Food Festival titled ‘Bukhara food Festival’ began at Peral Continental lawns ...,"RAWALPINDI: A three-day Regional Food Festival titled ‘Bukhara food Festival’ began at Peral Continental lawns to bring famous dishes of the country and regional under one roof.
Deputy Commissioner Mohammad Ali inaugurated the festival along with Pearl Continental Hotel Rawalpindi General Manager Rashid Banday. 
Thefestivalwas largely attended by the diplomats and residents of Rawalpindi and Islamabad.
Traditional cuisines from across the country displayed at different stalls and special traditional sitting was arranged to depict the four provinces culture.
There are also a lot of kids’ activities including face painting, jumping castle, and more. The Bukhara Food Festival will continue on Sunday. The festival has live traditional Pakistani food stations, serving delicious local delicacies, soups, salads, lassi and desserts. 
Perfect weather and ambience provided an ideal weekend outing to families to eat great food, while enjoying live music by Ustad Raees Ahmed Khan.
Published in Dawn, November 21st, 2021
"
16,"Electric vehicle policy to reduce air pollution by over 40pc, PM’s aide",TAXILA: Special Assistant to the Prime Minister (SAPM) on Climate Change Malik Amin Aslam has said Pakistan’s ...,"TAXILA: Special Assistant to the Prime Minister (SAPM) on Climate Change Malik Amin Aslam has said Pakistan’s first ever electric vehicle policy introduced by the PTI government would achieve climate related goals besides helping in reducing air pollution by over 43pc.
He expressed these views while inaugurating work on the construction of a new road in Awanabad village of Tajik union council on Saturday. 
The project would be completed at a cost of Rs8 million during the current fiscal year.
Mr Aslam said with 43pc of the airborne emissions in the country coming from the transport sector, transition to electric vehicles would provide a huge opportunity to reduce air pollution.
He said the Ten Billion Tree Tsunami Plantation and clean energy projects were acknowledged during the UN-led global climate summit (COP26).
He said Pakistan was awarded with Forestry Champion by the UN and Nature Leader award by UK at the summit.
He said though there were issues including inflation in Pakistan but it was also a fact that the PTI government under the leadership of Prime Minister Imran Khan was taking practical steps to rid the nation of these problems.
“There are dozens of government’s programmes including Ehsaas Programme, Kamyab Jawan Programme, Insaf Health Card, and Ehsaas Scholarship through which efforts are being made to eradicate poverty and unemployment and people are also getting relief,” he added.
He said the government was striving hard to resolve public issues on a priority. Development projects have been initiated by the government to facilitate the masses. There is inflation not only in Pakistan but across the world and it would be controlled soon. 
He urged the masses to get themselves registered with Ehsaas Programme to get relief. 
He said heavy debt, corruption and expensive electricity contracts given by previous governments were one of the major causes of inflation.
Mr Aslam said work on the construction of 12-km-long Bhatiot Boota road had been started which will directly benefit thousands of residents of Attock and seven villages of Jand. 
He said the road project which was put on the back burner for many years was launched in a bid to provide better traveling facilities to the local people. It will reduce the distance of these villages from the Attock district headquarters by 40km.
He said at present the residents of these villages have to cover 80 to 100 km distance to reach Attock but after the completion of the road the distance will reduce by up to 50pc.
Mr Amin said the road will also benefit other areas of Jand and Pindigheb besides generating economic activities.
He said steps were being taken to meet the paucity of teachers at Government Shuja Khanzada Shaheed College Hazro. Besides, work was being carried out on a water supply scheme for the area at a cost of Rs2.5 million.
Published in Dawn, November 21st, 2021
"
