,Header,Summary,Detail
9,Admissions to medical colleges to start in Oct: PMC,ISLAMABAD: The Pakistan Medical Commission (PMC) has decided that admissions to all public medical colleges shall...,"ISLAMABAD: The Pakistan Medical Commission (PMC) has decided that admissions to all public medical colleges shall begin on October 17 and conclude by December 31, including on all special seats. The admission to private medical colleges shall be concluded by January 31, 2023.
Moreover, admissions to public dental colleges shall be concluded by February 14 and to private dental colleges by February 28.
Colleges and universities as per regulations are at liberty to initiate the application process at any time after May 2023. The result of over 200,000 students registered across Pakistan and internationally for MDCAT will be declared on October 7.
According to a statement, students who gave the MDCAT exam last year will also be able to use their 2021 results equivalence to 2022 MDCAT when applying for admissions.
For admission to public colleges, each province or territory shall determine the merit structure based on the students having qualified the MDCAT at 65pc for admission to medical colleges and 55pc for admission to dental colleges. Private colleges/universities frame their individual merit criteria for admissions subject to again students having qualified the MDCAT as per notified eligibility for medical and dental programmes.
As per regulations framed by the Medical and Dental Council, the national admissions scheduling committee consisted of 11 members. 
The members are: Dr Allah Rakha (Punjab-UHS), Prof Jawad Ahmed (KP-KMU), Prof Riaz Ahmed Shaikh (Sindh), Prof Dr Zahir Khan Mandokhail (Balochistan admission committee), Prof Mulazim Hussain Bukhari (AJK admission committee), Prof Moosa Khan (federal capital territory-SZAMBU), Brig Azhar Shams (Nums), Prof Dr Abdul Rasheed Mian and Ghulam Noorani (nominees of the private medical colleges) and Dr Ali Farhan and Dr Mohammad Rizwan Saghir Chatha (nominees of the private dental colleges).
The PMC said as part of its continuing efforts to establish consensus based benchmarks for medical and dental colleges earlier this year had framed regulations for forming the national admission scheduling committee. The committee has representation of all provinces.
Every private medical and dental college was requested to submit nominations. Two persons each receiving the highest number of nominations from medical colleges and dental colleges were notified to the committee.
“While rumours about a boycott appeared in some press reports on Friday attributed to Pami, the PMC refutes the rumours as it was prerogative of the colleges to nominate representatives which they did and from among them members were appointed to the committee,” the statement said.
Published in Dawn, July 17th, 2022
"
10,"Alvi seeks enabling environment for women in business, industrial sectors",Says banks providing business loans to women under favourable and easy terms.,"ISLAMABAD: President Dr Arif Alvi on Saturday called for creating an enabling environment to ensure participation and inclusion of women in economic, business, trade and industrial sectors on a fast-track basis.
He expressed these views while talking to a delegation of the Women Chamber of Commerce and Industry, Peshawar (WCC&IP) led by its president, Shahida Parveen, at Aiwan-i-Sadr.
Welcoming the delegation, President Alvi said women made up almost 50pc of the country’s population and ensuring their safety and security at workplace and providing quality education and skills to them should be the government as well as society’s priority.
“Local traditions and practices regarding women’s property and inheritance rights need to be changed and women should be given all property rights admissible to them as per our religion and the Constitution,” Mr Alvi said.

Says banks providing business loans to women under favourable and easy terms 

He said steps had been taken for their financial empowerment, and that legislation was passed to give their due share in inherited property, adding that as per law, if the property of a woman had been encroached upon, it would be gotten vacated by the government.
The president also highlighted that commercial banks were providing business loans to women under favourable and easy terms and conditions and called upon the chambers of commerce around the country to help women entrepreneurs secure loans to start their businesses and improve upon their existing setups. 
He also urged the WCC&IP to create linkages with other chambers for greater participation of women, expressing his concerns over the fact that Pakistan had one of the lowest workforce participation rates for women in the world.
The president said the Federal Ombudsman Secretariat for Protection against Harassment at Workplace (FOSPAH) had also been empowered to hear the grievances of women even if such cases were already being heard by the courts, adding that the secretariat had been further authorised to send its reports and findings for perusal of the courts.
Mr Alvi called on the WCC&IP to motivate businesswomen to benefit from the programme launched by Facebook with the help of Tevta Punjab for imparting training to them and marketing their products.
He said Amazon was another effective platform which could be used by businesswomen to market their products.
President Alvi appreciated the Women Chamber of Commerce and Industry Peshawar for providing an effective and vibrant platform to help women enter business, trade and industry and assisting those already pursuing businesses.
Published in Dawn, July 17th, 2022
"
11,Traders want edible oil prices slashed,"RAWALPINDI: After reduction in edible oil prices in international market, traders on Saturday demanded of the...","RAWALPINDI: After reduction in edible oil prices in international market, traders on Saturday demanded of the government to pass on the relief to citizens.
Rawalpindi Karyana Retailers Association President Saleem Pervaiz Butt said despite reduction in international price of edible oil, the vegetable oil companies did not reduce the prices.
He said that we contacted price control committee and elected representative to force the vegetable oil companies to reduce the price of oil and ghee for end consumers.
“The one kg pack of vegetable oil should be available at Rs390 but it is still over Rs500 per kg in the wholesale market,” he said and added that the government should take notice of the issue.
He said people criticised the shopkeepers for selling ghee and oil at higher prices but we were getting it on higher prices from the wholesale market. 
He said there was a need that the government should contact the private companies and ensured that they would sell it on revised rates.
He said that Punjab Traders Association President Mian Afaq Ansari also wrote letter to Prime Minister Shehbaz Sharif and Chief Minister Hamza Shehbaz to take notice of the issue.
He said that the government had imposed fines on shopkeepers for selling the edibles including pulses and sugar on higher rates but failed to stop ghee mafia from increasing the prices.
On the other hand, the residents of the garrison city expressed their reservations over increase in prices of edibles in the open markets and said that the government appeared helpless to control the inflation.
Mohammad Akram, a resident of Naya Mohallah, said he bought the oil at Rs530 per kg and pulses on higher rates. Ahsan Ahmed, a resident of Murree Road, said that the prices of edibles was getting more expensive and it was difficult to manage the kitchen budget.
“The common man did not find any relief despite reducing the petrol and diesel prices,” he said.
“The fares of public transport were not reduced and people had to pay extra Rs10 for last month. In June, the Public transporters increased the fare from Raja Bazaar to Chaklala Scheme-III (Rs40 to Rs50) and they are still charging,” said Abdul Rasheed, a resident of Rehmatabad.
Published in Dawn, July 17th, 2022
"
12,Rains bring relief for Cholistan’s residents,BAHAWALPUR: The intermittent rain over the last three days has filled almost all the open ponds (tobas) in ...,"BAHAWALPUR: The intermittent rain over the last three days has filled almost all the open ponds (tobas) in Cholistan, providing water for the residents of the desert area and their livestock. 
The rain has not only ensured water supply for the human as well as animal populations in the area, but also fed the grazing fields comprising plants and bushes for the herds for several months.  
Cholistan Development Authority (CDA) Managing Director (MD) Mahar Khalid Ahmed told Dawn that with the recent intermittent showers, the rainwater has also accumulated in the low-lying plains of Cholistan, converting them into temporary ponds that may dry up during the next week or so.  
He says that the rains during the last week have proved a boon for the Cholistani people and their livestock, who had been facing drought-like conditions during the previous months of May and June, creating an acute shortage of drinking water.  
He says that these showers have also a moderating effect on otherwise harsh weather in the area, hoping that it will the local population that had moved to relatively greener areas along with their livestock in search of water and fodder to return to their native places.  
The CDA managing director appreciated the role of various government departments and agencies, including divisional and district administrations, Provincial Disaster Management Authority (PDMA), Rescue 1122 and some NGOs for taking immediate relief and rescue measures to provide drinking water in the desert area during the previous two months of scorching heat.
Published in Dawn, July 17th, 2022
"
13,17 more test positive for Covid-19 in Rawalpindi,"RAWALPINDI: As many as 17 more people were diagnosed with deadly coronavirus during the last 24 hours, raising the...","RAWALPINDI: As many as 17 more people were diagnosed with deadly coronavirus during the last 24 hours, raising the district’s tally of confirmed cases to 47,039.
As per the latest data released by the District Health Authority on Saturday, the total infected cases included 43,488 from Rawalpindi and 3,551 from other districts. Among the new cases, six arrived from the Rawalpindi Cantonment and Potohar town, three from Rawal town, and one from Attock and Islamabad.
“Presently, 81 confirmed patients are quarantined at homes, and one in the Attock Hospital,” the report added. 
The report further said that 6,973,375 people, including 44,797 health workers, had jabbed themselves against Covid-19 across the district since the launch of the drive on March 10, 2021.
The District Health Authority updated that during the last 24 hours, 1,546 samples were collected, out of which 1,529 were declared negative, while the positivity rate was recorded at 0.97pc. 
Published in Dawn, July 17th, 2022
"
