,Header,Summary,Detail
11,"Three police stations made operational without own buildings, manpower","ISLAMABAD: Three police stations including Sangjani, Phulgran and Kirpa were made operational with resources,...","ISLAMABAD: Three police stations including Sangjani, Phulgran and Kirpa were made operational with resources, manpower and buildings of other police stations, Dawn has learnt.
Police officers said that the three police stations were notified with the objective to reduce the burden of other police stations like Bhara Kahu, Koral and Tarnol respectively.
On Monday night, inspectors Shamsul Akbar, Nasir Manzoor and Imran Haider had been appointed as SHOs of Sangjani, Phulgran and Kirpa.
All three police stations were made operational and resources and manpower were provided to them after slashing available resources and manpower of other police stations, the officers said, adding that police stations were established to reduce the burden of other police stations, but it makes no difference.
Due to unavailability of infrastructure (building), manpower and resources, the same were cut short from other police stations and given to them, they added.
On Tuesday, one of the police stations, Phulgran, was made operational in Bhara Kahu police station, while Kirpa and Sangjani were made operational on Wednesday at Koral and Tarnol police stations, police said, adding that after the inauguration station clerks (Muharrar) for the police stations were also appointed.
Besides, two rooms each Bhara Kahu, Koral and Tarnol police station were reserved for SHOs and station clerks of the Phulgran, Kirpa and Sagjani police station respectively, they said, adding that 25 registers were also issued to the station clerks as per the Police Rules 1934.
A vehicle each was also issued to the SHOs of the three police stations for official work, they said, adding that the arsenal of the Bhara Kahu, Koral and Tarnol were also divided between Phulgran, Kirpa and Sangjani respectively.
The record and cases of the areas that falls in the vicinities of these three police stations was handed over to its station clerk from Bhara Kahu, Koral and Tarnol.
Manpower of 21 officials, including two SIs and five ASIs from the Bhara Kahu police station was given to Phulgran SHO, to make the police station operational, they said, adding that strength of 47 officials has been given to Kirpa police station, including four SIs and 10 ASIs.
The Kirpa police station registered its first case shortly after becoming operational, over a scuffle in the area of Satra Meel, the officers said. 
Senior officers asked the SHOs of Sangjani, Phulgran and Kirpa to rent buildings in areas for the police stations.
In April 2015, Faizabad police station was notified along with Karachi Company and Shams Colony but the police station exists only on papers.
Published in Dawn, August 19th, 2022
"
12,"‘Absence of female teachers, boundary walls barriers to girls’ education’","ISLAMABAD: Lack of female teachers, distance from schools and absence of boundary walls and proper sanitation are ...","ISLAMABAD: Lack of female teachers, distance from schools and absence of boundary walls and proper sanitation are all barriers to girls’ education in the country. All stakeholders must work together to make receiving an education a reality for everyone through provision of gender-inclusive facilities, quality education and development of school infrastructure. 
This was expressed by participants of an event held on Thursday as they pledged to work together towards eradicating all these barriers to girls’ education.
The event titled ‘Educating Girls in Balochistan’ was held at Pakistan National Council of the Arts (PNCA), organised by the International Rescue Committee, under the ‘Teach and Educate Adolescent Girls with Community Help’ project funded by the United Kingdom. Participants engaged in dialogue as they tried to come up with sustainable solutions to make access to education for girls in Balochistan a reality.
Shabnam Baloch, country director of International Rescue Committee said: “In order to eradicate the barrier to girls’ education in Balochistan, collaboration of all stakeholders, policymakers, practitioners, academia, and civil society is the need of the hour. 
Graham Gass, group head (health and education) British High Commission said: “The UKAID-funded Teach and Educate Adolescent Girls with Community Help programme has supported up to 29,000 out-of-school girls in Balochistan - providing accelerated learning programmes and vocational skills and helping to address the limiting social norms and barriers faced by girls in accessing quality education.”
A theatrical performance by Tekrik-i-Niswan, led by Sheema Kermani, was performed on barriers that girls in Balochistan had to face on a daily basis just to reach school. The play covered barriers like non-availability of nearby schools in the community, lack of availability of sanitation and hygiene facilities, boundary walls, and female teaching staff in schools.
Participants of the discussion concluded that such dialogues were necessary for cross organisational learning, adding that financing access to education, providing materials for learning, and creating safe spaces to learn within communities was of utmost importance.
Anne Flaker, who is director, Office of Education (USAID) said: “With an estimated 22.6 million children (aged 5 to 16) out of school,Pakistanis facing an education crisis. This is disproportionately affecting girls, who make up two-thirds of the country’s out-of-school children. 
“With so many girls not able to achieve more than an elementary education in Pakistan, USAID has made it a priority to improve girls’ education. We want to build on a long history of expanding access to high-quality education, especially for young girls in Balochistan, since we all understand how important it is for economic development, prosperity, and security that girls have access to school.”
Sher Zaman, managing director of Balochistan Education Foundation said in order to remove barriers to girls’ education in Balochistan, female teachers from the surrounding districts should be incentivised where there is significant shortage of female teachers, hindering basic operations of existing schools. He said girls and teachers who were attending school from surrounding villages should be allowed flexibility in school timing.
Quratulain Bakhteari, who is chief executive officer of Institute for Development Studies and Practices (IDSP) while speaking at the event mentioned the need to focus on adolescent girls’ nutrition and their psychological wellbeing. “Girls go through various physiological changes between the ages of 12 to 15 and it is then when we add in pressure of multiple subjects. Moreover, even if families consent to sending girls to school without female teachers, young girls require a mentor and a female figure to sensitise them on the physiological changes that they are going through.”
Ian Attfield, regional senior education adviser, Girls Education Challenge in his closing remarks shared that girls’ education had a positive multiplier effect as this will reduce child marriages, adolescent pregnancies, maternal mortality, and gender-based violence.The UK is supporting a global coalition that tackles the learning crisis by delivering foundational learning for all children.
During the event, emphasis was placed on the crucial and dynamic role of SDG 4 towards achieving the other 17 goals, which served as the cornerstone of the global commitment to ‘Leave No One Behind’.
Published in Dawn, August 19th, 2022
"
13,Health experts demand implementation of Cabinet decision regarding Health Levy,ISLAMABAD: Health activists have urged the govt to implement the decision of the federal cabinet regarding health...,"ISLAMABAD: Health activists have urged the govt to implement the decision of the federal cabinet regarding health levy.
Country head Campaign for Tobacco Free Kids Malik Imran Ahmed, in a statement, said that in June 2019, the federal cabinet announced to impose additional health tax on tobacco products to save children and low-income groups by taking tobacco products out of their spending reach.
“However, prominent members from all political parties have repeatedly blocked this move,” he alleged.
Mr Imran claimed that the current excise tax on cigarettes was lower than the inflation due to which practically cigarettes became cheaper and more affordable than two years ago.
“Therefore, it is important to impose healthy levy immediately otherwise the number of smokers in Pakistan will go beyond our control,” he said.
Program Manager Society for the Protection of the Rights of the Child (SPARC) Khalil Ahmed Dogar said that children and low-income people were primary target of tobacco industry and unfortunately tobacco control policies were making these groups more vulnerable.
“Despite the claims of tobacco industry, its products are the leading cause of deaths due to cancer, chronic respiratory diseases, and cardiovascular disease. 1,200 children start smoking daily and 170,000 people die due to tobacco induced diseases every year,” he said.
He said that the country was not recovered from financial crisis and cannot afford to lose precious funds on tobacco consumption.
“The government needs to adopt adequate measures for tobacco control and these include imposing health levy and strict implementation of tobacco control laws,” he said.
Published in Dawn, August 19th, 2022
"
