,Header,Summary,Detail
8,Arsenal boss Arteta praises Zinchenko ahead of move,LONDON: Arsenal manager Mikel Arteta on Wednes­day praised Oleks­andr Zinchenko’s versatility ahead of the...,"LONDON: Arsenal manager Mikel Arteta on Wednes­day praised Oleks­andr Zinchenko’s versatility ahead of the Ukrainian international’s move to the north London club from Manchester City for a repo­rted fee of around 32 million pounds ($38.35 million).
Earlier this week, Sky Sports said Arsenal would pay Premier League champions City 30 million pounds up front, with two million pounds in add-ons, for the 25-year-old, who will become their fifth recruit in the close season.
Zinchenko worked with Arteta when the Spaniard was an assistant to Pep Guardiola at City from 2016 to 2019.
“There are still a few formalities to get everything completed but we’re really happy to have him,” Arteta told reporters after Arsenal’s 3-1 win over Orlando City.  “I know the player really well. He’s an exceptional footballer.
“He is someone that is going to bring as well another competitive edge to that dressing room. He was a natural No. 10 early in his career and we converted him into a left back which can do a lot of things that we want in our way of playing.
“That versatility is something that is going to be important for the team because we have players in that position (left back) who are more specific full backs, so I’m really happy.”  Arsenal beat Major League Soccer’s Orlando to claim a third pre-season win, with Eddie Nketiah, Gabriel Martinelli and Reiss Nelson getting on the scoresheet for the English club, while Facundo Torres scored the home side’s only goal.
Arsenal will also take on Premier League rivals Chel­sea in the US before rounding off their pre-season preparations aga­inst Sevilla in London on July 30.
They begin their league campaign on Aug 5 with a London derby at Crystal Palace.
Published in Dawn, July 22nd, 2022
"
9,Fury offers to face Joshua for free,LONDON: WBC heavyweight champion Tyson Fury on Wednesday said he would return to the ring to fight Anthony Joshua in...,"LONDON: WBC heavyweight champion Tyson Fury on Wednesday said he would return to the ring to fight Anthony Joshua in their native England provided the bout was free to watch and attend.
Fury (32-0-1) in June said he was  “over” boxing but has since changed his tune, saying he would sign the contract immediately to take on Joshua (26-2) provided his terms were met.
“The fight has got to be for free,” Fury said in an Instagram post.
“Free to air on television and all tickets go for free. No money is to be made off of this British, historic fight if it happens,” he said.
“There’s the terms, I’m in the driving seat, take it or effing leave it.” Fury knocked out fellow Briton Dillian Whyte in April to retain his title before telling fans he would be sticking to his promise to his wife to retire.
Published in Dawn, July 22nd, 2022
"
10,South Africa’s Phehlukwayo out of ODI series vs England,LONDON: South Africa all-rounder Andile Phehlu­kwayo will miss the final two matches of the One-day International...,"LONDON: South Africa all-rounder Andile Phehlu­kwayo will miss the final two matches of the One-day International series against England as he is put through return to play protocols following a concussion in the first game on Tuesday, officials confirmed.
Phehlukwayo collided with captain Keshav Maharaj in the field as his head struck the latters shoulder, leading to a cut on the chin and a concussion in South Africas 62-run win at Chester-le-Street.
He was replaced in the game by Dwaine Pretorius, who was able to bowl as a concussion substitute, but did not have much joy as he returned figures of 0-26 in three overs.
Phehlukwayo will now hope to be fit for the start of the three-match T20 Inter­national series that begins on Wednesday. The last two ODIs will be played on Friday and Sunday.
Published in Dawn, July 22nd, 2022
"
11,National Senior Taekwondo Championship starts today,RAWALPINDI: The 15th Korean Ambassador National Senior Taekwondo Championship will roll into action here at Shehbaz...,"RAWALPINDI: The 15th Korean Ambassador National Senior Taekwondo Championship will roll into action here at Shehbaz Sharif Sports Complex on Friday.
Pakistan Taekwondo Federation president retired Lt Col Raja Wasim Ahmed said at a news conference on Thursday that senior teams of all the four provinces, Islamabad, Azad Jammu & Kashmir, Gilgit-Baltistan, Pakistan Army, Pakistan Air Force, Pakistan Navy and other affiliated units of the federation would feature in the four-day event.
Around 350 male and 200 female athletes will participate in the event which  will be officiated by 48 international and national referees of the PTF.
“Taekwondo is an Olympic sport and the PTF is trying to field its  athletes in different qualifiers to earn spots for the coveted event,”  Wasim said. 
“Our athletes also featured in qualifiers for Tokyo Olympics  but Covid-19 pandemic affected their training and consequently they  could not make a cut to the Olympics, we hope they’ll claim space in the  next Olympics,” he further added.
Published in Dawn, July 22nd, 2022
"
12,B-5 coaching course concludes,"KARACHI: As many as 100 players, coaches and sports teachers took part in the Baseball-5 Training and Coaching...","KARACHI: As many as 100 players, coaches and sports teachers took part in the Baseball-5 Training and Coaching Course, organised jointly by the Softball Federation of Pakistan in collaboration with the National Softball Academy, which concluded at Sindh Madressatul Islam University on Thursday.
The course featured lectures on up-to-date training and skills while baseball encounters were arranged among participants during the practical sessions. Special sessions with sports engineers were also arranged.
Pakistan are scheduled to feature in the inaugural B-5 Asia Cup in Malaysia next month and the SFP stated that the course was aimed to promote the game at grassroots level.
Published in Dawn, July 22nd, 2022
"
13,Bracewell hat-trick completes New Zealand rout of Ireland in second Twenty20,BELFAST: Michael Bracewell rounded off New Zealand’s crushing 88-run win over Ireland in the second T20 at Belfast...,"BELFAST: Michael Bracewell rounded off New Zealand’s crushing 88-run win over Ireland in the second T20 at Belfast on Wednesday with a hat-trick.
Ireland, chasing 180 to win, collapsed to 91 all out inside 14 overs at Stormont and were all but beaten when off-spinner Bracewell removed tailenders Mark Adair, Barry McCarthy and Craig Young with successive deliveries to become only the third New Zealand bowler to take a hat-trick at this level after pacemen Jacob Oram and Tim Southee. 
Leg-spinner Ish Sodhi broke the back of Ireland’s innings by removing Curtis Campher, Lorcan Tucker and George Dockrell in a return of 3-21. 
Had it not been for an eighth-wicket stand of 37 between Adair, who top-scored in the innings with 27, and McCarthy, Ireland might have suffered an even more crushing defeat. 
Ireland’s chase had started in style, with experienced opener Paul Stirling smashing spinner Mitchell Santner for a six and a four in the first over.
Stirling also struck fast bowler Lockie Ferguson through the covers for another four only to fall for 21 when he sliced the paceman to mid-off. 
His exit prompted a dramatic collapse that saw seven wickets lost for 31 runs as 23-0 was transformed rapidly into 54-7, with Jacob Duffy bowling No 3 Gareth Delany for a golden duck. 
Earlier, Dane Cleaver’s unbeaten 78 took New Zealand to 179-4 after Ireland captain Andy Balbirnie won the toss. 
Cleaver, playing only his second T20 international, faced 55 balls including five fours and four sixes after coming into bat when New Zealand were 44-1 in the fifth over. 
The series concludes when the teams return to Stormont on Friday.
Scoreboard 
NEW ZEALAND: 
M. Guptill c McCarthy b Young   11 
F. Allen c McCarthy b Little    35 
D. Cleaver not out  78 
G. Phillips b Young 23 
D. Mitchell c Tucker b Little   14 
J. Neesham not out  1 
EXTRAS (LB-10, W-7) 17 
TOTAL (for four wkts, 20 overs) 179 
FALL OF WICKETS: 1-44 (Allen), 2-70 (Guptill), 3-123 (Phillips), 4-171 (Mitchell). 
DID NOT BAT: M. Bracewell, M. Santner, I. Sodhi, L. Ferguson, J. Duffy. 
BOWLING: Young 4-0-34-2, Adair 4-0-28-0 (2w), Little 4-0-31-2, McCarthy 4-0-48-0 (1w), Dockrell 3-0-20-0, Campher 1-0-8-0. 
IRELAND: 
P. Stirling c Santner b Ferguson    21 
A. Balbirnie c Cleaver b Duffy  10 
G. Delany b Duffy   0 
H. Tector run out (Phillips)    2 
C. Campher c Neesham b Sodhi    14 
L. Tucker st Cleaver b Sodhi    2 
G. Dockrell c Neesham b Sodhi   0 
M. Adair c Phillips b Bracewell 27 
B. McCarthy c Phillips b Bracewell  11 
C. Young c Sodhi b Bracewell    0 
J. Little not out   0 
EXTRAS (W-4)    4 
TOTAL (all out, 13.5 overs) 91 
FALL OF WICKETS: 1-23 (Stirling), 2-24 (Delany), 3-27 (Tector), 4-41 (Balbirnie), 5-45 (Tucker), 6-45 (Dockrell), 7-54 (Campher), 8-91 (Adair), 9-91 (McCarthy). 
BOWLING: Santner 4-0-25-0 (2w), Duffy 3-0-20-2, Ferguson 2-0-10-1 (2w), Sodhi 3-0-21-3, Neesham 1-0-10-0, Bracewell 0.5-0-5-3. 
RESULT: New Zealand win by 88 runs. 
Published in Dawn, July 22nd, 2022
"
14,Shaheen out of second Sri Lanka Test with knee injury,He will stay with the Test side in Sri Lanka where his rehabilitation will continue under supervision of team's medical staff.,"GALLE: Pakistan pace bowler Shaheen Shah Afridi has been ruled out of the second Test against Sri Lanka with a knee injury, the team said Thursday. 
Shaheen, a left-arm quick, played a key part in the tourists’ opening win on Wednesday in Galle as he took four wickets in the first innings. 
Shaheen, key for Pakistan in all three formats, was injured on the fourth day of the Test.
“Due to a knee injury sustained on the fourth day of the first Test, Shaheen Afridi will miss the second Test, which will be played in Galle from July 24,” read a team statement. 
He will stay with the Test side in Sri Lanka, where his initial rehabilitation and management will continue under the supervision of the team’s medical staff, the release added. 
The 22-year-old Shaheen, who has taken 99 wickets in 25 Tests since making his debut in 2018, led the Pakis­tan pace attack including Hasan Ali and Naseem Shah in the match that ended on a tense fifth day. 
Opener Abdullah Shafique hit an unbeaten 160 to anchor Pakistan’s record chase of 342 at the Galle International Stadium to lead the two-match series 1-0. 
HOSTS LOSE THEEKSHANA 
Earlier on Thursday, Sri Lanka Cricket said that bowler Maheesh Theekshana had been ruled out of the second Test with a finger injury. 
The spinner returned figures of 2-68 in Pakistan’s first innings in the opening Test. Uncapped all-rou­nder Lakshitha Manasinghe comes into the squad as replacement. 
Batsman Pathum Nissanka, who contracted Covid in the middle of the second Australia Test earlier this month, returns for the final Pakistan match starting on Sunday in Galle.
The series is of vital importance for Sri Lanka, in terms of crucial World Test Championship points. After their loss in the first Test, they slipped to the sixth position in the table, with a points percentage of 48.15. Pakistan, on the other hand, moved up to the third spot, with a points percentage of 58.33. 
Published in Dawn, July 22nd, 2022
"
