,Header,Summary,Detail
10,JUI-F ends sit-in as officials promise to check attacks in Bajaur,BAJAUR: The eight-day-long sit-in staged by Jamiat Ulema-i-Islam-Fazl’s local chapter ended here on Saturday after...,"BAJAUR: The eight-day-long sit-in staged by Jamiat Ulema-i-Islam-Fazl’s local chapter ended here on Saturday after the district administration inked an agreement with the organisers to make concerted efforts to curb attacks on political activists in Bajaur.
“I would like to inform the residents of Bajaur that we have temporarily suspended our sit-in after the district administration and police officials assured in written that immediate steps would be taken within 20 days to improve law and order in the district,” said Maulana Abdur Rasheed, the party’s local chapter chief, while talking to reporters.
Accompanied by members of the negotiating committee comprising representatives of political, religious parties, business community and civil society, the JUI-F leader claimed deputy commissioner Fahad Wazir and district police officer Abdul Samad Khan had termed their demands valid.
Maulana Rasheed said the meeting was held at the deputy commissioner’s office. He said the protesters’ main demand was improving the law and order situation in the district, which had deteriorated in the recent past.
The JUI-F district chief said the meeting was also attended by provincial minister for social welfare and women empowerment Anwarzeb Khan as the provincial government’s representative.
He said a meeting of the district administration and police officials with the committee would be held after 20 days to take stock of the progress made on the protesters’ demands.
Maulana Rasheed said durable peace was vital for socioeconomic development of the district. He threatened that the protest sit-in would resume if the authorities failed to resolve their demands within the stipulated time.
The sit-in was launched on August 19 following a bomb attack on the vehicle of JUI-F leader and Khat tehsil council chairman Haji Said Badshah in Chinar area of Salarzai on August 15, in which Mr Badshah along with two colleagues was injured.
On Friday evening, federal minister for religious affairs Maufti Abdul Shakoor, PM’s adviser Ameer Muqam and provincial minister Anwarzeb Khan had visited the protesters, assuring them of government’s resolve to improve law and order situation in the district.
Published in Dawn, August 28th, 2022
"
11,Lack of facilities in Bara schools mars enrolment campaign,"KHYBER: Official negligence, shortage of teachers and damaged school buildings dealt a serious blow to the ongoing...","KHYBER: Official negligence, shortage of teachers and damaged school buildings dealt a serious blow to the ongoing enrollment drive in militancy-affected Bara tehsil of Khyber tribal district.
Teachers of some government schools, who requested anonymity, told this scribe during a visit to some of the damaged schools in different localities of Bara, that instead of bringing in more students, parents were withdrawing their children from government schools owing to persistent lack of facilities and official negligence.
They said that most of the tents provided by the provincial government about six years ago after destruction of school buildings were worn out beyond repair. They said that students were still compelled to sit under those tents as neither new tents were provided nor were the damaged buildings repaired.
The government provided some schools with fabricated classrooms a few years ago but those could not accommodate the large number of students. The students in some of these schools have to sit in open under trees due to the lack of space inside tents and fabricated classrooms.
Khan Akbar, the principal of Government Middle School Spin Qabar, in Sipah, area told this scribe that he had four fabricated classrooms and only two worn out tents for nearly 1,000 students.
The school was destroyed by militants in 2006-7 and reopened in 2015 after the return of displaced families to Bara. “The school building is in need of immediate reconstruction as students cannot bear the harsh weather conditions,” he said.
About 200 to 300 students were seen sitting in the shadow of the boundary wall as the main compound was muddied with rainwater. Some of water also inundated half space of a tent.
The situation in Government Middle School Gandaw was no different as one of the three tents was recently knocked down by strong winds while over 750 students were ‘stuffed’ into two ruptured tents and four fabricated classrooms.
“I have to adjust students of two or three classes in one fabricated room or tent to continue our courses and keep them busy in their studies,” Abidullah, the principal of the school, said.
Apart from damaged buildings and dilapidated condition of tents, shortage of teachers was also cited to be one of the major reasons for rapid dropout of children of different grades from the government schools in Bara.
Sources said that although schools were reopened in Bara after the return of displaced families in 2014-15 with limited facilities, yet the number of teaching staff was not increased and it remained the same as it was some two decades ago.
Samar Gul, a resident of the area, said that poor parents pulled out their children from government schools for lack of facilities and instead put them to work on daily wages to augment their meagre resources. He said that the parents, who could afford the expenses of private schools, took their children to those institutions.
This scribe tried several times to contact the district education officer (DEO), Uzair Ali, for his comments on the serious setback to the ongoing enrollment drive and continuous official negligence about the provision of better facilities to government schools, but he refused to oblige.
His office had even no figures about the number of so far enrolled children in government schools and the target for this year. The DEO was also yet to inspect the schools in need of repair and provision of other required facilities.
Published in Dawn, August 28th, 2022
"
12,Impact of flood on Mohmand Dam project reviewed,Wapda chairman calls for contingency plan to avoid delays,"MOHMAND: Wapda chairman retired Lt-Gen Sajjad Ghani and federal secretary for water resources Dr Kazim Niaz on Saturday visited the Mohmand Dam project to review the situation in the project area in the wake of unprecedented floods in the Swat River. 
Speaking on the occasion, the Wapda chairman said that the prompt response of the project management to the flood had not only helped minimise its impact, but also saved precious lives of the engineers and workers at the construction sites. 
He said the construction activities should be resumed immediately after the flood situation was over. He directed the management to devise a contingency plan in consultation with the consultants and contractor to overcome possible delays in project completion. 
Earlier, the federal secretary and Wapda chairman had a round of various components of the project to have first-hand information about impact of the flood in the project area. 

Wapda chairman calls for contingency plan to avoid delays 

Mohmand Dam project director and senior Wapda officers were also present on the occasion. 
The dam project management made a presentation to the visiting officials about the pre- and post-flood situations. They were told that construction activities were continuing at a good pace on 14 locations of the project prior to the flood. 
They were also briefed about the impact of the flood and loss to different components of the project, especially diversion tunnels, re-regulation pond and periphery roads on both banks of the Swat River in the project area. 
It was stated that this loss and impact could affect timelines of the project’s completion. The two officials were also apprised of the measures taken by the project management to avoid any further damage. 
A Wapda spokesman, meanwhile, said in a press statement that extraordinary flood situation had been witnessed in the Swat River at the under-construction Mohmand Dam project site. 
It said that resultantly the floodwater entered the diversion tunnels, breaching and overtopping the protection dyke, which affected the construction activities at the project. 
Mohmand Dam is being constructed on Swat River in Mohmand district of Khyber Pakhtunkhwa. The project is scheduled to be completed in 2026.
Published in Dawn, August 28th, 2022
"
13,Afghan gets life sentence for smuggling drugs,PESHAWAR: A court in Khyber district on Saturday convicted an Afghan national for smuggling narcotics in large...,"PESHAWAR: A court in Khyber district on Saturday convicted an Afghan national for smuggling narcotics in large quantity and awarded life imprisonment and Rs1 million fine to him.
Announcing verdict in the case, district and sessions judge Hidayatullah Khan ruled that the prosecution had proved its charge against the accused, Musa Khan, and the evidence on record connected him with the commission of the offence.
It also ordered the confiscation of the truck, which was used for drug smuggling, in favour of the state.
The convict was arrested by personnel of customs department while driving a truck at the Customs Import Terminal Torkham.
During search of the truck the team had recovered 104kg hashish, 9.13kg heroin and 70kg opium.
An FIR was registered on Dec 19, 2021, against the convict at the police station of the Investigation and Prosecution Branch, Collectorate of Customs (Enforcement), Peshawar, under Section 9-D of the Khyber Pakhtunkhwa Control of Narcotics Substance Act.
The court declared that the seized narcotics would be ‘kept intact’until the expiry of the period of appeal and they would be disposed of thereafter in accordance with law.
It also took notice of mode of registration of FIRs by the customs officials and observed that as routine the customs seizing officers were used to chalk out reports through computer instead of hand-written.
“It has also been observed that the FIR is scribed through computer on a plain paper and not maintained in the register of FIRs. This practice on the part of customs seizing staff is alien to the established practice,” the court observed, adding that the practice was always subject to criticism for being exposed to foul play and mischief.
It added that in order to ensure transparency and guard the interests of both the parties and avoid miscarriage of justice, it should be ensured by the customs authorities that spot proceedings by the seizing party are written by hand and FIRs are maintained in a proper register with printed serial numbers.
The judge ordered that a copy of the court’s verdict should be sent to the collector customs, Peshawar for compliance.
Special prosecutor Jamroz Khan appeared for the state and contended that the accused was caught red-handed smuggling the contraband from Afghanistan to Pakistan. He said the accused was involved in a heinous crime, so he didn’t deserve any leniency.
Published in Dawn, August 28th, 2022
"
