,Header,Summary,Detail
9,Covid-19 stunts growth of US population,It is the first time since 1937 that the country’s population grew by fewer than one million people.,"WASHINGTON: The Covid-19 pandemic has had a major impact on population growth as well, as the US population grew at a slower rate in 2021 than in any other year since the founding of this nation.
Statistics released by the US Census Bureau showed that in 2021 the US population grew only 0.1 percent and this is the first time since 1937 that the country’s population grew by fewer than one million people.
This was also the lowest numeric growth since at least 1900, when the Census Bureau began annual population estimates.
Apart from the last few years, when population growth slowed to historically low levels, the slowest rate of growth in the 20th century was from 1918-1919 amid the influenza pandemic and World War I.
The new estimates show that in 2021, the population growth declined from the previous year in 31 of 50 states, with 18 states sustaining absolute population losses.
In some states, population losses were exacerbated by inflated out-migration during the pandemic, although Florida and Texas benefitted from greater population in-flows.
The bureau noted that slower population growth has been a trend in the United States for several years, which is the result of decreasing fertility and net international migration, combined with increasing mortality due to an aging population.
Since the mid-2010’s, births and net international migration in the US have been declining at the same time deaths have been increasing. The collective impact of these trends is slower population growth.
The bureau noted that “this trend has been amplified by the Covid-19 pandemic, resulting in a historically slow population increase in 2021.”
Published in Dawn, December 27th, 2021
"
10,"Bird flu outbreak kills 2,000 cranes in Israel","Another 10,000 are believed to be infected, says specailist.","JERUSALEM: A bird flu outbreak has killed more than 2,000 wild cranes on a reserve in northern Israel, an unusually high toll for the seasonal flu, the parks authority said on Sunday.
In addition to the 2,000 dead, another 10,000 are believed to be infected, Ohad Hatsofe, a specialist at the Israel Nature and Parks Authority, said.
The virus affects Israel annually, but this year’s outbreak is much larger than previous years, said Uri Naveh, a senior scientist at the authority. Naveh described the number of dead cranes as  “exceptional”.
Like every year, roughly 100,000 wild cranes reached Israel since October, most stopping in the Hula Valley, an important point on their migratory path towards Africa.
More than 40,000 cranes are estimated to have remained in the area.
The avian flu ravaging the population, H5N1, has been detected in some chicken populations in northern Israel, Israel’s agriculture ministry said.
The ministry has suspended egg sales from affected farms.
It is rare for H5N1 to spread among humans, but there have been past outbreaks.
According to the World Health Organisation H5N1 has killed more than 450 people, mainly in Indonesia, Egypt and Vietnam, since 2003.
Published in Dawn, December 27th, 2021
"
11,Suicide bomber kills five at bar packed for Xmas in DR Congo,BENI: A suicide bomber killed at least five people at a crowded night spot in the city of Beni in the eastern...,"BENI: A suicide bomber killed at least five people at a crowded night spot in the city of Beni in the eastern Democratic Republic of Congo on Saturday, local officials reported.
Officials blamed the Allied Democratic Forces (ADF) militia, one of the deadliest armed groups in the region and claimed by the militant Islamic State group as its central Africa arm.
“The suicide bomber, prevented by security from gaining access to the bar, packed with clients, activated the bomb at the entrance,” said a statement from military officials running North Kivu province. Another 13 people were being treated for their wounds in hospitals, the statement added, describing the death toll as provisional.
Shortly after the blast, Narcisse Muteba, the colonel running the city during the state of emergency in the east of the country, had called on residents to return to their homes for their own safety.
A correspondent saw the remains of three bodies at the site of the explosion, the In Box restaurant. The remains of tables, chairs, bottles and glasses were scattered across the blast site.
One city hall source said that two children were among the dead, as well as two local officials.
More than 30 people were celebrating Christmas there when the bomb went off, two witnesses said.
“I was sitting there,” local radio presenter Nicolas Ekila said.  “There was a motorbike parked there. Suddenly the motorbike took off, then there was a deafening noise.” A police vehicle took the wounded to a nearby medical centre, which was immediately sealed off.
On June 27 in Beni, a blast from a improvised bomb at a Catholic church wounded two women, the same day a man died when the bomb he was carrying went off.
The day before, another device blew up near a service station without doing any damage. The authorities blamed those attacks on the ADF.
Beni, in North Kivu province on the DRC’s eastern border with Uganda, has been the site of regular clashes between the army and the ADF.
North Kivu and neighbouring Ituri province have been under a  “state of siege” since May, an emergency measure in which the military has taken effective control but which so far has not succeeded in stopping the attacks from the armed militia.
On November 30, the DRC and Uganda launched a joint operation against the ADF in the east of the country to try to quell the bloody ADF attacks. Uganda has also blamed the group for a string of attacks on its territory.
The ADF was historically a Ugandan rebel coalition whose biggest group comprised Muslims opposed to Ugandan President Yoweri Museveni.
But it established itself in eastern DRC in 1995, becoming the deadliest of scores of outlawed forces in the troubled region.
It has been blamed for the killings of thousands of civilians over the past decade in the DRC, as well as for bombings in the Ugandan capital Kampala.
The militant Islamic State group presents the ADF as its regional branch — the Islamic State Central Africa Province, or ISCAP.
On March 11 this year, the United States placed the ADF on its list of  “terrorist groups” affiliated with IS jihadists.
Published in Dawn, December 27th, 2021
"
12,Iraqi Kurds mourn their dead in Channel drowning,"RANYA: “If I don’t call you back, it’s because I will be in England,” Shakar Ali said in his last message to...","RANYA: “If I don’t call you back, it’s because I will be in England,” Shakar Ali said in his last message to his family as he attempted to cross the Channel from France to Britain.
But the inflatable boat he took along with around 30 other irregular migrants would never reach British shores.
Nearly a month after at least 27 of those migrants drowned, families of 16 of them finally got some closure on Sunday as their bodies arrived in Iraqi Kurdistan.
The remains arrived before dawn at the airport in the Iraqi Kurdish regional capital Arbil, where dozens of men, women and children had gathered.
Among the mourners, some embraced and black-clad women wept while others showed pictures of their lost kin.
Clutching his cane to his chest, an elderly man with a white beard showed a photo on his phone of his son Afrasia, who was just 24 years old.
The November 24 tragedy has been described by the International Organisation for Migration as the largest single loss of life in the English Channel since the UN agency started recording data in 2014.
The plain wooden coffins were placed in ambulances that transported them to their hometowns of Darbandikhan, Qadrawa, Ranya and Soran.
A woman sobbed as she pressed her face up against a window pane. Close by, two teenagers appeared similarly shaken. One of them rested his head against a casket, bidding his final farewell.
In the centre of Ranya, hundreds gathered in a mosque to honour the three victims from the Kurdish town.
The bodies were washed in the traditional Muslim way. The crowd filled a large prayer hall, and in the heavy silence, the murmurs of funerary prayers could be heard.
Shakar Ali, 30, left his home two months ago, making the long trip via Turkey, Greece, then Italy, before his Mediterranean journey ended in France.
“He attempted the crossing to Britain seven times,” his older brother Shamal said.  “Each time, he failed.” Three years earlier, Shakar, who had a degree in petroleum geology, was searching for a job.“He was unemployed until his departure,” his brother, a teacher, continued.
Published in Dawn, December 27th, 2021
"
