,Header,Summary,Detail
10,Thai monk rings ‘bell of peace’ in Swat,Ceremony held to celebrate birthday of King Rama X of Thailand...,"SWAT: The most venerable and internationally renowned Thai Buddhist monk Arayawangso said that Swat remained the land of Dhamma peace for mankind and it was high time to once again send the sound of peace from Swat valley to the entire world.
He along with his disciples and Buddhist followers from Thailand was attending the inauguration of the ‘bell of peace’ on the birthday anniversary of King Rama X of the Kingdom of Thailand here on Thursday.
The ceremony was also attended by Military and Defence Attaché at Royal Thai Embassy Col Adisak Showichen, local elders and members of the former Swat state royal family.
Monk Arayawangso said that traces of civilisation in Swat clearly indicated the virtuous spirit of humanity that prevailed for ages.

Ceremony held to celebrate birthday of King Rama X of Thailand

“The revival of civilisation for peace and welfare can really happen when the moral spirit of mankind returns to this sacred land once again. Now, all of us, who wish for a peaceful existence, make a mindful determination and send it through the sound of the bell of peace to everyone everywhere in the world,” he said.
He said that the goal of peace could be possible when the peace-loving people on that land of Pakistan and those around the world endorsed the idea of peace. “Together, we can push forward the course of peace along the noble pathway of Dhamma,” he added.
Colonel Adisak Showichen read a message of blessings in wake of the celebration of King Rama birthday anniversary.
“We are grateful to the government of Pakistan and the people for their support for celebrating the birthday of King Rama the 10th and installation of the bell of peace,” he said. He added that he was sure that the ring of the bell would send a peace signal to all over the world.
Dr Nitinant Wisaweisuan, the dean of Puey Ungphakorn School of Development Studies, Thammasat University, said on the occasion that Thai monks already installed two bells of peace in Peshawar and in Taxila museums before 2019.
“In 2019, the late Miangul Adan Aurangzeb had asked the venerable monk Arayawangso to visit Swat and install the bell of peace in Swat however, due to Covid-19 we could not come,” she said.
At the end of the ceremony, Imran Shaukat, the organiser and host of the Buddhist monks, thanked the embassy of Thailand and the Buddhist monks for visiting and installing the bell of peace.
On the occasion, the national anthems of Pakistan and Thailand were also played.
Published in Dawn, July 29th, 2022
"
11,Delay in start of work on college protested,BAJAUR: Awami National Party activists staged a protest demonstration here on Thursday against delay in launching...,"BAJAUR: Awami National Party activists staged a protest demonstration here on Thursday against delay in launching construction of building for government degree college in Salarzai. 
Besides party workers, social activists and traders also attended the demonstration held in Pashat Bazaar of Salarzai tehsil. 
The protesters were holding placards inscribed with slogans against delay in launching construction work of the college building by the concerned authorities. 
They claimed that the establishment of government degree college in Salarzai was approved about seven years ago, but work on the project could not be started as yet. 
ANP district president Gul Afzal Khan, deputy general secretary Sadiq Akbar Jan, Salarzai tehsil president Bahadar Khan and others spoke on the occasion. 
They recalled that then governor Sardar Mahtab Khan during his visit to Bajaur in Dec 2014 had approved two degree colleges in the region – one for Salarzai and the other for Barang tehsil – to promote higher education in these backward areas. 
They said that construction work on government degree college in Barang tehsil was finally launched on Dec 2018 after a deal on its site was made among the district administration’s officials, PTI MNA Gul Dad Khan and local elders. 
However, they resented that work on the degree college in Salarzai could not be commenced despite passage of more than seven years. 
The speakers claimed that besides allocation of land, funds had also been approved for the college several years ago. They said hundreds of students of Salarzai tehsil were quitting education after passing grade 10th exams every year, as they could not afford education in far away areas. 
The protesters flayed the provincial government and PTI’s local lawmakers for the prolonged delay in setting up the degree college in Salarzai tehsil.  
Published in Dawn, July 29th, 2022
"
12,Coronavirus cases continue to surge as 81 more test positive,Health dept expresses concern over people’s failure to follow SOPs...,"PESHAWAR: The health department showed concern over non-adherence to the Covid-19 precautions as numbers of virus-hit people continued to rise in the province as 81 more cases were recorded on Thursday.
Officials at the department said that most of the infected persons suffered from other diseases including diabetes and issues of liver, heart and lungs due to which they stood exposed to the virus. Such patients were required to stay home, get fully vaccinated and observe precautionary measures for protection against the infection and avoid hospitalization, they added.
“Rising trend in cases is source of concern which can be overcome through strict adherence to precautionary measures. Admissions are low and most of the cases are of omicron variant, which is more contagious but has less complications and patients recover with home treatment and home quarantine,” said officials.
They said the elderly people and those with comorbidities were admitted to hospitals due to low immunity. They said that such people required inoculation and adherence to standard operating procedures. They added that a day before, the province detected 116 confirmed patients after March 13 when 110 cases were recorded.

Health dept expresses concern over people’s failure to follow SOPs

Currently, 17 patients have been admitted to hospitals due to Covid-19 with none of them on ventilator.
“With increase in tests, tally of positive cases rises. It shows that the outbreak is in progress and we need to observe standard operation procedures (SOPs) such as social distancing measures, wearing face masks and hand hygiene, especially at crowded places,” said officials.
They said that at present, the positivity level was 2.53 per cent but it could be more if 7,000 tests were conducted on daily basis as opposed to 2,000 tests carried out currently. They added that positivity was 3.8 per cent the other day in the province.
The number of Covid-19 active cases continues to surge as a week before the province was home to 458 patients but now the number has risen to 750. Most of the active cases have been detected in Peshawar, Mardan, Malakand, Mansehra, Chitral Lower, Swabi, Nowshera, Kohat and Chitral Upper.
“We want the district administrations to enforce Covid-19 precautions, especially at bus stands, wedding halls and tourist spots,” said officials. They said that a month-long vaccination campaign was under way in the province to scale up immunisation level from 61 per cent to 80 per cent to create herd immunity against the virus.
They said that positivity was 4.6 per cent at sentinel sites, three per cent among health workers including polio and dengue staffers, 1.3 per cent in public and private offices, 1.1 per cent in educational institutions, 0.4 per cent in public transport and 0.2 per cent at markets.
The department has been asking the district health officers to increase contact tracing from the present 3.4 per cent to 15 per cent to ascertain the exact situation regarding prevalence of coronavirus and take steps accordingly.
Officials said that the province had 44 hospitals with Covid-19 management wards and isolation facilitates where 2,793 beds were dedicated to the coronavirus patients with a total of 314 ventilators. They said that bed occupancy was less than one per cent while all ventilators were unutilised.
“However, in case of showing laxity towards precautions and avoidance of vaccination, we can witness the 2020 like situation when hundreds of patients were hospitalised and many died for want of beds,” they said.
They said that precautions and revaccination should be given importance. “All elderly people and those having other ailments should get jabs and observe SOPs,” they added.
Published in Dawn, July 29th, 2022
"
13,Two injured in cylinder blast,SWABI: Two workers were seriously injured in a gas cylinder blast in a furniture showroom in Zaida market here on...,"SWABI: Two workers were seriously injured in a gas cylinder blast in a furniture showroom in Zaida market here on Thursday, said Rescue 1122 officials. 
They said that there were no visitors at the time of the incident. The cause of the blast was stated to be leaking of gas from the cylinder. 
After the blast, the furniture caught fire, but the rescue team rushed to the site and controlled the blaze. 
The rescue officials identified the two injured workers as Asad Khan and Hassan Khan. They were taken to the Bacha Khan Hospital Complex where doctors said their condition was critical. 
Meanwhile, a man was killed and two persons were injured in two incidents here on Thursday. 
An auto-rickshaw collidedwith a truck near Swabi interchange and as a result Mohammad Ayaz of Dagai village was killed and rickshaw driver Arshad Umar suffered injuries. 
In another case, Ishfaq Khan of Baja village was injured when unidentified assailants opened fire on him. 
Published in Dawn, July 29th, 2022
"
14,Enrolment drive launched in Shangla schools,SHANGLA: The district administration on Thursday launched enrolment campaign for the session 2022-23 in the...,"SHANGLA: The district administration on Thursday launched enrolment campaign for the session 2022-23 in the government schools of Shangla district. 
It asked the teachers to achieve the target of enrolment in their respective schools as the department had set the target of 9,000 new enrolments for the year. 
The campaign for the enrolment of new students in the government primary schools in Shangla was launched during a ceremony here at Primary School No-1, Alpuri, where deputy commissioner Ziaur Rehman was the chief guest. District education officer Muzaffar Ali Syed, Alpuri SDEO Aurangzeb Khan and Bisham assistant commissioner Jawad Asif were present at the ceremony. 
Speaking on the occasion, the DC urged the community to enrol their children between 4 and 7 years of age in their nearby government schools, saying it was the children’s fundamental right. 
He also directed the staff of education department to make all-out efforts to achieve the enrolment target. 
On this occasion, Ziaur Rehman enrolled some students at the GPS Alpuri and gave them books and bags. He also encouraged the parents to give priority to education of their children. 
DEO Muzaffar Syed said that the education department was trying to improve the quality of education as qualified teachers had been appointed in most schools. 
He said the education department was making efforts to fill the vacant posts of teachers and for this new recruitment was being made after every six months besides promotion of teachers. 
He said the education department had setthe target of 9,000 new enrolments for the district.
Published in Dawn, July 29th, 2022
"
15,Panellists call for making juvenile justice committees functional,ABBOTTABAD: Speakers at a seminar here on Thursday said that juvenile justice committees were non-functional in...,"ABBOTTABAD: Speakers at a seminar here on Thursday said that juvenile justice committees were non-functional in almost all the provinces of the country.
They said that Juvenile Act, 2018 lacked rules of business. They said that the law restrained male police officers from apprehending and investigating female juvenile. The female juvenile should only be kept in a juvenile rehabilitation centre established or certified exclusively for the purpose.
The seminar on ‘Juvenile Justice’ was organised at district barroom by a Lahore-based civil society organisation Sanjog in collaboration with Abbottabad District Bar Association.
More than 50 lawyers, social activists and journalists participated in the seminar. Senior lawyer Malik Saeed Akhtar was a focal person on the occasion.
Sanjog chief Hafiza Tayyaba Javed, former district and sessions judge Naveed Khan, human rights consultant Waheed Ahmad Chaudhry, senior probation officer Mohammad Amir, district bar association secretary Amjad Satti spoke on the occasion.
Malik Amjad Ali, the president of district bar association, said that laws were not fully implemented in Pakistan.
Waheed Ahmad Chaudhry said that as per law the decision with respect to juvenile offender should be made within six months. However, he said that the law was not implemented in letter and spirit.
He expressed concerns over non-existence of juvenile justice committee in the provinces.
Former judge Naveed Khan said that besides juveniles, the authorities should look into the pathetic condition of shelter homes and prisons that lacked basic facilities. He said that juveniles were kept with general prisoners having different criminal background.
“When a case is not decided within six months, the juvenile court should seek extension from the high court. If no such extension has been sought by the juvenile court, the complainant or the juvenile can move high court in this respect,” he said.
The former judge also showed concerns over implementation of law. He also stressed the need for creating awareness about juvenile law among people.
Later, Sanjog chief Hafiza Tayyaba Javed distributed certificates among the participants and awarded souvenirs to speakers.
Published in Dawn, July 29th, 2022
"
