,Header,Summary,Detail
8,Students agree to restore educational activities in all varsities except BU,QUETTA: Student organisations leading the protest sit-in against the disappearance of two students of Balochistan...,"QUETTA: Student organisations leading the protest sit-in against the disappearance of two students of Balochistan University agreed on Friday to restore educational activities in all institutions from Saturday for 15 days except the Balochistan University. 
Leaders of the student organisations involved announced their decision after six rounds of talks with a committee headed by provincial Minister Sardar Abdul Rehman Khetran. 
Speaking at a joint press conference, Mr Khetran, student leader Zubair Baloch and others announced that all universities of the province would restart classes from Saturday for 15 days as the government had assured recovery of the two missing students within 15 days. 
However, they said that Balochistan University would remain closed till the recovery of the two missing students, Faseih Baloch and Sohail Baloch.
Sardar Khetran said the two students had gone missing on November 1, triggering a protest sit-in and causing closure of the Balochistan University, but as a result of several rounds of talks with leaders of the student organisations, the students had agreed to restore educational activities in all closed universities, except Balochistan University.
“We will make all possible efforts to trace two missing students Faseih Baloch and Sohail Baloch within 15 days,” Sardar Khetran said, adding that the governor and the chief minister had taken the issue seriously and in this connection all officials concerned would be taken on board.
Zubair Baloch of the Baloch Student Organisation said that protesting students had given 15 days to the parliamentary committee for the recovery of the missing students and during these 15 days all universities, except Balochistan University, would reopen and resume educational activities.
“We want an open educational environment to be created in the educational institutions for students so that they can study without any interference.”
Sardar Abdul Rehman Khetran said that after improvement in law and order situation in the province, check posts of security forces had been gradually reduced, but as was in the past, necessary police personnel would remain present at the check posts.
Published in Dawn, November 27th, 2021
"
9,NAB files case against harbour officials,QUETTA: The National Accountability Bureau (NAB) has filed a reference pertaining to alleged embezzlement of more...,"QUETTA: The National Accountability Bureau (NAB) has filed a reference pertaining to alleged embezzlement of more than Rs321 million in the Pasni Fish Harbour rehabilitation project, officials of the anti-graft watchdog said on Friday.
The Pasni Fish Harbour Authority project’s directors Munir Ahmed and Ali Gul Kurd, deputy director Abdul Rub, assistant engineer Khalil Ahmed, chief executive officer of Mehran Engineering Works Nadeem Zafar and one Haleem Abbas have been nominated in the reference filed before an accountability court by NAB’s Balochistan chapter.
A spokesman for NAB said the Balochistan government had drawn up a PC-1 for the extension and rehabilitation of the Pasni Fish Harbour in 2010 and the project directors initiated work in the year 2015. According to PC-1 of the project, a dredger had to be procured to expand and repair the breakwater/safety embankments but the accused allegedly embezzled more than Rs321m released for the project without executing the construction work.
Published in Dawn, November 27th, 2021
"
10,Two held for illegal hunting in Hunza,GILGIT: Two persons have been arrested for illegally hunting a female ibex in Shiskat village of Hunza.,"GILGIT: Two persons have been arrested for illegally hunting a female ibex in Shiskat village of Hunza.
According to officials, they had received information on Thursday that unknown persons had opened fire on a herd of ibexes near Shishkat Gojal area of Hunza, killing an ibex. Upon receiving the information, a team was dispatched to the area to investigate the incident. 
The team found that two persons had shot dead a female ibex. Later, the wildlife staffers along with personnel of the Gulmit police station arrested two culprits identified as Sharifuddin and Naseeruddin during a raid.
The wildlife staffers also recovered the killed ibex from their possession and the gun used for its hunting. 
DFO wildlife Jibran Haider will announce a sentence against the accused.
Published in Dawn, November 27th, 2021
"
