,Header,Summary,Detail
8,PHC rejects bail plea of suspect arrested for wife’s ‘murder’,FIR of case was registered in Shangla district on June 29...,"PESHAWAR: Peshawar High Court has rejected bail plea of a person charged with killing of his wife and portraying it as suicide in Shangla district over a month ago.
A single-member bench consisting of Justice Mohammad Ijaz Khan observed that on tentative assessment of the available record, petitioner Aslam Khan was prima facie connected with the commission of the offence.
The bench observed that the offence also fell within the prohibitory clause of section 497 of the Code of Criminal Procedure and as such the petitioner was not entitled to the concession of bail.
The FIR of the occurrence was registered at Karora police station in Shangla district on June 29 under sections 302, 201, 202, 203 of the Pakistan Penal Code and section 15 of Arms Act.

FIR of case was registered in Shangla district on June 29

The complainant in the FIR was ASI Qaribullah, who stated that he received information from the petitioner, Aslam Khan, that his wife Salma committed suicide and her body was lying in his house.
He stated that pursuant to the information, he along with other police officials reached the spot and found the body lying in a pool of blood.
The body was sent for autopsy and the report provided that the deceased had not committed suicide as one of the bullets hit her left shoulder from behind, which was not possible in a suicide.
In the light of medical report and other information collected by the police, the petitioner was charged for the murder of his wife.
Police claimed that the motive of the murder was strained relations of the couple. They alleged that the petitioner was not of good character due to which he was often reprimanded by the deceased.
The petitioner’s counsel contended that his client was falsely implicated in the case and there was no eyewitness to the occurrence. 
He stated that the petitioner was present in the market at the time of occurrence when he received information about his wife committing suicide.
The bench observed that as per contents of the FIR, the petitioner claimed that his wife committed suicide but that claim was falsify by the medico-legal report.
The bench observed that the record revealed that in post events of the occurrence, the petitioner was not around anywhere including at the time of shifting of his inured wife to the hospital for treatment and then in receiving the body from the hospital or identifying the body before the doctor and also to attend her funeral ceremony.
It was added that such unnatural conduct on the part of petitioner in the case of unnatural death of the deceased made him disentitled for the grant of bail.
Earlier, bail petition of the petitioner was also turned down by an additional district and sessions judge in Shangla with the observation that a valuable human life was lost while the version presented by the petitioner shrouded in mystery, showing that he had somewhat link with the commission of the offence.
Published in Dawn, August 17th, 2022
"
9,Rains kill three in Khyber,Kaghan bridge’s collapse suspends KP-GB traffic...,"KHYBER/MANSEHRA: Three people, including two children, were killed and scores of houses were damaged in rain-related incidents in Khyber tribal district on Tuesday.
Rescue 1122 officials said a man and a minor boy were swept away by downpour-induced flash floods in Malagori and Ghundi areas of Jamrud tehsil as torrential rain fell in the region in the afternoon.
In another incident, a minor boy lost life and two of his relatives suffered injuries when the roof of their house collapsed in Ali Masjid area of Jamrud tehsil.
They were taken to a nearby hospital, where the doctors declared their condition to be out of danger.

Kaghan bridge’s collapse suspends KP-GB traffic

Torrential rains also damaged houses in several localities. Suspension of power supply for several hours was also reported.
Meanwhile, a bridge on the Mansehra-Naran-Jalkhad Road was washed away by flash floods in Battal area of Kaghan valley on Tuesday evening.
The bridge’s collapse suspended traffic between Khyber Pakhtunkhwa and Gilgit-Baltistan stranding road users, including tourists, in large numbers.
Deputy commissioner Adnan Khan Bittani told reporters that the National Highway Authority had shifted machinery to the area to install a temporary bridge for traffic’s restoration.
He said the continuing rains had hampered rescue and rehabilitation activities but he hoped for the early resumption of those activities. He said the people stranded in the valley, especially tourists, would leave for their destinations soon.
While a portion of the Mansehra-Naran-Jalkhad Road was eroded by the downpour, heavy landslides blocked it at many points.
The road’s closure caused long queues of vehicles on its both sides to the misery of travellers, especially women and children.
“Besides blocking roads, landslides also diverted the course of the Kunhar River water. They also hit a pickup vehicle injuring its driver,” a witness said, adding that it could take days to clear the road of the mass of rock and earth, which came down the hills.
Kaghan Hoteliers Association president Saith Matiullah hoped for the early reopening of the road to traffic and said hotel owners and workers would treat stranded people as guests until the artery was blocked.
Kaghan Development Authority assistant director Asad Shahzad said machinery had been shifted to the rain-hit areas, while tourists and passengers had moved away from the MNJ Road on foot.
Published in Dawn, August 17th, 2022
"
10,Tribesmen await help as lumpy skin disease kills over 100 animals,KHYBER: The lumpy skin disease (LSD) killed more than 100 domestic cattle and affected dozens of others during the...,"KHYBER: The lumpy skin disease (LSD) killed more than 100 domestic cattle and affected dozens of others during the last couple of weeks in different parts of Khyber tribal district, particularly in Tirah and Loe Shalman.
The residents of the remote Madan locality of Tirah told Dawn that more than 20 cows were killed by the disease in the valley as there was no treatment facility for the affected animals.
Zarin Khan, a resident of Maidan, said that the rapid spread of LSD terrified the locals as they lost their cows and a number of others were affected by the disease with no official assistance in sight.
He said that people were relying hugely on cattle for their daily requirements for dairy products.
Nauroz Khan, a local dispenser, told Dawn that most of the livestock owners arranged vaccines on their own as the lone veterinary dispensary in Karnakhel locality of Maidan was not yet to be made operational.
He said that the owners of affected animals were approaching private clinics for treatment where no medicines or vaccines were available, nor the local paramedics or dispensers had any knowledge about the treatment of LSD.
He said that the disease started affecting local livestock after the arrival of sacrificial animals from other parts of the province during Eidul Azha. “We brought the matter into the notice of local officials but no timely action was taken to save our domestic animals,” he lamented.
Reports about the sudden death of a number of cattle heads were also received from Sheen Pokh locality of Loe Shalman in Landi Kotal.
Malak Imroz and Gulab Khan, residents of the area, bordering Afghanistan, told Dawn that livestock was one of the major sources of livelihood for them and the sudden spread of LSD deprived them of their precious ‘assets’.
They said that the number of the domestic animals in Sheen Pokh was more than 2,000. They said they were at the risk of losing hundreds of their domestic animals if they were not provided with timely medical assistance. “We have already lost 119 cattle due to the deadly disease,” they added.
Aftab Khan, an official of livestock department, when contacted, said that several teams were constituted to vaccinate all the animals in Sheen Pokh locality.
He said that the newly constructed veterinary hospital in Sheen Pokh would be made operational in two weeks.
Published in Dawn, August 17th, 2022
"
11,"Over 17,000 enrolled in Swat drive so far","SWAT: District education officer (male) Riaz Ali has said that over 17,000 new children have so far been enrolled in...","SWAT: District education officer (male) Riaz Ali has said that over 17,000 new children have so far been enrolled in government schools in the district during the ongoing admission campaign, which would continue till the end of this month. 
He was speaking at a ceremony held at Wadudia High School in Saidu Sharif as part of the campaign. 
Malakand division commissioner Shaukat Ali Yousafzai was the chief guest at the event, which was also attended by additional deputy commissioner Sohail Khan, deputy district education officer Fazal Khaliq, principals, teachers and students of various schools. 
The district education officer said Swat district showed the best performance during the ongoing campaign in the province and had so far enrolled over 17,000 children. 
The commissioner said on the occasion that basic education was the right of every child and the parents had to play their role to enrol their children in schools so they could get education. 
He lauded the performance of the district education department and schools and said they would continue supporting the enrolment drive to ensure that every child had the access to basic education. He said special attention must be paid to the education of girls. 
Mr Yousafzai also participated in the enrolment campaign by filling admission form for a child. 
He distributed cheques to the principals of various schools for their excellent performance.
Published in Dawn, August 17th, 2022
"
12,Man seeks recovery of ‘abducted’ daughter,KOHAT: An elderly man has warned of committing self-immolation in front of the provincial police chief’s office if...,"KOHAT: An elderly man has warned of committing self-immolation in front of the provincial police chief’s office if his ‘kidnapped’ daughter is not recovered forthwith. 
Addressing a press conference here on Tuesday, Iqbal Shah, a resident of Tora Stana area of Gumbat tehsil, alleged that Akhtar Ali of Nizampur area had married with his daughter after kidnapping her seven months ago. He alleged that the man later sold her to someone in Rawalpindi.
He lamented that despite his repeated applications, the district police officer, Kohat, took no action to recover his daughter, who was already married. 
He said though the culprit had been arrested, his daughter was still missing.
He appealed to the chief minister to take notice of his misery and ensure early recovery of his daughter.
POLIO CAMPAIGN: A total of 53,807 children under the age of five would be given oral drops during a four-day anti-polio campaign starting on August 22 (Monday).
An official of Extended Programme on Immunisation briefed the participants of the steering committee for eradication of polio and typhoid held here on Tuesday that 137,855 children up to the age of 15 would be vaccinated against typhoid during a campaign, which would start on October 3 and continue till October 15.
The meeting was chaired by the deputy commissioner.
TRAINING: Khyber Pakhtunkhwa Rescue 1122 Director General Dr Khateer Ahmed has announced a free emergency training programme for the people of Kohat.
A rescue spokesperson, Yasir Khattak, in a statement on Tuesday said the people would be given training in first aid and emergency.
Meanwhile, deputy director Khyber Pakhtunkhwa Food Safety and Halal Food Authority Asad Qasim on Tuesday launched a campaign to check quality of food being served at the roadside eateries.
In a statement, he said teams had been dispatched to the bazaars to check food quality of restaurants through the mobile testing laboratory and impose fines on those not maintaining quality and hygiene.
Published in Dawn, August 17th, 2022
"
13,Two boatmen held for violating safety rules,HARIPUR: Police arrested two boatmen for allegedly violating the safety rules for passengers travelling in the...,"HARIPUR: Police arrested two boatmen for allegedly violating the safety rules for passengers travelling in the Tarbela Lake here on Tuesday. 
They said that deputy commissioner Mohammad Fawad had received a complaint on the citizen’s portal that the boatmen who transported passengers and picnickers to and from different points on the sides of Tarbela Lake were not observing the safety rules, which could endanger lives of the people. 
Mr Fawad sent his team along with police to Afghan camp No 15 that was being used by the boatmen as pick-and-drop point for passengers. The team found the passengers of two boats without safety jackets and arrested two boatmen later identified as Yaqub and Ilyas on charges of exposing passengers to extreme danger. 
Area people told mediapersons that despite repeated requests the boatmen of Tarbela Lake appeared to be least bothered about the safety of passengers. 
On July3, 2019, a Haripur-bound boat carrying 38 passengers from Torghar and different other areas had capsised in the lake. Later, bodies of four minor children floating on the water surface were recovered thesameday while bodies of 18 people were still untraced. 
Afterwards, the district administration has been asking the boatmen to ensure before start of the journey that their boats were mechanically fit and not overloaded and that all the passengers were wearing life jackets. However, it has been observed that the boatmen hardly observe the safety measures. 
GIRL COMMITS SUICIDE: A teenage girl has allegedly committed suicide in a village of Beer union council. 
Beer police said Sawera Bibi, 18, was found unconscious in her bedroom and taken to the trauma centre, but she did not survive. According to hospital sources, the preliminary examination showed that the girl had consumed some poisonous substance. 
Published in Dawn, August 17th, 2022
"
14,Girls excel in Bannu board SSC exam,"LAKKI MARWAT: The Board of Intermediate and Secondary Education, Bannu, announced the results of secondary school...","LAKKI MARWAT: The Board of Intermediate and Secondary Education, Bannu, announced the results of secondary school certificate (SSC) annual examinationsat a ceremony on Tuesday. 
The board chairman Arshad Ali Khalil, controller of examinations Dr Faiq Jan, Lakki Marwat district education officer Zahoor Khan, heads of educational institutions, position-holder students and their parents were present on the occasion. 
Announcing the results, Dr Faiq Jan said that a total of 26,824 students appeared in the matriculation examinations of which 24,955 were declared successful with the pass percentage of 93. 
In the science group, Maria Zeb, a student of Government Girls Centennial Model High School, Bannu, stood first by securing 1,081 marks out of total 1,100. 
Mubashir Ayaz Khan of Bannu Model School and College, and Hazrat Azam of Sadiq School and College, Mirali (North Waziristan), obtained second and third positions by securing 1,080 and 1,079 marks, respectively. 
In the humanities group, the girl students outclassed boys in the SSC examinations. 
Aqsa Gul, a student of Government Girls High School Bahadar Mughelkhel, Bannu, got first position by securing 967 marks, followed by Amina, a student of Government Girls Higher Secondary School (GGHSS) Dheri Syedaan Mamashkhel, Bannu, who grabbed second position by obtaining 964 marks. 
Aasia Bibi, a student of GGHSS Dheri Syedaan Mamashkhel and Laiba of Government Girls Centennial Model High School, Lakki Marwat, shared the third position. They obtained 956 marks each.
Published in Dawn, August 17th, 2022
"
