,Header,Summary,Detail
9,"SBCA told to file cases against builders, architects for illegal constructions",KARACHI: The Sindh High Court on Tuesday expressed serious resentment at the Sindh Building Control Authority for...,"KARACHI: The Sindh High Court on Tuesday expressed serious resentment at the Sindh Building Control Authority for failing to take action against illegal constructions and encroachments in the city.
The SHC also ordered the SBCA to removal illegal constructions, file criminal prosecution against builders/owners of such buildings, take action against architects and licensed inspecting engineers concerned as well as against SBCA officials for allowing such constructions.
It summoned the deputy commissioner-East along with a comprehensive report about encroachments in a Gulshan-i-Iqbal area.
The court also called the record of an approval for construction granted by the SBCA in 2019 to a man who had died in 1989.
A two-judge SHC bench headed by Justice Zafar Ahmed Rajput issued these directives on a set of petitions filed against illegal and unauthorised constructions and encroachments in different parts of the city.
In the light of the last order, the SBCA chief appeared in court on Tuesday. The bench berated him over frequent transfers of officials and said it was affecting their morale and weaken administration as well as the implementation of court orders against illegal and unauthorised constructions.
The SBCA chief conceded that they were facing different issues including incompetence while the lawyer for SBCA stated that there was no time frame in the authority for transfer and posting of officials.
A deputy director of the SBCA filed a compliance report about illegal constructions in Nazimabad and stated that a four-storey building was constructed against the approval granted for the ground-plus-one-floor.
He further stated that the fourth floor of the building had been demolished while notices issued to utility agencies to disconnect their connections in order to remove the remaining unauthorised construction and criminal prosecution had also been filed against the builder.
The bench said that after perusal of the compliance report and documents it appeared that the permission for raising construction of ground-plus-one-floor was granted to Syed Mehboob Hashmi in October 2019 while the petitioner said that Mehboob Hashmi was his father and he passed away in 1989 and no person of the same name ever existed in his family.
The bench directed the deputy director to submit the complete case file of the subject approval as well as further progress regarding the action against alleged violation.
Published in Dawn, December 15th, 2021
"
10,Action ordered against profiteers of urea fertiliser,"KARACHI: Taking notice of shortage of urea fertiliser and its sale at exorbitant prices in Sindh, the provincial...","KARACHI: Taking notice of shortage of urea fertiliser and its sale at exorbitant prices in Sindh, the provincial government on Tuesday directed the director general of the agriculture department and all deputy commissioners across the province to take action strict against profiteers. 
Talking to Dawn, chief minister’s adviser on agriculture Manzoor Hussain Wasan said that while an acute shortage of irrigation water in lower Sindh during Kharif as well as in Rabi 2021-22 was bound to affect yield of crops, the province was not given its due share of fertiliser by the Centre. 
“Had Sindh been given the due share of fertiliser by the federation, there would have been no shortage of it in the province,” he said, adding that 96,493 tonnes urea and 12,786 tonnes DAP were available in the province as on Dec 13.  
The adviser said Sindh was not getting its due share of urea. Sindh needed 4.6 million urea bags for wheat crop sown on 1.2 million hectares. 
He said officials had been warned of a strict action in case urea was sent to any other province from Sindh.
Published in Dawn, December 15th, 2021
"
11,Khuhro says Sindh will not accept unconstitutional steps,LARKANA: Pakistan Peoples Party Sindh president Nisar Ahmed Khuhro has said that gone are the days when elected...,"LARKANA: Pakistan Peoples Party Sindh president Nisar Ahmed Khuhro has said that gone are the days when elected governments were overthrown in the dark of the night, now people in Sindh will never accept any unconstitutional move. 
Talking to reporters after presiding over a meeting of party leaders at Garhi Khuda Bakhsh Bhutto on Tuesday, Khuhro reacted to federal minister Asad Umar’s statement and asked him stop issuing threats of unconstitutional steps. 
He said that neither the Muttahida Qaumi Movement nor Pak Sarzameen Party were not sole representatives of Urdu-speaking community as ethnic politics had now become a thing of the past. 
He said that those who had compromised Sindh’s rights and census issue had better stop threatening people now as people of Sindh had refused to succumb to pressures and threats. 
He alleged that MQM had compromised Sindh’s rights to obtain ministries and betray Sindh’s interests. The local government bill had become a law now and it no more required governor’s assent, he said. 
He accused the Pakistan Tehreek-i-Insaf government of pursuing a double-faced policy and said the PTI criticised the Sindh’s LG bill passed by Sindh Assembly while it had itself brought in an ordinance in Punjab on local government, which was against democratic norms. 
About the centre’s decision taken in CDWP’s recent meeting to stop funding provincial development projects related to devolved departments, he said the ‘move’ was a conspiracy to curtail provinces’ share in the National Finance Commission award and further strengthen the centre. 
He called the step unconstitutional and said when the centre held 43 per cent share in NFC it should have to allocate funds for provincial development projects, he said.
If the federal government did not want to fund provincial development projects then it should better increase provinces share from 57 per cent to 60 per cent and release Sindh its just share, he said. 
He said that if it was acceptable to the centre, Sindh would be ready to execute all its development projects. The federal government appeared to work towards strong centre without realising that strong provinces were symbol of a strong centre, he said. 
Earlier, Khuhro said while chairing the meeting held to review arrangements for a big public meeting at the 14th death anniversary of Benazir Bhutto on Dec 27 in Garhi Khuda Bakhsh Bhutto that PPP chairman Bilawal Bhutto-Zarari and former president Asif Ali Zardari would be key speakers on the day. 
He disclosed that Bilawal would unveil future strategy of the party in his address. 
Published in Dawn, December 15th, 2021
"
12,Two jobless men commit suicide,DADU: Two labourers committed suicide at different places in the jurisdiction of Jhaloo police station here on...,"DADU: Two labourers committed suicide at different places in the jurisdiction of Jhaloo police station here on Tuesday. 
Abdul Karim Chhajro, 36, hanged himself from a ceiling fan at Jhaloo village to end his life. His father said his son had been mentally upset due to unemployment, which might be the cause behind his extreme step, he said.  
In the other incident, Javaid, 25, son of Lal Khan Solangi, committed suicide by hanging himself from a tree before his house in Jaro Khan Solangi village. 
The father said Javaid decided to take his life as he had been unemployed.
Published in Dawn, December 15th, 2021
"
13,Experts call for focusing on science for survival of future generations,HYDERABAD: Experts have called for focusing on science for the sake of survival of future generations and said...,"HYDERABAD: Experts have called for focusing on science for the sake of survival of future generations and said research in bioscience can provide solutions for all living things and ensure longevity and health of human beings. 
They were speaking at the first Virtual Pakistan Congress of Zoology 2021 and the 40th three-day Pakistan Zoological Congress (International) that got under way at the Sindh Agriculture University (SAU) Tandojam in collaboration with Higher Education Commission (HEC) on Tuesday. 
Prof Dr Mohammad Iqbal Chaudhry, director general of International Centre of Chemical and Biological Centre, said that zoology was an important branch of science which affected whole ecology including humans, animals and plants and a lot of research was being done in the field all over the world.
He said that bioscience was a biological solution for all living things in which research was being done for the development of generations and longevity and health of human beings.
Dr Shahid Mehmood Baig, chairman of Pakistan Science Foundation, said in his virtual talk that quality science education was key to solving energy crisis, economic and environmental problems and other related issues. 
SAU vice chancellor Dr Fateh Marri said that experts of all fields would have to give importance to new topics of research in order to solve economic and environmental problems of Pakistan. 
He said: “We are expanding research to ensure production of quality seeds, breeding of livestock and farming in arid and saline infested areas in the country”.
Dr A.R. Shakoori, president of Zoological Society of Pakistan, said that scholars should publish their research articles in journals and ensure research environment instead of merely adding more names to dissertation.
Published in Dawn, December 15th, 2021
"
14,Show-cause notice issued to inspector involved in boy’s rape case,HYDERABAD: Deputy Inspector General of Police Hyderabad range on Tuesday issued show-cause notice to inspector Pir...,"HYDERABAD: Deputy Inspector General of Police Hyderabad range on Tuesday issued show-cause notice to inspector Pir Allah Bachayo in the wake of registration of an FIR against the official, accusing him of raping a 19-year-old boy in Sehwan on Sunday.
A spokesman for the DIG Syed Pir Mohammad Shah disclosed that the inspector was required to submit his reply to the show-cause notice within seven days. 
The notice stated that a case under sections 377, 506/2, 342, 337J, 34 of PPC had been lodged against the police inspector vide crime no 167/21 at Sehwan police station and he was told that he and his accomplices subjected a teenage boy to criminal assault and fled when the boy’s father caught them. 
The spokesman said that police took notice of the incident after the video of the incident went viral as this had tarnished image of the entire police department. 
A source in police claimed that the notice might culminate in dismissal from service of the accused if charges were proved and that was why it was issued to complete legal formalities. 
Probe committee formed
DADU: Jamshoro SSP Javid Baloch on Tuesday formed a probe committee to initiate departmental inq­uiry against Inspector Pir Allah Bachayo.
The committee to be led by DSP Kashif Qadiri would conduct the probe to ascertain if the charges that the inspector had subjected the boy to rape were true.
Published in Dawn, December 15th, 2021
"
15,Three SHOs suspended over ill-planned raid in Larkana,LARKANA: Deputy Inspector General of Police Larkana Range on Tuesday suspended three station house officers (SHOs)...,"LARKANA: Deputy Inspector General of Police Larkana Range on Tuesday suspended three station house officers (SHOs) and ordered to launch an inquiry into their conduct in the wake of death of two police officials and a suspect in an encounter with outlaws in Wada Mahar village on Monday night.
The suspended officials Inspector Mohammad Urs Noonari, sub-inspector Talib Hussain Junejo and sub-inspector Ali Hassan Mugheri, who had had taken part in the Monday night encounter, were shifted to police lines and asked not to make any move without permission of high-ups, said the order. DIG Mazhar Nawaz Shaikh, through another order, constituted a four-member fact finding team to probe the encounter. The team would interview all police officials concerned and check calls and wireless log, said the order.
Published in Dawn, December 15th, 2021
"
