,Header,Summary,Detail
10,Sindh cabinet orders confiscation of vehicles plying on fake number plates,Approves Rs1.5bn for road repair works on Peoples Bus routes.,"KARACHI: The Sindh Cabinet on Tuesday took serious notice of cars and luxury vehicles plying on roads with fake registration number plates of provincial government and police and directed the excise and taxation department to launch a crackdown on them. 
Participants in the cabinet meeting presided over by Chief Minister Syed Murad Ali Shah also directed the excise and taxation authorities to impound such vehicles and take strict action against their owners. 
The provincial cabinet also directed district administrations across the province to start assessment of losses of life, houses, crops, roads and sewerage system so that the federal government could be approached to compensate the affected people. 
The chief minister directed the local government department to get all the damaged roads, sewerage lines of Karachi and other districts repaired. 

Approves Rs1.5bn for road repair works on Peoples Bus routes

Date, Kharif crops losses 
The cabinet was told that heavy monsoon rains had caused havoc throughout the urban and rural areas of the province. 
CM advisor on agriculture Manzoor Wassan said that date crops were almost ready to harvest, but heavy rains washed them away in Khairpur and caused a loss of billions of rupees to date growers. 
He also took up the issue of damages caused to other Kharif crops in the province. 
The chief minister directed all the deputy commissioners across the province to assess the losses, including lives, katcha and pacca houses, road network, drainage and sewerage system. 
Besides approaching the federal government for grant of compensation, he said, the provincial government would also help the affected people from its own resources. 
Board to run 22 seminaries 
The cabinet also approved a proposal to constitute a seven-member management board under the secretary of school education to run 53 educational institutions, including 31 schools and 22 Madaris taken over by the government in compliance with the Financial Action Task Force terms. 
The management board has been assigned to run the taken over educational institutions. 
The cabinet was told that roads and drainage system of all the seven routes of Peoples Bus Service were damaged at different locations. The repair of roads and drainage systems would help smooth operation of the newly launched bus service. 
The cabinet approved a fund of Rs1.5 billion for repair works to be carried out through Karachi Metropolitan Corporation, Karachi Development Authority and the water board. 
The cabinet approved a proposal of the energy department to provide alternative energy solutions like solar technology for electricity in villages. 
Energy Minister Imtiaz Shaikh told the cabinet that a mini/micro grids solar home system would be established to provide electricity to villages under a ‘village electrification plan’. The cabinet approved the proposal. 
The cabinet on the request of an NGO, Children of Adam, approved allotment of 10-acres of land for establishment of Neuropsychiatric Centre at Deh Konkar, Karachi. The price fixation committee had fixed the market price of the land at Rs13 million per acre, but the cabinet approved it at 50 per cent of the market price — means Rs6.5 million per acre. 
Information Minister Sharjeel Inam Memon told the cabinet that 75 acres of land was given to the Hyderabad Press Club. He added that the club body had requested that the registration fees and other taxes may be exempted. 
The cabinet was informed that there was no provision to grant exemption and it was proposed that the cabinet might give a grant to the press club for payment of their taxes which the cabinet approved.
Published in Dawn, August 3rd, 2022
"
11,Reckless driving claims two lives in city,"KARACHI: Two persons were killed and three others, including two women, suffered injuries in two traffic accidents ...","KARACHI: Two persons were killed and three others, including two women, suffered injuries in two traffic accidents in the city on Tuesday, police said.
In the first incident, a recklessly-driven and fast-moving coach hit a car and a motorcycle on the Liaquatabad flyover.
According to a Chippa spokesperson, three occupants of the car suffered injuries and one of them died. The two wounded were identified as Zeenat Rahat, 25, and Maryam Shams, 25. A policeman, Assistant Sub-Inspector Khalid Ghauri, 50, who was riding a motorbike, also suffered injuries.
The dead and wounded persons were shifted to the Abbasi Shaheed Hospital. 
In another incident in Baldia Town, a water tanker ran over a minor boy. He was identified as Mujeeb Rehman, 5.
Published in Dawn, August 3rd, 2022
"
12,Agonising outages hit Karachiites as KE power plant develops fault,KE spokesman says problem may take 8-10 weeks to rectify.,"KARACHI: As the city struggles with rain and crumbling infrastructure, frequent power outages and loadshedding — at times for 12-16 hours a day — are making life impossible for Karachiites. 
Following the announcement by the KE about a technical fault in one of the generating units of its Bin Qasim plant, citizens across the city, who continue to face loadshedding, believe that the fault will exacerbate the situation. 
The KE on Tuesday said that the first unit of its Bin Qasim Power Station-3 (BQPS-III) was currently offline following a fault identified during a test being conducted as part of the plant’s commissioning, with an estimated restoration time of eight to 10 weeks. 
A KE spokesman told Dawn that no blast took place at the facility, which was taken offline late on Monday night. 

KE spokesman says problem may take 8-10 weeks to rectify

“The development arose during testing being performed by Siemens AG as part of the final stages of commissioning. Representatives from Siemens AG and Harbin Electric International, the contractor’s consortium, immediately initiated assessment,” the KE said in a statement and added: “While the plant is still under test run, we are closely monitoring the progress and have full confidence in the team of global experts tasked to resolve this on priority.” 
According to a media brief, early assessment showed that the fault is isolated to a section of the gas turbine. “Restoration time is currently estimated at 8-10 weeks. A detailed root cause analysis is also underway.”
The utility said that BQPS-III had achieved full load multiple times in the past month. Currently, power supply to the city is as per the routine schedule announced on June 30, it added. 
With an investment of over $650 million, BQPS-III completed the first firing of its generation unit of 450 megawatts on March 14 earlier this year. 
‘Paying consumers being penalised’
Paying consumers in very high loss (VHL) areas continue to suffer the most compared to those with low loss (LL) feeders, which are mostly exempted from loadshedding. 
The utility defines LL feeders as those where billing recovery is 80 per cent or above, while VHL feeders are those where recovery losses are 70pc, meaning most consumers are not paying bills and electricity theft is high. 
Speaking to Dawn, Ahmed Chandio, a resident of Ramazan Gabol Goth near Safoora Chowrangi, said that paying consumers in his area were being penalised. “We have no power for 10 hours every day, sometimes more.”
“KE needs to come up with a mechanism where paying consumers are not made to suffer. What is a bill-paying consumer supposed to do? My entire lane pays electricity bills, but we are penalised,” says Mr Chandio. 
In a tweet, Salman Mohsin from Saudabad said that his area had been facing announced loadshedding for 10 hours daily. According to a screenshot of the schedule, the first spell of loadshedding in his area begins at 8:05am to 11:05am; then 1:35pm to 4:35pm; 7:05pm to 9:05pm, and 11:35pm to 1:05am.
Meanwhile, responding to enraged consumers on social media, KE in a tweet said, “In light of the ongoing power supply constraints, K-Electric announced a rationalised load shed schedule for its customers. The shortfall is round the clock in KE territory and is persisting due to rising temperatures and curtailed fuel supply.”
The representative insisted that there was no unscheduled loadshedding.
Aneel Iqbal, a resident of Garden west, tweeted that loadshedding in his locality lasted for nine hours every day, primarily due to kundas. KE says it can’t do anything about the kundas so they shut the whole area. 
“In my area, there is at least 7 hours of loadshedding daily. This was a loadshedding exempted area earlier,” says Abdul Ghaffar, a sports journalist and an anchor. 
A resident of Drigh Road said the locality is one of the most liveable places in Karachi, but is plagued by loadshedding. “Between January and March, we had over 20 maintenance shutdowns which lasted from 9am to 5pm. Cabling was changed and our local IBC official assured us that no power outages would happen. However, things have gotten worse.”  
Published in Dawn, August 3rd, 2022
"
13,"Hepatitis, pregnancy-related complications claim 146 lives daily in country: experts",KARACHI: Hepatitis and pregnancy-related complications together claim 146 lives daily in Pakistan where the spread ...,"KARACHI: Hepatitis and pregnancy-related complications together claim 146 lives daily in Pakistan where the spread of hepatitis E is intensifying due to contaminated water.
People in Karachi, Hyderabad, Larkana, Sukkur and Mirpurkhas are particularly at a high risk of acquiring hepatitis A and E due to poor sanitary conditions.
These concerns were raised by experts at a seminar held on Monday at the Dow Medical College. The event was jointly organised by the Pakistan Society of Gastroenterology and World Gastroenterology Organisation in connection with the World Hepatitis Day.
Speaking at the seminar, Dow University of Health Sciences Pro Vice Chancellor Prof Nusrat Shah said that a silent tragedy affecting the large population in Pakistan remained unnoticed as every 16th minute a person died of hepatitis while every 31st minute a woman lost her life during childbirth.
“We seem helpless. There is neither news about it nor government institutions pay attention to it. We are being counted among the underdeveloped countries of Africa while our neighbouring countries, India, Iran and Bangladesh are ahead of us,” she observed.
Highlighting the WHO data on hepatitis, Dr Sajjad Jameel said hepatitis A and E killed 100,000 and 60,000 people, respectively.
“The death rate is much higher among pregnant women. In Pakistan, hepatitis A accounts for 50 to 60 per cent of acute viral hepatitis cases in children. Almost 96pc of individuals are found to be exposed to hepatitis A by the age of five years,” he said.
He pointed out that the symptoms of hepatitis A included fever, jaundice, indigestion, severe yellow urine, weakness, vomiting, right sided abdominal pain, nausea and dizziness.
“It’s a vaccine preventable disease. Healthy eating habits and ensuring good hygiene also help in prevention,” he said.
He also shared findings of a local study that showed out of the 2,735 patients infected with hepatitis, 232 were admitted to the hospital and 30 patients suffered from liver failure.
Dr Huma Qureshi said Pakistan was the second most affected country by hepatitis C and the country reported 164,000 new cases of hepatitis C in 2020.
“The risk of getting hepatitis C from blood transfusion is the highest with a rate of 14.8pc. Other sources of infection include contaminated syringes or injection use, hospital history, dental treatment, surgical history etc,” she said, urging provincial governments to invest in disease prevention.
According to Dr Qureshi, a significant majority of people being tested positive for hepatitis C are not being transferred to hospitals for treatment. “Unfortunately, people don’t know that now we have an effective oral treatment for hepatitis C and people are being cured within a few months. There is no effective vaccine against hepatitis C.”
Dr Abdul Qadir Memon said the combination of hepatitis B and D infection was considered the most severe form of chronic viral hepatitis.
“Hepatitis D has remained a neglected disease mainly due to lack of an effective antiviral treatment. The availability of new drugs now may be a strong incentive to identify its patients who may benefit from therapy,” he noted.
Published in Dawn, August 3rd, 2022
"
14,KU teachers hold protest over delay in selection boards,KARACHI: Several Karachi University (KU) teachers aspiring for promotion protested on the campus over a delay in the...,"KARACHI: Several Karachi University (KU) teachers aspiring for promotion protested on the campus over a delay in the hiring process pending since 2019 on Tuesday when the administration finally held the thrice-postponed selection board of the Institute of Environmental Studies (IES) and that too only for the post of associate professor.
Sources said five candidates, three internal and two external, appeared in the selection board that went smoothly. 
The IES selection board, first organised in January this year, was declared null and void by the secretary of universities and boards on the grounds that the vice chancellor had not taken permission for the process from the government. The step was strongly contested by KU teachers. Later, the university acquired permission from the provincial government for the selection board and planned it twice, but they were postponed.
On Tuesday, teachers gathered in front of the administrative block and shared their grievances.
They demanded that the administration announce a schedule for the selection boards pending since 2019 without any further delay.
“The process is being delayed for one or the other reasons due to which many teachers, who had been waiting for their promotions for a long time, have either retired or are about to hit their retirement age,” stated a press release by the KU selection board action committee.
Currently, there are 136 vacant posts for lecturer, 45 for assistant professors, 37 for associate professors and 110 vacant posts for professors, on the campus.
Speaking to Dawn, KU Vice Chancellor Prof Khalid Mahmood Iraqi said he would soon meet the secretary universities and boards over the issue.
“I am told that the university couldn’t get permission for holding the selection boards [from the government] other than IES. So, I will be meeting the secretary soon to sort out the issue,” he said, adding that he held selection boards of 2012, 2014 and 2016 when he headed the university as the acting vice chancellor of KU for three years.
Published in Dawn, August 3rd, 2022
"
15,Notice issued on maintainability of plea for court automation,KARACHI: The Sindh High Court (SHC) on Tuesday issued a notice to the provincial law officer on a petition seeking...,"KARACHI: The Sindh High Court (SHC) on Tuesday issued a notice to the provincial law officer on a petition seeking judicial automation, digitisation of legal record and e-court.
The petitioner also submitted that establishment of a national judicial database and online hearing must be initiated to deal with the deadlock of around two million cases pending across the country.
A two-judge bench headed by Justice Salahuddin Panhwar conducted the preliminary hearing of the petition and stated in its order: “Subject to maintainability particularly on the point of non-joinder misjoinder of the parties, issue notice to the AG Sindh for 17.08.2022.”
Sheema Kermani, through her lawyer, petitioned the SHC stating that she was a senior citizen and founder of a non-government organisation and she approached the court for court automation.
She submitted that the concept of e-court had gained momentum in Canada, Singapore and Thailand and the basic idea behind it was to decrease the third-party intervention, which paved the way for corruption. Neighbouring India was also excelling in e-court, she added.
Citing the ministry of law & justice secretary, Sindh chief secretary and others as respondents, the petitioner argued that digitisation of court record would help faster adjudication of cases, improve accessibility to legal documents and make it faster for multiple government agencies to access and utilise information.
She further submitted that an e-court project should be initiated, which could perform scanning and digital preservation of cases record in district judiciary as record rooms had no further space to keep up with the piling cases and rainwater seepage in storage facility was damaging the record considerably.
The petitioner stated that the federal government had established a Rs1.5 billion access to justice development fund, which could be utilised for setting up national judicial database to keep the record and status of pending cases and provision of information from national to provincial and district level in real time.
She sought directives for the respondents to formulate a policy and framework to introduce latest use of information technology in the field of judiciary and law, and allocation of necessary budget for the purpose.
The petitioner also asked the SHC to issue directives for the respondents to establish a judicial national database, enhance e-court and online court projects, improve IT infrastructure in courts and computerise the court documentation.
Published in Dawn, August 3rd, 2022
"
16,New IT lab opened at SMIU,KARACHI: Sindh Madressatul Islam University Vice Chancellor Dr Mujeeb Sahrai on Tuesday inaugurated the Dr Ibrahim...,"KARACHI: Sindh Madressatul Islam University Vice Chancellor Dr Mujeeb Sahrai on Tuesday inaugurated the Dr Ibrahim Mulla High Performance Computing Lab at the varsity.
Speaking at the inaugural ceremony, he said that the newly established computer lab, which is equipped with latest and modern computers and other IT facilities, would benefit the faculty and postgraduate students of SMIU. 
He expressed gratitude to Dr Ibrahim Mulla, his wife Mehnaz and other members of the family for their support. 
Earlier, Dr Aamir Iqbal Umrani welcomed the guests and said that the lab was a wonderful addition to the SMIU
The inaugural ceremony was attended by deans, chairpersons of various academic departments, heads of different administrative sections and faculty members.
Published in Dawn, August 3rd, 2022
"
17,Labourer dies in Bahria Town,KARACHI: A young labourer died when he fell from an under-construction building in Bahria Town Karachi on...,"KARACHI: A young labourer died when he fell from an under-construction building in Bahria Town Karachi on Superhighway on Tuesday. 
An Edhi Foundation spokesperson said that the labourer was working on the roof of a building near Phase-1. He was identified as Ashok Rama, 24.
Published in Dawn, August 3rd, 2022
"
18,Seven remanded in police custody in Karachi manslaughter case,"Suspects booked, arrested over death of their 26-year-old friend, who fell from high-rise building in DHA.","KARACHI: A judicial magistrate on Tuesday remanded in police custody seven suspects arrested in a case pertaining to the death of a young man who fell from a high-rise building in Defence Housing Authority.
Police booked and arrested Syed Mohammed Ammar, Usman Ahmed, Mohammed Awais, Aziz Ahmed, Ahmed Jamil and Syed Khizr Akbar over death of their 26-year-old friend Adil Masood Khan on Sunday morning.
On Tuesday, the investigating officer produced the suspects before the judicial magistrate (south) to seek their physical remand in police custody for interrogation.
The IO informed the court that the victim as well as the detained suspects had obtained the flat in question against Rs25,000 rent from its owner, Mohammad Shatba Qazi in DHA, Phase-VIII. He added that Khan fell from the terrace of the apartment and died on Sunday morning under suspicious circumstances. 
Victim’s sister Varda Masood had lodged an FIR against the suspects, the IO said, requesting the court to grant their physical remand.
Granting the request, the magistrate remanded the suspects in police custody, directing the IO to produce them on the next date along with an investigation report.
According to the FIR, the complainant said she lived in Lahore and she got a call from Adil’s friend, Hammad, who informed her about an accident and that her brother was shifted to the Jinnah Postgraduate Medical Centre. Later, she came to Karachi after she was informed about the death of her brother. She further stated that her brother’s friends had gone to a flat in DHA, where they abandoned Adil when he fell and fled at 5am.
She said that the body was lying in an open area for two hours and then the building administration shifted the corpse to a hospital.
A case was registered under Section 322 (manslaughter) and 34 (common intention) of the Pakistan Penal Code at the Sahil police station on the complaint of Ms Masood.
Published in Dawn, August 3rd, 2022
"
