,Header,Summary,Detail
10,France replace Austria in ATP Cup,PARIS: France will replace Austria in the ATP Cup in Sydney starting this weekend after the Austrians were forced to...,"PARIS: France will replace Austria in the ATP Cup in Sydney starting this weekend after the Austrians were forced to pull out, the tournament organisers said on Wednesday.
The Austrian team were hit by the withdrawal of Dominic Thiem and Dennis Novak, allowing France to compete in the event from Jan 1-9.
France had not initially met the criteria to participate in the international outdoor hard court men’s tournament between competing nations.
“France has become a late addition to the 16-country 2022 ATP Cup, replacing Austria in Group B following the withdrawals of Dominic Thiem and Dennis Novak,” read a statement on the tournament website.
Captained by Nicolas Copin, the French team will include 35th ranked Ugo Humbert, Arthur Rinder­knech, ranked 58, and doubles specialists Edouard Roger-Vasselin and Fabrice Martin.
Thiem, ranked 15, pulled out of the Australian tournament as he recovers from a wrist injury.
Published in Dawn, December 30th, 2021
"
11,Wapda B clinch women’s basketball title,LAHORE: Wapda B team defeated their A team 8-7 in an excitement-filled final of the All-Pakistan 3x3 Women ...,"LAHORE: Wapda B team defeated their A team 8-7 in an excitement-filled final of the All-Pakistan 3x3 Women Basketball Tournament here at the Government College University courts on Wednesday.
In the semi-finals played earlier on Wednesday, Wapda A defeated Frank Five Club 11-4 while Wapda B earned a 10-7 victory against SA Gardens.
Meanwhile, Mahmood Butt Memorial Basketball Tournament  3x3 for men and women will be played in Lahore from Jan 10 to 17 at the Government College, University courts and the National Basketball Championship would be staged in Lahore during the first week of February, Pakistan Basketball Federation secretary Khalid Bashir said.
Teams from Army, Pakistan Air Force, Wapda, POF, Railways and different regions would take part in the national event, he added.
Published in Dawn, December 30th, 2021
"
12,Semi-final lineup decided in CM Punjab Squash,LAHORE: Top seed Tayyab Aslam and Salman Saleem cruised into the semi-finals but third seed Israr Ahmed and Asim ...,"LAHORE: Top seed Tayyab Aslam and Salman Saleem cruised into the semi-finals but third seed Israr Ahmed and Asim Khan had to work to book their place in the last four in the CM-Punjab International Squash Championships on Wednesday.
Tayyab’s powerful shots left Waqar Mahboob guessing as he won his quarter-final 11-6, 11-5, 11-6 in 21 minutes while Salman sent Mehran Javed packing in just 26 minutes with a 11-5, 11-8, 11-8 win.
The real contest came in the third quarter-final where Israr scraped past Noor Zaman 8-11, 11-7, 3-11, 11-3, 14-12 in a 41-minute see-saw battle.
Asim, meanwhile, came from two games down to overcome Waqas Mahboob 6-11, 6-11, 11-4, 11-2, 11-9 (3-2) in 51 minutes.
Published in Dawn, December 30th, 2021
"
13,"Djokovic skips ATP Cup, raising doubts over participation in Australian Open",Organisers of the Australian Open have stipulated that all participants must be vaccinated against the coronavirus.,"SYDNEY: Novak Djokovic has pulled out of the Serbia team for the ATP Cup in Sydney, event organisers said on Wednesday, raising further doubts over whether the world number one will defend his Australian Open title next month.
There has been intense speculation over Djokovic’s participation in both events, with the 34-year-old, who is opposed to Covid-19 vaccinations, repeatedly declining to say if he has been inoculated against the virus.
Organisers of the Australian Open, which starts on Jan 17, have stipulated that all participants must be vaccinated against the coronavirus or have a medical exemption granted by an independent panel of experts.
“Novak Djokovic has officially withdrawn from the ATP Cup in Sydney, we have no update as yet on his plans for the Australian Open,” a Tennis Australia spokeswoman said in an emailed statement.
“Regarding the medical exemption process, which pertains to all players, there is a rigorous and independent process in place. As with all medical information it is subject to confidentiality.”
The global men’s tennis governing body ATP did not immediately respond to a request for comment.
ATP Cup organisers said Serbia’s team would now be led by world number 33 Dusan Lajovic.
Owing to Djokovic’s current world ranking, Serbia received top billing for the 16-team event, which runs from Jan 1-9, and have been drawn in Group A along with Norway, Chile and Spain.
Djokovic has won a record nine Australian Open titles, including the last three, and is in a three-way tie on 20 major titles with Roger Federer and Rafa Nadal in the all-time list.
His father Srdjan told a Serbian television channel last month that Djokovic would probably pull out of the major, saying Tennis Australia’s stance on mandatory vaccination was tantamount to  “blackmail”.
The season-opening ATP Cup also saw Austria, which failed the eligibility criteria following the withdrawal of Dominic Thiem and Dennis Novak, replaced by France.
Russia, which won the 2021 title, will be missing Andrey Rublev and Aslan Karatsev from that team.
Published in Dawn, December 30th, 2021
"
