,Header,Summary,Detail
12,"Running cattle markets is not cantonment board’s mandate, observes SHC",SBCA chief summoned to explain frequent transfers of officials...,"KARACHI: The Sindh High Court has come down hard on the lawyer for the Cantonment Board Malir for setting up cattle markets on lands owned by private entities.
A two-judge bench headed by Justice Zafar Ahmed Rajput remarked that it was not the domain of the cantonment board or its officials to set up or run cattle markets.
When the bench asked the lawyer for the cantonment board whether they were mandated to run businesses, he replied that the board was just providing services.
The court deplored that the petition had been pending for quite some time but the cantonment board filed a reply after an inordinate delay. The court adjourned the hearing till Jan 20 as the lawyer for petitioner sought time to go through the comments filed by the cantonment board.

SBCA chief summoned to explain frequent transfers of officials

A private housing society — the Pakistan Navy (CNGE) Cooperative Housing Society — through its lawyer Nasir Tarar filed a petition in 2016 against the cantonment board for setting up a cattle market on its land before Eidul Azha. 
SBCA chief summoned 
The same bench on Wednesday summoned the director general of the Sindh Building Control Authority (SBCA) observing that frequent transfers of officials were frustrating its various orders against illegal constructions in the city.
It observed that frequent transfers of public servants were affecting their morale and weaken administration, which could not be termed “good governance”.
At the outset of the hearing, SBCA official Syed Mohammad Zia appeared before the bench and filed a report in compliance with an earlier order.
He informed the bench that the competent authority had reshuffled/transferred the directors of different districts as he was transferred from South to East and then posted as deputy director-Malir.
He submitted that he had requested the current deputy director-South to make compliance of an earlier order about illegal constructions, but he neither appeared nor filed a compliance report.
The bench observed in its order that it appeared that in many identical petitions on the subject of illegal constructions various orders had been passed by this court requiring compliance of the directions, which are being frustrated by way of making frequent transfers/postings of the officers/officials of SBCA.
It further observed that in the present case the officer in question had been transferred twice in three weeks, which in fact had not only hindered and impeded the compliance of the court orders but also amounted to defiance of such orders.
The bench directed the SBCA chief to appear in person along with a comprehensive report on Dec 4 and also asked its office to communicate this order to the secretary of the local government department for information and compliance.
The bench has been passing various orders almost on a daily basis against removal of illegal constructions, prosecution against builders/owners of such buildings and action against SBCA officials for allowing such constructions on identical petitions filed against illegal constructions across the city.
Published in Dawn, December 9th, 2021
"
13,No end to patients’ suffering as doctors-govt talks fail,Protest sit-in of nurses continues...,"KARACHI: The Young Doctors Association (YDA), Sindh, continued their boycott of out-patient departments (OPDs) at public sector hospitals on a third consecutive day on Wednesday across the province as talks between their representatives and health department officials failed.
The association announced that they would continue their boycott till their demands were met.
“Today’s meeting of YDA Sindh was scheduled with health officials. Each and every point was discussed in detail but (the parties) couldn’t reach any conclusion. That’s why a complete boycott of OPDs will continue till acceptance of our demands,” said Dr Faizan Hussain Memon in a message on a social media group.
Sources said the talks between the association representatives and the health department officials couldn’t reach a common point for consensus. The government officials sought more time to look into the demands of YDA, which wanted an immediate notification on a few issues.

Protest sit-in of nurses continues

Earlier in the day, patients at OPDs had to return home without any medical consultation amid doctors’ protests held in major tertiary care hospitals of the province including the Jinnah Postgraduate Medical Centre, National Institute of Child Health, Dr Ruth Pfau Civil Hospital Karachi and Civil Hospital Hyderabad.
However, the young doctors’ body claimed that there was no disruption in service at emergency units, intensive care units, operation theatres and general, private wards.
The association is demanding paid deputation and central induction policies, increase in risk allowance and stipends of post-graduate trainees and house officers and regularisation of all doctors hired on contract basis.
It also urged the government to make Covid-19 risk allowance a permanent feature of doctors’ salaries and resolve the matter of their transfers at JPMC and NICH.
The government should also announce 500 seats of dental surgeons and make a separate cadre for the hiring of medical legal officers, YDA officials said.
At their demonstration at CHK, doctors also demanded that CT and MRI scan machines be made functional.
At the JPMC, several protesters held banners inscribed with slogans demanding immediate hiring of doctors to address their shortage at the hospital.
Meanwhile, nurses’ representatives continued with their sit-in outside the Karachi Press Club.
“So far, the government has only notified recruitment and promotion rules. We want some other issues to be resolved first before ending our protest,” said Aijaz Kaleri representing the Young Nurses’ Association, Sindh, adding that the government officials had sought time till Friday (tomorrow).
The nurses have suspended their services in the general wards of public sector hospitals across Sindh. A few days back, scores of nurses were thrashed, baton-charged and briefly detained by the police when they tried to march on the Chief Minister House.
Their demands include regularisation of nurses appointed at various healthcare facilities over the past two years for services related to Covid-19 and implementation of the Pakistan Nursing Council decision, according to which, nurses should head educational and training institutions for lady health workers and midwives.
“The government should also separate nurses’ education and deputation policies from that of doctors and raise stipend of trainee nurses who are getting a meagre monthly stipend of Rs15,880 unlike other provinces where this amount has risen to Rs33,000,” said Mr Kaleri.
Published in Dawn, December 9th, 2021
"
14,NED bus driver acquitted in 2014 case of running over woman,Model Court orders govt to pay diyat to deceased’s heirs observing blood of Muslim shall not go in vain...,"KARACHI: A model court on Wednesday acquitted the driver of an NED University point bus for want of evidence in a case pertaining to crushing a woman to death in 2014.
However, the court ordered the Sindh government to pay monetary compensation to the legal heirs of the victim.
Driver Hanif Akhtar was charged with rashly driving a point bus of the NED University and running over Areeba and wounding motorcyclist Irfan, Komal and Nasira in Sector 11-B, North Karachi on Sept 9, 2014.
On Wednesday, Judge Liaqat Ali Khoso of the Model Criminal Trial Court (central) pronounced his verdict reserved after recording evidence and final arguments from both sides.

Model Court orders govt to pay diyat to deceased’s heirs observing blood of Muslim shall not go in vain

The judge noted that the investigating officer failed to collect the evidence to establish that accused Akhtar was driving the varsity’s bus on the fateful day, adding that no testimony of the students commuting in the bus were recorded.
The court also observed that it transpired that the motorcyclist, Irfan, was riding with three pillion-passengers and their school bags, which showed negligence and irresponsible manner on his part. “The fault of deceased/victim also could not be ruled out,” the court stated.
The judge extended the benefit of the doubt to the accused and acquitted him.
In an interesting move, the judge ruled: “As per Shariah, the blood never goes vain and futile in Islam. Another proposition is that blood of Muslim shall not go in vain and futile in Islam.”
“The government is responsible for securing the blood of a deceased to be safeguarded. Hence, the provincial government is directed to initiate the case of the deceased Areeba Suhrab regarding payment of Diyat amount to her legal heirs, as per law and rules,” the judge ordered.
The court directed its office to send a copy of the judgement to the secretary of the Sindh government for compliance and submitting a report on implementation of these directives in letter and spirit.
A case was registered under Sections 320 (punishment for qatl-i-khata by rash or negligent driving), 337-G (punishment for hurt by rash or negligent driving), 427 (mischief causing damage to the amount of fifty rupees) and 279 (rash driving or riding on a public way) of the Pakistan Penal Code at the Sir Syed police station.
Published in Dawn, December 9th, 2021
"
