,Header,Summary,Detail
11,0.18m acre land retrieved: SACM,LAHORE: Special Assistant to Chief Minister (SACM) on Information Hasaan Khawar says the state land has remained an...,"LAHORE: Special Assistant to Chief Minister (SACM) on Information Hasaan Khawar says the state land has remained an easiest prey by qabza mafia as around 223,000 acres state land in Punjab worth Rs472 billion was brazenly encroached upon – with the connivance of the successive governments and officials.
“The 223,000 cases of encroachment are in fact receipts of incompetence of the previous governments,” Mr Khawar said while speaking at a news conference here on Saturday.
He said a forensic audit of fire incidents in public offices in the previous government would prove that the officials were hand in glove with the qabza mafia.
He said some 180,000 acres of land had so far been retrieved. Of the total land, he said, 7,000 acres were in urban areas and around 216,000 acres in villages. The state land belonged to forest, revenue, auqaf and other departments. He said the retrieved land was being handed over to the departments concerned to be used for projects of public welfare.
Mr Khawar said the chief minister had instructed that the remaining 35,000 acres land should be retrieved in the next five weeks.
Published in Dawn, November 28th, 2021
"
12,Girl injured in bid to board moving train,BAHAWALPUR: A girl travelling by Green Express was critically injured on Saturday when she fell from the platform on...,"BAHAWALPUR: A girl travelling by Green Express was critically injured on Saturday when she fell from the platform on the track on which the train had started moving.
According to eyewitnesses, Areeba (20) travelling along with her brother from Karachi to Lahore disembarked from the train to drink water. She attempted to board the moving train but failed and fell between the platform and the track. Her legs got chopped off.
The girl was removed to local hospital where she was stated to be critical.
SHOPKEEPERS HELD: The price control magistrates have arrested as many as 303 shopkeepers, got 76 first information reports registered and imposed a fine of Rs2.1 million during a week-long surprise raids in three districts of Bahawalpur division.
This was stated by Commissioner retired Capt Muhammad Zafar Iqbal while chairing a high-level meeting to review the situation in connection with the rising prices, ongoing vaccination campaigns of measles and Covid and the availability of fertilisers in the division here on Saturday. The deputy commissioners of three district participated in the meeting via video link.
The commissioner directed the officials to ensure supply of fertilisers on controlled prices as there was adequate stock available in the market. He also directed payment from sugar mills to growers in accordance with the rate fixed by the Punjab government.
POULTRY MEDICINES: The Federal Investigation Agency claimed on Saturday to have arrested two people on charges of selling spurious poultry medicines worth hundreds of thousands of rupees.
According to FIA Deputy Director Sarfraz Ali, a team [on a tip-off] raided a motorcycle-rickshaw and recovered substandard poultry medicines.
Rickshaw driver Abbas said he was going to deliver medicines to a poultry farm owned by Muhammad Asim. The FIA conducted a raid and arrested the owner. Further investigation is under way.
Published in Dawn, November 28th, 2021
"
13,"Students, teachers visit Multan Garrison",MULTAN: A contingent of students and faculty members from leading educational institutions spent a day with army at...,"MULTAN: A contingent of students and faculty members from leading educational institutions spent a day with army at Multan Garrison.
According to a press release issued by the Inter Services Public Relations here on Saturday, 120 students from the National University of Modern Languages (NUML) and the BZU were part of the contingent. The programme was organised to enlighten the students about functioning of the Pakistan Army.
Published in Dawn, November 28th, 2021
"
14,"Role of bookshops, libraries stressed for promoting literature","FAISALABAD: Journalist Ghazi Salahuddin has stressed the pivotal role of bookshops, libraries, education and...","FAISALABAD: Journalist Ghazi Salahuddin has stressed the pivotal role of bookshops, libraries, education and environment role in promotion of literature.
Giving examples of Orhan Pamuk of Turkey and Haruki Murakami of Japan, he said they were read a lot in their own countries before getting popular in the world.
“Ismail Kadare is popular and people read his novels globally although he writes in Albanian language. Our Karachi is equal to six Albanias,” he said on Saturday in a session on the second day of 8th Faisalabad Literary Festival being held virtually.
The session, titled, Our Literature in Comparison with the World Literature, had Ghazi Salahuddin, fiction writer and critic Nasir Abbas Nayyar and Saeed Naqvi as panelists while it was moderated by Asghar Nadeem Syed.
Salahuddin said it was imperative to note the environment in which literature was being produced rather to first look at the quality of literature. He raised the question of the number of readers in the country and what change a new book could bring about in society. He said we had treasure of novels and literature requiring attention but they could not get attention like those written in other countries.
Ghazi Salahuddin said Oprah Winfrey used to show a book in her show and it would become a best seller but on the contrary, Masood Ashar wrote about four novels in his columns in a reliable Urdu newspaper but nothing happened. Similarly, he added, reviews of books in New York Times also made books the best sellers but situation was different in Pakistan.
Asghar Nadeem said he had asked the committee selecting the vice chancellors to ask the candidates which book they had read and which film they had watched recently. With these two questions, he added, the committee could determine how the candidates’ sensibility had been developed.
Nasir Abbas Nayyar said we lacked the reading habit and discussion on the books being written.
“We have no standing at the international level as our writers are not being appreciated here and that’s why their books are not being translated.”
Mr Nayyar said that the governments in other countries would promote literature internationally but here the governments did not give the same treatment to literature.
Saeed Naqvi termed literature a dialogue between the writer and the readers. He said being reader we want to read the pieces which appealed to us rather than those which contradicted our thoughts.
He lamented that among the population of 200 million people, sale of 500 books of first edition was considered a success.
Four sessions were also held in the festival on Saturday while the same number of sessions would be held on Sunday (today).
Published in Dawn, November 28th, 2021
"
15,Snatched infant recovered,GUJRAT: Police claimed on Saturday to have recovered an infant who had been snatched from the lap of his mother by...,"GUJRAT: Police claimed on Saturday to have recovered an infant who had been snatched from the lap of his mother by two motorcyclists on Railway Road.
DPO Umar Salamat told reporters at a news conference that city’s A-division police station received a complaint of Abdul Khaliq of Khazoor Bakhsh of Sindh, who currently resides near Shadiwal Road, that unidentified people had snatched two-month-old son of his sister.
The DPO said the woman whose son was snatched was a beggar and police registered a kidnap case and a team led by Gujrat city circle DSP Pervez Gondal arrested Sohail Shah and his sister Naima Shah and recovered the infant.
Published in Dawn, November 28th, 2021
"
16,Booked,"BAHAWALNAGAR: Wildlife department officials booked four men for poaching, arresting three of them on Saturday. Wildlife officials","BAHAWALNAGAR: Wildlife department officials booked four men for poaching, arresting three of them on Saturday.
Wildlife officials said a man was booked in Chishtian tehsil for illegally netting quails, while three others – Sharif, Saeed and Siddique of Minchinabad, Haroonabad and Fort Abbas, respectively were arrested for poaching falcons and shooting birds and were also slapped Rs10,000 fine each.
Published in Dawn, November 28th, 2021
"
