,Header,Summary,Detail
10,New IBCC regional office in city inaugurated,KARACHI: The new building of Inter Board Committee of Chairmen’s (IBCC) regional office in Karachi was ...,"KARACHI: The new building of Inter Board Committee of Chairmen’s (IBCC) regional office in Karachi was inaugurated. The new office is situated adjacent to Liaquat National Library on Stadium Road.
Speaking on the occasion, Federal Minister Rana Tanveer Hussain stressed on the national ranking system for higher education institutes, training of teachers and quality enhancement.
He said Rs110 billion was earmarked for the Higher Education Commission in the budget that was significantly higher than allocation made by the previous government.
He said that provinces had certain reservations over the single national curriculum introduced by the previous government so reforms were made and a national curriculum had been introduced while specifying minimum benchmarks.
Earlier, IBCC Secretary Dr Ghulam Ali Mallah said that the IBCC issued equivalence certificates for foreign educational qualification certificates and hundreds of certificates were registered with the committee for the purpose.
He said that for facilitation of students the entire process of equivalence certification had been digitised and over 40 per cent of applications were being submitted online while fees in this regard could be submitted in any branch of all the banks around the country.
Published in Dawn, August 1st, 2022
"
11,Journalist Akhtar Balouch passes away,"KARACHI: Senior journalist, author and rights activist Akhtar Balouch passed away on Sunday after a brief illness. ...","KARACHI: Senior journalist, author and rights activist Akhtar Balouch passed away on Sunday after a brief illness. He was in his 50s.
He left behind a widow and three children. His funeral prayer was held at a local mosque in Garden after Zuhr prayer.
Mr Balouch was suffering from fever for the past few days, said his close friend and veteran photographer Akhter Soomro.
He underwent some tests on Saturday and doctors while informing him about his low blood pressure prescribed some medicines. However, he died before midnight.
Mr Soomro said that Balouch originally hailed from Mirpurkhas had worked in different media organisations. He was an office-bearer of the Hyderabad Press Club, coordinator of the Human Rights Commission of Pakistan in Sindh, head of an NGO and a regular contributor for Dawn.com.
He authored three books on Karachi and the fourth one — Teesri Jins — on transgender persons.
“He was a highly respected journalist and writer and an authority on Karachi’s political dynamics and cultural heritage,” said a statement issued by the HRCP.
Published in Dawn, August 1st, 2022
"
12,KWSB told to provide water to affected F. B Area residents,KARACHI: The Sindh ombudsman has taken serious notice of the failure of the Karachi Water and Sewerage Board to...,"KARACHI: The Sindh ombudsman has taken serious notice of the failure of the Karachi Water and Sewerage Board to comply with its earlier directives regarding supply of water to dozens of houses in Federal B Area Block 9.  
The office of the provincial ombudsman sent a notice to KWSB officials Hanif Baloch and Usman Khaskheli stating that their staff concerned did not take any effective measure for proper supply of water in the said area.
“This indicates mismanagement on the part of KSWB,” it said, directing the officials to take immediate action against the staffers and ensure sufficient supply of water in the area.
The directives came on the plea of affected residents of Federal B Area’s Block 9. They complained that around 48 houses — from R-23 to R-60 — were not getting water since long.
Talking to Dawn, one of the affected residents, Aftab Alam, alleged that their share of water was allegedly diverted by KWSB staff to nearby residential and commercial buildings.
He said that an unauthorised water storage tank was constructed at a public park in Federal B Area’s Block 7, close to the houses of affected residents, and water meant for them was diverted and stored in the illegal facility.
Mr Alam demanded that the anti-water theft team of the local government department visit the said park and take action against the illegal water storage facility forthwith.
Published in Dawn, August 1st, 2022
"
13,Body with torture marks found in plastic bag,MIRPURKHAS: A tortured body of an unidentified elderly man stuffed in a plastic bag was found near the Left Bank...,"MIRPURKHAS: A tortured body of an unidentified elderly man stuffed in a plastic bag was found near the Left Bank Outfall Drain near Balochabad here on Sunday. 
Some villagers spotted the suspicious bag and informed area police who found the body inside after opening up the bag and shifted it to mortuary of Mirpurkhas Civil Hospital where it was kept for identification. 
Deer carcass found
A carcass of a deer was found in desert near Kaloi town on Sunday. 
Some villagers found the carcass and informed wild life department officials who took it into custody and began investigation into the reasons behind the animal’s death. 
The villagers said that some mysterious disease had afflicted the deer and their carcasses were appearing at different places in the district. 
They demanded the authorities concerned order a thorough inquiry into the animals’ deaths and save their lives from the mysterious disease.
Published in Dawn, August 1st, 2022
"
14,"Nothing being done to rescue thousands of marooned villagers, says PTI leader",Visits flooded areas of Dadu district...,"DADU: Pakistan Tehreek-i-Insaf leader and former Sindh chief minister Liaquat Ali Jatoi on Sunday strongly criticised the provincial government for failing to undertake any relief and rescue operation in any part of the province, which was hit by a natural calamity. Thousands of people were marooned in the Kachho belt alone and had been waiting for relief and rescue for 11 days but neither any step was being taken to save their lives nor were proper arrangements being made to shift them to safe places, he said.
Mr Jatoi was speaking to the media in Johi after visiting Wahi Pandhi, Drig Bala, Haji Khan and other flooding-hit towns and villages in the Kachho area along with Sindh PTI vice president and former Dadu district nazim Karim Khan Jatoi on Sunday. 
The former CM said that during his visit, he could not see any government functionaries or volunteers helping out marooned men, women and children trapped in their destroyed villages. He also refuted Dadu deputy commissioner’s claim that boats were employed to shift people to safe places.
The Pakistan Peoples Party-led Sindh government did have funds amounting to billions of rupees but it seemed not ready to spend even on saving lives of poor and needy people, he said.

Visits flooded areas of Dadu district

The federal government, as well as corporate sector earning billions from oil and gas exploration in the area, also appeared indifferent to the affected people’s woes in their hour of need, he lamented.
Liaquat Jatoi and Karim Jatoi pointed out that road communication between each two of several hundred villages of Kachho belt was cut off by torrential rains and hill torrents and Johi also remained disconnected from them for many days but rehabilitation work had not been started till date.  
They noted that millions of rupees were got released in the name of water supply schemes every year but no such scheme was visible. All departments remained plagued with corruption over the tenures of PPP government, they added. 
They noted that heirs of a youth, Ali Khoso, revealed that he drowned in flood water while struggling to save his child from drowning near Johi. The family alleged that despite his hue and cry, the assistant commissioner of Johi and mukhtiarkar did not move to arrange a boat to rescue them. PPP ministers and lawmakers from the district did not render any service to people over the last 15 years of the party’s rule over Sindh, they deplored.
Liaquat Jatoi pointed out that bridges were built in the Kachho belt and major development works carried out in some other areas including Wahi Pandhi, Haji Khan Road and Gorakh Hills during his tenure as federal minister. He said he had also established electricity grid station in the Kachho area.
He condemned that law and order in Mehar was worsening but instead of arresting offenders, police at the behest of PPP government had recently implicated around 300 PTI workers in fake cases.
Published in Dawn, August 1st, 2022
"
15,Four children drown near Shikarpur,SUKKUR: A young boy and his sister drowned in a pond and two small sisters fell into a water channel to their death...,"SUKKUR: A young boy and his sister drowned in a pond and two small sisters fell into a water channel to their death in different areas near Shikarpur on Sunday.
Police said that villagers took out bodies of Abdul Wahab, 5, and his sister Kaz Bano, 7, from the pond in Muhammad Azeem Chandio village. They might have slipped and fallen into the pond while playing on its bank, said family members.
Police said that in another incident two sisters identified as Kanwal, 7, and Zareena, 8, downed in a water channel in Muhammad Umar Khoso village.
The girls’ relatives took out the bodies from the channel and brought them to nearby hospital where doctors declared them dead and handed them back the bodies after completing medico-legal formalities.
Teenage boy electrocuted 
A 16-year-old boy was electrocuted when he switched on an electrified pumping machine at home, said police officials.
They said that when Nadir Ali Buriro suffered the electric shock, he fell unconscious. The family took him to the Sukkur Civil Hospital where doctors pronounced him dead.
Published in Dawn, August 1st, 2022
"
16,Khursheed slams calls for accountability of politicians alone,SUKKUR: Federal Minister for Water Resources Syed Khursheed Ahmed Shah has sharply reacted to growing demands on...,"SUKKUR: Federal Minister for Water Resources Syed Khursheed Ahmed Shah has sharply reacted to growing demands on social media for accountability of politicians and said that similar demands are not made for those who had imposed four Martial Laws on Pakistan. 
The veteran leader of Pakistan Peoples Party said at a ceremony for the distribution of offer letters among the successful candidates who had passed job test for teacher at Sukkur IBA on Sunday that the Martial Laws promoted culture of Kalashnikov, heroin, terrorism and Talibanisation in the country.
Even three rivers were sold out during the military rules but no one raised any objection and even so-called courageous journalists dared not raise such questions, he said.
He said that people were being misguided about politicians and made to believe that they preferred leading luxurious and ostentatious life to serving public.
Politicians had given many great things to Pakistan such as constitution, atom bomb, missile system and other programs and projects yet they were maligned on media, he said.
Shah said that he had always tried his best to serve people because he believed it was the greatest ‘jihad’ to fight against ones’ own ‘nafs’ and serve nation. 
About the status of teacher in society, he said that teaches were respectable because the Prophet (SAW) himself had raised their status. It was a prime duty of parents and teachers to teach children and make them a better citizen, he said.
He took credit for making Sukkur city a centre of education with five universities. Work on an IT tower and COMSAT Center would commence shortly while NICVD and cancer hospital would be inaugurated soon in Sukkur, said Shah.
He said that youth were nowadays being brainwashed as they were seen smoking and misbehaving with teachers and parents. 
About the role of a woman, he said that the development of the country depended on educated woman because a child received primary education in her lap. 80 per cent women were less educated or uneducated in the country, said the minister.
Truth was distorted and lies were fabricated on social media to spread misinformation among people, he said. 
He said that a politician who told lies was not a true politician as a man should rather die than tell a lie. A politician commented on social media about the dead bodies stuck at Sukkur barrage gates and claimed they were of people killed in a clash, he said. “When I phoned him and explained to him the real reasons behind the floating bodies, he deleted the post,” said Shah.
He said that issues about free-will marriage were discussed at great length but the real issues were not raised and debated on. It was a pity that governments were congratulated on clinching deals with the Internal Monetary Fund, he said.
Published in Dawn, August 1st, 2022
"
17,Two Shia bodies settle year-long issue of majalis at Qadam Gah,"DC, SSP play important role in negotiations...","HYDERABAD: Observance of Azadari in Hyderabad began on Sunday in somewhat unpleasant manner amid tension between two Shia organisations over holding of Majalis (congregations) at Qadam Gah Maula Ali. 
A tense situation had already prevailed in and around the Qadam Gah as Anjuman-i-Imamia Sindh (AIS) several days back expressed its intention not to let Anjuman-i-Hyderi (AH) to hold its Majalis at the place despite having legal permits. The 10-day Majalis at Qadam Gah are held for almost seven decades.
Never before this year such a situation had been witnessed at Qadam Gah over holding of traditional programmes of Muharram. Police contingent remained deployed there. On Sunday, the AH was finally allowed to organise its Majalis as per the tradition after intervention of the Hyderabad deputy commissioner and SSP.
SSP Amjad Shaikh made it sure that the already set traditions were not disturbed. “I told them that no deviation could be accepted a far as observance of days including 10-day Majalis, central and 8th Rabiul Awwal processions is concerned,” the SSP told Dawn on Sunday, implying that the AH would hold its 10-day Majalis as per schedule and traditions.

DC, SSP play important role in negotiations

Trouble had started last year when the AIS, the custodian and management of Qadam Gah, had informed the AH that it would not allow it to hold the 10-day Majalis regardless of the tradition. The move was unacceptable to the AH.
The Qadam Gah, considered to be sacred not only in Fiqah-i-Jafria but also in Ahl-i-Sunnat’s Barelvi school of thought, is located off Station Road. A prayer mat of stone with imprints of Hazrat Ali Murtaza’s forehead, hands, knees and feet in position of prostration. It was brought by Talpurs from Iran in 1805. Since then the site is frequented by faithful.
Hyderabad-based AH, registered in 1948, has permits to stage the city’s central Ashura procession on 10th of Muharram, 10-day Majlis from Ist to 10th of Muharram, 10-day Majlis from 28th of Safar to 8th of Rabiul Awwal and ‘chup tazia’ procession on 8th of Rabiul Awwal.
However, The Shia sect calls Muharram’s first 10 days as ‘Ashra-i-Oola’ and Safar-Rabiul Awwal 10-day period as ‘Ashra-i-Akhir’.
For several days, AH and AIS had been talking to each other, directly or indirectly, but the talks remained inconclusive. One round of talks was held at the Hyderabad DC’s house in the presence of DC Fuad Soomro a few days back but still the matter remained unresolved.
On Saturday, the AH leadership brought things on record expressing its resolve to hold its Majalis at Qadam Gah “come what may”. At a press conference addressed by its acting president Ali Jawad Ansari, the AH made it clear that it would hold its first Majlis on the 1st of Muharram at Qadam Gah. He referred to a charter of demands drafted by the AIS which, he said, his organisation had refused to accept as it asked the AH would to hold its Majlais at Karbala Dadan Shah and not at Qadam Gah. The charger allowed the AH to continue to stage Ashura’s central and chup tazia processions.
Ghulam Mohammad Rind alias Chanda —chairman of the committee that had been mediating in the matter between the two sides for a year — spoke at length at the press conference. 
“Actually the administration is afraid of Sindh NAB’s DG Dr Najaf Mirza, who is brother of AIS’s Sadiq Mirza”, Mr Rind said.
“The AH has been holding its permitted events for decades. I, as the committee chairman, had asked the AIS to explain how the AH can be denied these activities and if there is anything wrong on the part of the AH, the latter can be asked to rectify it. The AIS, he said, was custodian of Qadam Gah but it couldn’t restrain the AH from holding its activities as it has valid permits for the events”.
Sadiq Mirza, the head of Qadam Gah’s management committee, had insisted on Saturday night that: “We will not allow them [AH] to hold 10-day Majlis of Muharram but it can hold the Ashura central and chupa tazia processions.” Mr  Mirza is brother of Dr Najaf Mirza.
Mr Ansari said: “We won’t tolerate obstruction in observance of days”. 
According to Nawaz Bhutto, the AIS had started creating problems during last year’s Ashra-i-Akhir. “We had settled things somehow. AIS is again behaving in a manner not acceptable to us,” he said.
“AIS is acting quite childishly rather foolishly. AIS can’t just do it as the AH has every right to hold its traditional programmes before and during Muharram,” remarked Kazim Mirza, a former AIS member. He served as head of Qadam Gah’s management for 11 years (1994-2005). AIS had revoked his basic membership and he filed a case which is pending adjudication. “My membership was cancelled by AIS’s patrons when they dissolved my management,” he said.
He accused AIS of trying to create chaos. AIS can’t deny anything to AH since it has valid permits for religious activities,” he said while referring to Mehfil-i-Hussaini, which holds one of the big Majlis on Station Road.
“Same goes for Qadam Gah for which the AH has valid permits to hold Majlais and start central and other processions. Even AIS can’t hold programmes at Qadam Gah sans permits. It is tantamount to causing provocation,” he remarked. 
DC Fuad talked to the Hyderabad SSP who eventually got the issue settled amicably. 
Published in Dawn, August 1st, 2022
"
