,Header,Summary,Detail
8,"‘Mother, child mortality data includes deaths at homes, private facilities’","LAHORE: The IRMNCH & Nutrition Programme Punjab has stated that 1,000 pregnant women and 88,000 children died in...","LAHORE: The IRMNCH & Nutrition Programme Punjab has stated that 1,000 pregnant women and 88,000 children died in Punjab’s private as well as public healthcare facilities, adding the data also includes such deaths occurring at homes.  
In a press release issued on Saturday, IRMNCH & N Programme in response to a news item published in Dawn edition of March 24, said, “...these are cumulative provincial figures of maternal mortality reported by the  LHWs from all across the province. These figures include overall  mortality reported from public and private hospitals as well as from  homes and not from the Basic Health Units (BHUs) and Rural Health Centres (RHCs)”.
It further says that Punjab is the only province to have developed this system  to collect, consolidate and analyse maternal mortality data from  community and this data collection mechanism does not exist anywhere  else in the country. It adds that currently, Punjab has the lowest Maternal Mortality Rate (MMR) in the country.  
It says most of these deaths are linked to deliveries at home as there is reluctance in community to seek services from skilled attendants and people mostly prefer local ‘dayee’ (birth attendant). 
It says out of 88,021 reported deaths, 62,831 were stillbirths which is a natural and global phenomena.  
It adds that IRMNCH programme transported 415,696 pregnant women to BHUs and RHCs to ensure safe deliveries. Similarly, it says, 46,854 women were transferred to the Tehsil Headquarters Hospitals (THQs) and District Headquarters Hospitals (DHQs) due to birth-related complications. In Punjab’s 1,234 BHUs not a single maternal death was reported in 2021, it says.   
It is, however, pertinent to mention that the Dawn story was based on an official report prepared by the Punjab Planning & Development Board.
Published in Dawn, March 27th, 2022
"
9,BVH short of drugs due to supply disruption,"BAHAWALPUR: The outpatient department (OPD) of the Bahawal Victoria Hospital (BVH) is facing shortage of medicines,...","BAHAWALPUR: The outpatient department (OPD) of the Bahawal Victoria Hospital (BVH) is facing shortage of medicines, causing a great deal of anguish to patients. 
According to several patients of diabetes, even insulin is not being provided to them. Several elderly patients daily visit the OPD to get insulin but after waiting for hours they return without [insulin] injections with the result that they are in distress. 
Additional Medical Superintendent (AMS) Dr. Zeeshan Rauf says the hospital is short of medicines as supply from the respective companies has been delayed. According to him, orders for the supply of medicines have been placed to the pharmaceutical companies but the supply is delayed due to the drug testing laboratory. However, he expresses the hope that the supply will be restored shortly. 
CONVOCATION: Governor Chaudhry Sarwar on Saturday delivered presidential address at the second convocation of Government Sadiq College Women University (GSCWU), Bahawalpur. 
The governor awarded degrees, gold and silver medals to 1,697 students.  
In his address, Mr Sarwar referred to the measures taken by the government for the empowerment of women and shed light on the pivotal role of women for the progress and development of the country. 
University’s syndicate member Syed Tabish Alwari, a former parliamentarian, met the governor and said the demand for restoration of the Bahawalpur province may also be incorporated in the bill regarding the creation of south Punjab province submitted by the PTI government to the National Assembly speaker.  
The governor replied in a positive manner assuring that he would convey it to the federal government but he (Alwari) should also approach other political parties to move the amendment to the bill. 
The governor also presided over the meeting of board of governors and the annual function of 68th Founders’ Day of Sadiq Public School and gave away prizes and medals to students.
Published in Dawn, March 27th, 2022
"
10,Union ‘works out Rs600m’ cost for teachers’ regularisation,SAHIWAL: Cost for the finance department is around Rs600 million if the provincial government decides to award Pay...,"SAHIWAL: Cost for the finance department is around Rs600 million if the provincial government decides to award Pay and Service Protection (PSP) to 6,500 public sector college and commerce teachers who have been protesting with the support of Punjab Professors and Lecturers Association (PPLA) and Commerce Professors and Lecturers Association (CPLA) by staging a sit-in at Civil Secretariat, Lahore, for the last 20 days.  
This was claimed by Abul Hasan Naqvi, who is representing the PSP committee which is part of three-member team that negotiated with Additional Chief Secretary Sayed Ali Murtaza on March 24, while talking to Dawn.  
He said in 2002, 2005, 2009 and 2012, as many as 723, 870, 2,098 and 2,600 college teacher, respectively, were inducted on a contract basis. In the same manner as per the policy evolved by the Musharraf dispensation, around 500 commerce teachers were appointed in 2004 on contract by Technical Education and Vocational Training Authority (Tevta).  
He said [above] four batches of college teachers were regularised in 2009, 2010, 2012 and 2015. Likewise, 500 commerce teachers were also regularised in 2012 after the federal government withdrew the contract policy in 2009 and asked all the federating units to regularise the services of contract employees.  
President Ittehad-i-Asatiza Pakistan Chaudhry Mustafa said both Sindh and Khyber Pakhtunkhwa followed the federal government’s directions and provided PSP to all contract employees. But the then Shahbaz Sharif-led provincial government in Punjab delayed the regularisation of contract employees for one year. Later, the PML-N provincial government continued with the contract scheme along with regularisation policy.  
PPLA Additional Secretary Ms. Sadia Alvi said the teachers were regularised without adding contract period of the service.  
Surprisingly, the Higher Education Department through a notification on July 9, 2013, withdrew its policy that had been agreed in 2009. The matter has been unresolved since then. 
An insider told this correspondent that as per the direction of the chief secretary, the provincial finance department and cabinet division along with the HED secretary had been working on the financial implication of PSP and “their figure is also matching with the amount calculated and provided by the members of the union.”  
A source in HED has claimed that the amount is not big and the department can manage it from its own allocated budget.
Published in Dawn, March 27th, 2022
"
11,Family of ‘lynched’ vendor seeks exhumation,"KASUR: The brother of the vendor who was allegedly lynched at a wedding at Pattoki a couple of days back, has...","KASUR: The brother of the vendor who was allegedly lynched at a wedding at Pattoki a couple of days back, has submitted an application with a local court on Saturday seeking exhumation to identify the cause of death.
In response to the application, the court has summoned the parties on Tuesday next. 
On March 21, cracker vendor Muhammad Ashraf was allegedly lynched by wedding guests at Aljannat Marriage Hall, Pattoki.  
The incident was highlighted in the media and drew criticism when a video clip uploaded on social media showed wedding guests having dinner as the vendor’s body was lying nearby.  
Sources says that after the vendor died the suspects (wedding guests) dragged his body inside the banquet hall, covered it with a white cloth, and started taking dinner.  
Local police, however, denied any torture of the deceased, claiming they could not find any evidence of lynching. 
Preliminary medical report of the victim also supports the police’s stance. 
Nevertheless, a report submitted by the tehsil administration says the victim was tortured to death by an angry mob, accusing the vendor of pick-pocketing. 
The family of the victim, however, claimed that Ashraf’s body had torture marks which were noticed by those who gave the body a bath before the burial.  
The family also alleged foul play on the part of the medical officer who conducted the autopsy and added that police connived with the suspects.
Published in Dawn, March 27th, 2022
"
12,UO holds convocation,"OKARA: In the first convocation of the University of Okara (UO) on Saturday, 1,543 graduates were awarded degrees ...","OKARA: In the first convocation of the University of Okara (UO) on Saturday, 1,543 graduates were awarded degrees and medals. 
VC Prof Dr Muhammad Zakria Zakar, along with chief guest Prof Dr Muhammad Ali, the VC of the Quaid-i-Azam University, gave away degrees to the graduates of the faculties of sciences, life sciences, management & social sciences and computing.   
In his address, Dr Zakar said: “This is the historical day when our first-ever graduates are receiving their degrees with great sense of achievement and success.”  
Prof Dr Ali lauded the efforts of Dr Zakria for unprecedented development of the university.   
Dr Nasrin Akhter, the associate professor of Education, was awarded the Higher Education Commission’s Best University Teacher Award.
Published in Dawn, March 27th, 2022
"
13,"One killed, two cops among five hurt in rivals clash","KASUR: A man was killed while five others, including two policemen, suffered injuries in a rivals’ clash here on...","KASUR: A man was killed while five others, including two policemen, suffered injuries in a rivals’ clash here on Saturday on Shahbaz Road, one of the busiest thoroughfares of the city, in the limits of A-Division police station.  
According to police, Maqsood Ahmed and Muhammad Ashraf had a clash on Shahbaz Road over a trifle. 
A passerby, Ashraf, called police 15. A team reached the spot and asked them to visit the police station that was at a short distance. 
When the police left the spot, both Ahmed and Ashraf again had an exchange of harsh words and they called their relatives and friends. 
The busiest road soon turned into a battlefield as both sides traded fire and used daggers. Police again visited the spot. Two policemen and as many passers-by were injured besides two relatives of Ashraf. None from Ahmed’s side was injured. 
The injured have been identified as passers-by Aslam, M Abbas, Ashraf, Muhammad Shahbaz, Mushtaq Ahmed and Amjad. 
The injured were rushed to the DHQ hospital where Ashraf was declared dead. 
Police are looking into the matter.
Published in Dawn, March 27th, 2022
"
14,UAF to hold litfest,TOBA TEK SINGH: The University of Agriculture Faisalabad (UAF) is holding 7th Lyallpur Art and Literature Festival...,"TOBA TEK SINGH: The University of Agriculture Faisalabad (UAF) is holding 7th Lyallpur Art and Literature Festival and a book fair from March 28 to March 31 as a part of its ongoing spring festival.  
UAF Vice Chancellor Prof Dr Iqrar Ahmad Khan has directed the officials concerned to make foolproof arrangements for the events.  
The art and literature festival is being arranged by the UAF Senior Tutor Office, while the book fair is being organised by Main Library.
According to Senior Tutor Dr Shoukat Ali, the inauguration ceremony of the literature festival will be held on March 28 at 10am at the UAF Iqbal Auditorium whereas Qirat, Naat, essay writing, bilingual declamation and Bait Bazi contests will be held, besides a Mushaira (poetry sitting), on March 28. He says that on March 29, Punjabi Takra, a quiz competition will be held, while on March 30, Virsa Music Fest, Spot Product Photography, Art Contest, etc will be organised. 
Published in Dawn, March 27th, 2022
"
15,PPP MNA denies joining PTI,"MUZAFFARGARH: PPP MNA Nawabzada Iftikhar Ahmad Khan has denied reports that he had joined the PTI. 

A campaign was...","MUZAFFARGARH: PPP MNA Nawabzada Iftikhar Ahmad Khan has denied reports that he had joined the PTI. 
A campaign was launched on social media in recent days regarding the resignation of a Mr Khan and his joining the ruling party.   
On Saturday, the MNA released a video statement, denying the report and alleged the PTI had launched the propaganda against members of the opposition parties. He claimed he was committed to PPP chairman Bilawal Bhutto. Nawabzada Iftikhar Ahmad Khan is the son of Nawabzada Nasrullah. His brother Nawabzada Mansoor is the MPA in the ruling party while Nawabzada Iftikhar was elected MNA on PPP ticket.
Published in Dawn, March 27th, 2022
"
