,Header,Summary,Detail
10,Turkiye accuses Greece of ‘hostile action’ against jets,ISTANBUL: Turkiye said on Sunday fellow Nato member Greece had used a Russian-made air defence system to harass...,"ISTANBUL: Turkiye said on Sunday fellow Nato member Greece had used a Russian-made air defence system to harass Turkish jets on a reconnaissance mission in what it termed a  “hostile action”.
The incident took place on August 23 when Greece’s S-300 missile system on the island of Crete put a lock on Turkish F-16 jets flying at 10,000 feet west of Rhodes, Turkish defence ministry sources said.
That was  “incompatible with the spirit of (Nato) alliance” and amounted to  “hostile acts” under the Nato rules of engagement, the sources added.
“Despite this hostile action, (Turkish) jets completed their planned missions and returned to their base safely.” Greek defence ministry sources dismissed the allegations.
“Greece’s S-300 missile system has never put a lock on Turkish F-16 jets”, the sources said, according to state-run Ert television.
Turkiye has in recent months complained of what it calls provocative actions by Greece, saying such moves undermine peace efforts.
Published in Dawn, August 29th, 2022
"
11,Texas woman arrested for hate crime against Indians in viral video,"Woman shouts racial abuse at four Indian women in a viral video, telling them to  ""Go back to India"".","WASHINGTON: Police in Texas arrested a woman who they said shouted racial abuse at four Indian women in a viral video, telling them to  “Go back to India,” in an incident brought to the attention of federal authorities.
“This incident is a hate crime in accordance with Texas laws,” police in Plano, Texas, where the incident occurred, said in a statement on Saturday.
“This incident may also be a hate crime based on federal law, and we are working closely with the FBI and the Department of Justice Civil Rights Division on this case.”  In a video of the incident, which was shared on social media and got millions of views, the woman was seen shouting racist comments in a parking lot at a group of four women of Indian origin.
“Go back to India, we don’t want you here,” she said in the video.  “I hate you Indians,” the woman, who identified herself as Mexican-American in the video, added. The arrest of the woman took place on Thursday. The video of the incident from Wednesday went viral on social media, particularly in India and the United States.
Police said the woman, Esmeralda Upton, was arrested on one charge of  “assault bodily injury” and one charge of  “terroristic threats.” She was held on a total bond amount of $10,000.
Published in Dawn, August 29th, 2022
"
12,Egypt dims lights to boost foreign exchange reserves,"CAIRO: An economic crisis spurred by the Ukraine war is casting darkness upon Egypt’s streets, as the government...","CAIRO: An economic crisis spurred by the Ukraine war is casting darkness upon Egypt’s streets, as the government dims lights to free up energy for export and bolster hard currency reserves.
Russia’s invasion of Ukraine had an immediate impact on Egypt, the world’s biggest wheat importer which has relied on the ex-Soviet states for over 80 percent of its grain.
Egypt, which turned to the International Monetary Fund for a loan after the war erupted, is pumping more natural gas abroad to increase its foreign currency reserves — a move that has come in for criticism.
And while the government announced electricity rationing this month, signs of wastage elicit scorn.
“I see streetlights still working during daylight hours... and we’re suffering from high electricity bills,” said a disgruntled Cairo resident in his 30s.
The country’s vital tourism sector has also been hit by the Ukraine conflict, cutting the flow of holidaymakers to a country still hurting from the 2011 revolution and Covid-19 pandemic.
Economic growth slowed to 3.2 percent in the fourth quarter of 2021-22 against 7.7 percent last year, although annual expansion was 6.6 percent. Despite the better-than-expected ann­ual figure, the government said growth had tapered off in the wake of “global political and economic developments”.
Egypt’s monetary policy has been caught between a rock and a hard place since Russia invaded Ukraine in February.
Inflation hit a three-year high of 14.6 percent in July after Egypt devalued the pound, pushing up the price of imports and depleting forex reserves by $7.8 billion since February to $33.1 billion in July.
Capital flight
Egypt is negotiating an IMF loan to help mitigate fallout from the Ukraine war on the country, where 30 percent of the 103 million population lives in poverty. But the talks have stretched out for six months, raising eyebrows among analysts.
“The fact that talks with the IMF have dragged is probably a sign that some officials are reluctant to follow through on the Fund’s demands and would prefer to rely on support from the oil-flush Gulf economies,” London’s Capital Economics said.
“We need to speed up negotiations with the IMF,” said Hany Genena, an economist and lecturer at American University in Cairo.
“Since last week, there has been a severe shortage of dollars provided to importers by banks in various sectors.” Cairo had previously secured a $12-billion IMF loan in 2016 that required it to slash subsidies and devalue the pound. In 2020, Egypt received two more loans, including $5.4 billion tied to reforms and $2.8 billion to tackle Covid.
Genena said Egypt needed to undertake more  “drastic” reforms to restore its forex reserves, including a full float of the pound. Last week, as the currency plunged to a near all-time low of 19.1 to the dollar, central bank governor Tarek Amer resigned.
It was unclear why Amer quit, but Egyptian media suggested it was because of his reluctance to implement a full float.
James Swanston of Capital Economics said the currency needed to depreciate to 25 pounds to the dollar by the end of 2024  “to avoid external imbalances rebuilding”.
But $14.6 billion worth of investments has flown out of the country in the first quarter of 2022, reflecting concerns over the Ukraine war.
Capital Economics said, however, that investment pledges worth $22 billion from Gulf countries will  “go some way to alleviating external financing concerns”.
Gas lifeline
Among Egypt’s slate of measures to preserve foreign currency was a decision to let the pound slip 17 percent against the greenback in March.
The government said electricity rationing seeks to achieve  “an additional surplus — at an average of 15 percent of the natural gas pumped to power stations — that can be exported and bring in hard currency.” Among the measures to conserve energy were  “reducing lighting in streets and public squares.” Since 2018, Egypt has been ramping up its natural gas capacity, now setting its sights on an energy-hungry Europe, which is eager to decrease reliance on Russian gas.
The government announced this month  “exceptional aid to nine million families at a cost of $52 million per month,” but for many, the soaring cost of living had already done enough damage.
Published in Dawn, August 29th, 2022
"
