,Header,Summary,Detail,Link,Category
0,"Ramiz should’ve quit PCB after Imran’s ouster as PM, says Aqib","“Many chairmen in the past had left the post with the ouster of the PM who had appointed them and Ramiz should’ve followed suit.""","LAHORE: Former Pakistan fast bowler Aqib Javed said on Wednesday that Ramiz Raja should have quit his post as the chairman of the Pakistan Cricket Board once Imran Khan had been ousted as Prime Minister. 
“Many chairmen in the past had left the post with the ouster of the prime minister who had appointed them and Ramiz should’ve followed suit,” Aqib, a part of Pakistan’s 1992 World Cup-winning side alongside Ramiz under the leadership of Imran, told reporters. 
Ramiz, who was appointed the PCB chief in September of 2021 for a term of three years after winning an unopposed election, was removed last week when a 14-member PCB management committee headed by former chairman Najam Sethi was placed to run cricket affairs in the country. 
Aqib, the coach of Pakistan Super League franchise Lahore Qalandars, said Ramiz had gained few friends during his tenure as PCB chief. 
“A lot of people were unhappy during his time at the top,” said Aqib. “The pool of the players had been limited to just 200. Ramiz ran the PCB as a one-man show and neither the players, franchises of the PSL nor the PCB employees happy with his attitude.” 
Sethi has outlined his vision to restore departmental cricket under the PCB constitution of 2014 and Aqib hailed it “as a good step to increase the pool of players”. “With jobs in departments, it will see more people take up cricket,” he said. 
PCB HITS BACK AT CLAIMS
Earlier on Wednesday, the PCB issued a lengthy statement expressing its “disappointment” over the comments made by Ramiz against Sethi on his YouTube channel as well as a television interview. It also attempted to provide clarity to Ramiz’s claims. 
“The PCB believes former chairman Mr Raja’s comments are aimed at tarnishing and damaging the impeccable reputation of present chairman 
Mr Sethi, and it reserves it’s rights to pursue legal proceedings to protect and defend the image and credibility of its Chairman and the institution,” read a PCB statement. 
It noted that it had already rebutted allegations from Ramiz that he’d not been allowed to collect his belongings. It also said that comparisons made by Ramiz about his expenditures to those made by Sethi during their time as chairmen of the PCB are “misleading and inaccurate as the circumstances are incomparable” as Pakistan played most of its cricket overseas while the Pakistan Super League too was held in the United Arab Emirates.
Published in Dawn, December 29th, 2022
",read full story,sport
1,"Sharjeel, Shan named among probables for NZ ODIs",Pace spearhead Shaheen Shah Afridi and batter Fakhar Zaman remain on the sidelines due to injuries and fitness issues.,"LAHORE: Pakistan’s interim national selection committee named top-order batters Sharjeel Khan and Shan Masood among the 22 probables for the upcoming three-match One-day International series against New Zealand on Wednesday. 
Opener Sharjeel, 33, last featured for Pakistan in ODIs in January 2017 while Shan last played in 2019. Both left-handers played against Australia in their last 50-over matches for the national side. 
The interim selection committee, led by former all-rounder Shahid Afridi, also named six uncapped players namely Abrar Ahmed — who is currently featuring in the Test series against New Zealand, Aamer Jamal, Ihsanullah, Kamran Ghulam, Qasim Akram and Tayyab Tahir. 
Pace spearhead Shaheen Shah Afridi and batter Fakhar Zaman remain on the sidelines due to injuries and fitness issues. 
“The selectors will announce the 16-player squad following the conclusion of the Pakistan Cup and during the second Test [against New Zealand], which will also be played in Karachi from Jan 2-6,” said a Pakistan Cricket Board news release. 
The ODIs will be played on Jan 9, 11 and 13 in Karachi. 
Probables: Babar Azam (captain), Abdullah Shafiq, Abrar Ahmed, Aamer Jamal, Haris Rauf, Hasan Ali, Ihsanullah, Imam-ul-Haq, Kamran Ghulam, Moham­mad Haris, Moham­mad Hasnain, Moham­mad Nawaz, Moha­mmad Rizwan, Moha­m­mad Was­im, Naseem Shah, Qasim Akram, Salman Ali Agha, Shadab Khan, Shahna­waz Dahani, Shan Masood, Shar­jeel Khan, Tayyab Tahir.
Published in Dawn, December 29th, 2022
",read full story,sport
2,‘India seriously considering bid for 2036 Games’,"NEW DELHI: India is  “seriously” considering a bid to host the 2036 Olympic Games, sports minister Anurag Thakur...","NEW DELHI: India is  “seriously” considering a bid to host the 2036 Olympic Games, sports minister Anurag Thakur said.
The world’s second-most populous nation has previously hosted the Asian Games and the Commonwealth Games, and Thakur told the Times of India newspaper it was the  “right time” to host the Olympics.
“If India is making news in every sector, from manufacturing to services, then why not in the field of sports? India is looking very seriously at bidding for the 2036 Olympics,” Thakur added.
The International Olympic Committee (IOC) has said it was in preliminary discussions with 10 cities but has not revealed a timeframe for when it plans to award the 2036 edition.
Paris, Los Angeles and Brisbane host the next three Games.
Among potential rivals for the Games are Indonesia and South Korea, as well as Qatar, which hosted this year’s FIFA World Cup. 
Thakur said his government would consult the Indian Olympic Association (IOA) and prepare a roadmap ahead of the IOC session in Mumbai next year.
“The IOC session is a prestigious event for India and whatever steps have to be taken to bid along with the IOA, the government will support them. It has to be a joint preparation,” he said.
Published in Dawn, December 29th, 2022
",read full story,sport
3,Domingo quits as Bangladesh head coach,DHAKA: Bangladesh coach Russell Domingo has quit just days after the side’s disappointing Test series defeat at...,"DHAKA: Bangladesh coach Russell Domingo has quit just days after the side’s disappointing Test series defeat at home to India with a year left on his contract, the country’s cricket board announced on Wednesday. 
Domingo, 48, had already been partially sidelined earlier this year when he was stripped of his role overseeing the T20 side right before the Asia Cup. 
The South African’s departure will leave Bangladesh scrambling to find a replacement before they host England in February. The South African informed the Bangladesh Cricket Board (BCB) about his resignation on Tuesday. 
All other coaching staff members, including pace bowling coach and fellow South African Allan Donald, will remain in their roles despite Domingo’s resignation. 
Domingo became the head coach in September 2019 after the BCB sacked Steve Rhodes and had a contract with the board until the 2023 50-over World Cup. 
Under him, Bangladesh won Twenty20 series against Australia and New Zealand at home, earned a historic Test win in New Zealand, an ODI series victory in South Africa and at home against India. 
Bangladesh won the ODI series against India 2-1 but lost both Tests, despite an impressive showing by their bowlers in the final match. 
England will play three ODIs and three T20 matches during their tour which concludes on March 14 in Dhaka.
Published in Dawn, December 29th, 2022
",read full story,sport
4,Carey century puts Australia in box seat in second South Africa Test,MELBOURNE: A maiden century by wicket-keeper Alex Carey pushed Australia closer to a series-sealing victory in the...,"MELBOURNE: A maiden century by wicket-keeper Alex Carey pushed Australia closer to a series-sealing victory in the second Test as South Africa’s batsmen were left with a mountain to climb at the end of a rain-hit day three on Wednesday. 
With Carey scoring 111 and all-rounder Cameron Green contributing an unbeaten 51 with a broken finger, the hosts piled on the runs before declaring at 575-8 under gathering clouds at the Melbourne Cricket Ground with an ominous lead of 386 after South Africa were bowled out in their first innings for 189. 
In reply, the Proteas were 15-1, still needing 371 runs to make Australia bat again, when play was stopped seven overs after tea and later abandoned due to persistent drizzle. 
Their bid to save the Test, and the three-match series after losing the opener in Brisbane, got off to a horror start with under-pressure skipper Dean Elgar caught by Carey off home skipper Pat Cummins without scoring in the second over. 
Opener Sarel Erwee was seven not out and number three Theunis de Bruyn was on six, the latter having been dropped by David Warner in the slips off Cummins. 
With drizzle falling and the ball skidding on a damp pitch, Erwee and De Bruyn headed off gratefully when play was halted. 
But Australia will be confident of taking the remaining wickets and avoid batting again. 
Following Warner’s double-century on day two and Green’s five-wicket haul on day one, Cummins’s team dominated for a third successive day, with South Australian Carey leading from the front. 
He had good support from Green, who bravely soaked up 177 balls despite nursing a broken finger that saw him retire on day two. 
The pair built a 117-run partnership as South Africa’s bowlers failed to build on a positive start after taking four wickets in the morning. 
“It was nice to be able to consolidate on our start from yesterday,” said Carey, who became only the second wicket-keeper to make a Test century at the MCG after Rod Marsh. 
“This one’s really special, obviously it’s a big moment. But it’s also great to help the Australian cricket team be in a strong position. That’s what we play for, to win games. To see [Green] put on a brave face, bat beautifully ... it allowed us to put on a really good partnership.” 
Carey pulled Marco Jansen for three to bring up his century but was later caught and bowled by the all-rounder after sending a top-edge high above the pitch. 
It could have been a better day for South Africa had their bowlers kept up the pressure after grabbing four early wickets. 
Australia began on 386-3 with Travis Head on 48 and Carey on nine after a herculean unbeaten double century from Warner in his 100th Test in gruelling heat on day two. 
The veteran opener retired exhausted with severe cramp after making his third Test double ton, but he returned to the crease when Anrich Nortje bowled Head for 51. He told host broadcaster Fox before play began that he had a “rough night’s sleep”. 
“I probably woke up six or seven times,” he added, and was bowled first ball by Nortje’s sizzling yorker. 
Cummins survived the hat-trick ball but was caught behind for four off the bowling of paceman Kagiso Rabada. 
“In general it has been a tough three days for us as a bowling unit,” admitted Proteas bowling coach Charl Langeveldt. “Kagi [Rabada] wasn’t on song and a few of the other guys in periods didn’t bowl well as a unit. It’s important for us to get the consistency going, but it hasn’t been there for us in this game. We have to take it hour by hour tomorrow and just try and get runs and see where it goes from there.” 
South Africa had taken three wickets for five runs, leaving Australia 400 for six, but the rally stalled as plucky tail-ender Nathan Lyon (25) combined with Carey in a quickfire 40-run partnership. 
Though Green batted superbly with his injury, the big all-rounder will not bowl for the rest of the Test and has been ruled out for the third and final match in Sydney. 
Fast bowler Mitchell Starc was also nursing a sore finger on his bowling hand but showed ample pace and swing in his few overs before the rain. 
Carey was confident Australia had enough in their attack to take care of business in Melbourne. 
“The way that [Starc] is bowling, I don’t have too many concerns for this match,” he said. “Pencil Gaz [Lyon] in for a heap of overs .... I feel like we’ve got enough bowling.”—Agencies
Scoreboard
SOUTH AFRICA (1st Innings) 189 (M. Jansen 59, K. Verreynne 52; C. Green 5-27, M. Starc 2-39)
AUSTRALIA (1st Innings, overnight 386-3):
D. Warner b Nortje  200
U. Khawaja c Verreynne b Rabada 1
M. Labuschagne run out  14
S. Smith c De Bruyn b Nortje    85
T. Head b Nortje    51
C. Green not out    51
A. Carey c & b Jansen   111
P. Cummins c Verreynne b Rabada 4
N. Lyon c Zondo b Ngidi 25
M. Starc not out    10
EXTRAS (B-5, LB-12, NB-5, W-1)  23
TOTAL (for eight wickets decl, 145 overs)   575
FALL OF WICKETS: 1-21 (Khawaja), 2-75 (Labuschagne), 3-314 (Smith), 3-363 (Green - retired hurt), 4-395 (Head), 5-395 (Warner), 6-400 (Cummins), 7-440 (Lyon), 8-557 (Carey)
DID NOT BAT: S. Boland
BOWLING: Rabada 28-1-144-2, Ngidi 22.1-2-98-1, Jansen 28-1-89-1, Nortje 25-1-92-3, Maharaj 41.5-3-135-0
SOUTH AFRICA (2nd Innings):
D. Elgar c Carey b Cummins  0
S. Erwee not out    7
T. De Bruyn not out 6
EXTRAS (LB-2)   2
TOTAL (for one wicket, seven overs) 15
FALL OF WICKETS: 1-0 (Elgar)
STILL TO BAT: T. Bavuma, K. Zondo, K. Verreynne, M. Jansen, K. Maharaj, K. Rabada, A. Nortje, L. Ngidi
BOWLING: Starc 4-1-13-0, Cummins 3-3-0-1.
Published in Dawn, December 29th, 2022
",read full story,sport
5,"India promote Pandya, drop Pant for Sri Lanka series",Out-of-form wicketkeeper-batsman Rishabh Pant has been dropped from both white-ball squads.,"NEW DELHI: All-rounder Hardik Pandya will lead India’s T20 side at home against Sri Lanka next week after selectors left several heavyweights out of the side.
Selectors have been under pressure to make wholesale changes to India’s white-ball squads after the side’s disappointing T20 World Cup semi-final defeat to England in November.
Sri Lanka’s tour begins with the first of three 20-over matches in Mumbai on January 3 before a three-match ODI series from January 10-15, with Pandya reprising his role as T20 captain for a second straight series, after leading India to victory over New Zealand in November.
Out-of-form wicketkeeper-batsman Rishabh Pant has been dropped from both white-ball squads.
Ageing superstars Virat Kohli, 34, and Rohit Sharma, 35, were not included for the three-match T20 series but both return for the ODI portion of the tour.
Sharma returns as 50-over captain after a thumb injury that forced him to sit out most of this month’s Bangladesh tour.
Pandya, who captained the Gujarat Titans to the Indian Premier League title this year in their debut season, will also serve as vice-captain for the ODI series.
Veteran ODI opener Shikhar Dhawan, 37, who led the team for a three-match series against hosts New Zealand in December, was also dropped from the squad for up-and-coming rookies Shubman Gill and Ishan Kishan after scoring just 18 runs across three matches in Bangladesh.
Sri Lanka have announced a 20-man squad for the tour with all-rounder and Asia Cup-winning skipper Dasun Shanaka leading the visitors in both formats.
India Squads:
Twenty20 Internationals: Hardik Pandya (captain), Ishan Kishan (wk), Ruturaj Gaikwad, Shubman Gill, Suryakumar Yadav, Deepak Hooda, Rahul Tripathi, Sanju Samson, Washington Sundar, Yuzvendra Chahal, Axar Patel, Arshdeep Singh, Harshal Patel, Umran Malik, Shivam Mavi, Mukesh Kumar.
One-day Internationals: Rohit Sharma (captain), Shubman Gill, Virat Kohli, Suryakumar Yadav, Shreyas Iyer, KL Rahul (wk), Ishan Kishan (wk), Hardik Pandya, Washington Sundar, Yuzvendra Chahal, Kuldeep Yadav, Axar Patel, Mohammed Shami, Mohammed Siraj, Umran Malik, Arshdeep Singh.
Sri Lanka squad: Dasun Shanaka (captain), Pathum Nissanka, Avishka Fernando, Sadeera Samarawickrama, Kusal Mendis, Bhanuka Rajapaksa, Charith Asalanka, Dhananjaya de Silva, Wanindu Hasaranga, Ashen Bandara, Maheesh Theekshana, Jeffrey Vandersay, Chamika Karunaratne, Dilshan Madushanka, Kasun Rajitha, Nuwanidu Fernando, Dunith Wellalage, Pramod Madushan, Lahiru Kumara, Nuwan Thushara.
Published in Dawn, December 29th, 2022
",read full story,sport
6,Muzammil advances in ranking tennis,ISLAMABAD: Muzam­mil Murtaza made it to the quarter-finals of the National Ranking Tennis Tournament after beating...,"ISLAMABAD: Muzam­mil Murtaza made it to the quarter-finals of the National Ranking Tennis Tournament after beating Nael Qureshi 7-6 (5), 7-6 (3) here at the SDA-PTF Complex on Wednesday.
Meanwhile, nearly all other seeded players, including Aqeel Khan and Mohammad Shoaib moved into the last-eight.
Results
Men’s singles (second round): Yousaf Khalil bt Israr Gul 6-3, 6-3; Barkatullah bt Abdullah Adnan 6-2, 6-4; Heera Ashiq bt Faizan Fayyaz 6-1, 6-2; Mohammad Shoaib bt Saqib Hayat 6-1, 6-2; M. Abid bt M. Talha Khan 6-3, 6-2; Muzammil Murtaza bt Ahmed Nael Qureshi 7-6 (5), 7-6 (3); Mudassir Murtaza bt Shahzad Khan 4-6, 6-0, 6-0; Aqeel Khan bt Sami Zeb Khan 6-4, 6-0.
Boys’ U-18 (first round): Asad Zaman bt Saifullah Khan 6-3, 6-2; Sami Zeb Khan bt Inam Qadir 6-1, 4-0; Hamza Roman bt Ali Zain 6-4, 6-4; Bilal Asim bt Mustansir Ali Khan 6-0, 6-0; M. Hamza Asim bt Hasan Ali 6-1, 6-2.
Boys U-14 (second round): M. Haziq Asim bt Abdur Rehman 4-1, 4-2; Abubakar Talha bt Hassan Usmani 4-0, 4-1; Sameer Zaman bt Abdul Razak 4-1, 4-2; Hamza Husain bt Sohan Noor 4-2, 4-1; Amir Mazari bt Saqib Ali 4-1, 4-2; Abdul Basit bt Taimur Ansari 2-4, 4-2, 5-4 (6); Nabeel Ali Qayum bt Zyed Zaman 4-0, 4-1; Ali Zain bt Abdullah Khan 4-0, 4-5 (7)
Published in Dawn, December 29th, 2022
",read full story,sport
7,"Sajjad, Shahid triumph in national snooker",Punjab qualifier Rana Irfan pulled off the biggest upset of the day when he toppled former world champion Ahsan Ramzan 4-2.,"KARACHI: Veteran Mohammad Sajjad started his title defence on a winning note as former champion Shahid Aftab compiled a splendid break of 140 on the opening day of the NBP 47th National Snooker Championship at the NBP Sports Complex on Wednesday.
With four national titles under his belt, Sargodha-based top seed Sajjad sent former national champion Mohammad Bilal packing 72-44, 56-50, 97-4, 62-34 in his Group ‘A’ opener.
However, Punjab qualifier Rana Irfan pulled off the biggest upset of the day when he toppled second seed and former world champion Ahsan Ramzan 4-2 with the score reading 63-39, 121-0, 39-83, 56-20, 39-78, 58-17 including a century break of 103 in the second frame.
Third seed Babar Masih and fourth seed Haris Tahir were stretched to their limits before overcoming their respective opponents. Babar who was 1-3 down fought back to whip M. Jawed Ansari 41-51, 80-43, 0-81, 32-98, 98-13, 71-35, 106-8 while Haris trounced Zaib Khan 109-8, 30-64, 40-63, 62-52, 98-47, 33-70, 68-15.
The day witnessed three century breaks with fifth seed Shahid hogging limelight cracking the highest break in the third frame registering 79-14, 81-8, 140-0, 58-26 triumph against Fawad Khan. He was unlucky in piling up 147 as he missed the black ball.
The other century break, of 101, came from Abdul Javed who accounted for Farukh Usman 4-1 (101-0, 30-68, 102-31, 67-9, 57-4).
Results:
Babar Masih bt M. Jawed Ansari 4-3 (41-51, 80-43, 0-81, 32-98, 98-13, 71-35, 106-8); Akash Rafiq bt Mohammad Naseem Akhtar 4-2 (14-75, 68-33, 64-57, 16-71, 69-19, 94-2); Haris Tahir bt Zaib Khan 4-3 (109-8, 30-64, 40-63, 62-52, 98-47, 33-70, 68-15); Waseem Abbas bt Abdul Sattar 4-1 (47-37, 56-18, 59-32, 1-75, 57-42); Mohammad Sajjad bt Mohammad Bilal 4-0 (72-44, 56-50, 97-4, 62-34); Shah Namat bt Jhanzaib Jahangir 4-0 (102-9, 103-13, 86-40, 78-31); Rana Irfan bt Ahsan Ramzan 4-2 (63-39, 121-0, 39-83, 56-20, 39-78, 58-17); Ali Hamza bt Sirbuland Khan 4-1 (75-34, 48-65, 59-56, 87-48, 59-46); Shahid Aftab bt Fawad Khan 4-0 (79-14, 81-8, 140-0, 58-26); Abdul Javed bt Farukh Usman 4-1 (101-0, 30-68, 102-31, 67-9, 57-4); Zulfiqar A. Qadir bt M. Iftikhar 4-3 (72-45, 4-70, 36-60, 0-75, 112-6, 65-26, 61-18).
Published in Dawn, December 29th, 2022
",read full story,sport
8,"United cruise past Forest, Chelsea back to winning ways",MANCHESTER: Manchester United cruised past Nottingham Forest 3-0 as the Reds made a positive start to life without...,"MANCHESTER: Manchester United cruised past Nottingham Forest 3-0 as the Reds made a positive start to life without Cristiano Ronaldo while Chelsea returned to winning ways as they scored early to ensure a 2-0  triumph over Bournemouth at Stamford Bridge on Tuesday in their first  Premier League victory since mid-October.   
United’s Marcus Rashford and Anthony Martial stepped out from the Ronaldo’s shadow to score in their dominant victory but manager Erik ten Hag is still targeting a striker to replace the Portuguese in the transfer market to make the Red Devils more clinical in the final third.Rashford has been a player transformed under Ten Hag and carried his fine form for England at the World Cup into the Premier League’s return.
“Our players performed really well in the World Cup, I was happy to see that and now they continue,” Ten Hag told Amazon Prime.  “They have to stay on that level, keep going and progress from game to game.”
A brilliantly worked corner opened the floodgates for United as Christian Eriksen picked out an unmarked Rashford inside the area to sweep into the top corner while  Martial converted Rashford’s pass to add another quickfire goal. 
Forest were without their first choice goalkeeper Dean Henderson as he is on loan from United and his understudy Wayne Hennessey was culpable when the home side doubled their lead just three minutes later.
United were also short handed at the back with Lisandro Martinez absent following Argentina’s World Cup celebrations, Diogo Dalot injured and Harry Maguire still feeling the aftereffects of an illness.
As a result Raphael Varane was forced into starting just nine days after playing 113 minutes for France in the World Cup final, while Luke Shaw lined up as a centre-back in a back four for the first time.
The home side should have added more than one goal in the second half, leading Ten Hag to repeat his call for a new striker.
United appear to have already missed out on one target with Cody Gakpo set to join rivals Liverpool from PSV Eindhoven.
“We are looking for a striker because games are coming every three days,” added Ten Hag.  “It’s tough and we want to play in all the leagues. Hopefully we can keep going till the end of the season, so we need numbers in the squad.”United finally got the third goal they deserved three minutes from time. The imperious Casemiro strode forward to win possession and picked out his Brazilian compatriot Fred to slot into the far corner.
Victory takes United to within one point of the top four and with a game in hand to come on fourth-placed Tottenham.
Forest remain rooted in the relegation zone, but just one point adrift of safety.
Meanwhile, Kai Havertz and Mason Mount both netted in the first half of a  dominant performance but the hosts will feel they could have won by a  bigger margin given the possession they enjoyed and chances they  created.
Chelsea ended a run of five league matches without a victory and moved up one place in the league standings to eighth.
Bournemouth have now lost four of their past five league games and remain in 14th place on 16 points.
Havertz  had Chelsea ahead after 16 minutes at the end of a swift move through  the middle, started by Jorginho, helped on by Mount and then with Raheem  Sterling delivering a perfect cross to the back post for the German to  stretch into the net.
The quick movement of the ball was  characteristic of the home side’s approach as they overwhelmed  Bournemouth in all departments.
Chelsea extended their lead in the  23rd minute at the end of another storming forward drive, with several  players involved before Havertz laid it back for Mount to hit a  right-footed curler into the net from outside the penalty area.
Chelsea,  with seven players from the World Cup in their starting line-up, had  Reece James back after the knee injury that made him miss out on the  tournament in Qatar and the England right back wasted no time in  reminding of his qualities.
But he had to go off early in the second half, visibly upset as he looked to suffer fresh knee trouble.
Bournemouth,  whose manager Gary ONeil was marking his first league match in charge  since being handed the job on a permanent basis, took almost an hour  before testing Kepa Arrizabalaga with substitute Jaidon Anthony’s shot  easily saved by the Chelsea goalkeeper.
The Spaniard made a much more vital stop in the 78th minute to deny midfielder Ryan Christie.
Bournemouth did finish lively, looking dangerous in the final 10 minutes  and might have got a consolation goal as former Chelsea player Dominic  Solanke missed with a close range header in stoppage time.
Published in Dawn, December 29th, 2022
",read full story,sport
