,Header,Summary,Detail,Link,Category
9,Japan coach Moriyasu staying on post World Cup,TOKYO: Japan coach Hajime Moriyasu will stay in his job after leading the Samurai Blue to the last-16 at the World...,"TOKYO: Japan coach Hajime Moriyasu will stay in his job after leading the Samurai Blue to the last-16 at the World Cup in Qatar, the Japan Football Association said Wednesday.
There had been speculation about his future after a rollercoaster performance by Japan, who again failed to reach the quarter-finals but produced stunning wins against Germany and Spain.
“This is really the happiest job”, Moriyasu said of his reappointment.
“It’s a job that gives me a chance to compete on a global stage with the pride of being Japanese. That’s why I decided to accept the offer”, he said.
It was the fourth time Japan had exited at the first knock-out stage and denied them a much-coveted quarter-final debut in their seventh straight World Cup appearance.
Moriyasu becomes the first Japan coach to stay on after a World Cup.
The 54-year-old’s new contract will run  “until the next World Cup”, said Japan Football Association head Kozo Tajima, who lauded Moriyasu for  “elevating the international status of Japan’s football”.
After the heartbreak of their exit in Qatar, Moriyasu insisted Japan are on the right path.
“We weren’t able to overcome this hurdle of losing in the last 16 and you might say that we didn’t achieve anything new,” he said.
“But the players have shown us something that we haven’t seen before by beating former champions like Germany and Spain.”
Published in Dawn, December 29th, 2022
",read full story,sport
10,"Anas, Mehwish claim titles",ISLAMABAD: Punjab’s Anas Ali Shah claimed the boys’ U-19 title after beating Abdullah Nawaz of Pakistan Air ...,"

Players in action during the PSF National Squash Championship at the Mushaf Squash Complex on Wednesday.—APP

 
ISLAMABAD: Punjab’s Anas Ali Shah claimed the boys’ U-19 title after beating Abdullah Nawaz of Pakistan Air Force  11-4, 4-11, 11-4, 11-8 while Mehwish Ali of Sindh outwitted Pakistan Army’s Amna Malik 11-6, 11-3, 11-2 to lift the girls U-19 trophy of the PSF National Squash Championship here at the Mushaf Squash Complex on Wednesday.
Abdullah Nadeem from Punjab  emerged victorious in the boys’ U-17 final  after a gruelling battle as he defeated Azan Ali from Pak Army 11-8,  10-12, 4-11,  11-3, 11-7 in 37 minutes.
Meanwhile, Nouman Khan representing PAF clai­med the  U-15 crown as he edged past Ahmed Rayyan  Khalil, also from PAF, 11-8, 12-10,  11-7 in a match that  lasted for 23 minutes In the boys U-11 final Faizan Ali from Pak Army defeated Malik Muhammad from KP 11-6, 11-8, 11-5 in 16 minutes while boys U-13  final was won by     Huzaifa Shahid from Sindh who downed Shahzeb from PAF 9-11, 11-9, 11-7, 11-7.
In the girls U-15 final, Mahnoor Ali from Sindh got a walk over victory against province-mate Sehrish Ali who could not play due to  high fever.
Published in Dawn, December 29th, 2022
",read full story,sport
11,Kyrgios’ late United Cup withdrawal surprises Australia team-mates,SYDNEY: Nick Kyrgios’s late withdrawal from the inaugural edition of the United Cup took his own team mates by...,"

SYDNEY: Spain’s Rafael Nadal in action during a practice session at the Tennis Centre on Wednesday, ahead of the United Cup.—AFP

 
SYDNEY: Nick Kyrgios’s late withdrawal from the inaugural edition of the United Cup took his own team mates by surprise on Wednesday as they were left in the dark until minutes before their pre-tournament news conference.
Kyrgios, who is ranked 22nd in the world and reached this year’s Wimbledon final, was set to lead Australia in the joint ATP and WTA event, which is being held in Sydney, Brisbane and Perth and offers ranking points and $15 million in prize-money.
Organisers said the 27-year-old, who was due to face Britain’s Cameron Norrie in his first singles match on Thursday in Group ‘D’, withdrew due to injury.
“We literally just found out 10 minutes ago. Obviously it’s news to all of us and we just move forward now,” co-captain Sam Stosur told reporters.
Kyrgios, who opted out of Australia’s Davis Cup team this year, later posted a video on Instagram where he was seen out in the sunshine at a harbour with the caption ‘Beautiful day’.
Alex de Minaur, who will now move into the number one men’s position for Team Australia, wanted to avoid discussing Kyrgios and focus on the upcoming event.
“I think it would be great if we just talk about this great team,” he said.  “We are all here, we are all happy to be here, we are about to play an exciting new event, something new for all of us — the United Cup.”  Australia will also play Rafa Nadal’s Spain in Group ‘D’.
Speaking before Kyrgios pulled out of the United Cup, Nadal said the Australian could easily go all the way.
“I know he doesn’t like a lot to play Roland Garros, that’s the only  tournament that looks like he doesn’t like to play that much,” said  Nadal in Sydney.
“The rest of the tournaments, he played final in  Wimbledon, in New York he was close with the quarter-finals I think,  with a very positive chance.“He can win in any tournament that  he’s playing. He has all the talent, the weapons to win against any  player. Of course he can.” 
The tournament, which runs from Dec 29-Jan 8, features 18 countries split into six groups of three, with teams playing two men’s and two women’s singles matches and a mixed doubles match.
Published in Dawn, December 29th, 2022
",read full story,sport
12,Andoo Comanche returns to victory in Sydney-Hobart yacht race,"SYDNEY: Andoo Coma­nche beat LawConnect in the Rolex Sydney Hobart Yacht Race on Wednesday, a return to victory...","SYDNEY: Andoo Coma­nche beat LawConnect in the Rolex Sydney Hobart Yacht Race on Wednesday, a return to victory after a race which narrowed down to two 100-footers in the final stretch. 
Andoo Comanche crossed the Derwent River finish line about 1 a.m. local time (1400 GMT), taking one day, 11 hours, 56 minutes and 48 seconds to complete the 628-nautical mile bluewater classic, according to the Cruising Yacht Club of Australia. 
The win was the fourth for the supermaxi yacht, after wins in 2015, 2017 and 2019 under different ownership and the name Comanche. It was the second year in a row that LawConnect placed second. 
“It feels pretty unbelievable at the moment, it’s still sinking in,” Andoo Comanche skipper John Winning Jr told reporters in Hobart, Tasmania. 
“It was less than an hour ago we were sort of still thinking, are we about to have a shutdown, what’s gonna happen, it didn’t feel real until the last minute and then now it’s just starting to settle in,” added Winning, greeted at the finish line by his father, who competed in the race in the 1970s. 
Andoo Comanche set the pace down Australia’s east coast from the start but LawConnect put up a strong challenge, according to race commentators, and crossed the finish line just 24 minutes behind the winner. 
Black Jack, the winner of the 2021 race, came in third, followed by Wild Oats, which fell behind after tearing one of its sails earlier in the race. The 109-strong racing fleet set off from a sun-splashed Sydney Harbour on Monday afternoon, charting their way through the 628-nautical mile course (1163km) towards the finish line in Hobart. 
The Bass Strait, which separates Tasmania from the mainland, can unleash perilous conditions. Race officials on Tuesday evening said only three of the starting fleet had been forced to retire so far. 
One of them, 40-foot yacht Yeah Baby, withdrew less than four hours into the race after reportedly colliding with a massive sunfish. 
Dozens of smaller yachts were still in the water on Wednesday morning, competing for the handicap prize, which compensates for boat size.
Published in Dawn, December 29th, 2022
",read full story,sport
13,Missed chances cost Pakistan as Williamson ton sees New Zealand gain lead,"“Since days one and two, the pitch is probably at its best,” says New Zealand opener Tom Latham.","KARACHI: Pakistan were let down by missed opportunities and New Zealand ensured they took advantage. The hosts’ wicket-keeper Sarfraz Ahmed was in the midst of it all as he erred not once, but twice in attempts to stump Kane Williamson out.
The veteran batter went on to score his first hundred in two years as New Zealand overcame Pakistan’s mammoth first-innings total of 438 with ease on the third day of the opening Test here at the National Stadium on Wednesday.
Pakistan did strike in the closing minutes to expose New Zealand’s tail and the Tim Southee-led side will look to add on to a tiny two-run lead with four wickets in hand on the penultimate day. But with the playing surface deteriorating fast, it wouldn’t be too easy for the visitors.
“Since days one and two, the pitch is probably at its best,” New Zealand opener Tom Latham said during the post-day press conference. 
“It is starting to take little bit more turn and especially out of footmarks. So it’s not going to get any easier to bat on, and from the position we are in, we will try to get as many runs as possible to put Pakistan under pressure.”
Williamson, who was conservative in his approach after Pakistan had struck in the first session to dismiss opener Devon Conway, took 47 balls to score his first boundary. On the next ball, he was ruled out lbw off leg-spinner Mohammad Abrar before challenging the field umpire’s decision to get it reversed.
The right-hander got his first reprieve at 15, when he missed a flick and the ball beat Sarfraz behind the stumps with Williamson well out of the crease. 
Sarfraz missed out again, this time on an easier chance, with Williamson on 21, as the wicket-keeper failed to dislodge the stumps after the former New Zealand skipper lost his balance in an attempt to play a drive off Nauman Ali.
Now more comfortable on the crease, Williamson danced down the track to smash one over the left-arm spinner’s head to get his second boundary. He then took on both Abrar and Nauman for five more boundaries to reach his 34th Test fifty.
Pakistan had an economic few overs before tea, but Williamson continued his onslaught on the hosts’ spinners after the break and soon reached his 25th hundred — his first ton since January 2021.
The 32-year-old was ably supported by a 47-ball 42 by Daryl Mitchell after New Zealand had lost Latham — after the left-hander had scored a hundred and Henry Nicholls, who played on Nauman onto his stumps to get dismissed at 22.
Mitchell started off with a four and six in the first six deliveries that he faced and dispatched Pakistan pacer Mohammad Wasim for four consecutive boundaries four overs later before a reverse sweep off Abrar ended his innings and his quickfire 65-run fourth-wicket partnership with Williamson.
It was then Tom Blundell’s turn to fortify New Zealand’s position. The wicket-keeper batter demonstrated balance between attack and defense and used his feet with precision to score boundaries. 
By the time he ended his stay on the crease, he had faced 116 balls for his 47, an innings that was studded with three fours and a six. With Williamson, he added 90 runs to New Zealand’s total before Wasim trapped him lbw.
After Blundell’s departure, Pakistan got their sixth and last wicket of the day when tailender Michael Bracewell was caught after getting a leading edge off Abrar.
“I think they were chances but one of the deliveries was on the leg side and Sarfraz did his best,” Nauman said of the missed chances.
“This pitch is on the slow side so our effort will be to get the last four wickets early on day four and then set a good target of close to 200 — which will be good on this pitch.”
Williamson wasn’t the only New Zealand batter to benefit from Pakistan’s errors. Conway, too, could have been out on Tuesday had Pakistan taken a review when the left-hander was ruled not out by the field umpire despite getting caught behind off spinner Nauman. He managed 92.
Conway’s partner Latham, on the other hand, added 18 to his overnight tally to reach what was nearly a flawless hundred. Both openers, however, couldn’t extend their stays on the crease for long after reaching their hundreds.
Their 183-run partnership was broken when Conway was trapped leg-before by Nauman with a delivery that spun sharply to thump into the batters pads. Conway’s dismissal had to be confirmed through a DRS review.
Latham, who had showed sound technique throughout his innings, brought his knock to an end with a miscued reverse sweep off Abrar to get caught in the slips at 113.
Both openers were dismissed before lunch with Sarfraz designated as the Pakistan captain in the absence of Babar Azam, who was off the field due to flu along with Shan Masood and Salman Ali Agha. The skipper, however, returned on the field later in the day.
Scoreboard
PAKISTAN (1st Innings) 438 (Babar Azam 161, Agha Salman 103; T. Southee 3-69) 
NEW ZEALAND (1st Innings, overnight 165-0): 
T. Latham c sub (Kamran) b Abrar    113 
D. Conway lbw b Nauman  92 
K. Williamson not out   105 
H. Nicholls b Nauman    22 
D. Mitchell c Sarfraz b Abrar   42 
T. Blundell lbw b Wasim 47 
M. Bracewell c Wasim b Abrar    5 
I. Sodhi not out    1 
EXTRAS (B-6, LB-6, NB-1)    13 
TOTAL (for six wickets, 136 overs)  440 
STILL TO BAT: T. Southee, N. Wagner, A. Patel 
FALL OF WICKETS: 1-183 (Conway), 2-231 (Latham), 3-272 (Nicholls), 4-337 (Mitchell), 5-427 (Blundell), 6-436 (Bracewell) 
BOWLING: Hamza 20-3-56-0, Wasim 24-3-81-1, Abrar 45-4-143-3, Nauman 44-2-137-2 (1nb), Babar 3-0-11-0.
Published in Dawn, December 29th, 2022
",read full story,sport
