,Header,Summary,Detail
0,"Conte, Tuchel see red as Kane snatches Spurs draw at Chelsea",Both managers sent off after full-time whistle for second physical altercation of the match.,"LONDON: Harry Kane snatched a 96th minute equaliser to salvage a 2-2 draw for Tottenham from a feisty London derby against Chelsea on Sunday.
Both managers Antonio Conte and Thomas Tuchel were sent-off after the full-time whistle for their second physical altercation of the match.
Chelsea looked set to get a new era at Stamford Bridge off to the best possible start as they twice led through Kalidou Koulibaly and Reece James.
Tottenham were well off the level required if they are to live up to hopes of challenging Manchester City and Liverpool for the title, but showed the newfound character instilled by Conte to fight back for a point.
The Italian and Tuchel were both booked in the aftermath of Pierre-Emile Hojbjerg’s first equaliser.
Tempers then flared again during a handshake after Kane nodded in with virtually the last action of the game.
Tottenham have still only won once at Stamford Bridge in 32 years in the league, but Conte will be delighted to escape with a share of the spoils against his former club.
New Chelsea chairman Todd Boehly was welcomed by a huge banner from the Chelsea support and saw an early return on the near 170 million ($206 million) investment in the transfer market since he sanctioned a 2.5 billion takeover to buy the club from Roman Abramovich.
Despite the drastic changes in the boardroom, on the field it was like the old times under Abramovich as Chelsea outthought, outplayed and outmuscled Spurs for the first 45 minutes.
Two of Chelsea’s new signings combined for the opening goal as it was from Marc Cucurella’s corner that Koulibaly found space to volley home.
Conte again resisted the temptation to start any of his six new signings, but it was not until the introduction of Richarlison just before the hour mark and a switch of formation that Tottenham began to threaten.
Kane had a glorious chance to level when he uncharacteristically dragged wide with only Edouard Mendy to beat.
Spurs did level 22 minutes from time in controversial fashion to light the spark between the two managers.


BRENTFORD’S Bryan Mbeumo (C) scores past Manchester United goalkeeper David de Gea during their match at the Brentford Community Stadium.—AFP

 
Kai Havertz looked to be clearly fouled by Rodrigo Bentancur before Tottenham broke forward and the ball eventually fell to Hojbjerg to fire low and hard past Mendy.
Tuchel reacted furiously to the decision and Conte’s overzealous celebration.
The German fought fire with fire as he sprinted down the touchline to celebrate when James thrashed home Raheem Sterling’s pass to restore Chelsea’s lead 13 minutes from time.
However, Kane had the final say as he flicked in Ivan Perisic’s corner deep into added time.
Earlier, Nottingham Forest celebrated their first home game in the Premier League for 23 years by beating West Ham United 1-0.
The two-time European champions have made 14 new signings in a bid to maintain their top-flight status and two of those making their home debuts were the stars as Taiwo Awoniyi scored the only goal and Dean Henderson saved Declan Rice’s penalty.
Forest had fortune on their side as the Hammers also had a first-half goal controversially ruled out and hit the underside of the crossbar twice after the break through Pablo Fornals and Said Benrahma.
But that mattered little to a jubilant 30,000 crowd at the City Ground, who revelled in their first three points back in the big time.
BRENTFORD HUMILIATE UNITED
A shambolic Manchester United side conceded four goals in the opening  35 minutes in a 4-0 drubbing at Brentford on Saturday as their woeful  start to the Premier League season continued.
United’s seventh  successive away league defeat was assured long before the interval as  Brentford took ruthless advantage of a catalogue of errors by the  visitors.
The rout began in the 10th minute when United keeper David de Gea allowed a weak shot by Josh Dasilva to slip past him.
Things  got worse for United eight minutes later when De Gea played the ball  out to former Brentford player Christian Eriksen who was caught in  possession and Mathias Jensen slotted home.
When United’s defence  failed to deal with a corner and Ben Mee glanced in a close-range header  to make it 3-0 the Brentford fans were ecstatic while United’s new  manager Erik ten Hag looked ashen-faced in his technical area.
Brentford’s  fourth was a gem as Ivan Toney delivered a diagonal ball to Bryan  Mbeumo from a counter-attack and Mbeumo calmly beat De Gea.
Ten  Hag made three substitutions at halftime with Raphael Varane, Tyrell  Malacia and Scott McTominay coming on but despite a slight improvement  United offered little fight.
Brentford’s fans serenaded their  players with  “Hey Jude” at the final whistle while United’s players  looked crestfallen as they trudged off rock bottom of the table having  also lost their opener at home to Brighton & Hove Albion.
It was the first time since 1960 that United  have conceded at least six goals in their first two matches of a  top-flight season and the first time they have lost their opening two  matches since 1992 when they went on to win the title. 
This side, however, looks woefully  inadequate to mount any kind of challenge and Ten Hag, who was taunted  by the Brentford fans, appears to have a huge job on his hands. 
The Dutchman is the first Manchester United manager to lose his first two games in charge since John Chapman in 1921. 
“It’s easy to dismantle this United side, just be organised and fight and you’re there,” said former United player and Sky Sports pundit Gary Neville said. 
For Brentford, whose starting line-up cost in the region of 55 million compared to the more than 400 million of United’s, have picked up four points in their first two games. 
United has Cristiano Ronaldo back in their starting line-up but the Portuguese forward barely got a look in. 
The confidence drained out of United from the moment De Gea allowed Dasilva’s shot to end up in the back of the net. 
Eriksen, who got a mixed reception from Brentford’s fans, then inadvertently gifted his former club their second as United looked shell shocked by the energy of their hosts who went on to record their biggest top-flight victory since 1938. 
Published in Dawn, August 15th, 2022
"
1,Netherlands announce squad for Pakistan ODIs,Uncapped all-rounder Arnav Jain and Lahore-born Musa Ahmed have also been named in the squad.,"AMSTERDAM: Veteran wicket-keeper/batter Wesley Barresi returned to the Netherlands One-day International side after three years as the Dutch Cricket Association announced their 15-member squad for three-match series against Pakistan on Sunday.
Barresi, 38, who made his debut in 2010, played his last game in 2019. He has scored 927 runs in 32 ODIs for the Netherlands and has featured for the national side in 42 T20s. 
Uncapped all-rounder Arnav Jain and Lahore-born Musa Ahmed have also been named in the squad as seven Dutch players skipped national duty to play in The Hundred and Royal London Cup in England.  
Fred Klaassen, Colin Ackermann, Roelof van der Merwe, and Timm van der  Gugten are all currently participating in The Hundred, while Paul van  Meekeren, Shane Snater and Brandon Glover are participating in the Royal London Cup — England’s domestic one-day competition. 
The three ODIs — part of the ICC World Cup Super League — will be played on Tuesday, Thursday and Sunday at the VOC ground in Rotterdam. 
Squad: Scott Edwards (captain/wicket-keeper), Musa Ahmad, Shariz Ahmad, Wesley Barresi, Logan van Beek, Tom Cooper, Aryan Dutt, Arnav Jain, Viv Kingma, Ryan Klein, Bas de Leede, Teja Nidamanuru, Tim Pringle, Max O’Dowd, Vikram Singh.
Published in Dawn, August 15th, 2022
"
2,Babar Azam to be awarded Sitara-e-Imtiaz,Azam will become the youngest Pakistani to receive the award; women’s team skipper Bismah Maroof to receive Tamgha-e-Pakistan.,"ISLAMABAD: Pakistan captain Babar Azam was named among the recipients of the Sitara-e-Imtiaz — the country’s third-highest civilian honour — on the occasion of its 75th Independence Day on Sunday.
The batter, at 27, will become the youngest Pakistani to be conferred upon the award while national women’s team skipper Bismah Maroof will receive the Tamgha-e-Pakistan.
Babar stands top of the International Cricket Council’s One-day International and T20 batting rankings and is placed third in the Test charts.
Hailing from Lahore, Babar boasts an ODI average of 59.2 and averaged more than 45 in Tests and T20s.
Bismah, a veteran of 118 ODIs and 117 T20s, on the other hand, has inspired a generation of aspiring women cricketers continuing to play cricket and lead Pakistan after becoming a mother.
The left-handed batter, also from Lahore, has amassed more than 5000 runs across both formats. 
As many as 253 Pakistani citizens are set to receive civilian awards this year, the President’s office announced Sunday.
Published in Dawn, August 15th, 2022
"
3,South Africa’s Olivier out of England series,LONDON: South Africa suffered a setback just days before their Test series against England when fast bowler Duanne...,"LONDON: South Africa suffered a setback just days before their Test series against England when fast bowler Duanne Olivier was ruled out of the entire campaign with a hip injury.
The 30-year-old sustained the injury during this week’s four-day tour match against the second-string England Lions in Canterbury and Olivier, a veteran of 15 Tests, is now returning home.
“Duanne presented with significant discomfort involving his right hip flexor muscle at the close of play on day three of the four-day tour match,” said Proteas team doctor Hashendra Ramjee in a Cricket South Africa statement issued Sunday.
“After clinical assessment, he was referred for an MRI scan which revealed a grade two tear involving the right pectineus muscle.
“Due to the extent of the injury, he has been ruled out of the three-match Test series against England and will return home where he will commence his rehabilitation with the Gauteng Central Lions medical team.” South Africa have not named a replacement for Olivier, with fellow quicks Kagiso Rabada, Lungi Ngidi and Anrich Nortje already in their squad.
The first Test at Lord’s is scheduled to start on Wednesday.
Published in Dawn, August 15th, 2022
"
4,"Henry out of WI tour, Sears in line for ODI debut",WELLINGTON: New Zealand fast bowler Matt Henry was ruled out of the One-day International series in West Indies with...,"WELLINGTON: New Zealand fast bowler Matt Henry was ruled out of the One-day International series in West Indies with a rib injury on Sunday paving the way for Ben Sears’s potential ODI debut in the three-match series.
Henry first experienced the pain in his left side during training last week and coach Gary Stead said they replaced the player to ensure he did not aggravate the injury.
“It’s a shame for Matt to have to return home at this point of the tour,” Stead said.
“Although the injury is not overly serious — we felt there was a significant risk it would become worse through playing.
“With the upcoming ODI series starting on Wednesday and consisting of three games over five days, we saw it as prudent to bring in a fully-fit replacement.”  Sears, who has played six Twenty20 Internationals, will join the squad in Jamaica on Sunday before flying out to Bridgetown which hosts the first ODI.
“Ben comes fresh from a successful tour with the Blackcaps in Europe and while he is yet to play ODI cricket — we believe hes ready if called upon,” Stead said.
“At 24-years-old he’s an exciting young prospect and we like the pace and skills he possesses.”
Published in Dawn, August 15th, 2022
"
5,Hat-trick hero King banishes Birmingham agony in Manchester,MANCHESTER: Australia’s Alana King claimed the first hat-trick in the history of women’s competition at The...,"MANCHESTER: Australia’s Alana King claimed the first hat-trick in the history of women’s competition at The Hundred on Saturday, a fortnight after the feat narrowly eluded her in the Commonwealth Games in Birmingham.
The leg-spinner claimed 4-15 to fire Trent Rockets to a 43-run victory against Manchester Originals who, chasing 120 for victory, were bundled out for 76.
King dismissed Cordelia Griffith, Sophie Ecclestone and Kate Cross in successive deliveries to claim a hat-trick at Old Trafford.
The 26-year-old paid tribute to her idol and deceased Australia spin great Shane Warne after her stellar debut in the 100-ball competition.
“I hope he’s looking down and pretty proud that I’ve spun a few today, it’s just a special place Old Trafford and I’m glad I could take some poles here,” said King.
She was part of the Australia team who won the gold medal when women’s Twenty20 made its debut at the Commonwealth Games in Birmingham.
In the July 31 match again Barbados, King dismissed Shakera Selman and Shamilia Connell in successive deliveries but was denied a hat-trick when captain Meg Lanning dropped Keila Elliott at slip in the next one.
“I’ll have nightmares,” Lanning said after that match.  “I wanted to dig a hole and jump in it as quick as I could.”
Published in Dawn, August 15th, 2022
"
6,Nadal puts fitness atop his Cincinnati priority list,"""Number one is nice but staying healthy is the most important thing,"" he says.","CINCINNATI: Rafael Nadal is keeping expectations in check while focusing on fitness as he prepares for the Cincinnati Masters.
The world number three, who handed in an abdominal muscle injury walkover in his Wimbledon semi-final with Nick Kyrgios, takes the second seeding behind Daniil Medvedev in the American Midwest at the joint ATP and WTA tournament.
With Novak Djokovic missing due to his refusal to get a Covid-19 vaccination, the 36-year-old Spaniard has one less dangerous opponent to deal with at the US Open tuneup.
Nadal could return to the top ranking spot for the first time since January 2020, which would mean a top seeding at the US Open starting on August 29.
That could come to pass if he wins the Cincinnati title and Medvedev fails to reach the quarter-finals.
But for Nadal, it’s all about keeping healthy, letting the results fall where they may. 
“Number one is nice but staying healthy is the most important thing,” Nadal said on Sunday. 
“I don’t have a goal of returning to number one. 
“If that happens because I play very well, then it would mean a lot to have that opportunity.” 
The 2013 Cincinnati champion said that his goal will be to “stay healthy and finish the season playing where I want to play”.  
“I won’t play more than what I think will work for my body.” 
The Spaniard said that with a baby on the way, his playing schedule might have to be moderated.
“I’m happy to be in this position — if for some reason I return to number one, I’d be very happy.” 
Nadal, who has put in a brutal training schedule since arriving in Cincinnati at mid-week, said that still feels pain on serve from his injury.
But he said that obstacles are part of any comeback. 
“You cannot expect to play at an amazing level immediately. You have to be humble and use the tools that you have to win the first match,” Nadal said. 
“Once you win a few, things change. I’m not always having some good feelings on court. You need to accept that things will be difficult at first.”
Published in Dawn, August 15th, 2022
"
7,New-look Barca frustrated by Rayo in season opener,MADRID: Barcelona were held 0-0 by Rayo Vallecano in their opening game of the La Liga season and had captain Sergio...,"MADRID: Barcelona were held 0-0 by Rayo Vallecano in their opening game of the La Liga season and had captain Sergio Busquets sent off late on.
The Catalans had 21 shots on goal and almost 70 per cent of possession at the Camp Nou but were unable to break the deadlock.
Barca boss Xavi started close-season signings including defender Andreas Christensen, winger Raphinha and striker Robert Lewandowski, who were only able to feature after being registered with the league late on Friday.
The five-time Champions League winners had to comply with La Liga’s strict financial controls before being able to confirm the likes of ex-Bayern Munich attacker Lewandowski in their squad ahead of the new campaign.“We tried as much as we could but we lacked aim and effectiveness. Maybe  the pressure and expectation got a little under our skin,” Barca coach Xavi Hernandez told  DAZN. 
“It will be a process, Rayo knew how to defend deep and hold on to their strategy with an outstanding discipline.   “We have to be patient and keep working. Better days will come.” The hosts dominated the opening half an hour as Lewandowski was denied a goal on his competitive debut.
The Poland forward was judged to be offside from an Ousmane Dembele pass before his delicate chipped finish was cancelled out.
As rain fell at the Camp Nou in temperatures of 26 degrees Celsius, Pedri came close to breaking the deadlock with 10 minutes of the half to play but his curling effort flew past the post.
Despite their first half control Marc Andre ter Stegen ensured the sides stayed level at the break with a fine save to stop Rayo’s Alvaro Garcia during injury time.
Barca continued their onslaught on the Rayo defence but were unable to beat goalkeeper Stole Dimitrievski, who was involved in two heavy collisions on his line within the first 10 minutes of the second half.
With half an hour to play Xavi brought on Frenkie de Jong for Gavi despite the Netherlands midfielder being linked with a move away from Catalunya to lighten club debt, which forced Lionel Messi to leave 12 months ago.
Xavi’s Rayo counterpart Andoni Iraola also made changes in the final 30 minutes including giving experienced Colombia striker Radamel Falcao his competitive debut.
With nine minutes left De Jong combined with Lewandowski but the 33-year-old’s shot skimmed the upright.
Seven minutes later another Barca summer signing was denied a goal as midfielder Franck Kessie was offside before beating Dimitrievski.
Xavi’s side ended the game with 10 men as club skipper Busquets was red-carded for an elbow on Falcao in the fourth of eight injury time minutes.
Less than 60 seconds later, Falcao thought he had scored the winner, and claimed Rayo’s third straight win over the Catalans, but was found to be offside and the visitors held on for the point.
Earlier, 21-year-old winger Alex Baena scored twice on just his eighth La Liga appearance as Villarreal beat Real Valladolid 3-0.
Forward Joselu claimed a point for Espanyol at Celta Viga with a 97th minute winner with a 2-2 draw after the Galicians’ veteran striker Iago Aspas scored his side’s opening goal of a season for a third straight campaign.
Published in Dawn, August 15th, 2022
"
8,"Champions Milan off to winning start, Dumfries steals show for Inter",MILAN: AC Milan got off to a winning start in their Italian title defence with a hard-fought 4-2 win over Udinese on...,"MILAN: AC Milan got off to a winning start in their Italian title defence with a hard-fought 4-2 win over Udinese on Saturday as Denzel Dumfries’ stoppage-time strike earned Inter Milan a late win at Lecce.
Champions Milan bounced back from going behind with less than two minutes on the clock to claim the three points thanks to two goals from Ante Rebic, a Theo Hernando penalty and a strike from Brahim Diaz.
The margin of defeat was harsh on Udinese who acquitted themselves well in front of a raucous home crowd at the San Siro.
However three points and four goals were the perfect way for Milan to kick-off what is likely to be a tight title tussle in Italy, with no clear favourite ahead of the start of the campaign.
“What didn’t we like? Surely the fact that we conceded a goal in such a short time, we have to start games better,” Milan coach Stefano Pioli told broadcaster DAZN. 
Fans at a packed San Siro roared  “we are the champions” as the team came out on a balmy summer’s evening in Milan, but they were soon stunned into silence when Rodrigo Becao met Gerard Deulofeu’s corner with a header which squeezed past Mike Maignan.
Milan responded and were ahead with less than a quarter of a hour gone after a long VAR check on a clash between Davide Calabria and Udinese’s Brandon Soppy led to Hernandez smashing in his 12th-minute spot-kick. Rebic swept home the hosts’ second three minutes later.
A hugely entertaining first half ended with the Milan fans again wondering what was going on thanks to Adam Masina, whose diving header in the fourth minute of added time levelled the scores in spectacular fashion.
Masina then calmed the home side’s nerves when he handed Diaz a tap-in to put Milan back ahead, unwittingly nodding Hernandez’s cross into the Spaniard’s path.
Diaz was at the heart of things again in the 68th minute, pressuring Roberto Pereyra in the Udinese area before nicking the ball and rolling back a low pass which Rebic stretched to push in the fourth which sealed the win.
Dumfries stole the headlines on Romelu Lukaku’s return to Serie A with a 94th-minute strike just as Inter looked to have dropped points at newly-promoted Lecce.
Lukaku nodded home from close range with just 81 seconds gone to give Inter the lead at the Stadio Via del Mare, an ominous sign for Lecce as he had netted against the southern side on his Italian top flight debut in 2019, a 4-0 thumping for Inter at the San Siro.
However Marco Baroni’s side, pushed on by passionate home support, refused to be cowed by their more illustrious opponents and drew level less than two minutes after half-time through Assan Ceesay, who slipped in a precision finish after being neatly put through by Federico Di Francesco.
Kristijan Bistrovic and Lameck Banda both stung Samir Handanovic’s fingers in the Inter goal but the away side had chances to win as they pressed in the latter stages.
Dumfries headed off the post and Lukaku was denied by flying goalkeeper Wladimiro Falcone just before the Netherlands wingback bundled in the winner which was harsh on the spirited hosts.
Silvio Berlusconi’s Monza were given a reality check in their first ever Serie A match, beaten at home 2-1 by Torino.
Aleksei Miranchuk opened the scoring two minutes from the break on his Torino debut, expertly finishing off Antonio Sanabria’s through ball following a quick passing move.
Sanabria doubled the away side’s lead with an acrobatic scissor kick midway through the second half, much to the disappointment of Berlusconi who was in the stands at the Stadio Brianteo.
Atalanta won Saturday’s other early match, 2-0 at Sampdoria through goals from Rafael Toloi and Ademola Lookman.
Published in Dawn, August 15th, 2022
"
