,Header,Summary,Detail
9,"Neymar scores brace, Mbappe on target in PSG victory",PARIS: Neymar continued his outstanding start to the season with a brace while Kylian Mbappe marked his return to ...,"PARIS: Neymar continued his outstanding start to the season with a brace while Kylian Mbappe marked his return to the team with a goal but also had a penalty saved as Paris St-Germain trounced Montpellier 5-2 in Ligue 1 on Saturday.
Neymar rolled in a spot-kick to put PSG 2-0 up at the break on a hot night at the Parc des Princes after Falaye Sacko’s own goal had put them ahead.
The Brazilian then headed in his second and PSG’s third shortly after the interval, taking his tally for the season to five goals already after just three games.
Wahbi Khazri pulled one back for Montpellier before Mbappe made it 4-1 and new signing Renato Sanches came off the bench to get the fifth late on.
Enzo Tchato notched another consolation for the visitors at the death but PSG have now recorded three wins out of three this season under new coach Christophe Galtier, scoring 14 goals in the process.
Neymar has picked up where he left off last season, when he scored nine in PSG’s final nine Ligue 1 matches.
So often plagued by fitness issues since arriving in Paris in 2017, he finally looks in rude health.
In contrast, Mbappe was playing his first competitive game since announcing on the final night of last season that he had agreed a new three-year deal to stay at PSG, turning down a move to Real Madrid in the process.
The France superstar missed his club’s first two games of the new campaign — a 4-0 defeat of Nantes in the season-opening Champions Trophy, and then the 5-0 win at Clermont — due first to suspension and then injury.
“Physically, we knew his lack of game time in pre-season would cost him,” Galtier told broadcaster Canal Plus when asked about Mbappe’s performance and attitude, with the 23-year-old appearing frustrated at times on the night.
“He is a competitor, he wants to be good, and he wants to be good quickly.” Mbappe, whose last match was against Gamba Osaka in Japan almost three weeks ago, had a penalty saved midway through the first half by Montpellier goalkeeper Jonas Omlin after the VAR spotted a handball in the area.
However, it was his shot that was diverted in by Sacko for an own goal to break the deadlock, and Mbappe later got his goal following a Neymar corner in the second half, but Galtier admitted the striker was not yet on peak form.
“A top-level footballer can’t just switch himself on or off. He needs time to be back to 100 per cent of his athletic ability and when he gets there he will make even more of a difference,” Galtier admitted.
“He likes to get forward and score goals and it is really quite normal that he should be, not disappointed, but a bit short of full fitness compared to his team-mates.” Meanwhile Neymar thought he had a hat-trick late on when he finished from a Lionel Messi pass, only for the celebrations to be cut short when the VAR spotted an offside in the build-up.
Earlier in Ligue 1, Monaco bounced back from their midweek Champions League elimination to draw 1-1 with Rennes.
Knocked out in the third qualifying round of Europe’s elite club competition by PSV Eindhoven, Monaco had Youssouf Fofana sent off inside 15 minutes at the Stade Louis II.
Axel Disasi then had a penalty saved for the hosts, and Gaetan Laborde put Rennes ahead before the hour mark.
However, Swiss forward Breel Embolo pounced on an error by Rennes substitute goalkeeper Dogan Alemdar to ensure a share of the spoils.
Published in Dawn, August 15th, 2022
"
10,‘Emotional’ Werner scores for Leipzig on Bundesliga return,BERLIN: Former Chelsea striker Timo Werner found the back of the net on an emotional return to Leipzig but  his...,"BERLIN: Former Chelsea striker Timo Werner found the back of the net on an emotional return to Leipzig but  his 10-man team twice gave away the lead to settle for a 2-2 draw  against visitors Cologne and they remain without a win after two  matchdays. 
Leipzig’s midfielder Dominik Szoboszlai received a straight red card for an elbow to the throat of Cologne’s Florian Kainz just before half time.
Werner left Leipzig for London in 2020 before returning earlier this week in a 25 million ($30.2 million) deal.
Leipzig’s record goal-scorer put his side ahead in the 36th minute, when goalkeeper Marvin Schwaebe let Werner’s long-distance strike dip under his body and trickle across the line.
Cologne equalised just four minutes later however, when striker Florian Dietz dinked in from close range to chalk up his first ever Bundesliga goal. French forward Christopher Nkunku gave the home side the lead in the 56th minute, but Cologne were able to equalise with 20 minutes to go through a clumsy own goal from Leipzig’s Josko Gvardiol.
After the game, Werner — who was subbed off to warm applause in the 68th minute — said he was  “very emotional” to return.
“It was something special for me, to return after two years.”  “Leipzig is always a part of me. I grew up here and I got my first Germany call up here”. In Saturday’s late game, Schalke secured a last-minute 2-2 draw with Borussia Moencheng­ladbach when Marius Buelter converted a penalty in injury time.
Schalke opened the scoring in the 29th minute thanks to a stunning solo goal from Rodrigo Zalazar, who dribbled the ball from halfway before scoring via a long-range strike from the edge of the penalty box.
Jonas Hofmann — fresh off a midweek contract extension — skidded the ball over the line in the 27th minute, before France’s Marcus Thuram put Gladbach in front just six minutes later. Gladbach winger Patrick Herrmann was adjudged to have handballed in the penalty area in injury time, giving Buelter the chance to convert from the spot.
Schalke striker Simon Terodde summed up his side’s emotional full-time celebrations.
“The people here — they’ve missed us,” he said.
“It’s beautiful that we could give them a point in the 93rd minute.”
Werder Bremen snatched a late point at home against Stuttgart through a 95th minute goal from Scottish winger Oliver Burke.
Bremen’s two-pronged attack of Niclas Fuel­l­krug and Marvin Ducksch again combined, putting the home side in the fourth minute.
Stuttgart equalised in the 38th minute through Wataru Endo and took the lead with just over ten to play through Silas Katompa Mvumpa, before Burke won a point for Bremen late.
Augsburg won 2-1 away at Bayer Leverkusen thanks to an 82nd minute goal from Andre Hahn, deepening the winless Leverkusen’s woes after their early German Cup exit.
In the German capital, Hertha Berlin drew 1-1 with Eintracht Frankfurt. Frankfurt had a late penalty overturned on VAR and Hertha held on to pick up their first point of the season.
In Sinsheim, Hoffenheim came from 2-0 down to win 3-2 against an impressive Bochum, thanks to goals from former Liverpool defender Ozan Kabak, Christoph Baumgartner and an 88th minute header from Munas Dabbur.
Published in Dawn, August 15th, 2022
"
11,Hurkacz topples Ruud to set Montreal final against Carreno Busta,MONTREAL: Hubert Hurkacz shrugged off a slow start to upset fourth seed Casper Ruud on Saturday and book a title...,"MONTREAL: Hubert Hurkacz shrugged off a slow start to upset fourth seed Casper Ruud on Saturday and book a title clash with Pablo Carreno Busta at the ATP Montreal Masters.
Poland’s Eighth-seeded Hurkacz needed two hours to claim a 5-7, 6-3, 6-2 victory over his Norwegian opponent, who had dropped just one set all week.
But his workload was minor compared to that of unseeded Spaniard Carreno Busta, who needed three hours to hold off Briton Daniel Evans 7-5, 6-7 (7/9), 6-2.
Carreno Busta had a match point in the second set tiebreaker but couldn’t close out victory for another 50 minutes, finally sprinting away as he won the last dozen points of the match.
Evans sent over his sixth double-fault of a long evening to surrender the contest.
Carreno Busta reached his first Masters final, where he’ll be vying to become the first unseeded Canadian champion since Argentina’s Guillermo Canas in 2002.
Against Ruud, Hurkacz finished with 47 winners - including 18 aces - and 19 unforced errors, advancing on his second match point.Ruud and Hurkacz traded early breaks, but the Norwegian gained the edge in the first set, winning it on another break of serve.
He then inflicted further punishment by breaking Hurkacz to love in the opening game of the second as he tried to set a tone for the remainder of the match.
But Hurkacz struck back with an immediate break and carried on to level the match at a set apiece.
Hurkacz got away quickly in the deciding set, grabbing a 4-1 lead with two quick breaks of serve before closing out the comeback triumph.
He avenged a loss to Ruud in the fourth round at Roland Garros two months ago.
Hurkacz has won his first five ATP finals and is keen to carry on with his string of victories.
HALEP TO FACE HADDAD MAIA 
Simona Halep dug deep to beat Jessica Pegula 2-6 6-3 6-4 to punch her ticket to Sunday’s Canadian Open  final where she will face Beatriz Haddad Maia after the Brazilian  toppled Karolina Pliskova for her latest win over a marquee player. 
Two-time tournament champion Halep got off to a sluggish start and  the American took full advantage, wrapping up the 35-minute first set  with an ace. 
But a loose service game by Pegula early in the second set, capped  by a unforced backhand error, gave the Romanian former world number one a  3-1 lead as frustration began to mount in her less experienced  opponent. 
In the third set, Halep broke at love for a 3-2 lead and hung on to  claim her 37th victory of the year despite producing 10 double faults  and putting fewer than 60 per cent of her first serves into play.
In the other semi-final, Haddad Maia broke the big-serving Czech to open the match and produced two excellent first serves to capture the first set. 
Pliskova responded with more aggressive play in the second set,  which resulted in a 5-2 lead but Haddad Maia weathered the storm and  battled back to force a tiebreak. 
In the breaker, Pliskova saved one match point but failed to  convert her set point opportunity and double faulted to end the  hard-fought affair. 
The unseeded Haddad Maia has defeated local favorite Leylah  Fernandez, world number one Iga Swiatek and Tokyo Olympics gold medalist  Belinda Bencic en route to her first WTA 1000 event final. 
Haddad Maia beat Halep in the semifinals of the Birmingham Classic  earlier this year, a tournament she went on to win for her lone WTA  title.
Published in Dawn, August 15th, 2022
"
