,Header,Summary,Detail
0,Imran fires ‘warning shots’ at police and judiciary,Threatens action against sessions judge who granted Gill’s remand.,"• Threatens action against sessions judge who granted Gill’s remand
• Announces plans to begin nationwide protest drive from today
• In response to remarks, Pemra bans live broadcast of PTI chief’s speeches
ISLAMABAD: After threatening to file cases against the police, bureaucracy, the Election Com­m­ission of Pakistan and political opp­o­nents over the treatment allegedly meted out to his chief of staff, Pakistan Tehreek-i-Insaf (PTI) Chairman Imran Khan on Saturday warned the judiciary against its “biased” attitude towards his party, saying that it should brace itself for the consequences.
Despite the imposition of Section 144 of CrPC and Section 16 of the MPO  in the federal capital, a large number of residents came out to attend  the rally led by Mr Khan. The procession started from Zero Point and  reached F-9 Park where the party leadership and their ally, former  minister Sheikh Rashid, also addressed the participants.
Addressing a party rally in the capital’s F-9 park to express solidarity with embattled leader Dr Shahbaz Gill, Mr Khan called out Additional District and Sessions Judge Zeba Chaudhry, who had  approved Mr Gill’s two-day physical remand at the request of the  capital police, and said she should prepare herself as action would be  taken against her.

          View this post on Instagram            A post shared by Churail Sarwat (@sarwatg)

 
He also pointed out that there was no action against Jamiat Ulema-i-Islam-Fazl chief Maulana Fazlur Rehman and Defence Minister Khwaja Asif, who he claimed had also made statements against the armed forces. He said if a case could be registered against Gill, the PTI would file cases against “everyone”, including former prime minister Nawaz Sharif and Interior Minister Rana Sanaullah.
Mr Khan again called on the “neutrals” (a euphemism he uses for the military establishment) to stand with the nation rather than the “gang of thieves”, in reference to the ruling coalition. He said he wanted to ask the neutrals if they were “really neutral”. He also alleged that the Islamabad police was taking orders for action against his party leaders from ‘someone’.
“When I asked the police to ‘tell me what did you do to Shahbaz Gill’, they said ‘we did nothing, we got a boot from behind to follow orders’,” he said while announcing to move the Supreme Court against the alleged torture on Gill.
Moreover, he alleged that when the PTI-backed government in Punjab started taking action against police officials involved in torturing party workers on May 25 during their long march, the authorities got scared as they started receiving calls asking them not to touch the law enforcers.
On the other hand, the PTI chief said, Gill was caught and tortured to send a message and frighten people that if he could be broken mentally then anyone could be. About his decision to hold the rally on a 24-hour notice, Khan said it was because Gill was being treated inhumanely and restrictions were imposed on the service of ARY News.
He further claimed ARY had been suspended to send a message to other channels that they could face the same consequences.
At the end, the former premier announced that he would present a roadmap to the public in the party’s rally at Rawalpindi’s Liaquat Bagh on Sunday (today), adding he planned to take to the streets across the country from today. “I’m going to take the nation along and tell them, including children and women, that Pakistan cannot become the country it was meant to be as envisioned by Allama Iqbal and Quaid-i-Azam Muhammad Ali Jinnah until we break the shackles of slavery,” he concluded the rally.
After Mr Khan’s speech, the electronic media regulator slapped a ban on all satellite TV channels from carrying the PTI chief’s speeches live. The Pakistan Electronic Media Regulatory Authority (Pemra) communiqué – issued late at night – held that channels had failed to implement a time-delay mechanism which could curtail such occurrences.
In a four-page document that included a specific reference to Mr Khan’s speech on Saturday night, where he had targeted police and judicial officers, the regulator said that only recorded speeches could be telecast, and those too would only be allowed if a time-delay mechanism was in place. 
Although the order was not posted on Pemra’s official Twitter account at the time of going to print, a senior government functionary confirmed its authenticity.
In a separate statement, PML-N, PPP, MQM Pakistan and JUI-F called on the judiciary to take legal action against Imran and his aides for threatening a female judge and intimidating police officers, APP reported.
Published in Dawn, August 21st, 2022
"
1,PM orders inquiry into traders’ fixed tax issue,Suspends fixed sales tax collection through electricity bills; tells ministers to take traders on board before making decisions.,"• Suspends fixed sales tax collection through electricity bills
• Directs ministers to take traders on board before making any decision
• Ordinance may be issued in the next few days to change collection mechanism, says official
LAHORE: Prime Minister Shehbaz Sharif has ordered an inquiry into how a fixed sales tax imposed on traders doubled at the imposition stage and suspended the tax collection through electricity bills.
Presiding over a meeting on the issue in Lahore on Saturday, the premier also ordered that a new mechanism be devised to collect the sales tax and directed the ministers concerned to take the trading community on board in this regard.
The meeting was attended by Finance Minister Miftah Ismail, Energy Minister Khu­r­ram Dastgir, Minister of State for Petroleum Musadik Malik, the Federal Board of Revenue (FBR) chairman, relevant federal secretaries and other senior officials.
In the budget, the government decided to collect a fixed tax from retailers through electricity bills. The tax rate was decided to be Rs3,000 on a monthly bill of up to Rs30,000; Rs5,000 on a bill ranging from Rs30,000 to Rs50,000; and Rs10,000 on a bill above Rs50,000. These tax rates were to be doubled for retailers not on the Active Taxpayers’ List. 
However, under pressure from protests by several trade bodies, the government announced rolling back the fixed tax scheme and reverting to the old system.
Sources said the government might soon issue an ordinance reviving an old mechanism effective since 2014 under which sales tax was collected at the rate of 5pc on a monthly bill of up to Rs20,000 and at 7.5pc on a bill above Rs20,000.
However, a finance ministry official said that since the new rate was imposed in the finance bill, the government would need an ordinance to change the collection mechanism, something that could happen “in the next few days”.
The official said the collection of the fixed tax would remain suspended in the meantime.
During the meeting, the premier also directed the participants to consult traders’ representatives before taking any decision on collecting tax from shopkeepers through utility bills.
According to FBR data, trading and wholesale make up roughly 19pc of GDP but chip in a minuscule Rs6bn in taxes to the national exchequer. Out of about 2.3 million traders and shopkeepers in the country, hardly 5,000 file tax returns.
Published in Dawn, August 21st, 2022
"
2,12 more dead as Balochistan reels from rains,"Army chief asks Lt Gen Asif Ghafoor, who heads the Southern Command, to assist provincial govt in rescue and relief work.","QUETTA: The largest province remained disconnected from the country on Saturday as 12 more people lost their lives as a result of devastation caused by torrential rains and flash floods, officials told Dawn.
In view of the worsening situation, Army Chief Gen Qamar Javed Bajwa ordered Lt Gen Asif Ghafoor, who heads the Southern Command, to assist the provincial government in rescue and relief operations. 
The deaths were reported from Jaffarabad, Barkhan and Khuzdar districts.
A family of five in Goth Mir Khan Sobdrani in Gandakha area of Jaffarabad was killed instantly as the roof of their mud house caved in, official sources confirmed.
In another incident, three of a family were killed in Dera Bugti district when their house’s roof collapsed.
Separately, three people were killed in Jaffarabad’s Usta Muhammad area, while one death was reported in Khuzdar.
Meanwhile, heavy rains continued in Chaman, Kohlu, Nasirabad, Jaffar­abad, Jhal Magsi, Musa­khail, Noshki, Khuzdar, Lasbela districts.
In Sohbatpur district, a large number of mud houses collapsed as floodwater submerged dozens of villages.
A new torrent of flash floods also hit the already devastated Noshki where several residential areas including Mall, Butto and Kaishangi came under water, piling on the miseries of flood victims.
According to reports, a pick-up vehicle was washed away in the Kaishangi area and search was underway for the passengers.
Several passengers were stuck between Dalbandin, Noshki and Kharan after the heavy rains followed by flash floods hit the areas.
The province was still almost completely cut off from the rest of the country, after traffic on all highways, other than the Quetta-Sukkur Highway, was suspended. 
The province’s rail link was also suspended for many days due to damage to railway tracks at several points.
The Quetta-Lasbela-Karachi Highway has been closed for several days after a bridge at Uthal was washed away, while the traffic on Quetta-Zhob and Quetta-Lorali highways connecting Balochistan with Punjab and Khyber Pakhtunkhwa was also suspended for the last two days.
The railway track at Notal and Dera Murad Jamali was inundated in flood water, suspending service between Balochistan and the rest of the country.
According to the Provincial Disaster Management Authority (PDMA), traffic was resumed between Bela and Awaran after a damaged bridge was repaired. The Gwadar-Ratodero M-8 Motorway was still cut off near Khuzdar. The repair work could not be initiated as the road was still submerged. 
The Khuzdar-Basima Sector of N-30 National Highway was cut off near Kodak due to overflow of seasonal nullahs, while Zhob-Dera Ismail Khan N-50 National highway was cut off at Danasar. 
COAS directs to mobilise resources for relief activity
According to Inter-Services Public Relations (ISPR), General Qamar Javed Bajwa asked Commander Southern Command Lt Gen Asif Ghafoor to assist the provincial government in rescue and relief operations, .
The COAS also directed Lt-Gen Ghafoor to utilise the army’s resources to help the affected population and restore critical communication infrastructure.
“Pakistan Army stands with flood affected population in this difficult testing time and shall undertake this assistance effort as national obligation,” ISPR quoted the COAS as saying.
Also on Saturday, National Disaster Management Authority (NDMA) Chairman Lt Gen Akhtar Nawaz dispatched relief goods to flood-hit areas of Sindh. Speaking at the occasion, he admitted that that Balochistan was the worst hit region
Ali Raza Rind in Chagai and Ali Jan Mangi in Dera Murad Jamali also contributed to this report
Published in Dawn, August 21st, 2022
"
3,Imran’s papers for NA-118 by-election challenged,The appeal has been filed by a PML-N candidate from the constituency.,"LAHORE: An appeal has been filed with an appellate tribunal challenging the nomination papers of former prime minister Imran Khan for by-election in NA-118, Nankana Sahib.
Dr Shezra Mansab Kharal, a candidate of the Pakistan Muslim League-Nawaz from the constituency, filed the appeal, saying the returning officer ‘illegally’ accepted the nomination papers of Mr Khan.
She alleged Mr Khan did not disclose, in his nomination papers, the gifts he had received from Toshakhana. She said Mr Khan also failed to disclose the details of the assets owned by him and his wife. 
Also, the appellant said, the nomination papers filed by the PTI candidate were not attested by an oath commissioner as required by the law. She said all those shortcomings had been formally raised before the returning officer, but he chose to ignore the objections and accepted Mr Khan’s nomination papers.
She requested the tribunal to set aside the decision of the returning officer and reject the nomination papers of Mr Khan for the by-election from NA-118.
Multan, Faisalabad seats
Meanwhile, the provincial election commission took notice of transfers and postings of the government officials falling within the constituencies where by-elections were going to be held.
The by-election would be held in NA-157 of Multan and NA-108 of Faisalabad.
The district monitoring officer of Multan directed the government to cancel transfer orders of three sub-inspectors of the market committee. The secretary for higher education was also directed to cancel notifications relating to transfer and posting of principal of the Government Graduate College of Commerce, Multan.
The Faisalabad district monitoring officer also directed the health secretary to cancel notification about transfers and postings in different hospitals.
Published in Dawn, August 21st, 2022
"
4,Fawad proposes multi-party panel to probe ‘torture’ claims,"• Suggests Saad, Shireen and Khokhar identify, bring to book those involved in ‘heinous crime’ • Marriyum rubbishes allegations...","• Suggests Saad, Shireen and Khokhar identify, bring to book those involved in ‘heinous crime’
• Marriyum rubbishes allegations of maltreatment as ‘propaganda’, releases video showing a ‘healthy Shahbaz Gill’ in hospital
ISLAMABAD: Conde­m­ning the alleged torture of party leader Dr Shahbaz Gill while in police custody, Pakis­tan Tehreek-i-Insaf (PTI) Sen­ior Vice President Fawad Chaudhry on Saturday suggested that a three-member multi-party panel be formed to expose the individuals responsible and bring them to book.
Meanwhile, the government claims the PTI’s allegations of torture on Gill were mere “propaganda” to divert attention from real issues.
Speaking to the media here on Saturday, Mr Chaudhry stressed that the violence and torture allegedly inflicted on Gill was unacceptable and intolerable. The gravity of the situation, he said, could be gauged from the fact that all political parties were raising their voice against it. He suggested a three-member “ind­­e­pendent” panel consisting of PPP’s Mustafa Nawaz Kho­khar, PML-N federal minister Khwaja Saad Rafique and former PTI minister Dr Shi­r­een Mazari, be formed to probe into the torture on Gill.
He further said the panel should be tasked with identifying the individuals invol­ved in the heinous crime and bring them to book, adding that no one could question the integrity of a panel with members from all  major political parties.
Commenting on cases against PML-N leaders in Punjab, Mr Chaudhry said the provincial government dealt with the issue in a very civilised manner, but the PML-N leaders fled to Islamabad instead of facing the court like the PTI did.
He further remarked that the PML-N’s Azma Bukhari had made a sensational statement that their sole purpose was to extract a statement from Gill against PTI chairman Imran Khan. He added it was difficult to trust the Islamabad Police in the current circumstances.
Govt terms torture claims ‘mere propaganda’
Meanwhile, Information Minister Marri­yum Aurangzeb slammed PTI chief Imran Khan for generating ‘false propaganda’ over the alleged torture on his chief of staff.
Addressing a press conference, the minister said the PTI’s claims of torture under police custody were nothing but “propaganda” to deviate from real issues, which she said were a “defamatory social media campaign over the Lasbela martyrs after the foreign funding verdict followed by Gill’s comments against a state institution”.
Responding to a question, she also challenged Mr Khan to name the agencies that provided him reports about PML-N and PPP, to support his claims in this regard. She stated Gill had violated “red lines given in the Constitution on the basis of which a case was registered against him under the law” and he was taken into custody for investigation.
“We want to make it clear that nobody should be tortured, and in this case there is no use of violence over Shahbaz Gill. It is only propaganda that has been launched by the PTI,” the minister said. “When Shahbaz Gill faces a camera he starts acting.”
She also addressed a video being circulated on social media to claim it showed torture marks on Gill, saying the clip was of another incident in Chakwal where a child predator was tortured by locals. Disseminating such edited videos was a violation of cybercrime laws, Ms Aurangzeb said, adding the torture claims were being probed and Interior Minister Rana Sanaullah would soon hold a press conference to present all the evidences and facts to the public.
On Imran Khan’s claims Gill was subjected to sexual abuse as well, the minister said if that was the case, it would have come up in his medical reports, adding a preliminary torture report was being prepared by the Islamabad Police.
She then played a video, supposedly from Saturday noon and purportedly showing Gill at the Pakistan Institute of Medical Sciences along with Islamabad Police personnel, going through some documents while appearing healthy and standing on his feet.
“Is this the same person Imran Khan claims to have been subjected to severe torture?” Ms Aurangzeb asked, adding: “This video reflects Mr Gill’s real health condition.”
Fawad on ‘hospital’ video
A short while later, PTI leader Fawad Chaudhry, reacting to the video shown by the minister, said if it was genuine then it’s good news. He, however, questioned that if Gill was indeed this healthy then why the party chief, lawyers and media weren’t being allowed to meet him. “Police should allow Imran Khan, lawyers and the media to meet him,” he said in a tweet.
Published in Dawn, August 21st, 2022
"
5,PML-N leaders seek protective bail from IHC in Punjab Assembly violence case,"Tarar claims party members being targeted to ""avenge"" action against Gill.","ISLAMABAD: A day after police raids on their residences in connection with the violence witnessed in the Punjab Assembly during the chief minister’s election on April 16, at least 13 leaders of the Pakistan Muslim League-Nawaz (PML-N) on Saturday approached the Islamabad High Court (IHC) to seek protective bail.
The party leaders, who made the state and Lahore’s Qilla Gujjar Singh police station head respondents in their identical petitions, inc­luded Rana Mashood, Saiful Malook Khokhar, Adil Cha­ttha, Attaullah Tarar, Shuaib Marth, Malik Ghulam Habib, Sardar Awais, Mirza Javed, Pir Khizer Hayat, Raja Saghir, Abdul Rauf, Bilal Farooq, and Rana Manan.
According to the petitions, the FIR against them was registered on the complaint of Deputy Superintendent of Police Shahzad Manzoor. The petitioners termed the contents of the FIR “frivolous” and based on “mala fide” intentions.

Tarar claims party members being targeted to ‘avenge’ action against Gill

The petitioners said they have a right to approach the court of competent jurisdiction and added that their liberty was at stake as there was strong apprehension of their arrest while approaching the said court for relief. The pleas requested the IHC to grant the PML-N leaders protective bail to enable them to appear before the court concerned for bail. The IHC is expected to take up the petitions on Monday.
The FIR in the case alleged that there was a call for the chief minister’s election in the Punjab Assembly when “a few members of the Assembly attacked the deputy speaker” who was subsequently escorted to his chamber. Meanwhile, a few unknown individuals entered the guest gallery and assaulted the MPAs, it claimed.
APP adds: Speaking to reporters outside the high court, PML-N leader and Prime Minister’s Special Assistant on Narcotics Control Attaullah Tarar, whose house was raided a day earlier, lashed out at the Punjab government, especially Chief Minister Parvez Elahi, for its role in the raids. He alleged Mr Elahi was facilitating the “anti-state narrative” of former prime minister Imran Khan and called him a “remote controlled” chief minister.
Mr Tarar said the cases registered against the PML-N MPAs in connection with the Punjab Assembly violence were “baseless” as he went on to accuse the Punjab police of allegedly robbing the houses of the said MPAs during the “illegal raids”. Mr Tarar alleged that the PML-N supporters were being targetted to allegedly avenge the arrest of Shahbaz Gill, a close aide of Imran Khan who has been booked in a sedition case.
“Imran Khan through a remote control [CM] was using the Punjab government to target his political opponents,” he alleged and warned of payback. “Parvez Elahi sahib, you and your son [Moonis Elahi] will face the consequences of this new trend that you have set,” Mr Tarar said, alleging that Moonis Elahi was issuing orders to the government officials without any official authority.
He said instead of the PML-N MPAs, cases should be registered against individuals who manhandled the deputy speaker on April 16.
Published in Dawn, August 21st, 2022
"
