,Header,Summary,Detail
11,Man gets bail in Malakand honour killing case,PESHAWAR: The Peshawar High Court has granted bail to a man named in a Malakand honour killing case.,"PESHAWAR: The Peshawar High Court has granted bail to a man named in a Malakand honour killing case.
Justice Mohammad Ijaz Khan of a single-member bench accepted the bail petition of the accused, Noorullah alias Noore, a resident of Peshawar, on the condition of furnishing two surety bonds of Rs300,000 each.
The honour killing incident had occurred in the jurisdiction of the Pul Chowki police station in Malakand area on Oct 27, 2020.
Tasleem, a woman, who was injured in the firing, was the complainant in the case. She had initially charged her brother, Nawab, and two unidentified people with killing her husband, Hassan Wali, and injuring her. She also named petitioner Noorullah and another accused, Asfandyar, in the FIR.
The complainant claimed that she was a resident of Peshawar and was engaged to Shakir but married her cousin, Hassan Wali, of her own free will to the annoyance of her family members.
She alleged that on the day of the firing incident, her brother, Nawab, had visited her residence along with two unidentified people and said he wanted to see her husband.
The woman added that the three men later sat down with her husband in a room of the house before she heard gunshots and when she entered the room, she found her husband to be in a pool of blood.
She alleged that the accused also fired at her causing several injuries.
Lawyer Said Hakeem appeared for the petitioner and insisted that his client was falsely implicated in the murder case.
He contended that initially, his client was not named in the FIR but the complainant later charged him committing the murder without any legal justification.
The counsel said that even the identification parade conducted by the police was doubtful as the complainant had declared therein that her younger brother had told her that the petitioner was also involved in the murder of her husband.
He wondered why the petitioner would kill the complainant’s husband when he was not even related to them.
Published in Dawn, March 24th, 2022
"
12,Khudai Khidmatgar Faiz Kaka dies in Swabi,"SWABI: Faiz Mohammad Khan Kaka, a renowned Khudai Khidmatgar who ...","


 
SWABI: Faiz Mohammad Khan Kaka, a renowned Khudai Khidmatgar who had quit Awami National Party and joined Pashtun Tahaffuz Movement (PTM), passed away here on Wednesday. He was 88. 
Manzoor Pashteen, PTM president, visited his residence and offered fateha for the departed soul. He paid rich tribute to Kaka. 
Faiz Kaka, who hailed from Shewa village, was an established jirga figure who never hesitated to speak the truth. 
He was about 14-years old when Pakistan got independence and he would usually narrate the memories of the independence struggle. 
His father, Shad Mohammad Khan, was also a staunch Khudai Khidmatgar. 
During Ayub Khan’s regime when Khan Abdul Ghaffar Khan was arrested along with his supporters while protesting against One Unit plan Kaka was also among them. 
He was a brave person and had told Asfandyar Wali Khan and late Begum Naseem Wali Khan that they had diverted from the true philosophy of Bacha Khan, and later quit ANP as a protest. 
Liaquat Yousafzai, PTM’s district president, recalled that when they were arrested along with Kaka after the Swabi public meeting, Kaka was told by police to go home. However, he told the police that he could not leave unless his colleagues were freed. 
Faiz Kaka was laid to rest in his ancestral graveyard at Shewa village. His funeral was attended by PTM leaders, jirga members and activists of various political parties. 
JUI-F MEETING: Jamiat Ulema-i-Islam-Fazl provincial chief Senator Maulana Attaur Rehman said here on Wednesday that JUI-F would clean sweep the second phase of local government elections in Hazara, Malakand division and other districts likethe first phase. 
He expressed these views while addressing his party workers here. Congratulating the newcomers who joined the party, he said the caravans of DI Khan, Balochistan, Dera Ghazi Khan, Tank, Lakki Marwat, Karak, Bannu and Hangu would join other caravans of Khyber Pakhtunkhwa on March25. 
Afterwards, all the caravans will reach Islamabad in the evening under the leadership of JUI-F chief Maulana Fazlur Rehman.
Published in Dawn, March 24th, 2022
"
13,"Facilities sought for transgender, disabled persons","LAKKI MARWAT: Coalition for Inclusive Pakistan (CIP), a forum of rights activists, has asked the government to ...","LAKKI MARWAT: Coalition for Inclusive Pakistan (CIP), a forum of rights activists, has asked the government to ensure availability of ramps in government and private buildings and provide jobs to the persons with disabilities, transgender people and women. 
The demand was made at a convention held at the Bannu Press Club on Wednesday. 
Assistant commissioner Attaullah Khan, district election commissioner Habibur Rehman and press club president Mohammad Alam Khan were also present on the occasion. 
“The government has issued clear instructions regarding construction of ramps in all buildings for the disabled and there is a need to implement those instructions in letter and spirit,” said social activist Faizur Rehman. 
He urged the government to improve the living conditions of the marginalised communities. 
The assistant commissioner said on the occasion that ramps had been built in many government buildings to provide an easy entry facility to the disabled persons. 
He said that a separate desk would be set up for women at the relevant outlets under Ehsaas Programme. 
The district election commissioner said steps had been taken to enable the transgender people, the disabled and women to use their right of vote with dignity. 
He said the ECP had ensured that all polling stations were accessible to the voters, especially the disabled people and elderly. 
Mr Alam also urged the government to give due representation to the transgender people, disabled and women in the dispute resolution councils of the police department.  
Published in Dawn, March 24th, 2022
"
14,Over 30 non-teaching hospitals being revamped: minister,Taimur Jhagra inaugurates newly-established block at Naseerullah Khan Babar Memorial Hospital,"PESHAWAR: Provincial Minister for Health Taimur Khan Jhagra on Wednesday inaugurated the newly-established medical and children emergency block at Naseerullah Khan Babar Memorial Hospital as part of the reform programme under which 50 secondary care facilities are being upgraded across the province.
“Another federal government-funded project to completely revamp 32 non-teaching district headquarters hospitals is also in progress to develop gynea, medical, emergency, children and other services through installation of equipment and deployment of the required personnel,” the minister told at a news conference at NKBH.
He said that NKBH and Safwat Ghayur Shaheed Memorial Hospital were catering to the needs of a large number of people in Peshawar district. The former was selected as the pilot secondary healthcare facility, which received 85,000 patients on average per month, he added.

Taimur Jhagra inaugurates newly-established block at Naseerullah Khan Babar Memorial Hospital

He said that reforms to improve service delivery at the hospital included scaling up infrastructure and equipment, availability of medicines, cleanliness and security. The initiatives launched by government in line with Prime Minister Imran Khan’s vision started benefitting people as per data of Independent Monitoring Unit of health department, he said.
“The government is set to expand reforms agenda to cover 50 more hospitals across the province,” said the minister. He said that provision of round-the-clock services to people was atop of the agenda, implementation of which started in May 2021 in the hospital.
The minister praised the hospital management committee for setting up dedicated OPD pharmacy from its own funds. He said that digitised system enabled the staff to record data regarding dispensation of medicines and provide free of cost drugs to the patients.
With the inauguration of new block, more than 3,000 patients including men, women and children would be checked at the hospital while one-window operation for gynea meant to speed up services, he said.
Mr Jhagra said that gynea ward, OPD and labour room were being operated in the same building to ensure timely services to women. Every day, 20 deliveries took place at the hospital besides 100 women examined at the OPD, which not only facilitated the nearby people but also reduced workload on tertiary care hospitals in the provincial capital.
He said that upgradation of women and children service at hospitals was major component of the reform programme. He said that the hospital also got central oxygen supply with automatic manifold, designed to supply oxygen to 40 beds directly in different wards and operation theatres.
The minister said that the system installed at a cost of Rs1.6 was financially supported by NGOs, Helvetas Swiss and Cesvi Pakistan. He said that series of reforms would continue throughout the province to ensure availability of doctors, paramedics, nurses and other resources to enable the people to get services at their native districts.
He said that along with reforming hospitals’ clinical and non-clinical operations, host of new services were also introduced to meet healthcare needs of patients.
Published in Dawn, March 24th, 2022
"
15,"Opposition has required MNAs to oust Imran, claims Safdar",PML-N leader flays govt over high inflation,"MANSEHRA: Pakistan Muslim League-Nawaz leader retired Captain Mohammad Safdar on Wednesday claimed that the combined opposition had secured the National Assembly votes requiredfor the ouster of the prime minister, and would form a government capable enough to address economic crisis in the country.
He also insisted that his party would sweep the second phase of local body elections in Khyber Pakhtunkhwa.
Addressing a public meeting in Chakia area here, the PML-N leader criticised the Pakistan Tehreek-i-Insaf government for what he called the people’s misery mainly caused by unprecedented inflation.
He said the ruling PTI was using government resources to influence voters but it couldn’t fool the latter, who would never vote for the PTI election nominees on March 31.

PML-N leader flays govt over high inflation

Mr Safar, who is the son-in-law of former prime minister and PML-N supremo Nawaz Sharif, said his party was sincerely working on all fronts to dislodge the ‘selected’ PTI government.
He urged the people to support the combined opposition for the early ouster of the PTI government.
“You should not be fooled by the development projects being announced by the ruling PTI to woo voters,” he said.
On the occasion, PML-N leader Sardar Shahjehan Yusuf said the people would vote for his party’s poll nominees not only in Hazara division but in other parts of the province as well.
MEDICINES SEIZED: The police on Wednesday claimed to have seized a large quantity of medicines meant for government health centres.
District police officer Sajjad Khan told reporters that the recovery of medicines labelled not-for-sale came during the checking of a pickup vehicle on the Karakoram Highway after the driver abandoned it. He said the driver escaped, so the police launched a search for him and his accomplices.
The DPO said the police were also tracing the health department officials involved in the medicine theft.
Published in Dawn, March 24th, 2022
"
16,Electric supply to Bajaur trade centres restored,BAJAUR: Electric supply to most trade centres here was restored on Wednesday after two weeks suspension over the...,"BAJAUR: Electric supply to most trade centres here was restored on Wednesday after two weeks suspension over the meter installation issue.
The development came at the intervention of the district administration, an official of the Tribal Electricity Supply Company told Dawn on condition of anonymity.
He said that senior officials of the administration led by deputy commissioner Iftikhar Alam met the company’s top bosses here two days ago and called for the immediate restoration of electric supply to bazaars, including those in district headquarters Khar.
The official said that the administration supported the Tesco’s stand that electricity would be supplied to shops only after the installation of power meters there, but it asked them to restore electric supply to prevent street protests by traders.
He said that the district administration assured the Tesco that it would call a meeting of trader leaders and other major stakeholders from across the tribal district for the amicable resolution of the power meters issue.
The official said that the Tesco, which had earlier announced zero tolerance against the traders opposed to meter installation, accepted the administration’s request and agreed to restore power supply to trade centres without delay.
He said that power supply was restored in the main Khar bazaar three days ago and in trade centres of Inayat Kallay, Nawagai and Sadiqabad areas on Tuesday.
The traders of Khar and Inayat Kallay areas, which have the largest and second largest commercial centres in the district respectively, confirmed the restoration of electric supply.
They said that the power supply, which remained suspended for more than 17 days, was restored on Tuesday by the Tesco following the holding of protest demonstrations by the traders.
Published in Dawn, March 24th, 2022
"
17,Two labourers killed in landslide,MUZAFFARABAD: Two labourers from the Hazara division of Khyber Pakhtunkhwa (KP) were killed after being trapped in a...,"MUZAFFARABAD: Two labourers from the Hazara division of Khyber Pakhtunkhwa (KP) were killed after being trapped in a landslide while they were doing manual work on Wednesday, police said.
Station House Officer (SHO) Wajahat Kazmi confirmed to Dawn that Faizullah and Yousuf, residents of Ugi Battagram, were digging along the house of Manzoor Shah in Taami Gojra neighbourhood, which triggered a landslide in the adjacent mountain. 
Local residents, who were later joined by Rescue 1122 personnel, launched a rescue operation and retrieved their bodies after an effort of almost two hours.
Both bodies were later dispatched to their native area, SHO Kazmi said.
Expressing grief over the loss of lives, civil society activists said that government departments had turned a blind eye towards illegal cutting of mountain slopes in different neighbourhoods, notwithstanding the threat, the unlawful practice posed to the lives of labourers and passers-by.
“Influential people excavate mountain slopes with impunity to carve out residential and commercial plots even along main arteries, let alone less visited areas, but none among the government functionaries stops this unlawful practice fraught with threats not only to human beings but also the environment,” said Saeed Shah, a civil society activist.
Published in Dawn, March 24th, 2022
"
