,Header,Summary,Detail
7,"Russia launches shock bid to host Euros, challenges British Isles, Italy",LONDON: Russia launched a shock bid to host football’s European Championship one month after invading its neighbor...,"LONDON: Russia launched a shock bid to host football’s European Championship one month after invading its neighbor and seeing its teams suspended from international competitions over the war in Ukraine.
The late declaration of interest in bidding is a challenge to the British Isles, which through its combined bid thought it was unchallenged to host the UEFA showpiece in 2028 until Turkey also entered the contest on Wednesday. 
Italy is the only declared bidder for Euro 2032 apart from Russia.
“A meeting of the Russian Football Union executive committee decided on Wednesday to support the decision to declare interest in the 2028 and 2032 tournaments,” the organisation said in a statement ahead of the deadline for expressions of interest to be submitted to UEFA.
Russia’s federation was not suspended by UEFA despite the ban on its teams from playing since last month. The RFU president, Alexander Dyukov, also still sits on the UEFA executive committee and is CEO of an oil subsidiary of state-owned Gazprom, which was dropped as a Champions League sponsor over the war.
“We must take the opportunity to host the Euro,” Dyukov told Russia’s Match TV. “It will be at the World Cup stadiums and we have developed infrastructure.”
Russia hosted the 2018 World Cup and the venue for the final Luzhniki Stadium was used last week for a rally supporting President Vladimir Putin.
“We are sending the declaration today,” Dyukov said. “We assume that Russia is already prepared to to host large-scale competitions. We have the experience.”
Russia’s unlikely plan is sure to face fierce opposition. Poland, Sweden and the Czech Republic had independently announced they would refuse to play Russia in World Cup qualifying even on neutral territory ahead of FIFA’s decision to suspend Russia.
UEFA will provide the tournament requirements to bidders next Wednesday and then confirm their candidacies on April 5. The deadline to submit final bid dossiers is not until April 2023 with a decision by the UEFA executive committee in September 2023.
“We reserve the right to enter a bid,” Dyukov said. “This option doesn’t cost anything. And you cant refuse it, if it isn’t expensive.”
The British Isles bid is being led by England and also features Ireland, Scotland, Wales and Northern Ireland.
Published in Dawn, March 24th, 2022
"
8,Moriyasu expects aggressive Australia in World Cup clash,The Japanese are on the verge of a seventh consecutive World Cup despite a poor start to the final phase of qualifying round.,"HONG KONG: Japan coach Hajime Moriyasu has experienced joy and despair throughout Asia’s World Cup preliminaries but victory over Australia in Sydney on Thursday will guarantee a happy conclusion to a dramatic campaign.
Both Japan and Saudi Arabia can confirm their spots at the finals in Qatar this week, with Herve Renard’s Saudi side set to advance if they beat already eliminated China in Sharjah.
The Saudis lead Group ‘B’ by a point from Japan with Australia in third, three points behind Moriyasu’s side and needing to defeat the ‘Samurai Blue’ to put their qualifying fate back into their own hands.
The Japanese are on the verge of a seventh consecutive World Cup despite a poor start to the final phase of qualifying, when losses against Oman and Saudi Arabia raised questions over Moriyasu’s future.
But the former Sanfrecce Hiroshima boss has come through that slump to lead his side to five straight wins, including a 2-1 victory over the Australians in Japan in October, and another three points will be enough to secure a place in Qatar.
“Australia were very strong and their intensity level was high when we played them last October,” Moriyasu told the Asian Football Confed­eration’s website.
“I am quite sure that the next game is going to be more aggressive and intense than our last game, and think it will be a good game of football.”
Iran and South Korea have already claimed the two automatic berths available from Group ‘A’, with the pair facing off in Seoul on Thursday in the battle for top spot.
That leaves the United Arab Emirates, Lebanon and Iraq battling for third in the group and a spot in the playoffs.
Iraq will face the UAE in Riyadh while Lebanon host Syria in Sidon.
The UAE, under new coach Rodolfo Arruabarrena, are third with nine points, three ahead of the Lebanese with Iraq a further point adrift.
The two third-placed teams meet in a playoff in Qatar on June 7 before taking on South American opposition for a spot at the finals a week later.
Published in Dawn, March 24th, 2022
"
9,"Ecuador, Uruguay aiming to lock in World Cup spots this week",SAO PAULO: South America’s quota of four direct spots for the World Cup in Qatar could be filled with a round of...,"SAO PAULO: South America’s quota of four direct spots for the World Cup in Qatar could be filled with a round of qualifying to spare, with Ecuador and Uruguay aiming to secure spots behind Brazil and Argentina this week.
The fifth-placed team in South America will play an intercontinental playoff against the fifth-placed team from Asia in June for another spot in Qatar, so the competition is still intense.
Peru, Chile and Colombia are seeking to remain in contention for the fourth or the fifth positions in qualifying right until the last round. Bolivia, Paraguay and Venezuela are already out.
The most anticipated match on Thursday will be at the Centenario Stadium in Montevideo, where Uruguay (22 points) and Peru (21) will face off. Sixth-placed Chile are on 19 and their hopes depend on getting points against first-placed Brazil (39) in Rio de Janeiro.
Third-placed Ecuador (25) can secure their spot in Qatar with a combination of different results. A win at Paraguay is enough for Gustavo Alfaro’s team. A draw could also work, as long as Peru don’t beat Uruguay. A loss could also suffice if the Peru lose in Montevideo.
Uruguay were at serious risk of not qualifying for the World Cup after four consecutive defeats under veteran coach Oscar Tabarez. The outlook has improved in the two matches since Diego Alonso took over. Now the Uruguayans can reach the World Cup with a victory against a direct rival for the spot, as long as Chile don’t win at Brazil.
“We will play this match as if it were a final,” Alonso told a news conference.
Peru can achieve at least fifth position with a win at Uruguay as long as Chile don’t beat Brazil. Avoiding defeat in Montevideo could also be enough to get close to Qatar.
“To reach the final round depending only on ourselves is what we had expected all along,” said Ricardo Gareca, who took Peru to a World Cup for the first time in 36 years in the latest edition. “We have to have a lot of narrative, conviction, mentality to depend only on ourselves in the two final rounds.”
For Chile, a loss to Brazil would mean the end of its World Cup hopes for 2022. Chile have never beaten Brazil away. 
“It is clear that we cannot play a fearful match,” Chile coach Martin Lasarte said. “We have to play as equals.”
Colombia (17) host Bolivia (15) and need an extremely unlikely combination of results to qualify.
Friday’s only South American qualifying match features Argentina as Venezuela’s hosts. The last round of qualifying will be staged next Tuesday.
The final rounds of qualifying are also a relief for South American teams, who have faced serious headwinds since the beginning of the Covid-19 pandemic, not only because of their high toll of the virus in their countries but also with health protocols required to bring Europe-based players in for matches.
Published in Dawn, March 24th, 2022
"
10,"Russian, Belarusian swimmers banned from world championships",LAUSANNE: Russian and Belarusian swimmers were banned Wednesday from competing at the world championships because of...,"LAUSANNE: Russian and Belarusian swimmers were banned Wednesday from competing at the world championships because of the war in Ukraine.
The sport’s governing body FINA, had broken with most other organisations by continuing to allow Russians and Belarusians to compete, though as neutral athletes without national symbols.
“Following the review of an independent risk assessment, the FINA Bureau met today and confirmed that athletes and officials from Russia and Belarus will not take part [in the world championships],” FINA said.
The event, which will be held in Hungary in June and July, includes swimming, diving, water polo and artistic swimming.
The German and Swiss teams had previously indicated they could boycott the championships if Russia was still allowed to compete. Russia finished third in the medal table behind China and the United States at the last championships in 2019.
FINA added that Russia responded to the ban by withdrawing from all events on this year’s calendar. Russia was stripped of hosting the world short-course championships in Kazan in December and FINA is now seeking a new host.
Russian and Belarusian athletes already have been suspended from sports  including football, track, gymnastics, skiing and ice skating because of  the invasion of Ukraine.
Published in Dawn, March 24th, 2022
"
11,"Hareem, Maria, Farah reach Karachi TT semisw","KARACHI: Top seed Hareem Anwar, second seed Maria Tazeem and fourth seed Farah Salman cruised into women’s singles...","KARACHI: Top seed Hareem Anwar, second seed Maria Tazeem and fourth seed Farah Salman cruised into women’s singles semi-finals of the Karachi Table Tennis Championship here at the Sindh Sports Board (SSB) Sports Complex the other day.
Former Karachi champion Hareem outplayed Sumaira 11-3, 11-3, 11-4 in the quarter-finals.
Maria, another prominent player, struggled to overpower former national champion Ghalia Mohsin 3-11, 11-9, 6-11, 11-9, 11-9 in their quarter-final that was extended to full length.
In other last-eight matches, Farah accounted for third seed Aisha Yousuf 11-7, 11-8, 11-3 while unseeded Maliha Ansaar defeated Noreen Farhan 11-7, 7-11, 11-9, 11-9.
Results:
Veterans singles (semi-finals): Azhar Khursheed bt Israr Khan 11-7, 8-11, 11-7, 11-9; Ejaz Mailk bt Iqbal Gaba 11-6, 11-7, 7-11, 11-7
Women’s doubles (quarter-finals): Farah/Adeena bt Sameera/Sumaira 11-4, 11-4, 11-7; Maria/Aisha bt Rida/Neha 11-4, 11-2, 11-3; Ghalia/Maliha bt Noreen/Maham 11-7, 11-6, 11-4
Semi-finals: Hareem/Qurat bt Aisha/Maria 15-13, 11-8, 13-11; Ghalia/Maliha bt Farah/Adeena 11-6, 11-3, 12-10
Women’s singles (pre-quarter finals): Farah Salman bt Rida Tahira 11-2, 11-6, 11-2; Maliha Ansaar bt Maryam Shahzad 11-4, 11-3, 11-2; Sumaira bt Fatima Zehra 11-8, 11-9, 11-5; Aisha Yousuf bt Maham Nadeem 11-4, 11-5, 14-12; Hareem Anwar bt Anabia Siddiqi 11-6, 11-4, 11-3; Ghalia Mohsin bt Neha Salim 11-2, 11-3, 11-2; Maria Tazeem bt Sameera 11-1, 11-5, 11-1; Noreen Farhan bt Adeena Hussain 11-6, 11-7, 11-6
Quarter-finals: Hareem Anwar bt Sumaira 11-3, 11-3, 11-4; Farah Salman bt Aisha Yousuf 11-7, 11-8, 11-3; Maria Tazeem bt Ghalia Mohsin 3-11, 11-9, 6-11, 11-9, 11-9; Maliha Ansaar bt Noreen Farhan 11-7, 7-11, 11-9, 11-9
Men’s singles (first round): Mohammad Ubair bt Shoaib Munir 11-7, 11-8, 12-10; Ubaid-ur-Rehman bt Khalid Khan 11-9, 11-9, 7-11, 5-11, 11-5; Wajahat Ahmed bt Jasheenuddin 11-8, 11-3, 11-3; Affan Baqai bt Khizer Riaz 11-7, 11-6, 10-12, 12-10; Faisal Saqib bt Mohammad Faaz 11-7, 11-8, 13-11; Hasan Vohra bt Fayyaz Iqbal 11-7, 11-9, 11-8; Ahmed Hasan bt Umair Ahmed 11-9, 11-6, 11-7; Kamran Shahzad bt Jamal Hasan 11-8, 11-5, 11-4; Hamza Saleem bt Huzaifa Hatim 6-11, 6-11, 15-13, 11-8, 12-10; Syed Shariq Zahoor bt Zain Farooq 9-11, 11-8, 9-11, 11-6, 11-7; Zaid Saad bt M. Ahsan 11-7, 11-9, 11-9; Saad Raza bt Ibrahim Qazi 4-11, 11-7, 11-5, 11-3; Taha Ali bt Muzammil 11-5, 7-11, 11-6, 8-11, 11-7; Gul Hasan bt Rahim Riaz 11-8, 11-6, 11-9; Syed Fakhir bt Ahmed Shah Gilani 14-16, 11-6, 11-8, 7-11, 11-9; Zawwar Sheikh bt Syed Muteeb Alam 11-5, 11-6, 11-9; Fawad Ahmed bt Syed Samiullah 11-9, 11-8, 11-6; Shehroze Aslam bt Hasan Ahmed 11-8, 11-9, 11-8; Saad Mehmood bt Usman Shamim 11-6, 11-8, 11-6; Haq Nawaz bt Ahmed Raza 11-7, 11-8, 11-9; Mohammad Arshad bt Anil Mohammad Ali 11-6, 11-2, 11-6; Ali bt Saifullah Imran 11-7, 11-8, 11-9; Syed Nafay Zaidi bt Saif Asif 11-9, 11-8, 11-9; Usama Qayyum bt Sameer Asif 11-8, 11-8, 11-6; Mohammad Zubair bt Hasan Adil 11-9, 11-8, 12-10; Mohammad Mushtaq bt Shozib Tanveer 11-9, 11-9, 11-8; Shayan Abbas bt Ahmed 11-8, 11-9, 11-7
Published in Dawn, March 24th, 2022
"
12,All Pakistan women’s and juniors squash commences,As many as 180 players from across the country are competing in the event.,"KARACHI: The All Pakistan juniors and women’s squash tournament commenced here at the PN Roshan Khan-Jahangir Khan Squash Complex on Wednesday.
As many as 180 players from across the country are competing for honours in women’s, boys U-19, U-15 and U-13 events which is being held under the aegis of Pakistan Navy.
Results:
Women’s: Noor-ul-Huda bt Manahil Durani 11-5, 11-7, 11-2; Hira Aqeel bt Mehwish Ali 11-6, 11-5, 9-11, 3-11, 11-9; Zaynab Khan bt Saliha Rasheed 11-1, 11-2, 11-3; Aiman Shahbaz bt Syeda Sara 11-3, 11-3, 11-3; Amna Malik bt Alina Zehra 11-2, 11-0, 11-2; Mahnoor Ali bt Noreen Shams 11-7, 11-2, 11-4; Mariam Malik bt Wajeeha Altaf 11-1, 11-1, 11-3; Aina Shaikh bt Sameera Shahid 11-5, 12-10, 11-3; Komal Khan bt Wania Tahir 11-6, 11-3, 11-7; Anum Aziz bt Zoha Abdullah 11-4, 11-7, 11-2; Sana Bahadur bt Tahreema Islam 11-7, 11-6, 11-1; Ilsa Imran bt Manahil Aqeel 11-7, 11-4, 11-5; Feha Asim bt Ummay Kalsoom 11-9, 11-2, 10-12, 4-11, 11-7; Nimra Aqeel bt Fajar Hamid 11-3, 11-6, 11-2; Aina Aziz bt Ronaq Saleem 11-6, 11-9, 11-4; Zunaira Khan bt Sibgha Arshad 11-5, 11-6, 11-2.  
Boys U-19: Mehrab Khan bt Ammar Shaikh 11-1, 11-1; M. Saif bt Nabeel Ahmad 11-3, 11-3; M. Ali bt Abdullah Younas 11-3, 11-3; M. Din Haris bt M. Haad Imran 11-6, 11-3; Qasim Qadir bt Ammar Ali 11-5, 11-3; Shayyan Adnan bt M. Mehdi 11-3, 11-8; Abdul Waqar bt Shehzad 8-11, 11-6, 11-3; Hussain Waheed bt M. Owais 10-12, 11-8, 11-8.   
Boys U-15:Mohammad bt M. Dawood Ahmad 11-9, 11-4, 6-11, 11-4; Umer Arif bt Furqan 11-5, 11-5, 11-9; Azan Ali bt Ayan Bin Kaleem 11-1, 11-1, 11-1; Haris Sheraz bt Hassan Ramzan 11-5, 11-4, 11-3; Abdullah Arslan bt A. Ahad Imran 11-2, 11-5, 11-2; Nasrullah bt Ibrahim Mansoor 11-4, 11-5, 11-2; Mobeen Khan bt Umer Qamar 11-4, 11-4, 11-3; Usman Tahir bt Ali Ahmad Usmani 11-2, 11-9, 11-5; Abdul Basit bt Talha Imran 11-5, 11-8, 11-1; Rana Zohaib bt Haris Zahid 7-11, 11-8, 11-5, 11-3; Abdullah Shahid bt Ali Raza 11-3, 11-2, 11-3; Mustafa Irfan bt Umar Raza 11-4, 11-5, 11-1.  
Boys U-13: Ahmad Ali bt M. Ansar 11-5, 10-12, 11-8, 13-11; Rana Ayan bt Tahoor Tahir 11-2, 11-0, 11-0; Sufian Shahid bt Abdul Rafay 11-2, 11-3, 11-5; Saifullah Bahadur bt Saifullah 11-1, 11-0, 11-1; Huzaifa Shahid bt Suleman Khan 11-0, 11-0, 11-1; M. Bin Atif bt Shahnawaz Butt 13-11, 11-4, 11-5; Syed Savi bt S. Inshaal Abbas 11-1, 11-2, 11-1; Shahzaib bt Sohail Adnan 11-6, 11-7, 11-3; Amir Adnan bt Saifullah 11-8, 11-1, 11-4; Haris Khaleel bt M. Umer Ahmad 11-7, 11-5, 11-5; M. Rehan bt Umer Afzal 11-5, 11-2, 11-2; Abdul Ahad bt Saifullah 11-3, 11-2, 11-3; Raja Ali Amir bt A. Rafay Khan 11-3, 11-4, 11-3; M. Umer Farooq bt Abdul Haseeb 11-6, 11-5, 11-3.
Published in Dawn, March 24th, 2022
"
