,Header,Summary,Detail
6,Pant top scores as India defeat West Indies in fourth T20,LAUDERHILL: India advanced their preparation for the next Twenty20 World Cup with a series-clinching 59-run victory...,"

LAUDERHILL (Florida): Indian batter Rishabh Pant plays a shot during the fourth Twenty20 International against the West Indies at the Central Broward Regional Park.—AFP

 
LAUDERHILL: India advanced their preparation for the next Twenty20 World Cup with a series-clinching 59-run victory over the West Indies in the fourth fixture of a five-match series at the Broward County Stadium in Florida on Saturday.
Defending a formidable total of 191 for five in front of fiercely partisan Indian supporters at the United States venue, Rohit Sharma’s side dismissed their opponents for 132 off 19.1 overs.
India take an unbeatable 3-1 lead in the series ahead of the final match at the same venue on Sunday.
Arshdeep Singh led the bowling effort for India, the left-arm medium-pacer continuing to impress with his clever combination of swing and seam to take three for 12, finishing off the match with the wicket of Obed McCoy.
For McCoy, who established a new West Indies bowling record in T20Is with figures of six for 17 in the second match in St Kitts last Monday, this was an especially forgettable experience.
Despite taking two wickets, the left-armer was belted for 66 runs across his four overs, the most expensive spell ever by a West Indies bowler in this format.
India continued with their policy of all-out attack after being put in to bat with Rishabh Pant leading the effort for the top order with 44 off 31 balls.
Each of the top five got starts and while none was able to carry on for a really commanding innings, their pace of scoring ensured the final total was always going to be challenging on a surface where free-flowing strokeplay became increasingly difficult.
“We knew it was not going to be easy because of the conditions,” said Sharma after the match.
“I thought we had a good score on the board but just could not take things for granted. Our bowlers did extremely well to keep making crucial breakthroughs.” For West Indies captain Nicholas Pooran, the margin of the defeat was just another reminder of the amount of work required by the two-time former champions ahead of the qualifying phase for the T20 World Cup in Australia in October.
His dismissal for 24, run out after carting left-arm spinner Axar Patel for a succession of boundaries, typified West Indian frustration.
“The series may be over as a contest but the final match gives other players a chance to put their hands up ahead of the World T20,” said Pooran in hinting at a number of changes for Sunday’s finale.
“They had gotten off to a flying start batting first but I was really happy at least with the way the bowlers stuck to the task.”
Scoreboard
INDIA: 
R. Sharma b Hosein  33
S. Yadav lbw Joseph 24 
D. Hooda c King b Joseph    21 
R. Pant c Drakes b McCoy    44 
S. Samson not out   30 
D. Karthik b McCoy  6 
A. Patel not out    20 
EXTRAS (LB-4, W-9)  13
TOTAL (for five wkts, 20 overs) 191
FALL OF WICKETS: 1-53 (Sharma), 2-61 (Yadav), 3-108 (Hooda), 4-146 (Pant), 5-164 (Karthik)
DID NOT BAT: A. Khan, B. Kumar, R. Bishnoi, A. Singh 
BOWLING: Hosein 4-0-28-1, Drakes 4-0-31-0 (2w), McCoy 4-0-66-2 (4w), Joseph 4-0-29-2 (1w), Holder 4-0-33-0 (2w)
WEST INDIES: 
B. King c&b Khan    13 
K. Mayers c Hooda b Patel   14 
D. Thomas c Hooda b Khan    1  
N. Pooran run out Samson    24 
R. Powell c Hooda b Patel   24 
S. Hetmyer b Bishnoi    19 
J. Holder c Samson b Singh  13 
A. Hosein c Yadav b Bishnoi 3 
D. Drakes b Singh   5 
A. Joseph not out   6  
O. McCoy b Singh    2 
EXTRAS ( LB-3, W-5) 8 
TOTAL (all out, 19.1 overs) 132 
FALL OF WICKETS: 1-18 (King), 2-22 (Thomas), 3-49 (Pooran), 4-64 (Mayers), 5-82 (Powell), 6-101 (Holder), 7-106 (Hosein), 8-116  Hetmyer, 9-128 (Drakes) 
BOWLING: Kumar 3-0-21-0 (1w), Khan 4-0-17-2 (1w), Patel 4-0-48-2 (3w), Singh 3.1-0-12-3, Bishnoi 4-0-27-2, Hooda 1-0-4-0 
RESULT: India won by 59 runs.
Published in Dawn, August 8th, 2022
"
7,Magnificent Messi inspires PSG to 5-0 win over Clermont,PARIS: Lionel Messi scored a sensational  bicycle-kick goal as Paris St Germain began the defence of their Ligue 1...,"PARIS: Lionel Messi scored a sensational  bicycle-kick goal as Paris St Germain began the defence of their Ligue 1  title with an emphatic 5-0 victory over Clermont at the Stade Gabriel  Montpied on Saturday
Neymar was also in outstanding form for a PSG side who did not miss the injured Kylian Mbappe, with the Brazilian opening the scoring in Clermont before setting up Achraf Hakimi and Marquinhos for further goals before half-time.
Messi then exchanged passes with Neymar before sidefooting in the visitors’ fourth goal with 10 minutes left.
Yet Messi saved the best for last, darting into the box four minutes from the end to control a Leandro Paredes pass on his chest with his back to goal, before converting with an acrobatic overhead kick.
That goal had the crowd at Clermont singing the name of the seven-time Ballon d’Or winner, who endured a difficult first season in Paris.
PSG’s victory in new coach Christophe Galtier’s first league game in charge was achieved despite Mbappe missing the trip due to an adductor injury.
Mbappe also missed last week’s 4-0 defeat of Nantes in the season-opening Champions Trophy due to suspension.
Messi had opened the scoring in that game, while Neymar netted a brace.
The duo therefore already have six goals between them this season, with PSG looking in ominous form.
“There is no denying we have lots of talent but what I retain is the collective desire to win the ball back very early, to play with intensity, to never let up,” Galtier, who replaced the sacked Mauricio Pochettino, told broadcaster Canal Plus.
“The squad have been very receptive since I arrived. They like to work hard together, have fun together. But the season is long. This was just the first game.”
Galtier said he would have no trouble finding a place in the line-up for Mbappe, who is expected to return next weekend and play his first competitive game since turning down a move to Real Madrid to sign a new three-year deal in Paris.Neymar fired in the opener in the ninth minute after Messi was unable to control Pablo Sarabia’s cutback, and it was Neymar who set up Hakimi to blast in the second in the 26th minute.
The world’s most expensive player was also the provider for the third goal in the 38th minute when his free-kick from the left was headed in by Marquinhos.
Messi then took over at the end, and it is likely to be a long season for Clermont given four teams will be relegated at the end of the campaign, when Ligue 1 will be reduced from 20 clubs to 18.
Earlier, Monaco benefited from a favourable late VAR call to claim a 2-1 win at Strasbourg.
The principality side were 2-0 up and cruising when Sofiane Diop struck early in the second half to add to Krepin Diatta’s magnificent opener.
However, Habib Diallo pulled one back for Strasbourg and then appeared to have salvaged a draw when he nodded home in the second minute of added time, only for the referee to disallow the goal for a marginal offside after consulting with the VAR.
Monaco now travel to the Netherlands to face PSV Eindhoven in their Champions League third qualifying round, second leg in midweek. The first leg ended 1-1.
Published in Dawn, August 8th, 2022
"
8,Sevilla agree deal to sign Isco on free transfer,"SEVILLE: Sevilla have reached an agreement in principle to sign free agent Isco on a two-year deal, the La Liga club...","SEVILLE: Sevilla have reached an agreement in principle to sign free agent Isco on a two-year deal, the La Liga club said on Sunday.
The former Real Madrid midfielder would undergo a medical on Monday before finalising his transfer, Sevilla added.
Spanish playmaker Isco will become the Andalusian club’s third summer signing after they brought in defender Alex Telles on a season-long loan from Manchester United on Thursday and centre-back Marcao from Galatasaray last month.
Isco confirmed his departure from Real Madrid in May after nine successful years in the Spanish capital, winning 19 trophies including three league titles, five Champions League trophies and four Club World Cups.
The 30-year-old, who spent two seasons at Malaga and also played for Valencia, made more than 350 appearances and scored 53 goals for Real.
However, he was sparingly used by manager Carlo Ancelotti last season, playing only 17 times in all competitions as Real won the league title and the Champions League.
Isco, capped 38 times by Spain, has worked with Sevilla boss Julen Lopetegui twice before — with the national team in the build-up to the 2018 World Cup and later that year during the Spanish manager’s brief spell in charge at Real.
The Andalusian club, who finished fourth in the league last season, begin the new campaign with a trip to Osasuna on Friday.
Published in Dawn, August 8th, 2022
"
9,Nishioka stuns Rublev to book Washington final with Kyrgios,WASHINGTON: Japan’s Yoshihito Nishioka shocked eighth-ranked Andrey Rublev on Saturday to join Wimbledon runner-up...,"WASHINGTON: Japan’s Yoshihito Nishioka shocked eighth-ranked Andrey Rublev on Saturday to join Wimbledon runner-up Nick Kyrgios in reaching Sunday’s ATP and WTA Washington Open men’s final with straight-set triumphs.
Nishioka, a 96th-ranked lefthander, stunned top seed Rublev 6-3, 6-4 in 80 minutes to book his first ATP final since 2020 at Delray Beach.
“Just enjoy the day tomorrow,” Nishioka said.  “Just play my best. (I’m) excited.” 
Australia’s 63rd-ranked Kyrgios ousted Sweden’s 115th-ranked Mikael Ymer 7-6 (7-4), 6-3 and reached back-to-back tour-level finals for the first time in his career.
The 27-year-old Aussie, who lost to Novak Djokovic last month in his first Grand Slam final, won the most recent of his six ATP titles at Washington in 2019.
“It was a tough-fought semi-final and I’m just happy to be in the final once again,” Kyrgios said.  “I didn’t play anywhere near my best tennis.” Nishioka, who won his only ATP title in 2018 at Shenzhen, hadn’t won a tour-level match since March when the week began but has taken five this week and will rise to at least 54th in Monday’s world rankings.
He fired only 12 winners but took full advantage of Rublev’s 33 unforced errors and converted on 4-of-5 break points.
“I tried to be a little bit aggressive, because I knew Andrey was going to play aggressive,” Nishioka said.  “I needed to play a little bit aggressive to him.” Kyrgios is 3-0 against Nishioka, most recently winning in the third round of his 2019 Washington title run.
“We’ve played many times, but he beat me every time since 16 years old,” Nishioka said.  “It’s really tough to play against him. He doesn’t have any pace. He just hits the ball so hard every time. Very tough to break his service games.
“The most important thing is I have to focus on my service games.” 
Estonia’s Kaia Kanepi, trying to end a nine-year WTA title drought at age 37, and 60th-ranked Liudmila Samsonova will meet in the women’s final at the US Open tuneup.
World number 37 Kanepi eliminated Australia’s Daria Saville 6-3, 6-1 while Samsonova routed China’s Wang Xiyu 6-1, 6-1.
Rublev, thwarted in his bid for a 12th career title and fourth of the year, fell to 1-2 against Nishioka.
Nishioka, 26, broke for a 3-1 lead, Rublev slamming his racquet to the court in frustration, and held through to claim the first set on his second ace.
After two exchanges of beaks in the second set, Nishioka broke to lead 5-4 and held to win when Rublev smashed a forehand long.
Kyrgios won the last three points in his first-set tiebreaker and took the only break of the match on a passing forehand winner in the penultimate game, firing his 10th ace to win in 94 minutes.
Kyrgios, who jumps to at least 42nd in Monday’s rankings, fired 28 winners with only 15 unforced errors and hit 71% of his first serves.
“I served pretty solid,” Kyrgios said.  “But from the back of the court I didn’t play well at all.” 
KANEPI PLAYS SMOOTH
Kanepi seeks her fifth career WTA title but her first since the 2013 Brussels Open. She won her only WTA hardcourt title at Brisbane in 2012.
“I played my best match,” Kanepi said.  “Everything was very smooth for me. I hit a lot of lines.” 
Samsonova, 23, won her only meeting with Kanepi in last year’s first round at Wimbledon. Samsonova is into her first WTA hardcourt final, having won her only prior final at last year’s German Open.
Published in Dawn, August 8th, 2022
"
