,Header,Summary,Detail
8,McKeon and Le Clos make history in Birmingham pool,"BIRMINGHAM: Swimmer Emma McKeon became the most successful Commonwealth Games athlete of all-time on Sunday, leading...","BIRMINGHAM: Swimmer Emma McKeon became the most successful Commonwealth Games athlete of all-time on Sunday, leading an Australian sweep of the women’s 50 metre freestyle to claim a record 11th gold medal. 
It was a night of milestones at the Sandwell Aquatic Centre as moments earlier South African Chad Le Clos had joined shooters Michael Gault and Phil Adams as the most decorated Games athletes ever when he snatched his 18th medal by picking up a silver in the men’s 200 metres butterfly. 
Australia then ended the evening with a bang, powering to gold in the women’s 4x200m relay in a world record time of seven minutes, 39.29 seconds, smashing the old mark of 7:40.33 set by China at the Tokyo Olympics. 
Madison Wilson, Kiah Melverton Mollie O’Callaghan and Ariarne Titmus, with a brilliant anchor leg, came home a massive 12.69 seconds clear of Canada, who finished a distant second to take silver while England completed the podium. 
McKeon’s 50m freestyle win follows earlier victories in the mixed 4100 freestyle and womens 4100 freestyle relays to sit alone atop the gold medal table ahead of fellow Australian swimmers Susie ONeill, Ian Thorpe and Leisel Jones. 


LONDON: Gold medallist Laura Kenny (C) of England celebrates with silver medallist New Zealand’s Michaela Drummond (L) and bronze winner Maggie Coles-Lyster of Canada during the medal presentation ceremony for the women’s 10km scratch race of the Commonwealth Games at the Lee Valley VeloPark on Monday.—AFP

 
McKeon, winner of seven medals at last year’s Tokyo Olympics, was able to share the landmark moment with Meg Harris and Shayna Jack who joined her on the podium taking silver and bronze respectively. 
“It is special,” said McKeon.  “It makes me reflect on the last eight years since my first Commonwealth Games and I can see how far I’ve come as a person and an athlete.” 
Le Clos’ milestone comes 10 years to the day since he beat American great Michael Phelps in the same event at the 2012 London Olympics. Swimming out of lane five, the same lane he beat Phelps from, Le Clos was beaten to the wall by Lewis Clareburt with a winning time of one minute, 55.60 seconds. 
However, he could not be denied a place in the record books after finishing just 0.29 seconds back of the New Zealander to snatch silver ahead of England’s James Guy. 
“I’m gutted not to have won, I’ll be honest,” said Le Clos, adding he plans to be top the podium before the end of the Games.  “I would’ve cut my finger off to win tonight. It meant everything to me and my family everyone’s in the stands, my friends flew out for this race. 
“Fair play to Lewis, he had a great race. He said he watched me growing up and I said, ‘man, did you have to do it on my day?   “Could you not have given me one more time?” 
A three-time Commonwealth Games champion in the event, Le Clos looked like he might make it four leading with 50m to go but the 30-year-old would be overhauled down the stretch by Lewis, who adds the 200m butterfly title to the 400m individual medley gold he won earlier at the Sandwell Aquatic Centre. 
Le Clos’ medal haul from four Commonwealth Games includes seven gold, four silver and seven bronze. 
His trophy case also contains four Olympic (one gold, three silver) and seven world championship medals (four gold, one silver, two bronze). 
The rugby sevens came to a conclusion in Coventry with South Africa inflicting more Commonwealth Games woe on Olympic champions Fiji. 
The South Africans won 31-7 — Muller du Plessis scoring two tries — to regain the title they won in 2014, but for the Fijians it was their fourth silver medal. 
The distraught players sank to their knees at the final whistle. 
New Zealand men took the bronze, beating bitter rivals Australia 26-12. 
There was further disappointment for Fiji in the women’s final as they lost 22-12 to Australia. 
There was a second gold for England’s Alex Yee as the hosts won the triathlon mixed relay title.
Published in Dawn, August 2nd, 2022
"
9,"Haider Ali ends fifth in weightlifting, Jahanara Nabi breaks national record at CWG","England’s Christopher Murray set a new Games record en route to winning the gold medal, lifting an overall total of 325kg.","BIRMINGHAM: Haider Ali started off well. Lifting 135kg on his first attempt on the snatch during the men’s 81kg weightlifting final at the Commonwealth Games on Monday, he raised hopes of ending Pakistan’s wait for a medal at the Games by building on that.
It wasn’t to be.
Haider attempted 140kg on his next two tries but was unable to do so. Sitting joint-seventh, he needed to do better in the clean and jerk.
He lifted 161kg in the first attempt but as he went for 169kg in his second, he seemed to be relaxing his left arm.
A successful 170kg lift in the third attempt saw him finish with a total of 305kg but it was only good enough for fifth place.
England’s Christopher Murray set a new Games record en route to winning the gold medal, lifting an overall total of 325kg (snatch 144kg; clean & jerk 181kg).
Australian Kyle Bruce got silver with 323kg (143kg+180kg) while Canadian Nicolas Vachon picked bronze with 320kg (140kg+180kg), narrowly pipping India’s Ajay Singh who finished on 319kg (143kg+176kg).
In the pool, there was a Pakistan 1-2 in the second heat of the women’s 100m freestyle but both Jahanara Nabi and Bismah Khan failed to make it to the semi-finals.
Jahanara, however, broke her national record by 0.16 seconds after clocking a minute 1:01.51 to finish 40th among 55 competitors who started. Bismah finished 47th overall after a time of 1:02.59.
In the women’s 100m backstroke heats, Mishael Ayub clocked 1:22.12 and finished third-bottom among 28 competitors.
Published in Dawn, August 2nd, 2022
"
10,"Will pursue FIH if interference in PHF affairs continues, Khalid Sajjad Khokhar tells govt officials","PHF president, who currently stands de-notified from his post, said he was committed to following federation's constitution.","LAHORE: Pakistan Hockey Federation president Khalid Sajjad Khokhar will look up to the sport’s world governing body if the government continues to interfere in the federation’s affairs.
Khokhar apprised Pakistan Sports Board director general Asif Zaman and Minister for Inter-provincial Co-ordination Ehsan-ur-Rehman Mazari on Monday.
The PHF president, who currently stands de-notified by the PSB from his post, told the officials that he was committed towards following the federation’s constitution — which was in line with International Hockey Federation’s (FIH) statutes — to conduct its elections, which were due in May.
It was the PHF’s failure to meet the deadline for the polls in the first place that made the PSB de-notify Khokhar, along with secretary Asif Bajwa and the federation’s treasurer. Khokhar had rejected the step.   
“I have talked to both DG PSB Asif Zaman and the federal sports minister and have informed them that I am duty-bound to follow the PHF’s constitution, which is aligned with the FIH,” Khokhar told Dawn on Monday. 
“The talk was held in a very good atmosphere and we have reached at a consensus that all the issues including the release of the financial aid of the PHF will be solved after the ongoing Commonwealth Games. 
“Everyone knows that the international sports federations do not like the interference of the government in the affairs of the respective sports federations, so, in the national interest, all the matters will be discussed and will be resolved amicably after the games.” 
Khokhar is currently in Birmingham, where he travelled to with the Pakistan contingent for the Games.
Following Khokhar’s de-notification, the PSB last week had appointed a four-member committee to run the PHF’s affairs and conduct the elections in the next 30 days.
One of the members of the committee, Nasir Ali, had also announced the name of the election commissioner for the polls. However, according to the PHF constitution, only the federation’s president has the authority to make appointments.  
Khokhar, in a show of power and also to reject PSB’s move, named Haider Hussain as the PHF secretary after the committee was named.
The committee, interestingly, had made the announcement of the election commissioner’s appointment through the PHF’s media Whatsapp group, which implied that the PHF had surrendered to the PSB.
However, Khokhar’s talks with the government officials clearly indicate that he is adamant to uphold his constitutional right as the PHF president to hold the elections.
In the recent past, the PSB has interfered in the matters of the Pakistan Olympic Association and the Pakistan Football Federation, despite clear stance from the both the bodies’ respective parent organisations against government interference. 
While the world football governing body FIFA has slapped Pakistan with multiple bans in the last decade, the International Olympic Committee was not very far from suspending Pakistan’s membership.
Dawn tried to reach DG PSB Asif for a comment, but he did not respond to the approaches.
Published in Dawn, August 2nd, 2022
"
11,Mosaddek replaces Nurul as BD captain for Zimbabwe T20 decider,DHAKA: Bangladesh have named all-rounder Mosaddek Hossain to lead the side in the series-deciding third Twenty20...,"DHAKA: Bangladesh have named all-rounder Mosaddek Hossain to lead the side in the series-deciding third Twenty20 against Zimbabwe in Harare on Tuesday.
Mosaddek replaces Nurul Hasan as captain after the wicket-keeper/batsman was ruled out of the rest of the tour with a finger injury he sustained in Sunday’s seven-wicket win in the second match.
The three-match series in Harare is locked at 1-1 after Zimbabwe won the first by 17 runs.
Mosaddek led Bangladesh’s comeback with a career-best 5-20 in the second match.
A Bangladesh Cricket Board (BCB) statement on Monday also said that the experienced Mahmudullah Riyad will replace Nurul in the squad.
Mahmudullah, who led Bangladesh’s T20 side for 43 matches until this series, is already in Zimbabwe as part of the One-day International squad.
He was rested for the T20 series because Bangladesh were trying to rebuild following 11 defeats in 13 matches since October 2021.
Bangladesh will play three ODIs against Zimbabwe on August 5, 7 and 10, all of them at the Harare Sports Club.
Published in Dawn, August 2nd, 2022
"
12,Saudi Arabia among four countries interested in hosting Women’s Asian Cup,"KUALA LUMPUR: Saudi Arabia, Australia, Jordan and Uzbekistan have submitted Expressions of Interest to host the 2026...","KUALA LUMPUR: Saudi Arabia, Australia, Jordan and Uzbekistan have submitted Expressions of Interest to host the 2026 Women’s Asian Cup, the Asian Football Confederation (AFC) said on Monday. 
If selected, Saudi Arabia, whose women’s football team only played its first match in February this year, will host its first official international women’s tournament. 
Although recent reforms have given women in Saudi Arabia more freedoms, many of their rights remain restricted. Saudi women were banned from attending fixtures in stadiums until 2017. 
Australia last hosted the Women’s Asian Cup in 2006, while the 2018 edition was played in Jordan. Uzbekistan have not previously hosted the tournament. 
“The AFC will now work with all Bidding Member Associations on the delivery of the necessary bidding documentation in accordance with the bidding process with a decision to be finalised and communicated in 2023,” the AFC said. 
The winning bid will be announced next year and the AFC hailed the growing popularity of the tournament. 
China claimed a record-extending ninth Women’s Asian Cup title after beating South Korea in the final of the 2022 tournament, which was hosted by India and expanded from eight to 12 teams. 
The 2026 edition “is expected to build on the solid foundations of the tournament’s celebrated legacy”, the AFC said.
Published in Dawn, August 2nd, 2022
"
13,Barcelona sells 25 per cent stake in audiovisual studio to Socios.com,BARCELONA: Spanish football club Barcelona sold a 25% stake in its audiovisual studio to digital fan token firm...,"BARCELONA: Spanish football club Barcelona sold a 25% stake in its audiovisual studio to digital fan token firm Socios.com for 100 million euros ($102 million), club chief Joan Laporta said on Monday, as the La Liga giant steps up efforts to bring in revenue to register new players.
Socios.com will come on board as a technology partner accelerating Barca’s blockchain, non-fungible token and Web3 strategies. Socios.com owner and technology provider Chiliz will take a strategic stake in Barca Studios.
“Barca Studios includes (in its portfolio) metaverse, NFTs and Barca tokens. It’s the sale of a stake ... it’s in principle forever, we could recover it if something happens,” Laporta said at a news conference to unveil new signing Jules Kounde, who was bought from Sevilla.
Barca has been using several mechanisms to increase its revenue in order to offset losses, reduce debt and fulfil La Liga’s financial fair play rules.
Socios.com will support Barca in its efforts to build new digital connections with its global fan base of 400 million.
The deal comes after the club last month sold a further 15% stake in its La Liga TV rights to US private equity group Sixth Street, giving Sixth Street a 25% stake.
The club signed Brazil winger Raphinha from Leeds United and Poland striker Robert Lewandowski from Bayern Munich following a first investment from Sixth Street when it bought 10%.
Laporta, who presided over one of Barca’s most successful periods between 2003 and 2010, said in August 2021 that the club’s debts totalled 1.35 billion euros, with 673 million owed to banks.
In June, Barca approved the sale of a minority share of its licensing and merchandising division and the cession of up to 25 per cent of its income from its La Liga TV rights.
The club has also signed a shirt and stadium sponsorship deal with Spotify in an agreement worth 280 million euros and approved financial plans in December to renovate Camp Nou, including raising an additional 1.5 billion euros in debt.
Published in Dawn, August 2nd, 2022
"
