,Header,Summary,Detail
0,Pakistan’s path to 2026 World Cup looks treacherous again after AFC confirms format,"Pakistan, who have never won a World Cup qualifier in their history, last played in June 2019.","KARACHI: Unless Pakistan’s national football team — which hasn’t played an international match since the last three years — gets a good run of friendlies and gels quickly, its road to World Cup qualification will once again end at the first stage. 
Pakistan, who have never won a World Cup qualifier in their history, last played in June 2019 when they lost to Cambodia in the first round of qualifiers for the 2022 FIFA World Cup in Qatar, which gets underway in November this year. 
Then, Pakistan were ranked among the bottom 12 among Asia’s 48 members, who had to enter in the first stage. 
And despite the 2026 World Cup in the United States, Canada and Mexico being expanded to 48 teams from 32 — increasing Asia’s slots from 4.5 to 8.5, Pakistan are still likely to start their road to qualification in the first stage. 
That after the Asian Football Confederation confirmed the joint-qualification cycle for the World Cup as well the 2027 AFC Asian Cup on Monday, which sees the last 22-ranked Asian teams starting their campaign with a single home-and-away fixture in October next year. 
The road to the World Cup ends for the 11 countries that lose in the opening round. 
The 11 winners, meanwhile, will advance to the second round, joining the continent’s top 25 teams with the 36 then being divided into nine groups of four each which will compete in a round-robin home and away format. 
The top two in each of the nine groups advance to the third stage — the 18 teams also qualifying for the Asian Cup. For World Cup qualification, those teams will be divided into three groups of six each with the top two from each group securing a spot at the World Cup. 
Teams finishing third and fourth will then be divided into two groups of three with the group winners going through to the World Cup and the second-placed teams competing in a playoff, the winner of which will be Asia’s representative in the intercontinental playoff. 
The change this time around, unlike in the last two qualification cycles, for teams like Pakistan which went out in the first round of qualifying is that they get another crack at trying to qualify for the Asian Cup. 
While the top-ranked side in the 11 teams that fall in the first round advance to the final round of the Asian Cup qualifiers, the 10 others will compete in a playoff with the five winners also going through to the final round. 
There they will join the 18 teams that failed to make it to the third stage of World Cup qualifying with the 24 teams being divided into six groups of four each with the winners of each securing a spot at the Asian Cup. 
“The new qualification format has been established after several consultation and dialogue sessions with the AFC Member Associations (MAs), briefings with the AFC Competitions Committee, as well as the Confederation’s key stakeholders,” the AFC said in a news release. 
“The format above is based on the entry of all 47 Member Associations and is subject to change depending on the final number of entries.” 
Pakistan’s entry would’ve been missing if the FIFA suspension on the Pakistan Football Federation, which was lifted at the end of May, had prolonged till next year. 
The suspension, which was slapped in April last year after the FIFA-appointed PFF Normalisation Committee was pushed out of the headquarters of the country’s football governing body, along with the long-running crisis in the PFF has seen the national miss out on participating in international friendlies as well as tournaments, notably last year’s SAFF Championship. 
After FIFA lifted the suspension, the PFF Normalisation Committee has been keen on restoring football activity in the country but its toughest task perhaps will be to ensure that a strong national team enters the first round of World Cup qualification. 
Players have also missed out on domestic action due to the football crisis in the country and while the mandate of the NC is till June next year — by which it has to hold fresh elections of the PFF, the foundations it lays in the coming months to revive the team will be key if Pakistan are to end their dismal record in World Cup qualifiers.
Published in Dawn, August 2nd, 2022
"
1,Five-star Shamsi leads South Africa to T20 series triumph over England,SOUTHAMPTON: Tabraiz Shamsi’s maiden five-wicket Twenty20 International haul sealed South Africa’s 90-run...,"SOUTHAMPTON: Tabraiz Shamsi’s maiden five-wicket Twenty20 International haul sealed South Africa’s 90-run thrashing of England on Sunday as the Proteas completed a 2-1 series win.
The 32-year-old left-arm wrist-spinner took 5-24 as England, set 192 for victory, collapsed to 101 all out with 20 balls to spare at Southampton after losing their last eight wickets for 49 runs.
Earlier, in-form South Africa opener Reeza Hendricks hit 70 — his third fifty of the series — and Aiden Markram made an unbeaten 51 as the Proteas posted a competitive 191-5.
Recalled left-arm quick David Willey took 3-25.
Shamsi’s haul was all the more impressive given his expensive return of 0-49 in England’s series-opening win in Bristol.
But South Africa have been much improved in the field since that 41-run defeat and this win gave them a first T20 series success in England, as well as their first white-ball bilateral series victory in the country since 1998.
By contrast, defeat left England still searching for a first series win under new white-ball captain Jos Buttler following One-day International and T20 reverses against India and a drawn ODI campaign with the Proteas.
Jonny Bairstow (27) was the only England batsman to make more than 20, but Buttler and white-ball coach Matthew Mott do have at least seven matches at this level scheduled in Pakistan in September in which to turn things around before the T20 World Cup in Australia.
England’s chase suffered an early setback when Buttler was out for 14, caught at short third man off spinner Keshav Maharaj.
The out-of-form Jason Roy fell for 17, caught behind off Anrich Nortje — in after South Africa decided against risking fellow fast bowler Kagiso Rabada’s injured ankle ahead of next month’s three-Test series in England.
And when Moeen Ali was brilliantly caught one-handed by a leaping Tristan Stubbs off part-time spinner Markram, the hosts were 59-4.
Shamsi then cleaned up Liam Livingstone before taking two wickets in two balls, with Sam Curran caught in the deep before Willey was clean bowled.
Chris Jordan survived the hat-trick only to be lbw to Shamsi.
Adil Rashid holed out off Shamsi before Maharaj ended the match when he dismissed Bairstow with the aid of a catch by David Miller — a memorable way for the South Africa captain to finish his 100th T20 international.
England’s decision to recall Willey in place of Richard Gleeson reaped an early reward when he had potential dangerman Quinton de Kock chopping onto his stumps for a three-ball duck.
But South Africa recovered, with the Proteas 53-1 at the end of the powerplay.
Hendricks completed a 42-ball fifty and he then upped the tempo with three boundaries in a 16th over bowled by Curran.
He was eventually well caught by wicket-keeper Buttler off the expensive Jordan (1-52).
But Markram, back in South Africa’s T20 team for the first time since last year’s World Cup, having first provided solid support, went on to a 36-ball fifty before Miller chipped in with a quickfire 22.
Scoreboard
SOUTH AFRICA:
Q. de Kock b Willey 0 
R. Hendricks c Buttler b Jordan 70 
R. Rossouw b Ali    31 
A. Markram not out  51 
D. Miller b Willey  22 
T. Stubbs c Livingstone b Willey    8 
EXTRAS (LB-3, W-6)  9 
TOTAL (for five wickets, 20 overs)  191
FALL OF WICKETS: 1-0 (de Kock), 2-55 (Rossouw), 3-142 (Hendricks), 4-183 (Miller), 5-191 (Stubbs)
DID NOT BAT: A. Phehlukwayo, K. Maharaj, A. Nortje, L. Ngidi, T. Shamsi 
BOWLING: Willey 4-1-25-3, Topley 4-0-45-0, Jordan 4-0-52-1 (2w), Ali 1-0-4-1 (1w), Rashid 4-0-33-0, Curran 3-0-29-0 (3w)
ENGLAND: 
J. Roy c de Kock b Nortje   17 
J. Buttler c Ngidi b Maharaj    14 
D. Malan c Nortje b Phehlukwayo 7 
J. Bairstow c Miller b Maharaj  27
M. Ali c Stubbs b Markram   3 
L. Livingstone c Maharaj b Shamsi   3 
S. Curran c Markram b Shamsi    9
D. Willey b Shamsi  0 
C. Jordan lbw Shamsi    14
A. Rashid c Markram b Shamsi    0
R. Topley not out   0 
EXTRAS (B-4, LB-2, NB-1)    7 
TOTAL (all out, 16.4 overs) 101 
FALL OF WICKETS: 1-28 (Buttler), 2-33 (Roy), 3-52 (Malan), 4-59 (Ali), 5-65 (Livingstone), 6-79 (Curran), 7-79 (Willey), 8-97 (Jordan), 9-97 (Rashid) 
BOWLING: Maharaj 3.4-0-21-2, Nortje 2-0-12-1 (1nb), Ngidi 2-0-10-0, Shamsi 4-0-24-5, Phehlukwayo 4-0-23-1, Markram 1-0-5-1
RESULT: South Africa won by 90 runs.
Published in Dawn, August 2nd, 2022
"
2,WI stalwart Dottin quits citing negative team environment,"BIRMINGHAM: All-rounder Deandra Dottin, whose 38-ball century against South Africa remains the fastest hundred in...","BIRMINGHAM: All-rounder Deandra Dottin, whose 38-ball century against South Africa remains the fastest hundred in women’s T20 Internationals, has retired from the West Indies side citing negative team environment.
The 31-year-old all-rounder, currently playing for Barbados at the Commonwealth Games in Birmingham, announced the decision on Twitter adding she looked forward to ”playing domestic cricket around the world.”  
“The current climate and team environment has been non-conducive to my ability to thrive and reignite my passion,” said Dottin, who made her West Indies debut in a 2008 ODI against Ireland. 
“With much sadness but without regret, I realize that I am no longer able to adhere to team culture and team environment as it has undermined my ability to perform excellently.”  
Dottin is the most-capped West Indies’ women cricketer having played 124 Twenty20 and 143 One-day Internationals for them.
She became the first woman to smash a century in T20 Internationals following her unbeaten 112 off 45 balls in a 2010 World Cup match against South Africa in St Kitts.
She has scored close to 6500 international runs and claimed 134 wickets with her medium pace.
Published in Dawn, August 2nd, 2022
"
3,Chapman ton powers NZ to seven-wicket win over Scotland,EDINBURGH: Mark Chapman completed a memorable few days in Edinburgh with an unbeaten hundred as New Zealand...,"EDINBURGH: Mark Chapman completed a memorable few days in Edinburgh with an unbeaten hundred as New Zealand comfortably defeated Scotland by seven wickets in a lone One-day international on Sunday.
Chapman followed his T20-best 83 in a 102-run thrashing of the Scots on Friday with 101 not out as New Zealand, beaten finalists in the last two 50-over World Cups, also proved too strong for their non-Test hosts in the longer white-ball format.
The 28-year-old Chapman shared an unbroken fourth-wicket partnership of 175 with Daryl Mitchell (74 not out) as the Black Caps won with 25 balls to spare as they finished on 307-3 in reply to Scotland’s 306 all out. 
“The platform which the boys up top left us was awesome, it really set up the innings,” said Mitchell. 
“It was nice to get out in the middle with ‘Chappy’ and get the job done. 
“His knock was awesome. It was nice to see him (Chapman) get an ODI hundred, I’m really stoked for him.” 
It was Chapman’s second century in seven career ODIs following his unbeaten 124 against the UAE back in 2015.
Martin Guptill (47) and opening partner Finn Allen, with exactly 50, got New Zealand’s chase off to a sound start before the fourth-wicket duo eased New Zealand home despite off-spinner Michael Leask’s 2-46.
Leask had a fine match overall, making 85 and sharing a stand of 92 with Matthew Cross (53) that kept Scotland in the game after they had slumped to 107-5.
All-rounder Leask faced 55 balls, including nine fours and four sixes.
New Zealand’s Michael Bracewell and Jacob Duffy took three wickets apiece.
Scoreboard
SCOTLAND: 
K. Coetzer c Tickner b Duffy    22 
M. Jones b Bracewell    36 
C. MacLeod c Guptill b Tickner  7 
R. Berrington c Chapman b Bracewell 12 
M. Cross c Cleaver b Mitchell   53
C. Greaves c Tickner b Bracewell    6 
M. Leask c Guptill b Duffy  85 
M. Watt c Guptill b Ferguson    31 
S. Sharif c Cleaver b Ferguson  28 
C. Sole c Phillips b Duffy  3 
H. Tahir not out    5 
EXTRAS (B-1, LB-5, NB-2, W-10)  18
TOTAL (all out, 49.4 overs) 306 
FALL OF WICKETS: 1-46 (Coetzer), 2-69 (MacLeod), 3-73 (Jones), 4-93 (Berrington), 5-107 (Greaves), 6-199 (Cross), 7-262 (Leask), 8-279 (Watt), 9-299 Sharif 
BOWLING: Duffy 7.4-0-52-3 (5w), Ferguson 10-0-77-2 (4w, 1nb), Tickner 10-1-62-1 (1w, 1nb), Bracewell 10-2-43-3, Santner 10-0-60-0, Mitchell 2-0-6-1
NEW ZEALAND:
M. Guptill lbw Leask    47 
F. Allen c MacLeod b Tahir  50 
D. Cleaver b Leask  32 
M. Chapman not out  101 
D. Mitchell not out 74 
EXTRAS (B-1, LB-1, W-1) 3
TOTAL (for three wickets, 45.5 overs)   307
FALL OF WICKETS: 1-78 (Allen), 2-125 (Guptill),  3-132 (Cleaver)
DID NOT BAT: G. Phillips, M. Bracewell, M. Santner, L. Ferguson, J. Duffy, B. Tickner 
BOWLING: Sharif 8-0-40-0, Watt 9-0-57-0 (1w), Sole 9.5-0-68-0, Greaves 2-0-24-0, Tahir 9-0-70-1, Leask 8-0-46-2
RESULT: New Zealand won by seven wickets.
Published in Dawn, August 2nd, 2022
"
4,Alcaraz climbs to fourth in ATP rankings,"PARIS: Spanish teenager Carlos Alcaraz climbed another place to number 4 in the ATP world ranking on Monday, just...","PARIS: Spanish teenager Carlos Alcaraz climbed another place to number 4 in the ATP world ranking on Monday, just behind his legendary compatriot Rafael Nadal.
In spite of losing in three sets on Sunday to Jannik Sinner on the clay final in Umag, where he was defending champion, 19-year-old Alcaraz leapfrogs the Greek Stefanos Tsitsipas who slips back to fifth.
Sinner remains 10th in the rankings which are still dominated by the Russian Daniil Medvedev.
Novak Djokovic moved up one place to sixth while Cameron Norrie also edged up one slot to 12th.
SWIATEK STAYS ON TOP
Meanwhile, French Open champion Iga Swiatek rema­ined firmly at the head of the latest WTA rankings, in spite of her shock exit in her home Poland Open last week.
Swiatek had not lost on clay in over a year before going down 6-1, 1-6, 6-4 to France’s Caroline Garcia in the quarter-finals in Warsaw.
The Pole, who has held the top spot since the surprise retirement of Australian Ashleigh Barty at the end of March, remains more than 4,000 points ahead of number two Anett Kontaveit.
With no changes at all in the top 20, the biggest jump was by Garcia whose victory over Ana Bogdan in the final in Warsaw took her from 45th to number 32.
Published in Dawn, August 2nd, 2022
"
5,Paras Love clinches Monsoon Cup at LRC,LAHORE: Bay colt Paras Love won the Monsoon Cup during the day/night Lahore Summer Meeting in balmy conditions amid...,"LAHORE: Bay colt Paras Love won the Monsoon Cup during the day/night Lahore Summer Meeting in balmy conditions amid drizzle here at the Racecourse on Sunday.
Half-an-hour before the start of the first race it started drizzling which continued till the end of the fifth and last race of the day.
Paras Love, the four-year-old country-bred colt, took a flying start under apprentice Haroon Gulzar and kept on well finally warding off the challenge from the 25-100 favourite filly Fall In Line by three-fourth of  length at the finish line.
Bay colt Rana Gee came slithering away third, another seven lengths back in this second race of the day run over 900 metres. 
In the supporting event, the Kaghan Plate Class VII Division I (Class VI included) contested over 1,000 metres, chestnut horse Surkhab put up a scintillating display of speed to land a memorable victory to make it two wins on the trot.
The winner piloted by seasoned jockey Aamir Pervez beat the on-rushing bay Silent Assassin by half-a-length. Bay Drums Of War led the field for nearly four furlongs to eventually finish third, two lengths further away.
Trainer Rashid Latif was accredited with a fine double when he sent out  Surkhab in the fourth and Ammar Love in the fifth race to end the day in a blaze of glory.
The even-money favourite filly Ammar Love in a close encounter beat stable-mate Sehar.
Published in Dawn, August 2nd, 2022
"
6,"Neymar, Messi secure Champions Trophy for PSG",TEL AVIV: Neymar scored twice with Lionel Messi also on target as Paris Saint-Germain thrashed Nantes 4-0 in the...,"TEL AVIV: Neymar scored twice with Lionel Messi also on target as Paris Saint-Germain thrashed Nantes 4-0 in the Champions Trophy in Tel Aviv on Sunday in new coach Christophe Galtier’s first match in charge.
After an underwhelming first season in French football, Messi struck 22 minutes into the traditional curtain-raiser, being played in Israel for the second year in a row.
Neymar, whose future at the club has been the source of much speculation this summer, doubled the lead just before the break with a magnificent free-kick.
Sergio Ramos added a third and Neymar bagged his second late on from the penalty spot as PSG, the reigning Ligue 1 champions, eased to victory over last season’s French Cup winners.
“It was a good match. There was a trophy on the line so we wanted to win it,” Neymar told Prime Video, drowning out rumours of his potential departure.
“If Kylian (Mbappe), Leo and myself are happy, PSG will do well,” he added.
“I hope this season all three of us will stay and it will go well.” It is the ninth time in 10 seasons PSG have lifted the Champions Trophy.
Galtier became PSG’s seventh different manager since the Qatari takeover of 2011 when he was appointed on a two-year deal in early July as the replacement for Mauricio Pochettino.
PSGs array of world class talent did not disappoint the Israeli crowd with Messi  opening the scoring in the 22nd minute, after a through ball from  Neymar that allowed him to round the goalkeeper and net from a tight  angle. 
Neymar added a second from a curling free kick on the stroke of  halftime before Sergio Ramos, who spent most of last season out injured  after his move from Real Madrid, added the third with an audacious  backheel from close range in the 57th minute.  The final goal came in the 82nd minute after Neymar was fouled by  Nantes defender Jean Claude Castelletto, who was sent off, and the  Brazilian converted the subsequent spotkick.
Published in Dawn, August 2nd, 2022
"
7,England rejoices at women’s historic Euro triumph,LONDON: England’s hungover  “Lionesses” held a victory party in central London on Monday in front of thousands...,"LONDON: England’s hungover  “Lionesses” held a victory party in central London on Monday in front of thousands of jubilant fans after they clinched the country’s first major football trophy since 1966.
A capacity crowd of 7,000 supporters packed into Trafalgar Square to give the women’s team a rapturous reception as they paraded the European championship trophy, following their 2-1 win over Germany on Sunday.
A tournament record crowd of 87,192 was at London’s Wembley Stadium to see the victory, and the BBC said more than 23 million viewers tuned in on television or online Sunday.
“We said we wanted to make our legacy about winning and that’s what we did,” England captain Leah Williamson told the flag-waving crowd in Trafalgar Square.
“The party’s not going to stop!” she added after her squad stayed up into the early hours celebrating.
“This team likes to work hard, but we definitely like to party harder.” Chloe Kelly, who scored the winner deep into extra-time, said she was  “a bit worse for wear”.
“I ain’t stopped dancing!” British royals, political leaders, and football legends have all hailed the players’ game-changing exploits.
The men’s team failed last year to conquer Europe, falling short in the final to extend a winless streak stretching back to the 1966 World Cup, the only previous major trophy won by a men’s or women’s England senior team. 
But above all, it highlighted the huge strides made in the women’s game in the country, where the Football Association (FA) banned women’s football for nearly 50 years in 1921. 
Having twice fallen at the final hurdle, it proved to be third time lucky for England as the class of 2022’s memorable run throughout the tournament lifted spirits all around the country. 
“The Championships and your performance in them have rightly won  praise,” Britain’s Queen Elizabeth said in a letter to the Lionesses.   “However, your success goes far beyond the trophy you have so deservedly  earned. 
“You have all set an example that will be an inspiration for girls and women  today, and for future generations.”  Sarina Wiegman’s team have been  unstoppable as they scored a record 22 times during the tournament,  including an impressive 4-0 thumping of second-ranked Sweden in the  semi-finals.
“I think we really made a change. I think this tournament has done so  much for the game but also for society and women in society in England  but I also think in Europe and across the world and I hope that will  make a (bigger) change too,” Wiegman told a news conference  shortly  after it had been interrupted by the team coming in, dancing and singing  around her with a rowdy rendition of the England anthem  “It’s coming  home!” — the 1990s football song officially called  “Three Lions”.
“These Lionesses have raised the bar. They have changed the way women’s football is viewed in this country,” former England International Alex Scott, who hosted the Trafalgar Square celebration, told BBC TV.
The previous day a similar number watching the final in Trafalgar Square had erupted with euphoria. Some people dived into its famous fountains, fittingly watched over by the square’s four lion statues.
David Baddiel, who recorded it with fellow comedian Frank Skinner and pop group Lightning Seeds for the men’s Euro 1996 tournament, said the Lionesses had helped redefine the sport.
“Football is not by default owned by men,” he told BBC radio.
“It’s the same game, played by women or played by men.
“And what’s totally brilliant in the last sort of few weeks is the sense that the country can get behind it in entirely the same way.”
Published in Dawn, August 2nd, 2022
"
