,Header,Summary,Detail
10,Sri Lanka name 18-member squad for Pakistan Tests,COLOMBO:  Sri Lanka named an 18-member squad for the two-match Test series against Pakistan on Thursday with Pathum...,"COLOMBO:  Sri Lanka named an 18-member squad for the two-match Test series against Pakistan on Thursday with Pathum Nissanka, Dhananjaya de Silva, Jeffrey Vandersay and Asitha Fernando back in the team after recovering from Covid.
The returning quartet will further strengthen the group which bounced back to hammer Australia after losing the first Test on a vicious turner. 
Both matches were played in Galle, where Dimuth Karunaratne’s Sri Lanka will be looking to build on their winning momentum in a likely spin battle in the opening Test starting Saturday. 
Debutant left-arm spinner Prabath Jayasuriya, who returned a match haul of 12 wickets to hand Australia a thumping defeat by an innings and 39 runs in the final match, has also been picked for the Pakistan games. 
Mystery spinner Maheesh Theekshana and all-rounder Kamindu Mendis also got a first Test cap in the previous match after the team suffered a Covid outbreak and both will be available against Babar Azam’s Pakistan.
Kamindu also made a mark in the series-levelling win with his gritty 61 in a 133-run stand with Dinesh Chandimal, who hit his maiden Test double century. 
Sri Lankan captain Karunaratne admitted Pakistan will be tougher opposition than Australia in the two Tests but believed playing in Galle for the third straight time will be an advantage for the hosts. 
“Pakistan is a strong side. (But) playing three games in Galle is good for a team. We know how conditions are in the last few games,” said Karunaratne. “Pakistan don’t have that opportunity. Big advantage for us. We need to turn that in our favour.”
The second Test will be played in Colombo from July 24. 
Sri Lanka squad: Dimuth Karunaratne (captain), Pathum Nissanka, Oshada Fernando, Angelo Mathews, Kusal Mendis, Dhananjaya de Silva, Kamindu Mendis, Niroshan Dickwella (wicket-keeper), Dinesh Chandimal (wicket-keeper), Ramesh Mendis, Maheesh Theekshana, Kasun Rajitha, Vishwa Fernando, Asitha Fernando, Dilshan Madushanka, Prabath Jayasuriya, Dunith Wellalage, Jeffrey Vandersay.
Published in Dawn, July 15th, 2022
"
11,"Pidcock wins 12th stage, Vingegaard still in yellow","L’ALPE D’HUEZ: British rookie Tom Pidcock, riding for Ineos, showed world class skills as he won stage 12 of the...","L’ALPE D’HUEZ: British rookie Tom Pidcock, riding for Ineos, showed world class skills as he won stage 12 of the Tour de France on the Bastille Day holiday on Thursday.
A daredevil descent lit the fuse for the 22-year-old’s win while an explosive acceleration on the final ascent of the Alpe d’Huez finished the job.
Jonas Vingegaard maintained his overall lead with defending champion Tadej Pogacar on his wheel.
South African Louis Meintjes was second in the stage, with former four time winner Chris Froome third.
They were part of an escape group that Pidcock first caught with a breath-taking descent and then dropped on the last Alpine climb of this 109th edition of the Tour.
Pidcock is the Olympic mountain-bike champion and the cyclo-cross world champion and the beauty and bravery of his descent of the Col du Telegraph set him apart from the other riders.
“On the descent people did not want to risk chasing me,” Pidcock who climbed to eighth with his feat, said at the finish line. “My first stage win on my first tour. Not bad. Even if I get dropped every day now I don’t care.”
A day after his triumph on the Col du Granon, Danish Jumbo rider Vingegaard, chaperoned by team-mates held off a blistering attack from Pogacar, who is second in the overall. Ineos leader Geraint Thomas followed them over the line and climbs to third overall.
Published in Dawn, July 15th, 2022
"
12,ECB security team to visit Pakistan next week,"Sources say officials will assess venues in Lahore, Karachi, Multan and Rawalpindi.","KARACHI: A security delegation of the England and Wales Cricket Board will visit Pakistan next week to inspect the potential venues for the team’s tour later this year.
The delegation will comprise security officials of the ECB and a representative of the Professional Cricketer’s Association — England’s players’ body.
According to sources, the officials will assess venues in Lahore, Karachi, Multan and Rawalpindi for Pakistan’s seven-match Twenty20 International series and three-match Test series against England scheduled for September and November-December respectively.
During its visit, the security delegation will meet representatives of the cities’ local administration while also carrying out inspection of the hotels — where the teams will potentially stay during the tours — and assess the route to the stadiums.
Since the return of Test cricket to Pakistan in 2019 after a 10-year gap, only Karachi, Rawalpindi and Lahore have hosted five-day games. 
However, Dawn understands that Multan is in consideration for one of the 10 matches during England’s visit, which, if goes ahead, will take place after nearly 17 years.
The Multan Cricket Stadium hosted Pakistan’s three-match One-day International series against the West Indies in June and witnessed full-houses throughout the series.
England were scheduled to visit Pakistan for five T20s last year, but the ECB pulled out of the tour citing players’ mental well-being issues. The withdrawal came days after New Zealand abruptly aborted their tour fearing “security threats”.
Published in Dawn, July 15th, 2022
"
13,Chahal shines as India dismiss England for 246,LONDON: Yuzvendra Chahal ripped through England’s middle-order as the Indian attack dominated again to bowl out ...,"LONDON: Yuzvendra Chahal ripped through England’s middle-order as the Indian attack dominated again to bowl out the home side for 246 inside 50 overs in the second One-day International of their three-match series at Lord’s on Thursday. 
Two days after pace proved England’s undoing during a 10-wicket thrashing in the first of a three-match series at the Oval, leg-spinner Chahal was their tormentor-in-chief on the other side of London’s River Thames. 
He finished with 4-47 from his maximum 10 overs, including a burst of 3-18 in 16 balls that accounted for key batsmen Jonny Bairstow, Joe Root and Ben Stokes as England slumped from 72-1 to 87-4. 
England, on the third anniversary of their dramatic World Cup final victory at Lord’s, were indebted to two players who didn’t feature in that match — Moeen Ali and David Willey — for getting past 200. 
The left-handers put on 62 in 13 overs after coming together at 148-6 after India captain Rohit Sharma won the toss and opted to field first on a green-tinged pitch. 
Moeen top-scored with 47 while Willey, who should have been out for one and was dropped again on 23, made 41. 
England were unchanged despite a batting collapse on Tuesday that was followed by a mauling for their attack. 
India recalled Virat Kohli, who missed the Oval match with a groin problem, on a day where the 33-year-old star batsman — without an international hundred since 2019 — was left out of the squad for an upcoming Twenty20 series in the West Indies. 
England collapsed to 26-5 inside eight overs at the Oval during a match where India fast bowler Jasprit Bumrah took a career-best 6-19. 
But they avoided similar embarrassment at Lord’s. 
Jason Roy heaved Mohammed Shami over deep midwicket for six before, on 23, he flicked first-change Hardik Pandya straight to deep square leg. 
Fellow opener Jonny Bairstow, one of five England survivors from the World Cup final in Thursday’s team along with Roy, Root, Stokes and now captain Jos Buttler, looked in good touch. 
But he was bowled for a run-a-ball trying to slog sweep Chahal, who then had Root plumb lbw for 11 when the world’s top-ranked Test batsman, missed a sweep. 
Dangerman Buttler, who has lost three of his four games since succeeding retired World Cup-winning skipper Eoin Morgan as England’s white-ball captain, managed just four before he was bowled by a Shami inswinger to leave England reeling at 87-4 Stokes, playing one reverse sweep too many, was lbw to Chahal for 21. 
Liam Livingstone took the attack to Pandya but the bowler got his revenge when the Lancastrian holed out in the deep after an entertaining run-a-ball 33. 
Moeen, who pulled Prasidh Krishna for a huge six, repaired some of the damage before he holed out off Chahal with Willey, reprieved on one when Krishna dropped a simple chance at fine leg, slogging a catch in the deep off Bumrah.
Published in Dawn, July 15th, 2022
"
14,Bangladesh sweep to ODI series win as WI batting wilts,PROVIDENCE: Bangladesh’s array of spin bowling talent again proved too much for the West Indies batting line-up to...,"PROVIDENCE: Bangladesh’s array of spin bowling talent again proved too much for the West Indies batting line-up to handle with the visitors completing a comprehensive series-clinching nine-wicket victory in the second One-day International of a three-match series at the Guyana National Stadium on Wednesday.
Beaten by six wickets in the first match at the same venue on Sunday, the home batters were even more inept in being dismissed for 108 off 35 overs.
Having been swept 2-0 in both the preceding Test and T20 series, the tourists extended the ODI dominance of their present foes in reaching the modest target with almost 30 overs to spare.
It was their 10th consecutive ODI victory over the West Indies and also ensures they remain unbeaten in ODI series against the Caribbean side since they lost the corresponding duel in the region in 2014.
Off-spinner Mehidy Hasan Miraz led the rout with figures of four for 29 while left-arm slow bowler Nasum Ahmed claimed three for 19 and the Man of the Match award as the home side’s batters once again appeared all at sea on a pitch which again offered considerable assistance to the spinners.
Tamim Iqbal then led the comfortable pursuit of such a modest target, sealing victory and reaching a 53rd ODI half-century with his seventh boundary. 
“We really wanted to win this series very badly after losing in the Tests and T20 Internationals,” said Tamim in reflecting on a performance which gave Bangladesh at fifth straight ODI series win. 
“We know this is the format we are strongest in and it was important to show that confidence after the earlier disappointments.” 
Following their struggles in the rain-affected first match, West Indies tried to build a more stable platform after predictably being put in to bat.
However the dismissal of Kyle Mayers by the spin of Mosaddek Hossain after an opening stand of 27 in the 11th over triggered the slide which saw them crashing to 86 for nine in the 31st over.
An unbeaten 25 by all-rounder Keemo Paul and a last-wicket stand of 22 with fellow-Guyanese Gudakesh Motie at least took the West Indies past the 100-run mark.
Motie was the lone-wicket taker in the Bangladesh reply, dismissing Najmul Hossain Shanto for 20 to end an opening stand of 48 with Tamim.
Liton Das’ unbeaten 32 alongside his skipper ensured the romp to victory was completed in double-quick time. 
“We didn’t show up as a batting unit today,” was the frank assessment of West Indies captain Nicholas Pooran, who fell to Nasum for a first-ball duck. 
“It is quite frustrating our batting efforts of late in ODI cricket and we need to come together quickly to fix this situation.”
Scoreboard
WEST INDIES:
S. Hope c Mosaddek b Nasum  18 
K. Mayers b Mosaddek    17 
S. Brooks b Nasum   5 
B. King b Mehidy    11 
N. Pooran b Nasum   0 
R. Powell c Mahmudullah b Shoriful  13 
A. Hosein run out (Mustafizur)  2
K. Paul not out 25 
R. Shepherd b Mehidy    4 
A. Joseph c Nurul b Mehidy  0 
G. Motie lbw Mehidy 6
EXTRAS (LB-3, W-5)  7 
TOTAL (all out, 35 overs)   108 
FALL OF WICKETS: 1-27 (Mayers), 2-39 (Brooks), 3-44 (Hope), 4-45 (Pooran), 5-69 (Powell), 6-72 (King), 7-72 (Hosein), 8-86 (Shepherd), 9-86 (Joseph) 
BOWLING: Mosaddek 10-0-37-1 (2w), Mustafizur 4-0-12-0, Mehidy 8-1-29-4, Nasum 10-4-19-3 (1w), Shoriful 3-0-9-1
BANGLADESH:
Tamim Iqbal not out 50 
Najmul Hossain c Hosein b Motie 20 
Liton Das not out   32 
EXTRAS (B-1l, NB-1, W-8)    10 
TOTAL (for one wicket, 20.4 overs)  112
FALL OF WICKETS: 1-48 (Shanto)
DID NOT BAT: Mahmudullah, Atif Hossain, Nurul Hasan, Mehidy Hasan, Mosaddek Hossain, Nasum Ahmed, Shoriful Islam, Mustafizur Rahman 
BOWLING: Joseph 3-0-7-0 (2w), Hosein 6-0-35-0 (3w), Motie 7.4-1-39-1 (2w), Pooran 2-0-14-0 (1w, 1nb), Paul 2-0-16-0
RESULT: Bangladesh won by nine wickets. 
Published in Dawn, July 15th, 2022
"
